id,name,company_name,summary,description,duration,departure_location,departure_times,price_adult,price_child,includes,highlights,keywords,duration_hours,link_booking,link_more_info,phone,image_url,image_urls,commission_rate,active,price_source_url,price_tiers,raw_text,duration_days,duration_category,tour_type,locations,tags,audience,intensity_level,itinerary,menu,age_requirements,ideal_for,video_urls,important_information,what_to_bring,whats_extra,cancellation_policy,booking_connected
d9d463300ef56401,Ultimatives Jetboot-Erlebnis,pioneeradventures,,"Erleben Sie den Nervenkitzel der ultimativen Jetbootfahrt in Airlie Beach, wo Abenteuer auf eine atemberaubende Landschaft trifft. Diese adrenalingeladene Tour ist perfekt für Abenteuerlustige und Familien, die ein unvergessliches Erlebnis suchen. Spüren Sie den Rausch, wenn Sie an der Coral Sea Marina & Resort vorbeiziehen und aufregende 360- und 180-Grad-Drehungen, Powerstops und Drifts vollführen. Bestaunen Sie die atemberaubende Aussicht auf die Whitsundays und halten Sie Ausschau nach einheimischen Wildtieren wie Meeresschildkröten, Dugongs und Stachelrochen. Mit den witzigen und informativen Kommentaren an Bord ist bei dieser Tour Lachen und Spannung garantiert, was sie zu einem Highlight Ihres Aufenthalts in Airlie Beach macht.",30 Minutes,Coral Sea Marina & Resort,Choice of morning or afternoon departure,A$89,A$79,"30-minütige Fahrt mit dem Jetboot durch die Pioneer Bay
Schwimmwesten und Spritzwasserwesten
Spritzbrillen
Schließfächer/kleine Gepäckaufbewahrung
Lustige und informative Kommentare
Kostenlose GoPro-Fotos","30-minütige Jetboat-Fahrt um die Pioneer Bay von Airlie Beach aus
Die ultimative Mischung aus Lachen, Wasser und Adrenalin
Erleben Sie waghalsige Stunts wie 180- und 360-Drehungen, Powerstops und Drifts
Beobachten Sie Wildtiere wie Schildkröten, Dugongs und Stachelrochen in der Bucht
Kostenlose Fotos auf unserer Facebook-Seite verfügbar
Keine Erfahrung erforderlich: geeignet für alle Altersgruppen (ab 5 Jahren) und Fähigkeiten",,,https://www.pioneeradventures.com.au/tours/jet-boat-airlie-beach/,https://www.pioneeradventures.com.au/tours/jet-boat-airlie-beach/,,static/tour_images/pioneeradventures/d9d463300ef56401/image_6.jpeg,"static/tour_images/pioneeradventures/d9d463300ef56401/image_1.jpg,static/tour_images/pioneeradventures/d9d463300ef56401/image_2.jpg,static/tour_images/pioneeradventures/d9d463300ef56401/image_3.jpg,static/tour_images/pioneeradventures/d9d463300ef56401/image_4.jpg,static/tour_images/pioneeradventures/d9d463300ef56401/image_6.jpeg,static/tour_images/pioneeradventures/d9d463300ef56401/image_7.jpg,static/tour_images/pioneeradventures/d9d463300ef56401/image_8.jpg,static/tour_images/pioneeradventures/d9d463300ef56401/image_9.jpg,static/tour_images/pioneeradventures/d9d463300ef56401/image_10.jpg,static/tour_images/pioneeradventures/d9d463300ef56401/image_11.jpg,static/tour_images/pioneeradventures/d9d463300ef56401/image_12.jpg,static/tour_images/pioneeradventures/d9d463300ef56401/image_13.jpg,static/tour_images/pioneeradventures/d9d463300ef56401/image_14.jpeg,static/tour_images/pioneeradventures/d9d463300ef56401/image_15.jpg,static/tour_images/pioneeradventures/d9d463300ef56401/image_16.jpg",,True,https://www.pioneeradventures.com.au/tours/jet-boat-airlie-beach/,Adult: A$89 | Child (5-13): A$79,,,unknown,water,"Airlie Beach,Great Barrier Reef","adventure,private,sunset",family,adventurous,,,Ab 5 Jahren,"Nervenkitzel, Familien und Abenteuerlustige, die in Airlie Beach ein Erlebnis mit viel Adrenalin suchen.",,"['Das Mindestalter beträgt 5 Jahre und die Mindestgröße 120 cm.', 'Alle Kinder müssen beim Check-in von einem Erwachsenen begleitet werden.', 'Diese Tour ist nicht geeignet für Reisende mit Rücken- oder Nackenproblemen, Herzproblemen, Schwangerschaft oder anderen ernsthaften gesundheitlichen Problemen.', 'Diese Tour ist nicht rollstuhlgerecht.']","['Badeanzug', 'Handtuch', 'Sonnencreme']","['Es können keine losen Gegenstände mit an Bord genommen werden, z. B. Kameras, Hüte usw. Sie müssen in den bereitgestellten Aufbewahrungsboxen verstaut werden."", ""Wir bieten einen kleinen Stauraum für Dinge, die trocken bleiben müssen.""]","['Wenn die Veranstaltung wegen schlechten Wetters abgesagt wird, bieten wir Ihnen einen anderen Termin oder eine volle Rückerstattung an.', 'Wenn die Veranstaltung abgesagt wird, weil die Mindestteilnehmerzahl nicht erreicht wurde, bieten wir Ihnen einen anderen Termin/Erlebnis oder eine volle Rückerstattung an.']",0
25f0d62ea4d42c7c,Bottoms Up Sunset Bootstour,pioneeradventures,,"Fahren Sie an Bord von Bottoms Up in den Sonnenuntergang, eine entspannende und malerische Fahrt um Shute Harbour. Diese einzigartige, einstündige Abendtour bietet einen tiefen Einblick in die nächtliche Welt des Meereslebens und enthüllt die verborgenen Wunder der Whitsundays nach Einbruch der Dunkelheit. Diese Tour ist ideal für Naturliebhaber und alle, die das Great Barrier Reef in einem neuen Licht erleben möchten. Sie ist perfekt für alle, die ein ruhiges und doch aufregendes Abenteuer suchen.",1 Hour,Coral Sea Marina & Resort,"Departs 8 am, Returns 5 pm",FROM A$79,,"Glasbodenboot-Tour
Kreuzfahrt bei Sonnenuntergang
Eintauchen in die nächtliche Unterwasserwelt","Erleben Sie den Sonnenuntergang über Shute Harbour
Erkunden Sie die nächtliche Unterwasserwelt der Whitsundays
Entspannende und malerische Kreuzfahrt
Einzigartiges Abenteuer nach Einbruch der Dunkelheit
Perfekt für Naturliebhaber",,1.0,https://www.pioneeradventures.com.au/airlie-beach-glass-bottom-boat-tour/,https://www.pioneeradventures.com.au/airlie-beach-glass-bottom-boat-tour/,,,,,True,https://www.pioneeradventures.com.au/airlie-beach-glass-bottom-boat-tour/,Adult: A$79,,,half_day,combo,"Airlie Beach,Great Barrier Reef","adventure,luxury,private,relaxation,sunset",general,adventurous,,,Alle Altersgruppen willkommen,"Naturliebhaber, Paare und Familien auf der Suche nach einem einzigartigen Sonnenuntergangserlebnis",,[Kleinkinder 0-2 gehen GRATIS.],,,,0
d473b6b06dedf85a,Airlie Beach Glasbodenboot-Tour,pioneeradventures,,"Begleiten Sie uns auf der ""Bottoms Up"", einem speziell angefertigten Glasbodenboot, auf eine einzigartige Erkundungstour zu den lebhaften Korallenriffen von Airlie Beach. Diese Tour bietet ein intensives Erlebnis der vielfältigen Ökosysteme des Great Barrier Reefs, ohne nass zu werden. Perfekt für Familien, Alleinreisende und Freunde, genießen Sie eine geführte Reise durch die wunderschönen Whitsunday-Inseln, mit informativen Kommentaren und einem zusätzlichen Fotostopp am Lions Lookout.",70 Minutes,Coral Sea Marina & Resort,,A$89,A$79,"70 Minuten geführte Glasbodenboot-Entdeckungstour
Witziger und informativer Kommentar über das Riff
Schwimmwesten für Minderjährige
Bonus-Fotostopp am Lions Lookout
Höfliche Transfers von ausgewählten Orten","Einzigartiges Glasbodenboot-Erlebnis
Erforschen Sie die Korallenriffe von Airlie Beach
Informativer Kommentar über das Riff
Fotostopp am Lions Lookout
Ideal für alle Altersgruppen
Gelegenheit, eine große Vielfalt an Meereslebewesen zu beobachten
Vollständig beschattetes Schiff
Lizenzierte Bar an Bord",,,https://www.pioneeradventures.com.au/tours/day-tour/,https://www.pioneeradventures.com.au/tours/day-tour/,,static/tour_images/pioneeradventures/d473b6b06dedf85a/image_61.jpg,"static/tour_images/pioneeradventures/d473b6b06dedf85a/image_1.jpg,static/tour_images/pioneeradventures/d473b6b06dedf85a/image_2.jpg,static/tour_images/pioneeradventures/d473b6b06dedf85a/image_3.jpg,static/tour_images/pioneeradventures/d473b6b06dedf85a/image_4.jpg,static/tour_images/pioneeradventures/d473b6b06dedf85a/image_5.jpg,static/tour_images/pioneeradventures/d473b6b06dedf85a/image_6.jpeg,static/tour_images/pioneeradventures/d473b6b06dedf85a/image_7.jpg,static/tour_images/pioneeradventures/d473b6b06dedf85a/image_8.jpg,static/tour_images/pioneeradventures/d473b6b06dedf85a/image_9.jpg,static/tour_images/pioneeradventures/d473b6b06dedf85a/image_10.jpg,static/tour_images/pioneeradventures/d473b6b06dedf85a/image_11.jpg,static/tour_images/pioneeradventures/d473b6b06dedf85a/image_12.jpg,static/tour_images/pioneeradventures/d473b6b06dedf85a/image_13.jpg,static/tour_images/pioneeradventures/d473b6b06dedf85a/image_14.jpg,static/tour_images/pioneeradventures/d473b6b06dedf85a/image_15.jpg,static/tour_images/pioneeradventures/d473b6b06dedf85a/image_16.jpeg,static/tour_images/pioneeradventures/d473b6b06dedf85a/image_17.jpg,static/tour_images/pioneeradventures/d473b6b06dedf85a/image_18.jpg,static/tour_images/pioneeradventures/d473b6b06dedf85a/image_19.jpg,static/tour_images/pioneeradventures/d473b6b06dedf85a/image_20.jpg,static/tour_images/pioneeradventures/d473b6b06dedf85a/image_21.jpg,static/tour_images/pioneeradventures/d473b6b06dedf85a/image_22.jpg,static/tour_images/pioneeradventures/d473b6b06dedf85a/image_23.jpg,static/tour_images/pioneeradventures/d473b6b06dedf85a/image_24.jpg,static/tour_images/pioneeradventures/d473b6b06dedf85a/image_25.jpg,static/tour_images/pioneeradventures/d473b6b06dedf85a/image_26.jpg,static/tour_images/pioneeradventures/d473b6b06dedf85a/image_27.jpeg,static/tour_images/pioneeradventures/d473b6b06dedf85a/image_28.jpg,static/tour_images/pioneeradventures/d473b6b06dedf85a/image_29.jpg,static/tour_images/pioneeradventures/d473b6b06dedf85a/image_30.jpg,static/tour_images/pioneeradventures/d473b6b06dedf85a/image_31.jpg,static/tour_images/pioneeradventures/d473b6b06dedf85a/image_32.jpg,static/tour_images/pioneeradventures/d473b6b06dedf85a/image_33.jpg,static/tour_images/pioneeradventures/d473b6b06dedf85a/image_34.jpg,static/tour_images/pioneeradventures/d473b6b06dedf85a/image_35.jpg,static/tour_images/pioneeradventures/d473b6b06dedf85a/image_36.jpeg,static/tour_images/pioneeradventures/d473b6b06dedf85a/image_37.jpg,static/tour_images/pioneeradventures/d473b6b06dedf85a/image_38.jpg,static/tour_images/pioneeradventures/d473b6b06dedf85a/image_39.jpg,static/tour_images/pioneeradventures/d473b6b06dedf85a/image_40.jpg,static/tour_images/pioneeradventures/d473b6b06dedf85a/image_42.jpg,static/tour_images/pioneeradventures/d473b6b06dedf85a/image_43.jpg,static/tour_images/pioneeradventures/d473b6b06dedf85a/image_44.jpeg,static/tour_images/pioneeradventures/d473b6b06dedf85a/image_45.jpg,static/tour_images/pioneeradventures/d473b6b06dedf85a/image_46.jpg,static/tour_images/pioneeradventures/d473b6b06dedf85a/image_47.jpg,static/tour_images/pioneeradventures/d473b6b06dedf85a/image_48.jpg,static/tour_images/pioneeradventures/d473b6b06dedf85a/image_49.jpg,static/tour_images/pioneeradventures/d473b6b06dedf85a/image_50.jpg,static/tour_images/pioneeradventures/d473b6b06dedf85a/image_51.jpg,static/tour_images/pioneeradventures/d473b6b06dedf85a/image_52.jpeg,static/tour_images/pioneeradventures/d473b6b06dedf85a/image_53.jpeg,static/tour_images/pioneeradventures/d473b6b06dedf85a/image_54.jpg,static/tour_images/pioneeradventures/d473b6b06dedf85a/image_55.jpg,static/tour_images/pioneeradventures/d473b6b06dedf85a/image_56.jpg,static/tour_images/pioneeradventures/d473b6b06dedf85a/image_58.jpg,static/tour_images/pioneeradventures/d473b6b06dedf85a/image_59.jpeg,static/tour_images/pioneeradventures/d473b6b06dedf85a/image_60.jpg,static/tour_images/pioneeradventures/d473b6b06dedf85a/image_61.jpg,static/tour_images/pioneeradventures/d473b6b06dedf85a/image_62.jpg,static/tour_images/pioneeradventures/d473b6b06dedf85a/image_63.jpg,static/tour_images/pioneeradventures/d473b6b06dedf85a/image_64.jpg,static/tour_images/pioneeradventures/d473b6b06dedf85a/image_65.jpg,static/tour_images/pioneeradventures/d473b6b06dedf85a/image_66.jpg,static/tour_images/pioneeradventures/d473b6b06dedf85a/image_67.jpg,static/tour_images/pioneeradventures/d473b6b06dedf85a/image_68.jpg,static/tour_images/pioneeradventures/d473b6b06dedf85a/image_69.jpg,static/tour_images/pioneeradventures/d473b6b06dedf85a/image_70.jpg",,True,https://www.pioneeradventures.com.au/tours/day-tour/,Adult: A$89 | Child (3-13): A$79,,,unknown,water,"Airlie Beach,Great Barrier Reef,Whitsunday Island","adventure,family-friendly,relaxation,sunset",family,adventurous,,,Alle Altersgruppen willkommen,"Familien, Alleinreisende und Freunde, die das Riff auf einzigartige und komfortable Weise erkunden möchten.",,"['Kleinkinder im Alter von 0-2 Jahren reisen kostenlos.', 'Unser Schiff ist leider nicht rollstuhlgerecht.', 'Der Ein- und Ausstieg in das Schiff und den Bus ist über Treppen möglich.', 'Kindersitze sind in Bussen, Zügen und individuellen Transportdiensten wie Taxis, Limousinen und Mitfahrdiensten nicht erforderlich.']","['Es gibt keine besonderen Anforderungen. Das Schiff ist vollständig von der Sonne beschattet""]",[Alkoholische und alkoholfreie Getränke können an Bord an unserer voll lizenzierten Bar erworben werden.],,0
66270ef3e8be90eb,Bottoms Up Nacht Bootstour,pioneeradventures,,"Begeben Sie sich auf ein fesselndes Abendabenteuer mit der Bottoms Up Night Boat Tour. Diese 60-minütige Tour ist perfekt für Familien, Paare und alle, die das pulsierende nächtliche Leben am Riff erkunden möchten, und bietet ein unvergessliches Erlebnis. Erleben Sie, wie die atemberaubende Unterwasserwelt im Schein der UV-Lichter zum Leben erwacht, während Sie über die Riffebenen gleiten. Unter Anleitung erfahren Sie mehr über das vielfältige Ökosystem des Great Barrier Reefs. Genießen Sie die einmalige Gelegenheit, Krebse, Schildkröten, Tintenfische und sogar Haie in ihrem natürlichen Lebensraum zu beobachten. Entspannen Sie sich und genießen Sie die lizenzierte Bar an Bord, während Sie die ruhige Schönheit der Umgebung von Shute Harbour auf sich wirken lassen.",60 Minutes,Coral Sea Marina & Resort,,A$99,A$89,"Höflichkeitsbus zur Abholung
Bar mit Schankrecht an Bord
Geführter und informativer Kommentar über das Riff
Unterwasser-UV-Lichter für optimale Sicht","60-minütige Abendtour zur Erkundung der Riffe
Beobachten Sie Unterwassertiere wie Krebse, Schildkröten, Tintenfische und Haie
Geführte und kommentierte Tour
Einzigartige Unterwasserbeobachtung mit UV-Licht
Entspannende Kreuzfahrt um Shute Harbour",,,https://www.pioneeradventures.com.au/bottoms-up-night-tour/,https://www.pioneeradventures.com.au/bottoms-up-night-tour/,,static/tour_images/pioneeradventures/66270ef3e8be90eb/image_1.jpg,"static/tour_images/pioneeradventures/66270ef3e8be90eb/image_1.jpg,static/tour_images/pioneeradventures/66270ef3e8be90eb/image_2.jpeg,static/tour_images/pioneeradventures/66270ef3e8be90eb/image_3.jpg,static/tour_images/pioneeradventures/66270ef3e8be90eb/image_4.jpg,static/tour_images/pioneeradventures/66270ef3e8be90eb/image_6.jpeg,static/tour_images/pioneeradventures/66270ef3e8be90eb/image_7.jpeg,static/tour_images/pioneeradventures/66270ef3e8be90eb/image_8.jpg,static/tour_images/pioneeradventures/66270ef3e8be90eb/image_9.jpg,static/tour_images/pioneeradventures/66270ef3e8be90eb/image_10.jpg,static/tour_images/pioneeradventures/66270ef3e8be90eb/image_11.jpg,static/tour_images/pioneeradventures/66270ef3e8be90eb/image_12.jpg,static/tour_images/pioneeradventures/66270ef3e8be90eb/image_13.jpg,static/tour_images/pioneeradventures/66270ef3e8be90eb/image_15.jpg,static/tour_images/pioneeradventures/66270ef3e8be90eb/image_16.jpg",,True,https://www.pioneeradventures.com.au/bottoms-up-night-tour/,Adult: A$99 | Child: A$89,,,unknown,combo,"Airlie Beach,Great Barrier Reef","adventure,family-friendly,luxury,private,relaxation,sunset",family,adventurous,,,Geeignet für alle Altersgruppen,"Familien, Paare und Naturliebhaber, die die nächtliche Unterwasserwelt des Great Barrier Reefs erkunden möchten.",,"['Altersgruppen: Geeignet für alle Altersgruppen (kein Zugang für Rollstuhlfahrer), Kleinkinder sind frei"", ""Erwachsene ab 14 Jahren"", ""Kinder von 2 bis 13 Jahren"", ""Kleinkinder von 0 bis 2 Jahren frei""]",,['Schankwirtschaft an Bord'],,0
