id,name,company_name,summary,description,duration,departure_location,departure_times,price_adult,price_child,includes,highlights,keywords,duration_hours,link_booking,link_more_info,phone,image_url,image_urls,commission_rate,active,price_source_url,price_tiers,raw_text,duration_days,duration_category,tour_type,locations,tags,audience,intensity_level,itinerary,menu,age_requirements,ideal_for,video_urls,important_information,what_to_bring,whats_extra,cancellation_policy,booking_connected,_csv_file
d027340742d50b7b,MiLady 3D3N,milady-sailing,,"Erleben Sie die Whitsundays stilvoll an Bord der MiLady, einer luxuriösen 54-Fuß-Yacht, die intime Abenteuer in kleinen Gruppen bietet. Diese Premium-Tour ist perfekt für alle, die eine Mischung aus Entspannung und Abenteuer suchen. Mit nur sechs Gästen an Bord ist ein persönliches Erlebnis garantiert. Genießen Sie das Segeln durch kristallklares Wasser, erkunden Sie lebhafte Korallenriffe und lassen Sie sich von Ihrem persönlichen Koch mit Gourmetgerichten verwöhnen. Ideal für Paare, Familien und kleine Gruppen, die einen einzigartigen und unvergesslichen Urlaub im Paradies suchen.",3 Tage 3 Nächte,"Coral Sea Marina, Airlie Beach","Abfahrt Freitag um 15:30 Uhr, Rückkehr Montag um 12:00 Uhr",FROM A$5018,,Segeln Sie 3 Tage und 3 Nächte lang. Intimes Erlebnis mit nur 6 Gästen. Geräumige Kabinen mit eigenem Bad. Voll klimatisierte 54-Fuß-Yacht. Schnorcheln Sie im Great Barrier Reef Marine Park. Die gesamte Schnorchelausrüstung wird gestellt. Frisch zubereitete Gourmetgerichte an Bord. Elektrische Winden für schnelles Segeln. Lizenziertes Schiff (kein BYO). Shark Shield-Antenne für die Sicherheit der Passagiere.,Entdecken Sie die schönsten Seiten der Whitsundays Komfort wie zu Hause an Bord der MiLady Gestalten Sie Ihren Charter mit Premium-Getränkepaketen Neueste kommerzielle Segelyacht in der Region Authentisches Segelerlebnis Segeltour in kleiner Gruppe,,,,https://sailing-whitsundays.com/whitsundays/milady-3d3n,,static/tour_images/sailing-whitsundays/d027340742d50b7b/image_37.jpg,"static/tour_images/sailing-whitsundays/d027340742d50b7b/image_1.jpg,static/tour_images/sailing-whitsundays/d027340742d50b7b/image_2.jpg,static/tour_images/sailing-whitsundays/d027340742d50b7b/image_3.jpg,static/tour_images/sailing-whitsundays/d027340742d50b7b/image_4.jpg,static/tour_images/sailing-whitsundays/d027340742d50b7b/image_5.jpg,static/tour_images/sailing-whitsundays/d027340742d50b7b/image_6.jpg,static/tour_images/sailing-whitsundays/d027340742d50b7b/image_7.jpg,static/tour_images/sailing-whitsundays/d027340742d50b7b/image_8.jpg,static/tour_images/sailing-whitsundays/d027340742d50b7b/image_9.jpg,static/tour_images/sailing-whitsundays/d027340742d50b7b/image_10.jpg,static/tour_images/sailing-whitsundays/d027340742d50b7b/image_11.jpg,static/tour_images/sailing-whitsundays/d027340742d50b7b/image_12.jpg,static/tour_images/sailing-whitsundays/d027340742d50b7b/image_15.jpg,static/tour_images/sailing-whitsundays/d027340742d50b7b/image_16.jpg,static/tour_images/sailing-whitsundays/d027340742d50b7b/image_17.jpg,static/tour_images/sailing-whitsundays/d027340742d50b7b/image_19.jpg,static/tour_images/sailing-whitsundays/d027340742d50b7b/image_20.jpg,static/tour_images/sailing-whitsundays/d027340742d50b7b/image_21.jpg,static/tour_images/sailing-whitsundays/d027340742d50b7b/image_22.jpg,static/tour_images/sailing-whitsundays/d027340742d50b7b/image_23.jpg,static/tour_images/sailing-whitsundays/d027340742d50b7b/image_25.jpg,static/tour_images/sailing-whitsundays/d027340742d50b7b/image_26.jpg,static/tour_images/sailing-whitsundays/d027340742d50b7b/image_27.jpg,static/tour_images/sailing-whitsundays/d027340742d50b7b/image_28.jpg,static/tour_images/sailing-whitsundays/d027340742d50b7b/image_29.jpg,static/tour_images/sailing-whitsundays/d027340742d50b7b/image_30.jpg,static/tour_images/sailing-whitsundays/d027340742d50b7b/image_31.jpg,static/tour_images/sailing-whitsundays/d027340742d50b7b/image_32.jpg,static/tour_images/sailing-whitsundays/d027340742d50b7b/image_33.jpg,static/tour_images/sailing-whitsundays/d027340742d50b7b/image_35.jpg,static/tour_images/sailing-whitsundays/d027340742d50b7b/image_36.jpg,static/tour_images/sailing-whitsundays/d027340742d50b7b/image_37.jpg,static/tour_images/sailing-whitsundays/d027340742d50b7b/image_38.jpg,static/tour_images/sailing-whitsundays/d027340742d50b7b/image_39.jpg,static/tour_images/sailing-whitsundays/d027340742d50b7b/image_40.jpg,static/tour_images/sailing-whitsundays/d027340742d50b7b/image_41.jpg,static/tour_images/sailing-whitsundays/d027340742d50b7b/image_42.jpg,static/tour_images/sailing-whitsundays/d027340742d50b7b/image_43.jpg,static/tour_images/sailing-whitsundays/d027340742d50b7b/image_45.jpg,static/tour_images/sailing-whitsundays/d027340742d50b7b/image_46.jpg,static/tour_images/sailing-whitsundays/d027340742d50b7b/image_47.jpg,static/tour_images/sailing-whitsundays/d027340742d50b7b/image_48.jpg,static/tour_images/sailing-whitsundays/d027340742d50b7b/image_49.jpg,static/tour_images/sailing-whitsundays/d027340742d50b7b/image_50.jpg,static/tour_images/sailing-whitsundays/d027340742d50b7b/image_51.jpg,static/tour_images/sailing-whitsundays/d027340742d50b7b/image_52.jpg,static/tour_images/sailing-whitsundays/d027340742d50b7b/image_53.jpg,static/tour_images/sailing-whitsundays/d027340742d50b7b/image_54.jpg,static/tour_images/sailing-whitsundays/d027340742d50b7b/image_55.jpg,static/tour_images/sailing-whitsundays/d027340742d50b7b/image_56.jpg,static/tour_images/sailing-whitsundays/d027340742d50b7b/image_57.jpg",,True,https://sailing-whitsundays.com/whitsundays/milady-3d3n,Private Doppelkabine mit eigenem Bad (04.11.2025 – 31.01.2026): 5018 AUD | Private Zweibettkabine mit eigenem Bad (04.11.2025 – 31.01.2026): 5297 AUD | Private Masterkabine mit eigenem Bad (04.11.2025 – 31.01.2026): 10037 AUD | Private Vierbettkabine mit eigenem Bad (04.11.2025 – 31.01.2026): 10037 AUD,,3.0,multi_day,water,"Airlie Beach,Great Barrier Reef","adventure,family-friendly,luxury,private,relaxation,small-group,sunset",family,adventurous,,"**Menü für Tag 1:** Snacks bei Sonnenuntergang: Nachmittags-Häppchen und ein Glas Sekt zum Abendessen: Frischer Barramundi vom Grill, Gartensalat mit Blattgemüse, Tomaten und Avocado, Kartoffelpüree Dessert: Pavlova mit frischen Früchten **Menü für Tag 2:**
Frühstück: Frisch gebrühter Kaffee, verschiedene Teesorten, Muffins, frische tropische Früchte, Müsli, Joghurt Vormittagsimbiss: Kekse, frisch gebrühter Kaffee, verschiedene Teesorten Mittagessen: Garnelenplatte, Räucherlachs, Frischkäse, griechischer Salat mit Oliven, Zwiebeln, Römersalat, Tomaten, Gurken Dessert: Belgische Schokoladentorte
Abendessen: Hähnchenbrust, gerollt und gefüllt mit Frischkäse und Kräutern, geröstete Paprika, Zucchini, Zwiebeln, Knoblauch, Kirschtomaten, Reis mit Kurkuma, Zitrusfrüchten und Pistazien **Menü für Tag 3:** Frühstück: Frisch gebrühter Kaffee, verschiedene Teesorten, Pfannkuchen, frische tropische Früchte, Müsli, Joghurt",Mindestalter 4+,"Paare, Familien und kleine Gruppen, die ein luxuriöses und intimes Segelerlebnis in den Whitsundays suchen.",,,,,,,data/sailing-whitsundays/en/tours_sailing-whitsundays_cleaned_with_media.csv
2997a437ba2b4afe,Meine Dame 2 Tage und 2 Nächte,milady-sailing,,"Erleben Sie die Whitsundays mit höchstem Komfort an Bord der MiLady, einer modernen 54-Fuß-Yacht, die für Abenteuer in kleinen Gruppen konzipiert ist. Mit nur sechs Passagieren pro Tour können Sie auf dieser intimen Reise den Menschenmassen entfliehen und ein individuelles Segelerlebnis genießen. Egal, ob Sie auf der Suche nach Abenteuer oder Entspannung sind, die MiLady bietet authentisches Segeln mit der Möglichkeit, beim Setzen der Segel oder Steuern zu helfen, atemberaubende Korallenriffe zu erkunden und an einem der schönsten Strände der Welt zu entspannen. Diese Tour ist ideal für Paare, Familien und kleine Gruppen und verbindet Luxus mit dem Nervenkitzel der Entdeckung, komplett mit Gourmet-Mahlzeiten und der Möglichkeit, während der Saison dem Gesang der Wale zu lauschen.",2 Tage 2 Nächte,"Coral Sea Marina, Airlie Beach","Abfahrt montags und mittwochs um 15:30 Uhr, Rückfahrt mittwochs und freitags um 12:00 Uhr",FROM A$3970,,"Geräumige Kabinen mit eigenem Bad Voll klimatisierte 54-Fuß-Yacht Schnorcheln im Great Barrier Reef Marine Park Alle Schnorchelausrüstung und Stingersuits werden gestellt Frisch zubereitete Gourmet-Mahlzeiten an Bord Lauschen Sie während der Walsaison den Gesängen der Wale über ein Hydrofon
Elektrische Winden für schnelles Segeln Abholung von den Inseln: Hamilton Island/Daydream Island und Long Island Stand-up-Paddle-Boards Lizenziertes Schiff (kein BYO)",Entspannendes 2-tägiges Segelerlebnis mit 2 Übernachtungen Segeln in kleiner Gruppe mit nur 6 Passagieren Authentisches Segelerlebnis mit Möglichkeiten zur Mithilfe Erkunden Sie den Great Barrier Reef Marine Park Gourmet-Mahlzeiten an Bord Lauschen Sie während der Walsaison dem Gesang der Wale Private Kabinen mit eigenem Bad Neuestes kommerzielles Schiff in der Region Genießen Sie Snacks und Sekt zum Sonnenuntergang am Nachmittag,,,,https://sailing-whitsundays.com/whitsundays/milady-2d2n,,static/tour_images/sailing-whitsundays/2997a437ba2b4afe/image_40.jpg,"static/tour_images/sailing-whitsundays/2997a437ba2b4afe/image_1.jpg,static/tour_images/sailing-whitsundays/2997a437ba2b4afe/image_2.jpg,static/tour_images/sailing-whitsundays/2997a437ba2b4afe/image_3.jpg,static/tour_images/sailing-whitsundays/2997a437ba2b4afe/image_4.jpg,static/tour_images/sailing-whitsundays/2997a437ba2b4afe/image_5.jpg,static/tour_images/sailing-whitsundays/2997a437ba2b4afe/image_6.jpg,static/tour_images/sailing-whitsundays/2997a437ba2b4afe/image_7.jpg,static/tour_images/sailing-whitsundays/2997a437ba2b4afe/image_8.jpg,static/tour_images/sailing-whitsundays/2997a437ba2b4afe/image_10.jpg,static/tour_images/sailing-whitsundays/2997a437ba2b4afe/image_11.jpg,static/tour_images/sailing-whitsundays/2997a437ba2b4afe/image_14.jpg,static/tour_images/sailing-whitsundays/2997a437ba2b4afe/image_15.jpg,static/tour_images/sailing-whitsundays/2997a437ba2b4afe/image_16.jpg,static/tour_images/sailing-whitsundays/2997a437ba2b4afe/image_17.jpg,static/tour_images/sailing-whitsundays/2997a437ba2b4afe/image_18.jpg,static/tour_images/sailing-whitsundays/2997a437ba2b4afe/image_19.jpg,static/tour_images/sailing-whitsundays/2997a437ba2b4afe/image_20.jpg,static/tour_images/sailing-whitsundays/2997a437ba2b4afe/image_21.jpg,static/tour_images/sailing-whitsundays/2997a437ba2b4afe/image_22.jpeg,static/tour_images/sailing-whitsundays/2997a437ba2b4afe/image_24.jpg,static/tour_images/sailing-whitsundays/2997a437ba2b4afe/image_25.jpg,static/tour_images/sailing-whitsundays/2997a437ba2b4afe/image_26.jpg,static/tour_images/sailing-whitsundays/2997a437ba2b4afe/image_27.jpg,static/tour_images/sailing-whitsundays/2997a437ba2b4afe/image_28.jpg,static/tour_images/sailing-whitsundays/2997a437ba2b4afe/image_29.jpg,static/tour_images/sailing-whitsundays/2997a437ba2b4afe/image_30.jpg,static/tour_images/sailing-whitsundays/2997a437ba2b4afe/image_32.jpg,static/tour_images/sailing-whitsundays/2997a437ba2b4afe/image_33.jpg,static/tour_images/sailing-whitsundays/2997a437ba2b4afe/image_34.jpg,static/tour_images/sailing-whitsundays/2997a437ba2b4afe/image_35.jpg,static/tour_images/sailing-whitsundays/2997a437ba2b4afe/image_36.jpg,static/tour_images/sailing-whitsundays/2997a437ba2b4afe/image_37.jpg,static/tour_images/sailing-whitsundays/2997a437ba2b4afe/image_38.jpg,static/tour_images/sailing-whitsundays/2997a437ba2b4afe/image_39.jpg,static/tour_images/sailing-whitsundays/2997a437ba2b4afe/image_40.jpg,static/tour_images/sailing-whitsundays/2997a437ba2b4afe/image_41.jpg,static/tour_images/sailing-whitsundays/2997a437ba2b4afe/image_42.jpg,static/tour_images/sailing-whitsundays/2997a437ba2b4afe/image_43.jpg,static/tour_images/sailing-whitsundays/2997a437ba2b4afe/image_44.jpg,static/tour_images/sailing-whitsundays/2997a437ba2b4afe/image_45.jpg,static/tour_images/sailing-whitsundays/2997a437ba2b4afe/image_46.jpg,static/tour_images/sailing-whitsundays/2997a437ba2b4afe/image_47.jpg,static/tour_images/sailing-whitsundays/2997a437ba2b4afe/image_48.jpg,static/tour_images/sailing-whitsundays/2997a437ba2b4afe/image_49.jpg,static/tour_images/sailing-whitsundays/2997a437ba2b4afe/image_50.jpg,static/tour_images/sailing-whitsundays/2997a437ba2b4afe/image_51.jpg,static/tour_images/sailing-whitsundays/2997a437ba2b4afe/image_52.jpg,static/tour_images/sailing-whitsundays/2997a437ba2b4afe/image_53.jpg,static/tour_images/sailing-whitsundays/2997a437ba2b4afe/image_54.jpg",,True,https://sailing-whitsundays.com/whitsundays/milady-2d2n,Private Doppelkabine mit eigenem Bad (04. November 2025 – 31. Januar 2026): 3970 AUD | Private Zweibettkabine mit eigenem Bad (04.11.2025 – 31.01.2026): 4188 AUD | Private Masterkabine mit eigenem Bad (04.11.2025 – 31.01.2026): 7940 AUD,,2.0,multi_day,water,"Airlie Beach,Daydream Island,Great Barrier Reef,Hamilton Island","adventure,family-friendly,luxury,private,relaxation,small-group,sunset",family,adventurous,,"**Snacks am ersten Tag bei Sonnenuntergang:** Nachmittagsimbiss und ein Glas Sekt **Abendessen:** Frischer Barramundi vom Grill, Kartoffelpüree, frischer Salat mit Tomaten und Avocado **Dessert:** Pavlova mit frischen Früchten **Frühstück am zweiten Tag:** Frisch gebrühter Kaffee, verschiedene Teesorten, Muffins, frische tropische Früchte, Müsli, Joghurt
**Vormittags-Tee:** Kekse, frisch gebrühter Kaffee, verschiedene Teesorten **Mittagessen:** Garnelenplatte, Räucherlachs, Frischkäse, grüner Salat mit Oliven, Zwiebeln, Römersalat, Tomaten, Gurken, knuspriges Brot **Dessert:** Belgische Schokoladentorte
**Tag 3 Frühstück:** Frisch gebrühter Kaffee, verschiedene Teesorten, Croissants, frische tropische Früchte, Müsli, Cerealien, Joghurt *Bitte beachten Sie: Dies ist ein Beispielmenü und kann sich ändern. Bitte teilen Sie uns bei der Buchung Ihre Ernährungswünsche mit.",Ab 4 Jahren,"Paare, Familien und kleine Gruppen, die ein luxuriöses und dennoch abenteuerliches Segelerlebnis in den Whitsundays suchen.",,,,,,,
