id,name,company_name,summary,description,duration,departure_location,departure_times,price_adult,price_child,includes,highlights,keywords,duration_hours,link_booking,link_more_info,phone,image_url,image_urls,commission_rate,active,price_source_url,price_tiers,raw_text,duration_days,duration_category,tour_type,locations,tags,audience,intensity_level,video_urls,important_information,what_to_bring,whats_extra,cancellation_policy,booking_connected
053743c2bb171e4d,Summer Jo 3D/3N,summer-jo-sailing,,"Experience the Whitsundays in style aboard the newly refurbished Summer Jo, a luxurious mega yacht offering intimate small-group adventures. Perfect for solo travelers, friend groups, and families with older children, this 3-day journey combines adventure with comfort. Explore iconic Whitsunday hotspots like Whitehaven Beach and the Great Barrier Reef, with opportunities for scuba diving and snorkeling. Enjoy mouthwatering meals prepared by our onboard chef and unwind on spacious decks perfect for socializing under the sun or stars.",3 Days 3 Nights,"Shop 9/33 Port Dr, Port of Airlie",,FROM A$826.26,,"All meals (unless you require gluten-free, vegan or dairy-free meals)
Snorkelling equipment, including masks and snorkels
Unlimited hot showers
Dedicated Dive Master onboard
Locally owned vessel","Explore the iconic Whitehaven Beach
Dive and snorkel on the Great Barrier Reef
Enjoy mouthwatering meals prepared by an onboard chef
Spacious decks for socializing
Dive Master onboard for expert diving guidance
Unlimited hot showers thanks to a desalinator
Locally owned vessel showcasing the Whitsundays",,,,https://explorewhitsundays.com/summer-jo-3d3n/,,static/tour_images/explorewhitsundays/053743c2bb171e4d/image_1.jpg,"static/tour_images/explorewhitsundays/053743c2bb171e4d/image_1.jpg,static/tour_images/explorewhitsundays/053743c2bb171e4d/image_3.jpg,static/tour_images/explorewhitsundays/053743c2bb171e4d/image_4.jpg,static/tour_images/explorewhitsundays/053743c2bb171e4d/image_7.jpg,static/tour_images/explorewhitsundays/053743c2bb171e4d/image_8.png,static/tour_images/explorewhitsundays/053743c2bb171e4d/image_9.jpg,static/tour_images/explorewhitsundays/053743c2bb171e4d/image_10.png,static/tour_images/explorewhitsundays/053743c2bb171e4d/image_11.jpg,static/tour_images/explorewhitsundays/053743c2bb171e4d/image_12.jpg",,True,https://explorewhitsundays.com/summer-jo-3d3n/,"Share Single: A$826.26 | Share Double: A$1,598 (for 2 people) | Private Double Cabin: A$1,879.06 (for 2 people) | Private Twin Cabin: A$1,879.06 (for 2 people) | Private Queen Cabin: A$2,115 (for 2 people)",,3.0,multi_day,water,"Airlie Beach,Great Barrier Reef,Whitehaven","adventure,family-friendly,private,small-group",family,moderate,,"['Ages 12+ for all cabin types.', 'Diving is subject to age, good health, weather, and the dive instructor’s discretion.']","['Clothing suitable for warm weather.', 'Toiletries.', 'Sun protection (sunscreen, hat, sunglasses).', 'Personal snorkeling gear (if preferred).']","['BYO alcohol policy: No glass, no red wine.', 'Drinks available for purchase on the vessel: $3 each for bottled water, coke, coke zero, and sprite.', 'All diving can be decided on and paid for on board.', 'Non-Certified/Intro Dive Prices: 1st Dive: $160 (includes 40 min Skill Session), Every additional dive uncertified: $120.', 'Certified Dive Prices: 1st Dive: $109, 2nd Dive: $99, 3rd Dive: $89, Additional dives after that: $75.']",,0
d5017dff684ba31b,Summer Jo 2D/2N,summer-jo-sailing,,"Experience the Whitsundays in style aboard Summer Jo, a newly refitted mega yacht offering luxurious amenities for ultimate comfort. Perfect for couples, families, and divers seeking adventure and connection with nature. Cruise through the breathtaking Whitsundays, explore vibrant coral reefs, and visit the world-famous Whitehaven Beach. This social, action-packed journey is ideal for those looking to level up their dive skills with an onboard Advanced Dive Course.",2 Days 2 Nights,"Shop 9/33 Port Dr, Port of Airlie","Departs Mondays and Wednesdays at 4 pm, Returns Wednesdays and Fridays at 2 pm",FROM A$653.30,,"Luxury accommodation aboard a newly refitted mega yacht
Snorkeling and diving opportunities
Visit to Whitehaven Beach and other Whitsunday locations
Option to complete Advanced Dive Course onboard
All meals included","Luxurious mega yacht experience
Action-packed journey with snorkeling and diving
Visit world-famous Whitehaven Beach
Opportunity to enhance dive skills
Gourmet meals prepared fresh onboard",,,,https://explorewhitsundays.com/summer-jo-2d2n/,,static/tour_images/explorewhitsundays/d5017dff684ba31b/image_2.png,"static/tour_images/explorewhitsundays/d5017dff684ba31b/image_1.jpg,static/tour_images/explorewhitsundays/d5017dff684ba31b/image_2.png,static/tour_images/explorewhitsundays/d5017dff684ba31b/image_5.jpg",,True,https://explorewhitsundays.com/summer-jo-2d2n/,"Share Single with Ensuite: A$653.30 (for 1 Person) | Share Double with Ensuite: A$1,306.60 (for 2 People) | Private Twin Cabin with Ensuite: A$1,692 (for 2 People) | Private Double Cabin with Ensuite: A$1,692 (for 2 People) | Private Queen Cabin with Ensuite: A$1,870.60 (for 2 People)",,2.0,multi_day,water,"Great Barrier Reef,Whitehaven","adventure,luxury,private,relaxation,small-group,sunset",general,adventurous,,"['Ages 12+', 'No specific fitness requirements mentioned.', 'Swimming ability is required for snorkeling and diving activities.', 'Supervision needs not specified.', 'No glass bottles or red wine allowed.']","['Clothes', 'Beach towel', 'Toiletries', 'Hat', 'Swimwear', 'Sunscreen', 'Jacket/sweater', 'Camera', 'Sunglasses', 'Running shoes or sandals for island walks', 'Cash or credit card for onboard purchases']","['Summer Jo is BYO alcohol.', 'No glass bottles or red wine allowed.', 'Pack belongings in a soft-sided bag.', 'Optional extras include scuba diving packages and underwater camera hire.', 'Additional costs for dietary requirements: $15 per day / $30 for the trip.']",,0
