id,name,company_name,summary,description,duration,departure_location,departure_times,price_adult,price_child,includes,highlights,keywords,duration_hours,link_booking,link_more_info,phone,image_url,image_urls,commission_rate,active,price_source_url,price_tiers,raw_text,duration_days,duration_category,tour_type,locations,tags,audience,intensity_level,video_urls,important_information,what_to_bring,whats_extra,cancellation_policy,booking_connected
2fea6fc96f22dd13,왈츠 마틸다 선셋 크루즈,explorewhitsundays,,"에어리 비치에서 왈츠잉 마틸다를 타고 고요한 선셋 투어를 떠나 자연의 걸작을 가장 앞자리에서 감상하세요. 휘트선데이 아일랜드를 통과하는 이 매혹적인 항해는 혼자 여행하는 여행객, 단체, 커플, 가족, 친구 등 고요한 탈출을 원하는 모든 이들에게 완벽한 여행입니다. 넓고 편안한 갑판에서 음료와 스낵을 즐기며 휴식을 취하는 동안 바다 위로 펼쳐지는 숨막히는 일몰을 감상하세요. 휘트선데이즈와 에어리 비치의 탁 트인 전망을 감상하며 잊지 못할 저녁을 보내세요.",,"9/33 포트 닥터 숍, 포트 에얼리, 호주",,A$79,A$47,"무료 버블 1잔
넓고 편안한 데크 공간
올 인클루시브(추가 비용 없음)
휘트선데이즈와 에어리 비치의 파노라마 전망","파이오니어 베이 항해하기
바다 위로 펼쳐지는 숨막히는 일몰 감상하기
음료와 스낵을 즐기며 휴식 취하기
혼자 여행하는 여행객, 단체, 커플, 가족, 친구에게 적합
매주 금요일과 토요일 이용 가능",,,https://explorewhitsundays.com/waltzing-matilda-sunset-cruise/,https://explorewhitsundays.com/waltzing-matilda-sunset-cruise/,,static/tour_images/explorewhitsundays/Waltzing Matilda Sunset Cruise/image_1.jpg,"static/tour_images/explorewhitsundays/Waltzing Matilda Sunset Cruise/image_1.jpg,static/tour_images/explorewhitsundays/Waltzing Matilda Sunset Cruise/image_3.jpg,static/tour_images/explorewhitsundays/Waltzing Matilda Sunset Cruise/image_4.jpg,static/tour_images/explorewhitsundays/Waltzing Matilda Sunset Cruise/image_5.jpg,static/tour_images/explorewhitsundays/Waltzing Matilda Sunset Cruise/image_6.jpg,static/tour_images/explorewhitsundays/Waltzing Matilda Sunset Cruise/image_7.jpg,static/tour_images/explorewhitsundays/Waltzing Matilda Sunset Cruise/image_10.jpg",,True,https://explorewhitsundays.com/waltzing-matilda-sunset-cruise/,성인 A$79 | 어린이(12세 이하): A$47,,,unknown,combo,"Airlie Beach,Great Barrier Reef,Whitsunday Island","private,relaxation,sunset",family,relaxed,,"['성인 12세 이상', '만 12세 이하 어린이', '혼자 여행하는 여행자, 단체, 커플, 가족, 친구에게 적합']]","['멋진 석양을 담을 카메라', '따뜻한 옷(겨울)', '모자(여름)', '출발 시 선글라스', '우비(필요 시)', 'BYO 음료(선택 사항)']","['BYO(얼음 제공)', '무료 버블 한 잔', '무료 핑거 푸드', '올 인클루시브(추가 요금 없음)']",,0
04f13907d7f1482b,휘트선데이 펄 2D/2N,explorewhitsundays,,"친밀한 그룹 항해를 위해 디자인된 스타일리시한 쌍동선인 휘트선데이 펄을 타고 전에 없던 휘트선데이를 경험하세요. 선장과 호스티스가 모두 승선하고 있어 번거로움 없이 편안하게 숨막히는 경치를 즐길 수 있습니다. 커플이나 소규모 그룹에게 이상적인 이 투어는 상징적인 화이트헤븐 비치와 힐 인렛을 포함한 가장 아름답고 한적한 명소로 여러분을 안내합니다. 넓은 갑판, 전용 욕실이 딸린 세련된 더블 캐빈, 선상 제빙기 및 스타링크(Starlink) 기반 와이파이와 같은 현대적인 편의시설을 갖추고 있어 편안하고 럭셔리한 여행을 보장합니다.",2박 2일,"9/33 포트 닥터 숍, 포트 에얼리, 호주",,"FROM A$3,490",,"선장과 안주인으로 완전 승선
스노클링 장비(마스크, 스노클, 잠수복, 부력 장치)
모든 해양 공원 입장료
화이트헤이븐 비치 & 힐 인렛 방문
그레이트 배리어 리프 스노클링
8명의 게스트와 함께하는 친밀한 그룹 세일링
라군 450 선박
4개의 스타일리시한 더블 캐빈과 전용 화장실
스탠드업 패들 보드
선상 가전제품을 위한 태양광 패널
스타링크가 제공하는 선상 와이파이
숯 여과 식수
선상 제빙기 및 커피 머신","전용 더블 캐빈이 있는 스타일리시한 카타마란
단 8명의 게스트와 함께하는 친밀한 세일링 체험
화이트헤이븐 비치 및 힐 인렛 방문
그레이트 배리어 리프 스노클링
휴식을 위한 넓은 데크
와이파이와 제빙기를 포함한 현대적인 편의시설",,,https://explorewhitsundays.com/whitsunday-pearl/,https://explorewhitsundays.com/whitsunday-pearl/,,static/tour_images/explorewhitsundays/04f13907d7f1482b/image_4.jpg,"static/tour_images/explorewhitsundays/04f13907d7f1482b/image_1.jpg,static/tour_images/explorewhitsundays/04f13907d7f1482b/image_4.jpg",,True,https://explorewhitsundays.com/whitsunday-pearl/,"욕실이 딸린 프라이빗 더블 캐빈: A$3,490",,2.0,multi_day,combo,"Airlie Beach,Great Barrier Reef,Hill Inlet,Whitehaven","private,relaxation,small-group",general,relaxed,,"['특정 연령 제한 언급 없음', '체력 요건 명시 없음', '스노클링 활동에는 수영 능력 권장', '감독 필요 없음', '유리병 사용 제한(와인병 제외)']","['갈아입을 옷', '수영복', '세면도구', '방충제', '리필할 물병', '카메라', '편안한 운동화', '자외선 차단제(선크림, 모자, 선글라스 등)', '저녁용 따뜻한 옷/풀오버(계절별)']","['BYO 주류 - 유리병 반입 불가(와인병 제외)', '일부 식단 요청 및 요구 사항에는 $20의 추가 요금이 부과될 수 있습니다.', '스노클링 장비(오리발, 처방 마스크 등) 추가 가능', '성수기(크리스마스, 부활절, 새해)에는 추가 요금이 발생할 수 있습니다.', '수하물 보관소가 지정되지 않았습니다.'], '숙박 시설에 짐을 보관할 수 없습니다",,0
053743c2bb171e4d,여름 조 3D/3N,explorewhitsundays,,"새롭게 단장한 럭셔리 메가 요트인 서머 조를 타고 친밀한 소규모 그룹 어드벤처를 즐기며 휘트선데이즈를 스타일리시하게 경험하세요. 나홀로 여행자, 친구 그룹, 어린이 동반 가족에게 완벽한 이 3일간의 여행은 모험과 편안함을 결합한 여행입니다. 화이트헤븐 비치와 그레이트 배리어 리프와 같은 휘트선데이의 상징적인 명소를 둘러보고 스쿠버 다이빙과 스노클링을 즐겨보세요. 선상 셰프가 준비한 군침 도는 식사를 즐기고 태양이나 별빛 아래에서 사교를 즐기기에 완벽한 넓은 데크에서 긴장을 풀어보세요.",3박 3일,"9/33 포트 닥터 숍, 포트 에얼리, 호주",,FROM A$826.26,,"모든 식사(글루텐 프리, 비건 또는 유제품이 없는 식사가 필요한 경우 제외)
마스크와 스노클을 포함한 스노클링 장비
무제한 온수 샤워
전담 다이브 마스터 승선
현지 소유 선박","상징적인 화이트헤이븐 비치 탐험하기
그레이트 배리어 리프에서 다이빙과 스노클링 즐기기
선상 셰프가 준비한 군침 도는 식사 즐기기
사교를 위한 넓은 데크
전문 다이빙 가이드를 위한 선상 다이브 마스터
담수화 장치 덕분에 무제한 온수 샤워 가능
휘트선데이즈를 보여주는 현지인 소유 선박",,,https://explorewhitsundays.com/summer-jo-3d3n/,https://explorewhitsundays.com/summer-jo-3d3n/,,static/tour_images/explorewhitsundays/053743c2bb171e4d/image_1.jpg,"static/tour_images/explorewhitsundays/053743c2bb171e4d/image_1.jpg,static/tour_images/explorewhitsundays/053743c2bb171e4d/image_3.jpg,static/tour_images/explorewhitsundays/053743c2bb171e4d/image_4.jpg,static/tour_images/explorewhitsundays/053743c2bb171e4d/image_7.jpg,static/tour_images/explorewhitsundays/053743c2bb171e4d/image_8.png,static/tour_images/explorewhitsundays/053743c2bb171e4d/image_9.jpg,static/tour_images/explorewhitsundays/053743c2bb171e4d/image_10.png,static/tour_images/explorewhitsundays/053743c2bb171e4d/image_11.jpg,static/tour_images/explorewhitsundays/053743c2bb171e4d/image_12.jpg",,True,https://explorewhitsundays.com/summer-jo-3d3n/,"싱글 공유: A$826.26 | 쉐어 더블: A$1,598(2인 기준) | 프라이빗 더블 캐빈: A$1,879.06(2인 기준) | 프라이빗 트윈 캐빈: A$1,879.06(2인 기준) | 프라이빗 퀸 캐빈: A$2,115(2인 기준)",,3.0,multi_day,water,"Airlie Beach,Great Barrier Reef,Whitehaven","adventure,family-friendly,private,small-group",family,moderate,,"['모든 객실 유형에 12세 이상.', '다이빙은 나이, 건강 상태, 날씨 및 다이빙 강사의 재량에 따라 달라질 수 있습니다.']]","['따뜻한 날씨에 적합한 옷.', '세면도구.', '자외선 차단제(선크림, 모자, 선글라스).', '개인 스노클링 장비(선호하는 경우).']","['BYO 알코올 정책: 잔, 레드 와인 금지.', '선내에서 구매 가능한 음료: 생수, 콜라, 콜라 제로, 스프라이트 각 $3.', '모든 다이빙은 선상에서 결정하고 결제할 수 있습니다.', '비인증/입문 다이빙 요금: 첫 번째 다이빙: $160 (40분 스킬 세션 포함), 추가 다이빙마다 비인증: 120.', '인증 다이빙 가격: 첫 번째 다이빙: $109, 두 번째 다이빙: $99, 세 번째 다이빙: $89, 그 이후의 추가 다이빙: $75.']",,0
f649adbc75a985f7,솔웨이 라스 3D/2N,explorewhitsundays,,"역사와 모험이 독특하게 어우러진 아름답게 보존된 대형 선박인 솔웨이 라스를 타고 휘트선데이즈를 경험하세요. 넓은 갑판 공간, 허가받은 바, 에어컨이 완비된 선실을 갖춘 이 투어는 편안함과 흥미진진한 경험을 선사합니다. 배낭여행객과 모험을 즐기는 여행객에게 완벽한 이 투어는 세일링, 스노클링, 아름다운 해변과 산호초 탐험의 스릴을 만끽할 수 있습니다. 솔웨이 라스는 숨막히는 일몰, 활기찬 해양 생물, 그리고 동료 여행자들과 평생 잊지 못할 추억을 만들 수 있는 기회를 제공합니다.",2박 3일,"9/33 포트 닥터 숍, 포트 에얼리, 호주",,"FROM A$2,150",,"선장 및 승무원 서비스
모든 식사 및 간식
수돗물, 차, 커피
목욕 타월
스탠드업 패들보드
스노클링 장비 및 기본 수업료
스팅거 슈트
모든 마리나 부과금","유서 깊은 대형 유람선 타고 항해하기
휘트선데이 아일랜드 탐험하기
갑판에서 야외 식사 즐기기
세일링 액티비티 참여하기
생생한 산호초에서 스노클링 즐기기
화이트헤이븐 비치에서 휴식하기
멋진 일몰과 일출 감상하기
해피아워에 다른 여행자들과 만나기",,,https://explorewhitsundays.com/all-tours/overnight-trips/solway-voyager-3d2n/,https://explorewhitsundays.com/all-tours/overnight-trips/solway-voyager-3d2n/,,static/tour_images/explorewhitsundays/f649adbc75a985f7/image_8.jpg,"static/tour_images/explorewhitsundays/f649adbc75a985f7/image_1.jpg,static/tour_images/explorewhitsundays/f649adbc75a985f7/image_2.jpg,static/tour_images/explorewhitsundays/f649adbc75a985f7/image_4.jpg,static/tour_images/explorewhitsundays/f649adbc75a985f7/image_5.jpg,static/tour_images/explorewhitsundays/f649adbc75a985f7/image_6.jpg,static/tour_images/explorewhitsundays/f649adbc75a985f7/image_8.jpg,static/tour_images/explorewhitsundays/f649adbc75a985f7/image_9.jpg,static/tour_images/explorewhitsundays/f649adbc75a985f7/image_10.jpg,static/tour_images/explorewhitsundays/f649adbc75a985f7/image_12.jpg",,True,https://explorewhitsundays.com/all-tours/overnight-trips/solway-voyager-3d2n/,"성인: A$2,150",,3.0,multi_day,combo,"Airlie Beach,Great Barrier Reef,Hook Island,Whitehaven,Whitsunday Island","adventure,private,relaxation,sunset",general,adventurous,,"['연령: 18세 이상', '최대 탑승 인원: 32명']","['옷', '비치타월', '세면도구', '모자', '수영복', '선크림', '재킷/스웨터', '카메라', '선글라스', '섬 산책용 운동화 또는 샌들', '기내 구매 시 현금 또는 신용카드']","['솔웨이 보이저는 BYO입니다', '여행에 필요한 소지품은 부드러운 가방에 넣어주세요.']",,0
3db466b62ae0d157,시스카 2D/1N,explorewhitsundays,,젊고 사교적인 분위기의 클래식 세일링 요트인 시스카를 타고 휘트선데이를 경험하세요. 새로운 친구를 사귀고 휘트선데이의 상징적인 장소를 탐험하고 싶지만 시간이 부족한 분들에게 안성맞춤입니다. 넉넉한 좌석 공간과 개방형 숙박시설에서 즐거운 세일링 어드벤처를 즐기며 한 잔의 음료를 마시며 사교를 즐기고 일몰을 감상하기에 이상적입니다. 이 투어는 모험과 동료애를 추구하는 젊은 여행객에게 안성맞춤입니다.,1박 2일,"9/33 포트 닥터 숍, 포트 에얼리, 호주","오전 9시 출발, 오후 4시 귀국",A$460.60,,"선장 및 승무원 서비스
모든 식사 및 간식
수돗물, 차, 커피
스노클링 장비 및 기본 수업료
스팅거 슈트
모든 침대 린넨","힐 인렛 전망대까지 가이드가 안내하는 부시 워크
화이트헤이븐 비치 방문
선셋 음료 및 저녁 식사 전 간식
프린지 산호초에서 스노클링 즐기기
선상에서 조리된 신선한 공동 식사
싱글 및 더블 침대를 갖춘 오픈 플랜 숙소",,,https://explorewhitsundays.com/all-tours/overnight-trips/siska-iv/,https://explorewhitsundays.com/all-tours/overnight-trips/siska-iv/,,static/tour_images/explorewhitsundays/3db466b62ae0d157/image_7.jpeg,"static/tour_images/explorewhitsundays/3db466b62ae0d157/image_1.jpg,static/tour_images/explorewhitsundays/3db466b62ae0d157/image_2.jpg,static/tour_images/explorewhitsundays/3db466b62ae0d157/image_3.jpg,static/tour_images/explorewhitsundays/3db466b62ae0d157/image_4.jpg,static/tour_images/explorewhitsundays/3db466b62ae0d157/image_6.jpg,static/tour_images/explorewhitsundays/3db466b62ae0d157/image_7.jpeg,static/tour_images/explorewhitsundays/3db466b62ae0d157/image_9.jpg,static/tour_images/explorewhitsundays/3db466b62ae0d157/image_10.jpg,static/tour_images/explorewhitsundays/3db466b62ae0d157/image_11.jpg,static/tour_images/explorewhitsundays/3db466b62ae0d157/image_12.jpg,static/tour_images/explorewhitsundays/3db466b62ae0d157/image_13.jpg,static/tour_images/explorewhitsundays/3db466b62ae0d157/image_14.jpg,static/tour_images/explorewhitsundays/3db466b62ae0d157/image_15.jpg,static/tour_images/explorewhitsundays/3db466b62ae0d157/image_16.jpg,static/tour_images/explorewhitsundays/3db466b62ae0d157/image_18.jpg,static/tour_images/explorewhitsundays/3db466b62ae0d157/image_19.jpg",,True,https://explorewhitsundays.com/all-tours/overnight-trips/siska-iv/,싱글 침대: A$460.60 | 하프 더블 침대(대기 요금): A$460.60,,2.0,multi_day,combo,"Airlie Beach,Great Barrier Reef,Hill Inlet,Whitehaven","adventure,private,sunset",general,adventurous,,"['연령: 15세 이상', '체력 요구 사항 없음', '스노클링 활동에는 수영 능력이 필요합니다.', '감독 필요 없음', '구체적인 제한 사항 언급 없음']","['옷', '비치 및 목욕 타월', '세면도구', '모자', '수영복', '선크림', '재킷/스웨터', '카메라', '선글라스', '섬 산책용 러닝화 또는 샌들']","['BYO 주류 및 청량음료 - 유리병, 레드 와인 금지', '병 판매점은 오전 10시까지 영업하지 않으므로 전날 밤에 예약해야 합니다', '선착장에 수하물 보관소 없음', '보관소는 에어리 비치의 메인 스트리트인 344 슈트 하버 로드(오전 7시~오후 6시)에 있습니다', '체크인 시 24달러의 비용으로 선착장에 주차할 수 있습니다']",,0
860462ff96e36caa,첫 2D/1박,explorewhitsundays,,"친밀한 소규모 그룹 모험을 위해 설계된 매력적이고 편안한 세일링 요트 프리마를 타고 휘트선데이즈를 경험하세요. 가족 여행, 로맨틱한 휴양지, 부드러운 모험을 원하는 여행객에게 이상적인 프리마는 목가적인 섬 지역을 탐험할 수 있는 특별한 기회를 제공합니다. 그늘이 드리워진 캐노피와 쿠션이 있는 일광욕 공간에서 휴식을 취하며 멋진 경치를 즐길 수 있습니다. 스노클링과 해양 생물을 만나고 선상에서 갓 준비한 식사를 즐길 수 있는 기회와 함께 매번 새로운 모험이 펼쳐집니다. 고요한 분위기에서 긴장을 풀고 다른 여행자들과 교류하고 싶은 분들에게 안성맞춤입니다.",1박 2일,"9/33 포트 닥터 숍, 포트 에얼리, 호주",,A$516.06,,"선장 및 승무원 서비스
모든 아침, 점심, 저녁 및 간식
수돗물, 차 및 커피
스노클링 장비 및 기본 수업료
입장/입장 - 화이트헤븐 비치
입장/입장 - 힐 인렛
입장/입장 - 휘트선데이 아일랜드
선착장 도착/출발 교통편
목욕 타월, 스팅거 슈트 및 모든 침대 린넨","소규모 그룹 세일링 어드벤처
목가적인 섬 위치
편안한 좌석과 일광욕 공간
게스트 냉장고가 있는 BYO 음료 정책
현지 식재료를 사용해 신선하게 조리된 식사
스노클링과 해양 생물 만나기 기회
멋진 일몰과 별 관찰",,,https://explorewhitsundays.com/overnight-trips/prima/,https://explorewhitsundays.com/overnight-trips/prima/,,static/tour_images/explorewhitsundays/860462ff96e36caa/image_6.png,"static/tour_images/explorewhitsundays/860462ff96e36caa/image_2.jpg,static/tour_images/explorewhitsundays/860462ff96e36caa/image_3.jpg,static/tour_images/explorewhitsundays/860462ff96e36caa/image_4.jpg,static/tour_images/explorewhitsundays/860462ff96e36caa/image_5.jpg,static/tour_images/explorewhitsundays/860462ff96e36caa/image_6.png,static/tour_images/explorewhitsundays/860462ff96e36caa/image_7.jpg,static/tour_images/explorewhitsundays/860462ff96e36caa/image_8.jpg,static/tour_images/explorewhitsundays/860462ff96e36caa/image_9.png,static/tour_images/explorewhitsundays/860462ff96e36caa/image_10.jpg,static/tour_images/explorewhitsundays/860462ff96e36caa/image_11.jpg,static/tour_images/explorewhitsundays/860462ff96e36caa/image_12.jpg,static/tour_images/explorewhitsundays/860462ff96e36caa/image_13.png,static/tour_images/explorewhitsundays/860462ff96e36caa/image_14.jpg,static/tour_images/explorewhitsundays/860462ff96e36caa/image_16.jpg,static/tour_images/explorewhitsundays/860462ff96e36caa/image_17.jpg,static/tour_images/explorewhitsundays/860462ff96e36caa/image_18.jpg,static/tour_images/explorewhitsundays/860462ff96e36caa/image_19.jpg,static/tour_images/explorewhitsundays/860462ff96e36caa/image_20.png,static/tour_images/explorewhitsundays/860462ff96e36caa/image_21.jpg,static/tour_images/explorewhitsundays/860462ff96e36caa/image_22.png,static/tour_images/explorewhitsundays/860462ff96e36caa/image_24.jpg,static/tour_images/explorewhitsundays/860462ff96e36caa/image_25.jpg,static/tour_images/explorewhitsundays/860462ff96e36caa/image_26.jpg,static/tour_images/explorewhitsundays/860462ff96e36caa/image_27.jpg",,True,https://explorewhitsundays.com/overnight-trips/prima/,"싱글 침대: A$516.06 | 더블 침대 전용(2인용): A$1,098 | 욕실이 딸린 프라이빗 더블 캐빈(2인용): A$1,156.20: A$1,156.20 | 전용 더블룸(욕실 포함) (2인용, 전화 예약) A$1,291.56",,2.0,multi_day,combo,"Airlie Beach,Great Barrier Reef,Hill Inlet,Hook Island,Whitehaven,Whitsunday Island","adventure,private,relaxation,small-group,sunset",general,adventurous,,"['연령: 4세 이상', '특별한 체력 요구 사항이 언급되지 않았습니다.', '스노클링 활동에는 수영 능력이 권장됩니다.', '4세 미만 어린이에 대한 감독 요구 사항은 명시되지 않았습니다.', '제한 사항이 언급되지 않았습니다.']","['옷', '비치타월/수건', '세면도구', '모자', '수영복', '선크림', '재킷/스웨터', '카메라', '선글라스', '섬 산책용 러닝화 또는 샌들']","['모든 청량음료 및 주류에 대한 BYO 정책.', '기내에서 음료는 판매하지 않습니다.', '부드러운 면 지퍼백에 포장.', '선착장을 오가는 교통편은 포함되어 있지 않습니다.']",,0
f0e5d40f952752df,휘트선데이 겟어웨이 2D/2N,explorewhitsundays,,"스타일리시한 쌍동선인 휘트선데이 겟어웨이를 타고 최고의 편안함으로 휘트선데이를 경험하세요. 이 친밀한 소규모 그룹 투어는 로맨틱한 휴가를 원하는 커플이나 여유로운 세일링 경험을 원하는 분들에게 적합합니다. 경험이 풍부한 선장과 호스티스가 가장 경치 좋은 장소, 고요한 해변, 고요한 정박지로 여러분을 안내하는 가운데 승무원 전원이 탑승한 선박의 프라이버시를 즐기며 긴장을 풀고 여유를 만끽할 수 있습니다. 항해사 지망생이든 한 잔의 여유를 즐기고 싶은 분이든, 이 투어는 모험과 레저가 완벽하게 조화를 이루고 있어 인파에서 벗어나 자연과 교감하고 싶은 모든 분들에게 이상적입니다.",2박 2일,"9/33 포트 닥터 숍, 포트 에얼리, 호주",오후 2시 30분 출발,FROM A$1405.30,,"선장과 호스티스로 구성된 완벽한 승무원 서비스
선상에서 준비된 미식 요리
힐 인렛 전망대까지 가이드가 안내하는 부시 워크
스노클링 장비
스탠드업 패들보딩
컨티넨탈 조식
뷔페 점심","아름다운 섬의 경치를 감상하며 항해하기
화이트헤이븐 비치와 힐 인렛 전망대 방문하기
생동감 넘치는 수중 세계 스노클링
럭셔리한 카타마란에서 휴식 취하기
선상에서 맛있는 식사와 음료 즐기기",,,https://explorewhitsundays.com/overnight-trips/whitsunday-getaway-2d2n/,https://explorewhitsundays.com/overnight-trips/whitsunday-getaway-2d2n/,,static/tour_images/explorewhitsundays/f0e5d40f952752df/image_3.jpg,"static/tour_images/explorewhitsundays/f0e5d40f952752df/image_2.jpg,static/tour_images/explorewhitsundays/f0e5d40f952752df/image_3.jpg,static/tour_images/explorewhitsundays/f0e5d40f952752df/image_4.jpg,static/tour_images/explorewhitsundays/f0e5d40f952752df/image_5.jpg,static/tour_images/explorewhitsundays/f0e5d40f952752df/image_7.jpg,static/tour_images/explorewhitsundays/f0e5d40f952752df/image_9.jpg,static/tour_images/explorewhitsundays/f0e5d40f952752df/image_10.jpg,static/tour_images/explorewhitsundays/f0e5d40f952752df/image_11.jpg,static/tour_images/explorewhitsundays/f0e5d40f952752df/image_12.jpg,static/tour_images/explorewhitsundays/f0e5d40f952752df/image_13.jpg,static/tour_images/explorewhitsundays/f0e5d40f952752df/image_15.jpg",,True,https://explorewhitsundays.com/overnight-trips/whitsunday-getaway-2d2n/,프라이빗 더블 캐빈 엔스위트: A$1405.30(2인 기준),,2.0,multi_day,combo,"Airlie Beach,Great Barrier Reef,Hill Inlet,Whitehaven,Whitsunday Island","adventure,luxury,private,relaxation,small-group",general,adventurous,,"['연령: 18세 이상', '휘트선데이 겟어웨이는 성인 전용 선박입니다.']","['옷', '세면도구', '모자', '수영복', '선크림', '재킷/스웨터', '카메라', '선글라스', '섬 산책에 적합한 운동화', '음료수 구매용 현금']","['모든 청량음료 및 알코올 음료와 생수에 대한 BYO 정책.', '소프트백에 포장해 주세요. (하드/가방 금지).', '선상 와이파이 - 스타링크 위성 인터넷은 크루즈 기간 동안 객실당 $10에 구매할 수 있습니다(체크인 시 결제).']]",,0
