id,name,company_name,summary,description,duration,departure_location,departure_times,price_adult,price_child,includes,highlights,keywords,duration_hours,link_booking,link_more_info,phone,image_url,image_urls,commission_rate,active,price_source_url,price_tiers,raw_text,duration_days,duration_category,tour_type,locations,tags,audience,intensity_level,video_urls,important_information,what_to_bring,whats_extra,cancellation_policy,booking_connected
d5017dff684ba31b,여름 조 2D/2N,explorewhitsundays,,"럭셔리한 편의시설을 갖추고 최고의 편안함을 선사하는 새롭게 단장한 메가 요트인 서머 조를 타고 휘트선데이즈를 스타일리시하게 경험하세요. 모험과 자연과의 교감을 원하는 커플, 가족, 다이버에게 완벽한 요트입니다. 숨막히게 아름다운 휘트선데이즈를 크루즈하고 생동감 넘치는 산호초를 탐험하며 세계적으로 유명한 화이트헤이븐 비치를 방문하세요. 이 사교적이고 액션으로 가득한 여행은 선상 어드밴스드 다이빙 코스를 통해 다이빙 스킬을 향상시키고자 하는 분들에게 이상적입니다.",2박 2일,"9/33 포트 닥터 숍, 포트 에얼리, 호주","월요일과 수요일 오후 4시 출발, 수요일과 금요일 오후 2시 귀국",FROM A$653.30,,"새로 개조된 메가 요트에서의 럭셔리 숙박
스노클링과 다이빙 기회
화이트헤븐 비치 및 기타 휘트선데이 명소 방문
선상 어드밴스드 다이빙 코스 옵션
모든 식사 포함","럭셔리한 메가 요트 체험
스노클링과 다이빙으로 가득한 액티비티 여행
세계적으로 유명한 화이트헤븐 해변 방문
다이빙 스킬을 향상시킬 수 있는 기회
선상에서 갓 준비한 미식 요리",,,https://explorewhitsundays.com/summer-jo-2d2n/,https://explorewhitsundays.com/summer-jo-2d2n/,,static/tour_images/explorewhitsundays/d5017dff684ba31b/image_2.png,"static/tour_images/explorewhitsundays/d5017dff684ba31b/image_1.jpg,static/tour_images/explorewhitsundays/d5017dff684ba31b/image_2.png,static/tour_images/explorewhitsundays/d5017dff684ba31b/image_5.jpg",,True,https://explorewhitsundays.com/summer-jo-2d2n/,"엔스위트와 싱글을 공유하세요: A$653.30(1인) | 쉐어 더블(엔스위트 포함): A$1,306.60(2인) | 전용 트윈 캐빈(욕실 포함): A$1,692(2인) | 전용 더블 캐빈(욕실 포함): A$1,692: A$1,692(2인) | 전용 퀸 캐빈(욕실): A$1,692: A$1,870.60(2인 기준)",,2.0,multi_day,water,"Great Barrier Reef,Whitehaven","adventure,luxury,private,relaxation,small-group,sunset",general,adventurous,,"['12세 이상', '특정 체력 요건 언급 없음', '스노클링 및 다이빙 활동에는 수영 능력이 필요합니다.', '감독 필요 없음', '유리병이나 레드 와인 반입 금지']","['옷', '비치타월', '세면도구', '모자', '수영복', '선크림', '재킷/스웨터', '카메라', '선글라스', '섬 산책용 운동화 또는 샌들', '기내 구매 시 현금 또는 신용카드']","['여름 조는 주류 반입 금지.', '유리병이나 레드 와인 반입 금지.', '소지품은 부드러운 가방에 넣어주세요.', '스쿠버 다이빙 패키지와 수중 카메라 대여는 추가 옵션입니다.', '식단에 대한 추가 비용 발생: 하루 $15 / 여행 총액 $30'], '식단에 대한 추가 비용: 하루 $15 / 여행 총액 $30",,0
a2d895c62988ac65,왈츠하는 마틸다: 휘트선데이즈 1박 2일 크루즈,explorewhitsundays,,"왈츠 마틸다와 함께 아름다운 휘트선데이즈에서 잊을 수 없는 세일링 어드벤처를 경험하세요. 이 특별한 소규모 그룹 투어는 망망대해에서 편안함과 스타일을 추구하는 이들에게 완벽한 친밀하고 개인화된 여행을 제공합니다. 게스트들 간의 커뮤니티를 조성하기 위해 세심하게 설계된 선박을 타고 목가적인 섬, 한적한 해변, 활기찬 산호초를 탐험하게 됩니다. 커플, 가족, 모험을 추구하는 여행객들에게 이상적인 왈츠잉 마틸다를 타고 보내는 모든 순간이 마법 같은 추억이 될 것입니다.",1박 2일,"9/33 포트 닥터 숍, 포트 에얼리, 호주",,FROM A$490,,"매우 지식이 풍부하고 친절하고 친절한 승무원
그늘막 차양이 있는 넓은 평평한 갑판
신선한 현지 농산물을 사용한 선상 식사
스노클링 장비 및 강습료 제공
모든 해양 및 공원 입장료 포함","독점적인 소규모 그룹 세일링 어드벤처
친밀하고 개인화된 경험
편안하고 스타일리시한 선박
커뮤니티와 연결을 위해 세심하게 설계된 레이아웃
목가적인 섬 위치, 한적한 해변, 생동감 넘치는 산호초",,,https://explorewhitsundays.com/waltzing-matilda-2-day-1-night-whitsundays-cruise/,https://explorewhitsundays.com/waltzing-matilda-2-day-1-night-whitsundays-cruise/,,static/tour_images/explorewhitsundays/a2d895c62988ac65/image_2.jpg,"static/tour_images/explorewhitsundays/a2d895c62988ac65/image_1.jpg,static/tour_images/explorewhitsundays/a2d895c62988ac65/image_2.jpg,static/tour_images/explorewhitsundays/a2d895c62988ac65/image_4.jpg",,True,https://explorewhitsundays.com/waltzing-matilda-2-day-1-night-whitsundays-cruise/,"프라이빗 더블 캐빈: A$1,125(2인 기준) | 쉐어드 싱글: A$490 | 쉐어드 더블: A$985(2인 기준) | 트리플 캐빈: A$1,470 | 쿼드 캐빈: A$1,960 | 그룹 캐빈: A$1,960",,2.0,multi_day,combo,"Airlie Beach,Great Barrier Reef","adventure,private,small-group",general,adventurous,,"['특정 연령 제한이 언급되지 않았습니다.', '체력 요건이 언급되지 않았습니다.', '수영 능력이 명시되지 않았습니다.', '감독 필요성이 언급되지 않았습니다.', '제한 사항이 언급되지 않았습니다.']","['카메라', '선글라스', '따뜻한 옷(겨울철)', '선크림 및 모자(여름철)', '우비(날씨에 따라 다름)', '모자 및 햇빛에 안전한 옷', '수영복', '타월']","['BYO 주류', '음식 BYO 정책에 대한 언급 없음', '수하물 보관소에 대한 언급 없음', '환승에 대한 언급 없음', '추가 옵션에 대한 언급 없음', '추가 비용에 대한 언급 없음']",,0
