id,name,company_name,summary,description,duration,departure_location,departure_times,price_adult,price_child,includes,highlights,keywords,duration_hours,link_booking,link_more_info,phone,image_url,image_urls,commission_rate,active,price_source_url,price_tiers,raw_text,duration_days,duration_category,tour_type,locations,tags,audience,intensity_level,video_urls,important_information,what_to_bring,whats_extra,cancellation_policy,booking_connected
569b7d6e736f5648,Discover Scuba Diving Pool-Tauchgang,whitsundaydiveadventures,,"Tauchen Sie ein in ein unvergessliches Abenteuer mit unserem Discover Scuba Diving Pool Dive. Diese Einführungsveranstaltung ist ideal für Anfänger und ermöglicht es Ihnen, die grundlegenden Tauchfertigkeiten zu erlernen und das aufregende Gefühl des Atmens unter Wasser in einer sicheren und kontrollierten Umgebung zu erleben. Unter der Leitung unserer professionellen SSI-Tauchlehrer haben Sie ausreichend Zeit, um sich mit der Tauchausrüstung vertraut zu machen und die Unterwasserwelt zu erkunden. Er ist das perfekte Sprungbrett für weitere Tauchabenteuer und gibt Ihnen das nötige Selbstvertrauen, um die Wunder der Unterwasserwelt zu erkunden, die Sie erwarten.",Approximately 2 hours,Airlie Beach Dive Centre,,FROM A$185.00,,"Die gesamte Tauchausrüstung wird gestellt
Theorieeinheit, um sich mit den grundlegenden Tauchprinzipien vertraut zu machen
Ausrüstungssitzung für Aufbau und Sicherheitschecks
Poolsitzung für praktische Übungen","Perfekt für Anfänger
Erlernen grundlegender Tauchfertigkeiten
Erfahrung mit dem Atmen unter Wasser
Sichere und kontrollierte Umgebung
Geführt von professionellen SSI-Ausbildern
45-minütige Pool-Sitzung",,2.0,,https://whitsundaydiveadventures.com/courses/try-scuba-pool-dive/,,,,,True,https://whitsundaydiveadventures.com/courses/try-scuba-pool-dive/,,,,half_day,water,"Airlie Beach,Whitsunday Island","adventure,private",general,adventurous,,"['Mindestalter: 8 Jahre', 'Ausfüllen eines grundlegenden medizinischen Fragebogens zur Sicherstellung der Tauchtauglichkeit']",,,,0
bac5e66fa717568f,Discover Scuba Diving Tagestour,whitsundaydiveadventures,,"Begeben Sie sich mit der Discover Scuba Diving Day Tour auf eine aufregende Einführung in das Tauchen. Dieses Abenteuer ist perfekt für Anfänger, die die Unterwasserwelt erkunden möchten, und bietet eine sichere und aufregende Möglichkeit, die Magie des Atmens unter Wasser zu erleben. Unter der Leitung professioneller Tauchlehrer tauchen Sie in die pulsierende Unterwasserwelt der Whitsunday Islands ein und sind damit die ideale Wahl für neugierige Abenteurer und Tauchanfänger gleichermaßen.",1 Day,Airlie Beach Dive Centre,,FROM A$399.00,,"Grundlegende Sicherheitsrichtlinien und Einweisung in die Fertigkeiten
Direkte Beaufsichtigung durch erfahrene Ausbilder
Benutzung der Tauchausrüstung
1 von einem Tauchlehrer geführter Tauchgang rund um die Whitsunday Islands
Alle Tauchausrüstungen werden gestellt
verhältnis Schüler zu Tauchlehrer 2:1","Erleben Sie den Nervenkitzel des Atmens unter Wasser
Erforschen Sie die Unterwasserwunder der Whitsunday Islands
Branchenführendes Verhältnis von 2:1 zwischen Schülern und Tauchlehrern
Persönliche Betreuung und Anleitung
Tauchzeit ca. 30 Minuten",,,,https://whitsundaydiveadventures.com/co/discover-scuba-diving-day-tour/,,,,,True,https://whitsundaydiveadventures.com/co/discover-scuba-diving-day-tour/,,,1.0,unknown,water,"Airlie Beach,Whitsunday Island","adventure,private",general,adventurous,,"['Mindestalter erforderlich: 12 Jahre alt."", ""Ausfüllen eines grundlegenden medizinischen Fragebogens zur Feststellung der Tauchtauglichkeit""]",,"[Verbessern Sie Ihren Tag mit einem Mittagessen, das als zusätzliche Option für alle Ernährungsbedürfnisse angeboten wird.]",,0
c1b2b67c9694aaa7,Airlie Beach Tagestour mit 2 Tauchgängen,whitsundaydiveadventures,,"Tauchen Sie auf dieser aufregenden Tagestour in die Tiefen der Whitsunday-Inseln ein - perfekt für zertifizierte Taucher, die ein unvergessliches Unterwasserabenteuer erleben möchten. Erkunden Sie die lebhaften Korallenriffe, in denen es von Meeresbewohnern nur so wimmelt, darunter Zackenbarsche, Meeresschildkröten und gelegentlich Weißspitzen-Riffhaie. Mit zwei fachkundig geführten Tauchgängen und erstklassiger Tauchausrüstung bietet diese Tour ein aufregendes und sicheres Taucherlebnis für alle Könnensstufen. Da nur 8 Taucher pro Tour teilnehmen können, werden Sie persönlich betreut und haben die Möglichkeit, die atemberaubende Schönheit der Whitsunday Islands voll und ganz zu genießen.",Full Day,Airlie Beach Dive Centre,,FROM A$399.00,,"Zwei geführte Tauchgänge
Alle Tauchausrüstungen werden gestellt
Erfahrener Skipper und Instruktor
Mittagessen an Bord als zusätzliche Option erhältlich","Erkunden Sie die atemberaubenden Korallenriffe der Whitsunday Islands
Begegnen Sie den verschiedensten Meeresbewohnern wie Zackenbarschen und Meeresschildkröten
Möglichkeit, Weißspitzen-Riffhaie zu sichten
Tauchtiefen zwischen 5 und 18 Metern
Sichtweite von 3 bis 20 Metern
Kreuzfahrt mit einer komfortablen Geschwindigkeit von 22 Knoten
Begrenzt auf maximal 8 Taucher pro Tour",,8.0,,https://whitsundaydiveadventures.com/co/2-tank-scuba-tour-whitsunday-islands/,,,,,True,https://whitsundaydiveadventures.com/co/2-tank-scuba-tour-whitsunday-islands/,$399.00,,,full_day,water,"Airlie Beach,Whitsunday Island","adventure,private",general,adventurous,,"['Teilnehmer müssen mindestens 12 Jahre alt sein, um an der Tauchexpedition teilnehmen zu können.', 'Sie müssen ein Open Water Brevet oder höher besitzen, um an der Tour teilnehmen zu können.', 'Füllen Sie einen grundlegenden medizinischen Fragebogen aus, der auf unserer Website verfügbar ist, um sicherzustellen, dass Sie fit sind, um sicher zu tauchen.', 'Begrenzt auf maximal 8 Taucher pro Tour.']",,"[Mittagessen: Verbessern Sie Ihren Tauchausflug mit einem köstlichen Mittagessen an Bord, das als zusätzliche Option für alle Ernährungsbedürfnisse angeboten wird.""]",,0
