id,name,company_name,summary,description,duration,departure_location,departure_times,price_adult,price_child,includes,highlights,keywords,duration_hours,link_booking,link_more_info,phone,image_url,image_urls,commission_rate,active,price_source_url,price_tiers,raw_text,duration_days,duration_category,tour_type,locations,tags,audience,intensity_level,video_urls,important_information,what_to_bring,whats_extra,cancellation_policy,booking_connected
atlantic_clipper_2d_2n_overnight_sailing_tour,अटलांटिक क्लिपर ओवरनाइट टूर,truebluesailing,,"व्हिटसंडेज़ की सबसे बड़ी नौकायन नाव, अटलांटिक क्लिपर पर सवार होकर परम मज़ेदार और सामाजिक नौकायन रोमांच का अनुभव करें।युवा और साहसी यात्रियों के लिए बिल्कुल उपयुक्त, यह दौरा जीवंत भोज, रोमांचक जल गतिविधियों और सुंदर सैर के साथ एक जीवंत वातावरण प्रदान करता है।वॉटरस्लाइड्स, गर्म स्पा और पैडलबोर्ड जैसी अनूठी सुविधाओं का आनंद लें।ताज़ा तैयार भोजन और व्हिटसंडे द्वीप समूह की अद्भुत सुंदरता का आनंद लें।चाहे आप नीले रंग में गोता लगा रहे हों या सन डेक पर आराम कर रहे हों, अटलांटिक क्लिपर एक अविस्मरणीय अनुभव का वादा करता है।",2 Days 2 Nights,Coral Sea Marina,,FROM A$755,,"एयर कंडीशनिंग के साथ 21 केबिन
5 गर्म बौछारें
स्कूबा डाइविंग
स्नॉर्कलिंग
दो जलप्रपात
6 मीटर गोता मंच
ताज़ा तैयार नाश्ता, दोपहर का भोजन, रात का खाना और सभी स्नैक्स
जहाज पर फ्रिज के साथ BYO शराब और पेय
स्नोर्कल उपकरण, स्टिंगर सूट/वेट सूट किराया, और प्लवनशीलता उपकरणों का निःशुल्क उपयोग
60 लोगों के लिए इनडोर बैठने की जगह
सन टैनिंग डेक और आश्रययुक्त कवर
एक मास्टर रीफ गाइड","व्हिटसंडेज़ में सबसे बड़ी नौकायन नाव
बेजोड़ सुविधाएं और जल गतिविधियाँ
गर्म स्पा और पैडलबोर्ड
ग्रेट बैरियर रीफ के अद्भुत दृश्य
सामाजिक और मनोरंजक माहौल
स्वादिष्ट भोजन और जीवंत नोक-झोंक
सुंदर सैर और सूर्यास्त समुद्र तट पार्टियाँ",,,https://truebluesailing.com.au/atlantic-clipper-overnight-tour/,https://truebluesailing.com.au/atlantic-clipper-overnight-tour/,,static/tour_images/truebluesailing/atlantic_clipper_2d_2n_overnight_sailing_tour/image_15.jpg,"static/tour_images/truebluesailing/atlantic_clipper_2d_2n_overnight_sailing_tour/image_1.jpg,static/tour_images/truebluesailing/atlantic_clipper_2d_2n_overnight_sailing_tour/image_10.jpg,static/tour_images/truebluesailing/atlantic_clipper_2d_2n_overnight_sailing_tour/image_12.jpg,static/tour_images/truebluesailing/atlantic_clipper_2d_2n_overnight_sailing_tour/image_15.jpg,static/tour_images/truebluesailing/atlantic_clipper_2d_2n_overnight_sailing_tour/image_16.jpg,static/tour_images/truebluesailing/atlantic_clipper_2d_2n_overnight_sailing_tour/image_23.jpg,static/tour_images/truebluesailing/atlantic_clipper_2d_2n_overnight_sailing_tour/image_26.jpg,static/tour_images/truebluesailing/atlantic_clipper_2d_2n_overnight_sailing_tour/image_27.jpg,static/tour_images/truebluesailing/atlantic_clipper_2d_2n_overnight_sailing_tour/image_37.jpg,static/tour_images/truebluesailing/atlantic_clipper_2d_2n_overnight_sailing_tour/image_41.jpg,static/tour_images/truebluesailing/atlantic_clipper_2d_2n_overnight_sailing_tour/image_42.jpg,static/tour_images/truebluesailing/atlantic_clipper_2d_2n_overnight_sailing_tour/image_48.jpg,static/tour_images/truebluesailing/atlantic_clipper_2d_2n_overnight_sailing_tour/image_64.jpg,static/tour_images/truebluesailing/atlantic_clipper_2d_2n_overnight_sailing_tour/image_85.jpg,static/tour_images/truebluesailing/atlantic_clipper_2d_2n_overnight_sailing_tour/image_86.jpg,static/tour_images/truebluesailing/atlantic_clipper_2d_2n_overnight_sailing_tour/image_92.jpg,static/tour_images/truebluesailing/atlantic_clipper_2d_2n_overnight_sailing_tour/image_97.jpg,static/tour_images/truebluesailing/atlantic_clipper_2d_2n_overnight_sailing_tour/image_98.jpg",,True,https://truebluesailing.com.au/atlantic-clipper-overnight-tour/,,,2.0,multi_day,combo,"Airlie Beach,Great Barrier Reef,Hill Inlet,Langford,Whitehaven,Whitsunday Island","adventure,private,relaxation,sunset",general,adventurous,,,,,,0
