id,name,company_name,summary,description,duration,departure_location,departure_times,price_adult,price_child,includes,highlights,keywords,duration_hours,link_booking,link_more_info,phone,image_url,image_urls,commission_rate,active,price_source_url,price_tiers,raw_text,duration_days,duration_category,tour_type,locations,tags,audience,intensity_level,itinerary,menu,age_requirements,ideal_for,video_urls,important_information,what_to_bring,whats_extra,cancellation_policy,booking_connected
2cd86c2c9772ee16,Deja que el mar te libere,whitsundaybullet,,"Disfrute de lo mejor de las Whitsundays a bordo de una excursión de un día muy apreciada. Este veloz catamarán a motor promete un viaje emocionante, perfecto para los aventureros que buscan explorar la belleza natural de las Whitsundays. Navegue a una velocidad de 25 nudos, lo que le permitirá aprovechar al máximo su tiempo visitando North y South Whitehaven Beach, practicando snorkel en los vibrantes arrecifes del Parque Marino de la Gran Barrera de Coral y disfrutando de impresionantes vistas desde el mirador de Hill Inlet.",8 Hours,Coral Sea Marina,,FROM A$230,FROM A$199,"Almuerzo buffet
Trajes de neopreno
Equipo de snorkel
Tablas de paddle","Rápido paseo en catamarán a motor por las Whitsundays
Visite las playas North y South Whitehaven Beach
Practique snorkel en el Parque Marino de la Gran Barrera de Coral
Mirador de Hill Inlet para disfrutar de unas vistas impresionantes
Navegue a 25 nudos para disfrutar del máximo tiempo de exploración",,8.0,https://whitsundaybullet.com.au/,https://whitsundaybullet.com.au/,,static/tour_images/whitsundaybullet/2cd86c2c9772ee16/image_1.jpg,static/tour_images/whitsundaybullet/2cd86c2c9772ee16/image_1.jpg,,True,https://whitsundaybullet.com.au/,Adult: $230 AUD per Person | Child (2-14 years): $199 AUD per Person | Family (2A + 2C): $760 AUD per Family,,,full_day,water,"Great Barrier Reef,Hill Inlet,Whitehaven","adventure,family-friendly,luxury",general,adventurous,,,,"Aventureros, amantes de la naturaleza y quienes deseen conocer las Whitsundays en un día.",,,"['BYO DRINKS', 'Sunscreen', 'Hat', 'Sunglasses', 'Towel']","['Se aplica un recargo de 20 $ por adulto y 10 $ por niño a todas las entradas en días festivos', 'Consulte nuestra página de preguntas frecuentes para obtener más información sobre las fechas en las que se aplica este recargo']",,0
