id,name,company_name,summary,description,duration,departure_location,departure_times,price_adult,price_child,includes,highlights,keywords,duration_hours,link_booking,link_more_info,phone,image_url,image_urls,commission_rate,active,price_source_url,price_tiers,raw_text,duration_days,duration_category,tour_type,locations,tags,audience,intensity_level,video_urls,important_information,what_to_bring,whats_extra,cancellation_policy,booking_connected
b8aee9e709ef4afa,Whitsunday Crocodile Safari,crocodilesafari,,"Découvrez le côté sauvage des Whitsundays avec le Whitsunday Crocodile Safari, une aventure naturelle australienne unique.Explorez les estuaires et les zones humides de la côte des Whitsunday et observez la faune fascinante dans son habitat naturel, notamment les emblématiques crocodiles des estuaires.Idéale pour les amoureux de la nature et les familles, cette visite offre un mélange d'aventure et d'éducation, avec des guides experts donnant un aperçu de la flore, de la faune et de l'histoire locales.Profitez d'une journée de détente en plein air avec un délicieux déjeuner barbecue et des friandises traditionnelles de bush tucker.",Full Day,Shute Harbour,,,,"Excursion d'une journée tous temps avec guides experts et commentaires
Transferts aller-retour en bus gratuits depuis Airlie Beach et Proserpine
Thé et amortisseur Billy traditionnels
Ponchos de pluie au besoin
Insectifuge au besoin
Prise en charge et transfert au camping touristique à Proserpine
Croisière sur la rivière Proserpine
Déjeuner au barbecue et au bar à salades
Eau potable glacée offerte au camping","Observez les crocodiles des estuaires dans leur habitat naturel
Explorez l'environnement tropical unique de la côte des Whitsunday
Découvrez la végétation et la faune des habitats humides d'eau douce
Profitez des commentaires d'experts professionnels de guides locaux sympathiques
Goûtez au « bush tucker » australien traditionnel comme Billy Tea et Damper
Détendez-vous dans un camping bien équipé avec une importance historique",,8.0,,https://crocodilesafari.com.au/whitsundays-crocodile-tour/,,static/tour_images/crocodilesafari/b8aee9e709ef4afa/image_3.jpg,"static/tour_images/crocodilesafari/b8aee9e709ef4afa/image_2.jpg,static/tour_images/crocodilesafari/b8aee9e709ef4afa/image_3.jpg,static/tour_images/crocodilesafari/b8aee9e709ef4afa/image_6.jpg,static/tour_images/crocodilesafari/b8aee9e709ef4afa/image_10.jpg,static/tour_images/crocodilesafari/b8aee9e709ef4afa/image_13.jpg,static/tour_images/crocodilesafari/b8aee9e709ef4afa/image_15.jpg,static/tour_images/crocodilesafari/b8aee9e709ef4afa/image_18.jpg,static/tour_images/crocodilesafari/b8aee9e709ef4afa/image_19.jpg,static/tour_images/crocodilesafari/b8aee9e709ef4afa/image_21.jpg,static/tour_images/crocodilesafari/b8aee9e709ef4afa/image_22.jpg,static/tour_images/crocodilesafari/b8aee9e709ef4afa/image_23.jpg",,True,https://crocodilesafari.com.au/whitsundays-crocodile-tour/,,,,full_day,water,"Airlie Beach,Proserpine","adventure,relaxation",general,relaxed,,,"['Chapeau', 'Appareil photo', 'Espèces (pour les boissons froides)', 'Veste (par temps frais ou venteux)', 'Chaussures (n'importe quel type est approprié)']","['Des boissons gazeuses froides, des jus de fruits et de l'eau en bouteille peuvent être achetés au camping', 'Les collations ne sont PAS disponibles à l'achat']",,0
