id,name,company_name,summary,description,duration,departure_location,departure_times,price_adult,price_child,includes,highlights,keywords,duration_hours,link_booking,link_more_info,phone,image_url,image_urls,commission_rate,active,price_source_url,price_tiers,raw_text,duration_days,duration_category,tour_type,locations,tags,audience,intensity_level,video_urls,important_information,what_to_bring,whats_extra,cancellation_policy
f57f6e18b43896db,휘트선데이 제트 스키 투어,oceandynamics,,"에어리 비치에서 다양한 제트 스키 투어 옵션을 제공하는 오션 다이나믹스와 함께 휘트선데이의 스릴을 만끽하세요. 휘트선데이 제트 스키 투어는 이 지역의 아름다운 경치와 수정처럼 맑은 바다, 다양한 해양 생물을 경험할 수 있는 짜릿한 방법을 제공합니다. 모험을 즐기는 분들에게 완벽한 투어는 호주에서 가장 아름다운 여행지 중 한 곳에서 잊을 수 없는 추억을 선사합니다.",1 Hour,Port of Airlie,"Departs 8 am, Returns 5 pm",FROM A$249,,"종합 안전 브리핑
필요한 모든 장비
데이드림 아일랜드 수영장 및 시설 전체 이용(데이드림 아일랜드 얼티밋 제트 스키 어드벤처 이용 시)","스릴 넘치는 1시간 가이드 제트 스키 투어
휘트선데이즈의 아름다운 자연 속에서 즐기는 짜릿한 경험
전용 프라이빗 투어 이용 가능
데이드림 아일랜드 편의시설 이용
안전 및 장비 포함
모험을 즐기는 분들에게 안성맞춤",,1.0,https://www.oceandynamics.com.au/jet-ski,https://www.oceandynamics.com.au/jet-ski,,static/tour_images/oceandynamics/f57f6e18b43896db/image_2.jpg,"static/tour_images/oceandynamics/f57f6e18b43896db/image_2.jpg,static/tour_images/oceandynamics/f57f6e18b43896db/image_3.jpg",,True,https://www.oceandynamics.com.au/jet-ski,"Airlie Adrenaline Jet Ski Tour: A$249 per jet ski (1 or 2 people) | Private One-Hour Tour: FROM A$1950 | Daydream Island Ultimate Jet Ski Adventure: A$425 per single passenger jet ski, A$475 for 2 passengers",,,half_day,water,"Airlie Beach,Daydream Island","adventure,private",general,adventurous,,"['최소 운전자 16세, 최소 승객 8세(키 120cm 이상, 수영 가능해야 함)', '거동이 불편한 게스트에게는 적합하지 않으며, 25m 수영이 가능하고 영어를 구사해야 함', '체중 및 신장 제한 적용, 투어 운영에 필요한 최소 인원', '최소 운전자 16세, 최소 승객 12세', '거동이 불편하거나 목 또는 허리 질환, 임산부가 있는 게스트에게는 적합하지 않음', '100m 수영 가능, 영어 가능, 오픈 워터에서 편안함을 느껴야 함', '체중 및 신장 제한 적용, 투어에 필요한 최소 인원']",,['백일몽 섬에서의 주류 소비는 제한됩니다. 자세한 내용은 약관 전문을 참조하세요'],"['48시간 초과: 수수료 없음', '48-24시간: 50% 취소 수수료', '24시간 이하(노쇼 포함): 100% 취소 수수료']"
