id,name,company_name,summary,description,duration,departure_location,departure_times,price_adult,price_child,includes,highlights,keywords,duration_hours,link_booking,link_more_info,phone,image_url,image_urls,commission_rate,active,price_source_url,price_tiers,raw_text,duration_days,duration_category,tour_type,locations,tags,audience,intensity_level,itinerary,menu,age_requirements,ideal_for,_csv_file
de3fea9f5aab47c4,Skydive Over Airlie Beach And the Whitsundays!,skydive,,"Experience the thrill of a lifetime with Skydive Airlie Beach, where adventure meets stunning natural beauty. This skydive offers breathtaking views of the Great Barrier Reef and the Whitsunday Islands, making it a unique experience for thrill-seekers and nature lovers alike. Perfect for adrenaline junkies, the skydive promises an exhilarating freefall and a scenic descent over turquoise waters and lush islands. Whether you're a seasoned skydiver or a first-timer, this adventure is sure to leave you with unforgettable memories and a sense of accomplishment.",,"Whitsunday Airport, Air Whitsunday Road, Whitsunday Airport, Flame Tree, QLD 4802","6am, 6:30am, 7:15am, 8am, 8:45am, 9:30am, 10:15am, 11:am",A$309,,"Tandem skydive from up to 8,000ft or 15,000ft
Up to 60 seconds of freefall
Personalised certificate of achievement
Compulsory Personal Accident Insurance from the Australian Parachute Federation
3 month membership of the Australian Parachute Federation","Spectacular views of the Great Barrier Reef
Breathtaking descent over the Whitsunday Islands
Convenient location with no long transfers
Capture your experience with high-resolution video packages
Free transfers from selected spots around Airlie Beach",,,https://www.skydive.com.au/locations/airlie-beach/,https://www.skydive.com.au/locations/airlie-beach/,,,,,TRUE,https://www.skydive.com.au/locations/airlie-beach/,"Tandem Skydive 8,000ft: FROM A$309 | Tandem Skydive 15,000ft: FROM A$369",,,unknown,combo,"Airlie Beach,Great Barrier Reef,Hamilton Island,Whitsunday Island",adventure,general,adventurous,,,,"Adrenaline junkies, first-time skydivers, nature lovers, and adventure seekers",data/skydive/en/tours_skydive_cleaned_with_media.csv
