id,name,company_name,summary,description,duration,departure_location,departure_times,price_adult,price_child,includes,highlights,keywords,duration_hours,link_booking,link_more_info,phone,image_url,image_urls,commission_rate,active,price_source_url,price_tiers,raw_text,duration_days,duration_category,tour_type,locations,tags,audience,intensity_level,itinerary,menu,age_requirements,ideal_for
d1fa670cc4271e8f,Airlie Beach Sunset Sail in Style Cruise,wings,,"Step aboard the SV Wings III, a luxurious 60 ft sailing catamaran, and embark on a serene sunset cruise across Airlie Beach Bay. This intimate experience is perfect for those seeking relaxation and a personal atmosphere, with limited guest numbers ensuring a more exclusive vibe. As you sail towards Pioneer Rocks, enjoy breathtaking views of the Whitsunday Islands and the vibrant coastal lights. This is an ideal experience for couples, families, and groups who appreciate stunning sunsets, tranquil waters, and a touch of elegance.",2 Hours,,"Departs and returns from Coral Sea Marina, Northern End, Meeting Point B Airlie Beach",FROM A$110,,"2 hours sailing on a SV Wings III
Tropical welcome drink on arrival
Tea varieties & 2 coffee machines
Large spacious decks and top sundeck
3 zoned Spotify playing
Cold refrigeration for BYO, ice and cold filtered water
BYO alcohol, soft drink & juice (no glass - wine & champagne ok)","Sail and cruise slowly along the Airlie Beach Bay
Enjoy breathtaking sunset views with Whitsunday Islands in the background
Experience a relaxed and personal atmosphere
Capture stunning sunset selfies on spacious decks
Listen to your favorite playlists with 3 zoned Spotify music onboard",,2.0,https://www.wings.com.au/airlie-beach-sunset-sail-in-style-cruise/,https://www.wings.com.au/airlie-beach-sunset-sail-in-style-cruise/,,,,,TRUE,https://www.wings.com.au/airlie-beach-sunset-sail-in-style-cruise/,Bring your own drinks: FROM A$110,,,half_day,combo,"Airlie Beach,Great Barrier Reef,Whitsunday Island","adventure,family-friendly,luxury,private,relaxation,small-group,sunset",family,adventurous,,"**Menu:**
- Antipasto grazing platters
- Delicious dessert canapés",Ages 5+,"Couples, families, and groups looking for a relaxing and intimate sunset sailing experience in the Whitsundays."
2a3290913e35d9a0,"Whitsunday Islands Sail, SUP & Snorkel Day Tour",wings,,"Experience the Whitsundays on a luxurious day tour aboard Wings III, perfect for those short on time but eager to explore the stunning islands. Relax on the plush sundeck or in the shaded seating area, and soak in the foredeck Jacuzzi while taking in the tropical beauty. This tour offers an exclusive experience with private mooring at Langford Island and flexible anchorage options. Discover the vibrant marine life of the Great Barrier Reef through snorkeling, stand-up paddleboarding, or clear bottom kayaking. Ideal for families and small groups seeking adventure and relaxation in a breathtaking setting.",6 Hours,,"Departs 8:50 am, Returns 3:30 pm",A$230,,"Snorkeling equipment
Stand-up paddleboards
Clear bottom kayak
Morning tea with sweet and savoury platters
Lunch with a selection of meats and salmon
Cold filtered drinking water
Knowledgeable crew
Private mooring at Langford Island","Cruise & sail towards Langford Island
Private mooring at Langford Island
Explore the underwater world of the Great Barrier Reef
Encounter vibrant marine life including green sea turtles
Relax on the plush sundeck or in the foredeck Jacuzzi
Small group experience with a maximum of 29 guests",,6.0,https://www.wings.com.au/whitsunday-islands-sail-snorkel-and-sup-tour/,https://www.wings.com.au/whitsunday-islands-sail-snorkel-and-sup-tour/,,,,,TRUE,https://www.wings.com.au/whitsunday-islands-sail-snorkel-and-sup-tour/,Adult: A$230,,,full_day,water,"Airlie Beach,Great Barrier Reef,Hook Island,Langford,Whitsunday Island","adventure,family-friendly,luxury,private,relaxation,small-group,sunset",family,relaxed,,"**Menu:**
- Morning Tea: Sweet and savoury platters
- Lunch: Selection of meats and salmon prepared fresh daily",Ages 6+,"Families, small groups, and adventure seekers looking to explore the Whitsundays in a luxurious and intimate setting."
