id,name,company_name,summary,description,duration,departure_location,departure_times,price_adult,price_child,includes,highlights,keywords,duration_hours,link_booking,link_more_info,phone,image_url,image_urls,commission_rate,active,price_source_url,price_tiers,raw_text,duration_days,duration_category,tour_type,locations,tags,audience,intensity_level,itinerary,menu,age_requirements,ideal_for,video_urls,important_information,what_to_bring,whats_extra,cancellation_policy,booking_connected
514805acd6445e40,Private Doppelkabine mit gemeinsamem Bad,sailing-whitsundays,,"Begeben Sie sich auf eine luxuriöse Reise durch die Whitsundays mit einem Aufenthalt in einer privaten Doppelkabine. Dieses Erlebnis bietet eine intime und komfortable Flucht, perfekt für Paare, die einen romantischen Ausflug suchen. Genießen Sie die atemberaubende Landschaft des Great Barrier Reefs und lassen Sie sich von der ruhigen Schönheit der Whitsunday Islands verzaubern. Diese Tour ist ideal für alle, die sich stilvoll entspannen und gleichzeitig eines der berühmtesten Reiseziele Australiens erkunden möchten.",2 days 1 night,Coral Sea Marina Meeting Point C,,"FROM A$1,249",,,,,,https://sailing-whitsundays.com/whitsundays/whitsunday-blue-3d3n,https://sailing-whitsundays.com/whitsundays/whitsunday-blue-3d3n,,static/tour_images/sailing-whitsundays/514805acd6445e40/image_7.jpg,"static/tour_images/sailing-whitsundays/514805acd6445e40/image_1.jpg,static/tour_images/sailing-whitsundays/514805acd6445e40/image_3.jpg,static/tour_images/sailing-whitsundays/514805acd6445e40/image_6.jpg,static/tour_images/sailing-whitsundays/514805acd6445e40/image_7.jpg,static/tour_images/sailing-whitsundays/514805acd6445e40/image_9.jpg,static/tour_images/sailing-whitsundays/514805acd6445e40/image_11.jpg,static/tour_images/sailing-whitsundays/514805acd6445e40/image_12.jpg,static/tour_images/sailing-whitsundays/514805acd6445e40/image_13.jpg,static/tour_images/sailing-whitsundays/514805acd6445e40/image_15.jpg,static/tour_images/sailing-whitsundays/514805acd6445e40/image_16.jpg,static/tour_images/sailing-whitsundays/514805acd6445e40/image_17.jpg,static/tour_images/sailing-whitsundays/514805acd6445e40/image_18.jpg,static/tour_images/sailing-whitsundays/514805acd6445e40/image_19.jpg,static/tour_images/sailing-whitsundays/514805acd6445e40/image_20.jpg,static/tour_images/sailing-whitsundays/514805acd6445e40/image_21.jpg,static/tour_images/sailing-whitsundays/514805acd6445e40/image_22.jpg",,True,https://sailing-whitsundays.com/whitsundays/whitsunday-blue-3d3n,"Private Double Cabin with Shared Bath (01 Jul 2025 - 30 Apr 2026): A$2,548 Total",,,multi_day,combo,"Airlie Beach,Great Barrier Reef,Hamilton Island,Hill Inlet,Whitehaven,Whitsunday Island","adventure,luxury,private,relaxation,small-group",general,adventurous,,,,"Paare, die einen romantischen und luxuriösen Urlaub verbringen möchten",,"[Sie müssen mindestens 18 Jahre alt sein, um die 3D3N-Reise von Whitsunday Blue buchen zu können"", ""Passagiere mit besonderen Ernährungsbedürfnissen (vegetarisch, vegan, milchfrei, glutenfrei usw.) müssen einen Aufpreis von $45 pro Person zahlen, der beim Check-in zu entrichten ist""]","['kleine weiche Tasche mit Kleidung zum Wechseln', 'Hut', 'Badesachen', 'Sonnenschutzmittel 30+', 'warmer Pullover für die Abende (saisonal)', 'eigene alkoholische Getränke, die in der Stadt gekauft werden können']","['BYO-Alkohol - keine Glasflaschen, mit Ausnahme von Wein und Champagner.', 'Passagiere mit besonderen Ernährungsbedürfnissen (Vegetarier, Veganer, milchfrei, glutenfrei usw.) müssen einen Aufpreis von $45 pro Person zahlen, der beim Check-in zu entrichten ist.', 'Gepäckaufbewahrung']",Bei Nichterscheinen oder Stornierung durch den Kunden innerhalb von 30 Tagen vor der Abreise werden 100 % des gesamten Ticketpreises einbehalten. Eine Erstattung im Falle einer Stornierung unterliegt sowohl unseren Stornierungsrichtlinien als auch den Bedingungen des Anbieters.,0
454ce2730756e741,Pfingstsonntag-Ausflug 3D/3N,sailing-whitsundays,,"Machen Sie eine Kreuzfahrt zu den Whitsundays an Bord der Whitsunday Getaway und erleben Sie einen unvergesslichen Ausflug ins tropische Paradies! Genießen Sie die Pracht einer ausgedehnten Reise, die 3 Tage und 3 Nächte dauert - länger als die meisten Touren in den Whitsundays. Die perfekte Reise für Paare und Flitterwöchner, die die Whitsundays mit Stil erleben möchten. Die Reise wurde so konzipiert, dass Paare die Möglichkeit haben, sich bei Speis und Trank verwöhnen zu lassen, während sie die atemberaubende Landschaft erkunden.",3 Days 3 Nights,Coral Sea Marina Meeting Point C,,FROM A$1420,,,"Kreuzfahrt durch die Whitsundays an Bord eines luxuriösen Schiffes
Erweiterte 3-Tage-, 3-Nächte-Tour
Perfekt für Paare und Flitterwöchner
Erkunden Sie das tropische Paradies mit Stil
Erleben Sie den Luxus von Wein und Essen",,,https://sailing-whitsundays.com/whitsundays/whitsunday-getaway-3d3n,https://sailing-whitsundays.com/whitsundays/whitsunday-getaway-3d3n,,static/tour_images/sailing-whitsundays/454ce2730756e741/image_9.jpg,"static/tour_images/sailing-whitsundays/454ce2730756e741/image_2.jpg,static/tour_images/sailing-whitsundays/454ce2730756e741/image_3.jpg,static/tour_images/sailing-whitsundays/454ce2730756e741/image_5.jpg,static/tour_images/sailing-whitsundays/454ce2730756e741/image_8.jpg,static/tour_images/sailing-whitsundays/454ce2730756e741/image_9.jpg,static/tour_images/sailing-whitsundays/454ce2730756e741/image_11.jpg,static/tour_images/sailing-whitsundays/454ce2730756e741/image_12.jpg,static/tour_images/sailing-whitsundays/454ce2730756e741/image_14.jpg,static/tour_images/sailing-whitsundays/454ce2730756e741/image_15.jpg,static/tour_images/sailing-whitsundays/454ce2730756e741/image_16.jpg,static/tour_images/sailing-whitsundays/454ce2730756e741/image_17.jpg,static/tour_images/sailing-whitsundays/454ce2730756e741/image_18.jpg,static/tour_images/sailing-whitsundays/454ce2730756e741/image_19.jpg,static/tour_images/sailing-whitsundays/454ce2730756e741/image_20.jpg",,True,https://sailing-whitsundays.com/whitsundays/whitsunday-getaway-3d3n,Private Queen Ensuite Cabin (sleeps 2): FROM A$1420,,3.0,multi_day,combo,"Airlie Beach,Great Barrier Reef,Hamilton Island,Hill Inlet,Whitehaven,Whitsunday Island","adventure,luxury,private",general,adventurous,,,Nur für Erwachsene (18+),"Paare und Flitterwöchner, die einen luxuriösen und romantischen Aufenthalt suchen",,"[Jeder Passagier muss die Sicherheitshinweise und Anweisungen, die von der Crew in englischer Sprache gegeben werden, verstehen und in der Lage sein, die erforderlichen Sicherheitsformulare in englischer Sprache auszufüllen."", ""Ein Passagier kann nur an Wasseraktivitäten teilnehmen, wenn er über ein gewisses Maß an Schwimmerfahrung verfügt.', 'Wenn ein Passagier nicht schwimmen kann, kann er zwar am Segeltörn teilnehmen, aber nicht an Wasseraktivitäten wie Schnorcheln.', 'Um unsere Mindestsicherheitsstandards zu erfüllen, müssen die Passagiere in der Lage sein, das Schiff im unwahrscheinlichen Fall eines Notfalls ohne Hilfe zu verlassen.', 'Das Mindestalter für Reisen mit Whitsunday Getaway beträgt 18 Jahre.']","['Kleidung zum Wechseln', 'Badekleidung', 'Toilettenartikel', 'Insektenschutzmittel', 'Wasserflasche zum Auffüllen', 'Kamera', 'Bequeme Wanderschuhe', 'Sonnenschutz (Sonnencreme, Hut, Sonnenbrille usw.)', 'Warme Kleidung/Pullover für abends (saisonbedingt)', 'Eigene Flossen, falls vorhanden']","['BYO Alkohol und alkoholfreie Getränke - keine Glasflaschen erlaubt (mit Ausnahme von Weinflaschen)', 'Für bestimmte Diätwünsche und -anforderungen kann ein Aufpreis von $15 pro Tag erhoben werden.', 'Zusätzliche Schnorchelausrüstung (Flossen, verschreibungspflichtige Masken usw.)', 'In den Hauptferienzeiten (d.h. Weihnachten, Ostern, Neujahr) kann ein Aufpreis erhoben werden.', 'Gepäckaufbewahrung']",Bei Nichterscheinen oder Stornierung durch den Kunden innerhalb von 30 Tagen vor der Abfahrt verfallen 100 % des gesamten Ticketpreises. Bei Stornierungen zwischen 30 und 60 Tagen vor der Abreise wird eine Stornogebühr von 25 % erhoben. Eine Erstattung im Falle einer Stornierung unterliegt sowohl unseren Stornierungsbedingungen als auch den Bedingungen des Anbieters.,0
3e9255da12060a9f,Whitehaven Dreamer,sailing-whitsundays,,"Gönnen Sie sich einen idyllischen zweitägigen Ausflug zu den Whitsunday Islands an Bord der luxuriösen Whitehaven Dreamer! Dieses luxuriöse Segelerlebnis führt Sie zu so berühmten Zielen wie Whitehaven Beach und Hill Inlet. Die Whitehaven Dreamer eignet sich perfekt für alle, die eine Mischung aus Entspannung und Abenteuer suchen, und bietet Schnorchelausflüge am weltberühmten Great Barrier Reef - eine unvergessliche Reise für Naturliebhaber und Abenteurer gleichermaßen.",2 Days,Coral Sea Marina Meeting Point C,,FROM A$1360,,"Segeln zum Whitehaven Beach und Hill Inlet
Schnorcheln am Great Barrier Reef
Unterkunft in einer privaten Doppelkabine mit eigenem Bad","Luxuriöses Segelerlebnis
Besuchen Sie Whitehaven Beach
Hill Inlet erkunden
Schnorcheln am Great Barrier Reef
Private Unterkunft in einer Doppelkabine",,,https://sailing-whitsundays.com/whitsundays/whitehaven-dreamer-2d2n,https://sailing-whitsundays.com/whitsundays/whitehaven-dreamer-2d2n,,static/tour_images/sailing-whitsundays/3e9255da12060a9f/image_1.jpg,"static/tour_images/sailing-whitsundays/3e9255da12060a9f/image_1.jpg,static/tour_images/sailing-whitsundays/3e9255da12060a9f/image_3.jpg,static/tour_images/sailing-whitsundays/3e9255da12060a9f/image_4.png,static/tour_images/sailing-whitsundays/3e9255da12060a9f/image_6.png,static/tour_images/sailing-whitsundays/3e9255da12060a9f/image_7.jpg,static/tour_images/sailing-whitsundays/3e9255da12060a9f/image_10.jpg,static/tour_images/sailing-whitsundays/3e9255da12060a9f/image_11.png,static/tour_images/sailing-whitsundays/3e9255da12060a9f/image_12.jpg,static/tour_images/sailing-whitsundays/3e9255da12060a9f/image_13.jpg,static/tour_images/sailing-whitsundays/3e9255da12060a9f/image_14.jpg,static/tour_images/sailing-whitsundays/3e9255da12060a9f/image_15.jpg,static/tour_images/sailing-whitsundays/3e9255da12060a9f/image_16.jpg,static/tour_images/sailing-whitsundays/3e9255da12060a9f/image_17.png",,True,https://sailing-whitsundays.com/whitsundays/whitehaven-dreamer-2d2n,Private Double Cabin with Ensuite (sleeps 2): A$2720 Total,,2.0,multi_day,combo,"Airlie Beach,Great Barrier Reef,Hamilton Island,Hill Inlet,Whitehaven,Whitsunday Island","adventure,private,relaxation",general,adventurous,,,,"Naturliebhaber und Abenteurer, die einen luxuriösen und erholsamen Urlaub suchen.",,"[Das Mindestalter für Kinder beträgt 6 Jahre."", ""Alle Gäste unter 18 Jahren müssen schwimmen können, und die Kinder müssen während der gesamten Reise von den Eltern beaufsichtigt werden."", ""Gäste unter 18 Jahren können nicht in Gemeinschaftsunterkünften untergebracht werden, es sei denn, die Gruppe belegt einen gesamten Gemeinschaftsbereich."", ""In anderen Fällen muss ein Elternteil den Gemeinschaftsbereich belegen und das Kind eine private Kabine mit dem anderen Elternteil teilen.', 'Bitte beachten Sie auch, dass es keine 2 gemeinsamen Einzelbetten im selben Bereich gibt, sie sind auf dem Boot verteilt.', 'Dies ist eine Aktivität auf dem Wasser, aus Sicherheitsgründen müssen ALLE Passagiere schwimmen können und fließend Englisch sprechen.', 'Dieses Segelabenteuer ist nur für aktive Menschen geeignet.', 'Ein grundlegendes Maß an Fitness und Mobilität ist erforderlich.', 'Als Richtlinie sollten die Gäste in der Lage sein, eine Leiter leicht zu besteigen.']","['Kleidung zum Wechseln', 'Badebekleidung', 'Toilettenartikel', 'Strandtuch', 'Insektenschutzmittel', 'Wasserflaschen zum Nachfüllen', 'Kamera', 'Bequeme Wanderschuhe', 'Sonnenschutz (Sonnencreme, Hut, Sonnenbrille)', 'Warme Kleidung/Pullover für abends (saisonbedingt)', 'Eigener Alkohol (keine kleinen Glasflaschen)']","['Erfrischungsgetränke, Wasser in Flaschen und Snacks', 'BYO Alkohol', 'Gepäckaufbewahrung']",Bei Nichterscheinen oder Stornierung durch den Kunden innerhalb von 30 Tagen vor der Abreise werden 100 % des gesamten Ticketpreises einbehalten. Eine Erstattung im Falle einer Stornierung unterliegt sowohl unseren Stornierungsrichtlinien als auch den Bedingungen des Anbieters.,0
6ddec421fe7ddb42,Whitehaven Dreamer Privat-Charter,sailing-whitsundays,,"Begeben Sie sich auf eine exklusive Reise mit der Whitehaven Dreamer Private Charter, die eine luxuriöse Flucht zu den unberührten Stränden und dem pulsierenden Meeresleben der Whitsundays bietet. Perfekt für diejenigen, die ein persönliches und intimes Erlebnis suchen, ist dieser Charter für kleine Gruppen und private Partys geeignet. Genießen Sie die Freiheit, abgelegene Buchten zu erkunden, in kristallklarem Wasser zu schnorcheln und am berühmten Whitehaven Beach zu entspannen. Ideal für Familien, Paare und Freunde, die auf der Suche nach einem maßgeschneiderten Abenteuer im Paradies sind.",Full day,Coral Sea Marina Meeting Point C,"Tues, Thurs, Sat",FROM A$8950,,"Private Chartererfahrung
Zugang zu abgelegenen Stränden
Schnorchel-Ausrüstung
Erfahrene Crew","Personalisierte Reiseroute
Besuch des Whitehaven Beach
Schnorcheln im Great Barrier Reef
Luxuriöser und intimer Rahmen
Ideal für kleine Gruppen und private Feiern",,,https://sailing-whitsundays.com/whitsundays/whitehaven-dreamer-private-charter,https://sailing-whitsundays.com/whitsundays/whitehaven-dreamer-private-charter,,static/tour_images/sailing-whitsundays/6ddec421fe7ddb42/image_1.jpg,"static/tour_images/sailing-whitsundays/6ddec421fe7ddb42/image_1.jpg,static/tour_images/sailing-whitsundays/6ddec421fe7ddb42/image_3.jpg,static/tour_images/sailing-whitsundays/6ddec421fe7ddb42/image_5.jpg,static/tour_images/sailing-whitsundays/6ddec421fe7ddb42/image_6.jpg,static/tour_images/sailing-whitsundays/6ddec421fe7ddb42/image_9.jpg,static/tour_images/sailing-whitsundays/6ddec421fe7ddb42/image_10.jpg,static/tour_images/sailing-whitsundays/6ddec421fe7ddb42/image_11.jpg,static/tour_images/sailing-whitsundays/6ddec421fe7ddb42/image_12.jpg,static/tour_images/sailing-whitsundays/6ddec421fe7ddb42/image_13.jpg,static/tour_images/sailing-whitsundays/6ddec421fe7ddb42/image_14.jpg,static/tour_images/sailing-whitsundays/6ddec421fe7ddb42/image_15.jpg,static/tour_images/sailing-whitsundays/6ddec421fe7ddb42/image_16.jpg,static/tour_images/sailing-whitsundays/6ddec421fe7ddb42/image_17.png",,True,https://sailing-whitsundays.com/whitsundays/whitehaven-dreamer-private-charter,,,,full_day,combo,"Airlie Beach,Great Barrier Reef,Hamilton Island,Hill Inlet,Whitehaven,Whitsunday Island","adventure,private,relaxation,small-group",general,adventurous,,,,"Familien, Paare und Gruppen, die ein privates und persönliches Pfingstsonntag-Abenteuer suchen.",,"[Das Mindestalter für Kinder beträgt 6 Jahre."", ""Alle Gäste unter 18 Jahren müssen schwimmen können, und die Kinder müssen während der gesamten Reise von den Eltern beaufsichtigt werden."", ""Gäste unter 18 Jahren können nicht in Gemeinschaftsunterkünften untergebracht werden, es sei denn, die Gruppe belegt einen gesamten Gemeinschaftsbereich."", ""In anderen Fällen muss ein Elternteil den Gemeinschaftsbereich belegen und das Kind eine private Kabine mit dem anderen Elternteil teilen.', 'Bitte beachten Sie auch, dass es keine 2 gemeinsamen Einzelbetten im selben Bereich gibt, sie sind auf dem Boot verteilt.', 'Dies ist eine Aktivität auf dem Wasser, aus Sicherheitsgründen müssen ALLE Passagiere schwimmen können und fließend Englisch sprechen.', 'Dieses Segelabenteuer ist nur für aktive Menschen geeignet.', 'Ein grundlegendes Maß an Fitness und Mobilität ist erforderlich.', 'Als Richtlinie sollten die Gäste in der Lage sein, eine Leiter leicht zu besteigen.']","['Kleidung zum Wechseln', 'Badebekleidung', 'Toilettenartikel', 'Strandtuch', 'Insektenschutzmittel', 'Wasserflaschen zum Nachfüllen', 'Kamera', 'Bequeme Wanderschuhe', 'Sonnenschutz (Sonnencreme, Hut, Sonnenbrille)', 'Warme Kleidung/Pullover für abends (saisonbedingt)', 'Eigener Alkohol (keine kleinen Glasflaschen)']","['Erfrischungsgetränke, Wasser in Flaschen und Snacks', 'BYO Alkohol', 'Gepäckaufbewahrung']",Bei allen Stornierungen werden 25 % des empfohlenen Verkaufspreises (RRP) einbehalten - nicht der ermäßigte Preis/Verkaufspreis. Bei Nichterscheinen oder Stornierung durch den Kunden innerhalb von 30 Tagen vor der Abreise werden 100 % des gesamten Ticketpreises einbehalten. Eine Erstattung im Falle einer Stornierung unterliegt sowohl unseren Stornierungsbedingungen als auch den Bedingungen des Anbieters.,0
34b4bf275e1c715d,On Ice Spezial-Paket,sailing-whitsundays,,"Erkunden Sie die Whitsundays und das Great Barrier Reef mit einer Vielzahl von spannenden Touren und Paketen. Egal, ob Sie ein mehrtägiges Segelabenteuer oder eine einzigartige Nacht in einem Unterwasserhotel suchen, es gibt für jeden Reisenden das passende Angebot. Genießen Sie Schnorcheln oder Tauchen in unberührten Riffen, entspannen Sie sich am atemberaubenden Whitehaven Beach oder wählen Sie aus einer Reihe aufregender Aktivitäten wie Rundflüge und Jetski. Ideal für Abenteuerlustige, Familien und Paare, die die Schönheit des australischen Tropenparadieses erleben möchten.",2 days 2 nights,Coral Sea Marina Meeting Point C,,A$725,,,"Schnorcheln und Tauchen in unberührten Riffen
Entspannen am Whitehaven Beach
Rundflüge und Jetski
Einzigartige Übernachtungsmöglichkeiten
Individuell gestaltbare private Charters",,,https://sailing-whitsundays.com/whitsundays/on-ice,https://sailing-whitsundays.com/whitsundays/on-ice,,static/tour_images/sailing-whitsundays/34b4bf275e1c715d/image_3.jpg,"static/tour_images/sailing-whitsundays/34b4bf275e1c715d/image_1.jpg,static/tour_images/sailing-whitsundays/34b4bf275e1c715d/image_2.jpg,static/tour_images/sailing-whitsundays/34b4bf275e1c715d/image_3.jpg,static/tour_images/sailing-whitsundays/34b4bf275e1c715d/image_5.jpg,static/tour_images/sailing-whitsundays/34b4bf275e1c715d/image_7.jpg,static/tour_images/sailing-whitsundays/34b4bf275e1c715d/image_8.jpg,static/tour_images/sailing-whitsundays/34b4bf275e1c715d/image_11.jpg,static/tour_images/sailing-whitsundays/34b4bf275e1c715d/image_12.jpg,static/tour_images/sailing-whitsundays/34b4bf275e1c715d/image_13.jpg,static/tour_images/sailing-whitsundays/34b4bf275e1c715d/image_14.jpg,static/tour_images/sailing-whitsundays/34b4bf275e1c715d/image_15.jpg,static/tour_images/sailing-whitsundays/34b4bf275e1c715d/image_17.jpg",,True,https://sailing-whitsundays.com/whitsundays/on-ice,,,,full_day,combo,"Airlie Beach,Great Barrier Reef,Hamilton Island,Hill Inlet,Whitehaven,Whitsunday Island","adventure,luxury,private,relaxation",general,adventurous,,,,"Abenteuerlustige, Familien und Paare",,"['Das Mindestalter für Kinder beträgt 6 Jahre.', 'Alle Gäste unter 18 Jahren müssen schwimmen können, und Kinder müssen während der gesamten Reise von den Eltern beaufsichtigt werden.', 'Gäste unter 18 Jahren können nicht in Gemeinschaftsunterkünften untergebracht werden, es sei denn, die Gruppe belegt einen ganzen Gemeinschaftsbereich.', 'Dies ist eine Aktivität auf dem Wasser, aus Sicherheitsgründen müssen ALLE Passagiere schwimmen können und fließend Englisch sprechen.', 'Dieses Segelabenteuer ist nur für aktive Menschen geeignet. Ein Grundmaß an Fitness und Mobilität ist erforderlich.']","['Kleidung zum Wechseln', 'Badebekleidung', 'Toilettenartikel', 'Strandtuch', 'Insektenschutzmittel', 'Wasserflaschen zum Nachfüllen', 'Kamera', 'Bequeme Wanderschuhe', 'Sonnenschutz (Sonnencreme, Hut, Sonnenbrille usw.)', 'Warme Kleidung/Pullover für abends (saisonal)']","[""Alkohol (BYO - weitere Informationen finden Sie unter 'Was Sie mitbringen sollten')"", 'Erfrischungsgetränke, Wasser in Flaschen und Snacks', 'Gepäckaufbewahrung']",Bei Nichterscheinen oder Stornierung durch den Kunden innerhalb von 30 Tagen vor der Abfahrt verfallen 100 % des gesamten Ticketpreises.,0
83caea5dc452753a,Powerplay Pfingstsonntag-Abenteuer,sailing-whitsundays,,"Erleben Sie die Whitsundays im Luxus an Bord der Powerplay, einem der prächtigsten Schiffe der Flotte. Dieses erstklassige Abenteuer ist perfekt für diejenigen, die eine exklusive und aufregende Erkundung der kühnen Landschaft der Whitsundays suchen. Mit ihren unglaublichen Eigenschaften und Aktivitäten bietet die Powerplay eine einzigartige Mischung aus Komfort und Abenteuer, ideal für Paare, Familien und Abenteuerlustige gleichermaßen.",Full day,Coral Sea Marina Meeting Point C,,"FROM A$12,550",,"Luxusschiff Powerplay
Exklusive Tour durch die Whitsundays
Unglaubliche Eigenschaften und Aktivitäten","Reisen mit Tempo und Stil
Erkunden Sie die kühne Landschaft der Whitsundays
Erleben Sie Luxus an Bord eines der luxuriösesten Schiffe
Perfekt für Paare, Familien und Aufregungssuchende",,,https://sailing-whitsundays.com/whitsundays/powerplay-private-charter,https://sailing-whitsundays.com/whitsundays/powerplay-private-charter,,static/tour_images/sailing-whitsundays/83caea5dc452753a/image_7.jpg,"static/tour_images/sailing-whitsundays/83caea5dc452753a/image_3.jpg,static/tour_images/sailing-whitsundays/83caea5dc452753a/image_6.jpg,static/tour_images/sailing-whitsundays/83caea5dc452753a/image_7.jpg,static/tour_images/sailing-whitsundays/83caea5dc452753a/image_9.jpg,static/tour_images/sailing-whitsundays/83caea5dc452753a/image_10.jpg,static/tour_images/sailing-whitsundays/83caea5dc452753a/image_11.jpg,static/tour_images/sailing-whitsundays/83caea5dc452753a/image_12.jpg,static/tour_images/sailing-whitsundays/83caea5dc452753a/image_13.jpg,static/tour_images/sailing-whitsundays/83caea5dc452753a/image_14.jpg,static/tour_images/sailing-whitsundays/83caea5dc452753a/image_15.jpg,static/tour_images/sailing-whitsundays/83caea5dc452753a/image_16.jpg,static/tour_images/sailing-whitsundays/83caea5dc452753a/image_17.jpg,static/tour_images/sailing-whitsundays/83caea5dc452753a/image_18.jpg,static/tour_images/sailing-whitsundays/83caea5dc452753a/image_19.jpg",,True,https://sailing-whitsundays.com/whitsundays/powerplay-private-charter,"Adult (Standard): A$12,550",,,full_day,combo,"Airlie Beach,Great Barrier Reef,Hamilton Island,Hill Inlet,Whitehaven,Whitsunday Island","adventure,luxury,private",general,adventurous,,,,"Paare, Familien und Abenteuersuchende, die Luxus und Abenteuer suchen",,"['Powerplay ist für Passagiere ab 6 Jahren geeignet.', 'Gäste unter 18 Jahren müssen von einem Elternteil oder Erziehungsberechtigten begleitet werden.', 'Dieses Segelabenteuer ist nur für aktive Menschen geeignet.', 'Ein grundlegendes Maß an Fitness und Mobilität ist erforderlich.', 'Gäste sollten in der Lage sein, eine Leiter leicht zu erklimmen.', 'Sie MÜSSEN schwimmen können, um an Bord des Bootes zu kommen.', 'Aus Sicherheitsgründen müssen Sie auch Englisch sprechen können.']","['Kleidung zum Wechseln', 'Badekleidung', 'Toilettenartikel', 'Strandtuch', 'Insektenschutzmittel', 'Wasserflaschen zum Nachfüllen', 'Kamera', 'Bequeme Wanderschuhe', 'Sonnenschutz (Sonnencreme, Hut, Sonnenbrille usw.)', 'Warme Kleidung/Pullover für abends (je nach Jahreszeit)']","[BYO-Alkohol - keine Glasflaschen erlaubt (bitte KEIN Rotwein)"", ""Für bestimmte Diätwünsche und -anforderungen wird ein Aufpreis erhoben: $20pp for 2 days, 2 nights; $30pp for 3 days, 3 nights', 'Additional snorkel equipment (prescription masks etc.)', 'Children equipment (life jackets, stingersuits, masks, etc.)', 'Peak holiday season (i.e. Christmas, Easter, New Years) may incur a surcharge.']","['Bei allen Stornierungen verfällt die nicht erstattungsfähige Anzahlung.', 'Alle Restzahlungen sind 2 Monate vor der Abfahrt fällig.', 'Bei Nichtzahlung des Restbetrags vor diesem Termin wird der Chartervertrag gekündigt und die nicht erstattungsfähige Anzahlung verfällt.', 'Sobald die Restzahlung erfolgt ist, verfallen bei Nichterscheinen und Stornierung durch den Kunden 100% des vollen Ticketpreises.']",0
