id,name,company_name,summary,description,duration,departure_location,departure_times,price_adult,price_child,includes,highlights,keywords,duration_hours,link_booking,link_more_info,phone,image_url,image_urls,commission_rate,active,price_source_url,price_tiers,raw_text,duration_days,duration_category,tour_type,locations,tags,audience,intensity_level,itinerary,menu,age_requirements,ideal_for,video_urls,important_information,what_to_bring,whats_extra,cancellation_policy,booking_connected
fd56a077ec5a503c,Whitsunday Adventurer 2D/2N - Außenriff & Verlängerte Segeltage,sailing-whitsundays,,"Begeben Sie sich auf eine unvergessliche Reise durch die Whitsundays und das Great Barrier Reef. Dieses Abenteuer ist perfekt für alle, die unberührte Riffe und abgelegene Strände erkunden und dabei den Komfort und Luxus eines gut ausgestatteten Schiffes genießen möchten. Diese Tour ist ideal für Abenteuerlustige und Naturliebhaber und bietet die einmalige Gelegenheit, in einer der atemberaubendsten Meereslandschaften der Welt zu schnorcheln oder zu tauchen. Sie haben die Möglichkeit, Ihre Reise individuell zu gestalten und Rundflüge, Jetskifahren und vieles mehr hinzuzufügen.",3 Nights,Coral Sea Marina Meeting Point C,,FROM A$677,,"Gemeinsame Unterkunft oder private Doppelkabine
Möglichkeiten zum Schnorcheln und Tauchen
Zugang zu unberührten Riffen und Stränden
Individuell anpassbare Erlebnisse wie Rundflüge und Jetski","Erkunden Sie das Äußere Great Barrier Reef
Schnorcheln oder Tauchen in unberührten Riffen
Schwimmen und Sonnenbaden am Whitehaven Beach
Individuell gestaltbare Erlebnisse mit Rundflügen und Jetski
Luxuriöses Schiff mit komfortablen Unterkünften",,,https://sailing-whitsundays.com/whitsundays/whitsunday-adventurer-2d2n,https://sailing-whitsundays.com/whitsundays/whitsunday-adventurer-2d2n,,static/tour_images/sailing-whitsundays/fd56a077ec5a503c/image_1.jpg,"static/tour_images/sailing-whitsundays/fd56a077ec5a503c/image_1.jpg,static/tour_images/sailing-whitsundays/fd56a077ec5a503c/image_2.jpg,static/tour_images/sailing-whitsundays/fd56a077ec5a503c/image_3.jpg,static/tour_images/sailing-whitsundays/fd56a077ec5a503c/image_6.jpg,static/tour_images/sailing-whitsundays/fd56a077ec5a503c/image_7.jpg,static/tour_images/sailing-whitsundays/fd56a077ec5a503c/image_9.jpg,static/tour_images/sailing-whitsundays/fd56a077ec5a503c/image_10.jpg,static/tour_images/sailing-whitsundays/fd56a077ec5a503c/image_12.jpg,static/tour_images/sailing-whitsundays/fd56a077ec5a503c/image_13.jpg,static/tour_images/sailing-whitsundays/fd56a077ec5a503c/image_14.jpg,static/tour_images/sailing-whitsundays/fd56a077ec5a503c/image_15.jpg,static/tour_images/sailing-whitsundays/fd56a077ec5a503c/image_16.jpg,static/tour_images/sailing-whitsundays/fd56a077ec5a503c/image_17.jpg,static/tour_images/sailing-whitsundays/fd56a077ec5a503c/image_18.jpg",,True,https://sailing-whitsundays.com/whitsundays/whitsunday-adventurer-2d2n,"Shared Accommodation (16+): A$677 | Private Double Cabin (requires 2 people): A$1,614 (for 2 people)",,3.0,multi_day,combo,"Airlie Beach,Great Barrier Reef,Hamilton Island,Hill Inlet,Whitehaven,Whitsunday Island","adventure,luxury,private",general,adventurous,,,Alter 16+ für Gemeinschaftsunterkünfte,"Abenteuerlustige, Naturliebhaber und alle, die ein luxuriöses und doch abenteuerliches Erlebnis in den Whitsundays und am Great Barrier Reef suchen.",,"['Das Mindestalter beträgt 6 Jahre.', 'Kinder im Alter von 6-15 Jahren müssen in einer privaten Kabine gebucht werden.', 'Jeder ab 16 Jahren kann in einer offenen Einzelkabine gebucht werden.', 'Kinder reisen auf dieser Tour zum vollen Erwachsenentarif.']","['Kleidung zum Wechseln', 'Badebekleidung', 'Strandtuch', 'Toilettenartikel', 'Insektenschutzmittel', 'Wasserflaschen zum Nachfüllen (bitte keine Metallflaschen)', 'Kamera', 'Bequeme Wanderschuhe', 'Sonnenschutz (Sonnencreme, Hut, Sonnenbrille usw.)', 'Warme Kleidung/Pullover für abends (saisonbedingt)', 'Bargeld, falls Sie an Bord Getränke kaufen möchten']","[""Alkohol und alkoholfreie Getränke (BYO - siehe 'Was Sie mitbringen sollten' für weitere Informationen)"", ""Sie können alkoholfreie Getränke an Bord kaufen (nur Bargeld)"", ""Für alle diätetischen Anforderungen (wie z.B. vegane, glutenfreie und laktosefreie Ernährung) muss ein Aufpreis von $20 pro Person gezahlt werden, der beim Check-in zu entrichten ist."", ""Koschere und Halal-Diäten können nicht berücksichtigt werden."", ""Gepäckaufbewahrung in unserem Airlie Beach Travel Shop""]",Bei Nichterscheinen oder Stornierung durch den Kunden innerhalb von 30 Tagen vor der Abfahrt verfallen 100 % des gesamten Ticketpreises.,0
fa0bf69d1ff5e9ca,Coral Sea Marina - Premium Tour,sailing-whitsundays,,"Begeben Sie sich von der Coral Sea Marina aus auf ein erstklassiges Abenteuer, das ein exklusives Erlebnis für alle bietet, die sowohl Entspannung als auch Abenteuer suchen. Diese Tour verbindet die Schönheit der Whitsundays mit dem Nervenkitzel der Erkundung des Great Barrier Reefs. Sie ist ideal für Paare und kleine Gruppen und verspricht eine unvergessliche Reise durch einige der atemberaubendsten Meereslandschaften.",Full day,Coral Sea Marina Meeting Point C,Departs 12:00 pm,FROM A$798,,"Gemeinsame Unterkunft
Private Doppelkabine als Option
Zugang zu Premium-Einrichtungen","Erkunden Sie das Great Barrier Reef
Besuchen Sie die atemberaubenden Whitsunday Islands
Möglichkeiten zum Schnorcheln und Tauchen
Entspannen am Whitehaven Beach
Individuell anpassbare Reiserouten für private Charters",,,https://sailing-whitsundays.com/whitsundays/whitsunday-adventurer-3d3n,https://sailing-whitsundays.com/whitsundays/whitsunday-adventurer-3d3n,,static/tour_images/sailing-whitsundays/fa0bf69d1ff5e9ca/image_1.jpg,"static/tour_images/sailing-whitsundays/fa0bf69d1ff5e9ca/image_1.jpg,static/tour_images/sailing-whitsundays/fa0bf69d1ff5e9ca/image_3.jpg,static/tour_images/sailing-whitsundays/fa0bf69d1ff5e9ca/image_5.jpg,static/tour_images/sailing-whitsundays/fa0bf69d1ff5e9ca/image_6.jpg,static/tour_images/sailing-whitsundays/fa0bf69d1ff5e9ca/image_7.jpg,static/tour_images/sailing-whitsundays/fa0bf69d1ff5e9ca/image_10.jpg,static/tour_images/sailing-whitsundays/fa0bf69d1ff5e9ca/image_11.jpg,static/tour_images/sailing-whitsundays/fa0bf69d1ff5e9ca/image_12.jpg,static/tour_images/sailing-whitsundays/fa0bf69d1ff5e9ca/image_13.jpg,static/tour_images/sailing-whitsundays/fa0bf69d1ff5e9ca/image_14.jpg,static/tour_images/sailing-whitsundays/fa0bf69d1ff5e9ca/image_15.png,static/tour_images/sailing-whitsundays/fa0bf69d1ff5e9ca/image_16.jpg,static/tour_images/sailing-whitsundays/fa0bf69d1ff5e9ca/image_17.jpg",,True,https://sailing-whitsundays.com/whitsundays/whitsunday-adventurer-3d3n,Shared Accommodation (16+): A$798 | Private Double Cabin (requires 2 people): A$2051 Total,,,full_day,combo,"Airlie Beach,Great Barrier Reef,Hamilton Island,Hill Inlet,Whitehaven,Whitsunday Island","adventure,luxury,private,relaxation,small-group",general,adventurous,,,Gemeinschaftsunterkunft (16+),"Paare, kleine Gruppen und Abenteuerlustige",,"['Das Mindestalter beträgt 6 Jahre.', 'Kinder im Alter von 6-15 Jahren müssen in einer Privatkabine untergebracht werden.', 'Wer über 16 Jahre alt ist, kann in einer offenen Einzelkabine untergebracht werden.', 'Kinder reisen auf dieser Tour zum vollen Erwachsenentarif.', 'Gäste unter 15 Jahren müssen in Privatunterkünften untergebracht werden.', 'Aus Sicherheitsgründen müssen alle Passagiere schwimmen können und fließend Englisch sprechen.']","['Kleidung zum Wechseln', 'Badebekleidung', 'Strandtuch', 'Toilettenartikel', 'Insektenschutzmittel', 'Wasserflaschen zum Nachfüllen (bitte keine Metallflaschen)', 'Kamera', 'Bequeme Wanderschuhe', 'Sonnenschutz (Sonnencreme, Hut, Sonnenbrille usw.)', 'Warme Kleidung/Pullover für abends (saisonbedingt)', 'Bargeld, falls Sie an Bord Getränke kaufen möchten']","[Alkohol und alkoholfreie Getränke (bitte keine Glasflaschen oder Rotwein)', 'Passagiere mit besonderen Ernährungsbedürfnissen (vegan, milchfrei, glutenfrei usw.) müssen einen Aufpreis von $30 pro Person zahlen, der beim Check-in zu entrichten ist. Dies gilt nicht für Vegetarier.', 'Zertifiziertes Tauchen (mit kompletter Ausrüstung) 1. Tauchgang - $120 2. Tauchgang - $100 Weitere Tauchgänge - je $70', 'Gepäckaufbewahrung in unserem Airlie Beach Travel Shop']",Bei Nichterscheinen oder Stornierung durch den Kunden innerhalb von 30 Tagen vor der Abreise werden 100 % des gesamten Ticketpreises einbehalten. Eine Erstattung im Falle einer Stornierung unterliegt sowohl unseren Stornierungsrichtlinien als auch den Bedingungen des Anbieters.,0
c0ac7d40f6616188,Pfingstsonntag-Abenteurer Privat-Charter,sailing-whitsundays,,"Gönnen Sie sich einen exklusiven privaten Charter an Bord eines der beliebtesten Katamarane der Whitsundays. Vermeiden Sie große Menschenmengen und genießen Sie eine maßgeschneiderte Tour, die alle Ihre Wünsche erfüllt. Erleben Sie die ultimative Entspannung, während Ihr professioneller Skipper und Gastgeber Sie in Ihrem bevorzugten Tempo zu allen Hot Spots der Whitsunday Islands bringt. Perfekt für diejenigen, die ein persönliches und intimes Abenteuer durch die atemberaubenden Whitsunday Islands suchen.",Full day,Coral Sea Marina Meeting Point C,,FROM A$9190,,,"Exklusive private Chartererfahrung
Vermeiden Sie große Menschenmengen mit einer persönlichen Reiseroute
Professioneller Skipper und Gastgeber
Besuchen Sie die schönsten Plätze der Whitsunday Islands
Ultimative Entspannung an Bord eines beliebten Katamarans",,,https://sailing-whitsundays.com/whitsundays/whitsunday-adventurer-private-charter,https://sailing-whitsundays.com/whitsundays/whitsunday-adventurer-private-charter,,static/tour_images/sailing-whitsundays/c0ac7d40f6616188/image_2.jpg,"static/tour_images/sailing-whitsundays/c0ac7d40f6616188/image_1.jpg,static/tour_images/sailing-whitsundays/c0ac7d40f6616188/image_2.jpg,static/tour_images/sailing-whitsundays/c0ac7d40f6616188/image_4.jpg,static/tour_images/sailing-whitsundays/c0ac7d40f6616188/image_7.jpg,static/tour_images/sailing-whitsundays/c0ac7d40f6616188/image_10.jpg,static/tour_images/sailing-whitsundays/c0ac7d40f6616188/image_11.jpg,static/tour_images/sailing-whitsundays/c0ac7d40f6616188/image_12.jpg,static/tour_images/sailing-whitsundays/c0ac7d40f6616188/image_13.jpg,static/tour_images/sailing-whitsundays/c0ac7d40f6616188/image_14.jpg,static/tour_images/sailing-whitsundays/c0ac7d40f6616188/image_15.jpg",,True,https://sailing-whitsundays.com/whitsundays/whitsunday-adventurer-private-charter,Private Charter (Between 01 Jul 2025 and 30 Jun 2026): A$9190,,,full_day,combo,"Airlie Beach,Great Barrier Reef,Hamilton Island,Hill Inlet,Whitehaven,Whitsunday Island","adventure,private,relaxation,small-group",general,adventurous,,,,Wer ein persönliches und intimes Abenteuer auf den Whitsunday Islands sucht.,,"['Das Mindestalter für Adventurer Private Charter beträgt 6 Jahre.', 'Aus Sicherheitsgründen müssen ALLE Passagiere schwimmen können und fließend Englisch sprechen.']","['Kleidung zum Wechseln', 'Badebekleidung', 'Strandtuch', 'Toilettenartikel', 'Insektenschutzmittel', 'Wasserflasche zum Nachfüllen (bitte keine Metallflaschen)', 'Kamera', 'Bequeme Wanderschuhe', 'Sonnenschutz (Sonnencreme, Hut, Sonnenbrille usw.)', 'Warme Kleidung/Pullover für abends (saisonbedingt)']","[BYO-Alkohol und alkoholfreie Getränke (siehe 'Was Sie mitbringen sollten')"", ""Für alle diätetischen Anforderungen (z. B. vegetarische, vegane, pescatarische, glutenfreie und milch- bzw. laktosefreie Ernährung) wird ein Aufpreis von $15 pro Person erhoben, der beim Check-in zu zahlen ist."", ""Koschere und Halal-Diäten können nicht berücksichtigt werden."", ""Während der Hauptferienzeiten (d. h. Weihnachten, Ostern, Neujahr) kann ein Aufpreis erhoben werden. Weihnachten, Ostern, Neujahr) kann ein Zuschlag erhoben werden.', 'Bei Reisen auf See zwischen dem 24. Dezember und dem 2. Januar wird eine einmalige Gebühr von $20 pro Person und Nacht erhoben, die direkt beim Check-in zu zahlen ist.', 'Bei Reisen, die am Osterfreitag, -samstag, -sonntag oder -montag stattfinden, wird eine einmalige Gebühr von $20 pro Person und Nacht erhoben, die direkt beim Check-in zu zahlen ist.']","['Bei allen Stornierungen verfällt die nicht erstattungsfähige Anzahlung.', 'Alle Restzahlungen sind 2 Monate vor der Abreise fällig.', 'Bei Nichtzahlung des Restbetrags vor diesem Termin wird der Chartervertrag gekündigt und die nicht erstattungsfähige Anzahlung verfällt.', 'Sobald die Restzahlung geleistet wurde, verfallen bei Nichterscheinen und Kundenstornierungen innerhalb von 30 Tagen vor der Abreise 100 % des vollen Ticketpreises.']",0
38a7091013a51a3f,Pfingstsonntag Perle,sailing-whitsundays,,"Entfliehen Sie ins Paradies an Bord des schnittigen und stilvollen Katamarans Whitsunday Pearl. Dieses luxuriöse Schiff bietet ein intimes Erlebnis mit Unterkünften für nur 8 Gäste in vier privaten Doppelkabinen, jede mit einem eigenen Bad. Diese Tour ist ideal für Paare und kleine Gruppen, die ein einzigartiges Abenteuer erleben möchten, denn sie verbindet Entspannung mit Erkundung. Genießen Sie das Schnorcheln in unberührten Riffen, den Besuch des kultigen Whitehaven Beach und die Ausübung von Wassersportarten. Mit geräumigen Decks, einer Kaffeemaschine und Starlink Wifi haben Sie alles, was Sie für eine komfortable Reise brauchen.",2 days 2 nights,Coral Sea Marina Meeting Point C,,FROM A$1695,,"Unterkunft in privaten Doppelkabinen mit eigenem Bad
Besuch des Whitehaven Beach
Schnorcheln in unberührten Riffen
Wassersport
Geräumige Decks
Kaffeemaschine
Starlink Wifi","Schlanker und stilvoller Katamaran
Intimes Erlebnis für bis zu 8 Gäste
Private Doppelkabinen mit eigenem Bad
Besuch des Whitehaven Beach
Schnorcheln in unberührten Riffen
Wassersport möglich
Geräumige Decks zum Entspannen
Kaffeemaschine an Bord
Starlink Wifi für Konnektivität",,,https://sailing-whitsundays.com/whitsundays/whitsunday-pearl-3d3n,https://sailing-whitsundays.com/whitsundays/whitsunday-pearl-3d3n,,static/tour_images/sailing-whitsundays/38a7091013a51a3f/image_6.JPG,"static/tour_images/sailing-whitsundays/38a7091013a51a3f/image_1.jpg,static/tour_images/sailing-whitsundays/38a7091013a51a3f/image_2.jpg,static/tour_images/sailing-whitsundays/38a7091013a51a3f/image_3.jpg,static/tour_images/sailing-whitsundays/38a7091013a51a3f/image_4.jpg,static/tour_images/sailing-whitsundays/38a7091013a51a3f/image_5.jpg,static/tour_images/sailing-whitsundays/38a7091013a51a3f/image_6.JPG,static/tour_images/sailing-whitsundays/38a7091013a51a3f/image_8.jpg,static/tour_images/sailing-whitsundays/38a7091013a51a3f/image_10.png,static/tour_images/sailing-whitsundays/38a7091013a51a3f/image_13.jpg,static/tour_images/sailing-whitsundays/38a7091013a51a3f/image_14.jpg,static/tour_images/sailing-whitsundays/38a7091013a51a3f/image_15.jpg,static/tour_images/sailing-whitsundays/38a7091013a51a3f/image_16.jpg,static/tour_images/sailing-whitsundays/38a7091013a51a3f/image_17.jpg",,True,https://sailing-whitsundays.com/whitsundays/whitsunday-pearl-3d3n,Private Queen Ensuite Cabin (sleeps 2): A$1695,,,multi_day,combo,"Airlie Beach,Great Barrier Reef,Hamilton Island,Hill Inlet,Whitehaven,Whitsunday Island","adventure,luxury,private,relaxation,small-group",general,adventurous,,,,"Paare und kleine Gruppen, die ein luxuriöses und intimes Abenteuer suchen",,"['Die Whitsunday Pearl ist nur für Erwachsene geeignet, das Mindestalter beträgt daher 18 Jahre.', 'Ein Passagier kann nur dann an den Wasseraktivitäten teilnehmen, wenn er über ein gewisses Maß an Schwimmerfahrung verfügt.', 'Um unsere Mindestsicherheitsstandards zu erfüllen, müssen die Passagiere in der Lage sein, das Schiff im unwahrscheinlichen Fall eines Notfalls ohne Hilfe zu verlassen.']","['Kleidung zum Wechseln', 'Badekleidung', 'Toilettenartikel', 'Insektenschutzmittel', 'Wasserflasche zum Auffüllen', 'Kamera', 'Bequeme Wanderschuhe', 'Sonnenschutz (Sonnencreme, Hut, Sonnenbrille usw.)', 'Warme Kleidung/Pullover für abends (saisonbedingt)', 'Eigene Flossen, falls vorhanden']","['BYO Alkohol - keine Glasflaschen (mit Ausnahme von Weinflaschen).', 'Für einige Diätwünsche und -anforderungen kann ein Aufpreis von $15 pro Tag erhoben werden.', 'In den Hauptferienzeiten (z.B. Weihnachten, Ostern, Neujahr) kann ein Aufpreis erhoben werden.', 'Sie können zusätzliches Gepäck in unserem Airlie Beach Bag Storage an der Hauptstraße gegen eine geringe Gebühr aufbewahren.']","[Bei Nichterscheinen oder Stornierung durch den Kunden innerhalb von 30 Tagen vor der Abreise verfallen 100 % des gesamten Ticketpreises"", ""Bei Stornierung zwischen 30-60 Tagen vor der Abreise wird eine Stornogebühr von 25 % erhoben""]",0
ba9746af968168dd,Whitsunday Blue Privat-Charter,sailing-whitsundays,,"Erleben Sie die Whitsundays in exklusivem Komfort und Stil an Bord der Whitsunday Blue. Dieser private Charter bietet individuelle Abenteuer für diejenigen, die eine einzigartige und luxuriöse Erkundung der Whitsunday Islands suchen. Ideal für Paare, Familien und Gruppen, die unvergessliche Erinnerungen in einer ruhigen und malerischen Umgebung schaffen möchten.",Full day,Coral Sea Marina Meeting Point C,"Departs 12:00 PM on Tue, Thu & Sat",FROM A$8660.00,,"Private Chartererfahrung
Personalisierte Reiseroute
Erfahrene Besatzung","Segeln Sie durch die atemberaubenden Whitsunday Islands
Luxuriöses und privates Segelerlebnis
Flexible, auf Ihre Wünsche zugeschnittene Reiseroute
Gelegenheiten zum Schnorcheln und für Strandbesuche
Ideal für besondere Anlässe oder intime Zusammenkünfte",,,https://sailing-whitsundays.com/whitsundays/whitsunday-blue-private-charter,https://sailing-whitsundays.com/whitsundays/whitsunday-blue-private-charter,,static/tour_images/sailing-whitsundays/ba9746af968168dd/image_2.jpg,"static/tour_images/sailing-whitsundays/ba9746af968168dd/image_1.jpg,static/tour_images/sailing-whitsundays/ba9746af968168dd/image_2.jpg,static/tour_images/sailing-whitsundays/ba9746af968168dd/image_3.jpg,static/tour_images/sailing-whitsundays/ba9746af968168dd/image_6.jpg,static/tour_images/sailing-whitsundays/ba9746af968168dd/image_10.jpg,static/tour_images/sailing-whitsundays/ba9746af968168dd/image_11.jpg,static/tour_images/sailing-whitsundays/ba9746af968168dd/image_12.jpg,static/tour_images/sailing-whitsundays/ba9746af968168dd/image_13.jpg,static/tour_images/sailing-whitsundays/ba9746af968168dd/image_14.jpg",,True,https://sailing-whitsundays.com/whitsundays/whitsunday-blue-private-charter,Private Charter: A$8660.00,,,full_day,combo,"Airlie Beach,Great Barrier Reef,Hamilton Island,Hill Inlet,Whitehaven,Whitsunday Island","adventure,private,small-group",general,adventurous,,,Alle Altersgruppen willkommen,"Paare, Familien und Gruppen, die ein privates und luxuriöses Segelerlebnis suchen",,"['Kinder unter 18 Jahren werden auf Anfrage berücksichtigt (keine Kleinkinder).', 'Whitsunday Blue stellt keine Ausrüstung in Kindergröße zur Verfügung, wie z.B. Neoprenanzüge, Schnorchelausrüstung oder Schwimmwesten.', 'Es liegt in der Verantwortung der Eltern/Erziehungsberechtigten, dafür zu sorgen, dass diese vorher woanders besorgt und bei der Abfahrt an Bord gebracht werden.', 'Aus Sicherheitsgründen müssen ALLE Passagiere schwimmen können und fließend Englisch sprechen.']","['Kleidung zum Wechseln', 'Badebekleidung', 'Toilettenartikel', 'Insektenschutzmittel', 'Wasserflasche zum Nachfüllen', 'Kamera', 'Bequeme Wanderschuhe', 'Sonnenschutz (Sonnencreme, Hut, Sonnenbrille usw.)', 'Warme Kleidung/Pullover für abends (saisonbedingt)']","[Zusätzliche Schnorchelausrüstung (verschreibungspflichtige Masken usw.)"", ""Kinderausrüstung (Schwimmwesten, Stachelanzüge, Flossen, Masken usw.)*"", ""In den Hauptferienzeiten (d.h. Weihnachten, Ostern, Neujahr) kann ein Aufpreis anfallen.', 'Bei Fahrten auf See zwischen dem 24. Dezember und dem 2. Januar fällt eine einmalige Gebühr von $20 pro Person und Nacht an, die direkt beim Check-in zu entrichten ist.', 'Bei Fahrten, die am Osterfreitag, -samstag, -sonntag oder -montag stattfinden, fällt eine einmalige Gebühr von $20 pro Person und Nacht an, die direkt beim Check-in zu entrichten ist.']","['Bei allen Stornierungen verfällt die nicht erstattungsfähige Anzahlung.', 'Alle Restzahlungen sind 2 Monate vor der Abreise fällig.', 'Bei Nichtzahlung des Restbetrags vor diesem Termin wird der Chartervertrag gekündigt und die nicht erstattungsfähige Anzahlung verfällt.', 'Sobald die Restzahlung geleistet wurde, verfallen bei Nichterscheinen und Kundenstornierungen innerhalb von 30 Tagen vor der Abreise 100 % des vollen Ticketpreises.']",0
e832e98d0fa269af,Whitehaven Strand & Hill Inlet,sailing-whitsundays,,"Erleben Sie die atemberaubende Schönheit der Whitsundays bei einem Besuch des Whitehaven Beach und Hill Inlet. Diese Tour bietet eine perfekte Mischung aus Abenteuer und Entspannung, ideal für Naturliebhaber und Fotografen, die atemberaubende Aussichten suchen. Genießen Sie das kristallklare Wasser, die unberührten Strände und den ikonischen, wirbelnden Sand von Hill Inlet. Perfekt für Familien, Paare und Alleinreisende, die einen der malerischsten Orte Australiens erkunden möchten.",Full day,Coral Sea Marina Meeting Point C,,FROM A$990,,"Schnorcheln oder Tauchen in unberührten Riffen
Besuch des Whitehaven Beach
Geführte Tour durch Hill Inlet","Erkunden Sie den legendären Whitehaven Beach
Erleben Sie den wirbelnden Sand von Hill Inlet
Schnorcheln oder tauchen Sie im Great Barrier Reef
Perfekt für Naturliebhaber und Fotografen
Ideal für Familien, Paare und Alleinreisende",,,https://sailing-whitsundays.com/whitsundays/whitsunday-blue-2d2n,https://sailing-whitsundays.com/whitsundays/whitsunday-blue-2d2n,,static/tour_images/sailing-whitsundays/e832e98d0fa269af/image_2.jpg,"static/tour_images/sailing-whitsundays/e832e98d0fa269af/image_1.jpg,static/tour_images/sailing-whitsundays/e832e98d0fa269af/image_2.jpg,static/tour_images/sailing-whitsundays/e832e98d0fa269af/image_4.jpg,static/tour_images/sailing-whitsundays/e832e98d0fa269af/image_5.jpg,static/tour_images/sailing-whitsundays/e832e98d0fa269af/image_7.jpg,static/tour_images/sailing-whitsundays/e832e98d0fa269af/image_10.jpg,static/tour_images/sailing-whitsundays/e832e98d0fa269af/image_11.jpg,static/tour_images/sailing-whitsundays/e832e98d0fa269af/image_12.jpg,static/tour_images/sailing-whitsundays/e832e98d0fa269af/image_13.jpg,static/tour_images/sailing-whitsundays/e832e98d0fa269af/image_14.jpg,static/tour_images/sailing-whitsundays/e832e98d0fa269af/image_15.jpg,static/tour_images/sailing-whitsundays/e832e98d0fa269af/image_16.jpg,static/tour_images/sailing-whitsundays/e832e98d0fa269af/image_17.jpg,static/tour_images/sailing-whitsundays/e832e98d0fa269af/image_18.jpg",,True,https://sailing-whitsundays.com/whitsundays/whitsunday-blue-2d2n,Private Double with Shared Bathroom (for 2 people): A$1980 Total | Private Double Cabin with Ensuite (for 2 people): A$2150 Total,,,full_day,combo,"Airlie Beach,Great Barrier Reef,Hamilton Island,Hill Inlet,Whitehaven,Whitsunday Island","adventure,private,relaxation",general,adventurous,,,Alle Altersgruppen willkommen,"Naturliebhaber, Fotografen, Familien, Paare und Alleinreisende",,"[Das Mindestalter für Passagiere auf der Whitsunday Blue beträgt 18 Jahre."", ""Für alle diätetischen Anforderungen (vegetarisch, vegan, milchfrei, glutenfrei usw.) ist ein Aufpreis von $45 pro Person zu zahlen, der beim Check-in zu entrichten ist."", ""Koschere und Halal-Diäten können nicht berücksichtigt werden.""]","['Kleidung zum Wechseln', 'Hut', 'Badebekleidung', 'Sonnencreme 30+', 'Warmer Pullover für die Abende (saisonbedingt)', 'Bringen Sie Ihre eigenen alkoholischen Getränke mit, die in der Stadt erhältlich sind - bitte keine Glasflaschen']","[BYO-Alkohol - keine Glasflaschen, mit Ausnahme von Wein und Champagner"", ""Erfrischungsgetränke können an Bord gekauft werden"", ""Für alle diätetischen Anforderungen (z. B. vegetarische, vegane, pescatarische, glutenfreie und milch-/laktosefreie Ernährung) ist ein Aufpreis von $15 pro Person und Tag zu zahlen, der direkt beim Check-in zu entrichten ist"", ""Feiertagszuschläge: Bei Reisen auf See zwischen dem 24. Dezember und dem 2. Januar wird eine einmalige Gebühr von 20 US-Dollar pro Person und Nacht erhoben, die direkt beim Check-in zu entrichten ist.', 'Bei Reisen, die am Osterfreitag, -samstag, -sonntag oder -montag stattfinden, wird eine einmalige Gebühr von 20 US-Dollar pro Person und Nacht erhoben, die direkt beim Check-in zu entrichten ist.']",Bei Nichterscheinen oder Stornierung durch den Kunden innerhalb von 30 Tagen vor der Abreise werden 100 % des gesamten Ticketpreises einbehalten. Eine Erstattung im Falle einer Stornierung unterliegt sowohl unseren Stornierungsrichtlinien als auch den Bedingungen des Anbieters.,0
