id,name,company_name,summary,description,duration,departure_location,departure_times,price_adult,price_child,includes,highlights,keywords,duration_hours,link_booking,link_more_info,phone,image_url,image_urls,commission_rate,active,price_source_url,price_tiers,raw_text,duration_days,duration_category,tour_type,locations,tags,audience,intensity_level,itinerary,menu,age_requirements,ideal_for,video_urls,important_information,what_to_bring,whats_extra,cancellation_policy,booking_connected
534bd6c9edbb17fa,Powerplay 2D/2N - Außenriff & Verlängerte Segel,sailing-whitsundays,,"Begeben Sie sich auf ein aufregendes 3-Nächte-Abenteuer zum Outer Great Barrier Reef, wo Sie die ultimative Mischung aus Entspannung und Erkundung erleben werden. Diese Tour ist perfekt für Abenteurer und Naturliebhaber, die in das pulsierende Meeresleben und die unberührten Gewässer des Riffs eintauchen möchten. Genießen Sie ausgedehnte Segeltörns, um die atemberaubenden Aussichten und Sonnenuntergänge zu genießen. Ideal für alle, die die Schönheit des Ozeans zu schätzen wissen und ein einzigartiges, tiefgreifendes Erlebnis suchen.",3 Nights,Coral Sea Marina Meeting Point C,,FROM A$635,,"Gemeinsame Unterbringung im Salon
Unterbringung im Doppelzimmer (2 Personen erforderlich)","Erkunden Sie das Äußere Great Barrier Reef
Ausgedehnte Segeltörns für maximale Entspannung
Möglichkeiten zum Schnorcheln und Tauchen
Atemberaubende Meerblicke und Sonnenuntergänge
Ideal für Abenteuerlustige und Naturliebhaber",,,https://sailing-whitsundays.com/whitsundays/powerplay-2d2n,https://sailing-whitsundays.com/whitsundays/powerplay-2d2n,,static/tour_images/sailing-whitsundays/534bd6c9edbb17fa/image_7.jpg,"static/tour_images/sailing-whitsundays/534bd6c9edbb17fa/image_2.jpg,static/tour_images/sailing-whitsundays/534bd6c9edbb17fa/image_5.jpg,static/tour_images/sailing-whitsundays/534bd6c9edbb17fa/image_6.jpg,static/tour_images/sailing-whitsundays/534bd6c9edbb17fa/image_7.jpg,static/tour_images/sailing-whitsundays/534bd6c9edbb17fa/image_9.jpg,static/tour_images/sailing-whitsundays/534bd6c9edbb17fa/image_10.jpg,static/tour_images/sailing-whitsundays/534bd6c9edbb17fa/image_11.jpg,static/tour_images/sailing-whitsundays/534bd6c9edbb17fa/image_12.jpg,static/tour_images/sailing-whitsundays/534bd6c9edbb17fa/image_13.jpg,static/tour_images/sailing-whitsundays/534bd6c9edbb17fa/image_14.jpg,static/tour_images/sailing-whitsundays/534bd6c9edbb17fa/image_15.jpg,static/tour_images/sailing-whitsundays/534bd6c9edbb17fa/image_16.jpg,static/tour_images/sailing-whitsundays/534bd6c9edbb17fa/image_17.jpg,static/tour_images/sailing-whitsundays/534bd6c9edbb17fa/image_18.jpg,static/tour_images/sailing-whitsundays/534bd6c9edbb17fa/image_19.jpg,static/tour_images/sailing-whitsundays/534bd6c9edbb17fa/image_20.jpg",,True,https://sailing-whitsundays.com/whitsundays/powerplay-2d2n,"Shared Saloon Accom (01 Jul 2025 - 30 Jun 2026): A$635 | Shared Double Accom (for 2 people): A$1,570 Total",,3.0,multi_day,combo,"Airlie Beach,Great Barrier Reef,Hamilton Island,Hill Inlet,Whitehaven,Whitsunday Island","adventure,luxury,private,relaxation,sunset",general,adventurous,,,,"Abenteuerlustige, Naturliebhaber und diejenigen, die den Blick auf das Meer und die Unterwasserwelt schätzen.",,"['Diese Tour ist ausschließlich für Personen ab 16 Jahren.', 'Wenn Sie mit Gästen unter 16 Jahren buchen, wird Ihnen der Zutritt verweigert.', 'Sie MÜSSEN schwimmen können, um an Bord zu gehen.', 'Aus Sicherheitsgründen müssen Sie auch Englisch sprechen können.']","['Kleidung zum Wechseln und Badebekleidung', 'Toilettenartikel', 'Strandtuch', 'Sonnenschutz (Sonnencreme, Hut, Sonnenbrille usw.)', 'Insektenschutzmittel', 'Bequeme Wanderschuhe', 'Warmer Pullover für die Abende (saisonbedingt)', 'Extra Geld für den Kauf von Softdrinks/Flaschenwasser']","['BYO-Alkohol - keine Glasflaschen oder Rotwein.', 'Erfrischungsgetränke können an Bord gekauft werden.', 'Für bestimmte Diätwünsche und -anforderungen kann ein Aufpreis von $20 erhoben werden.', 'Erfrischungsgetränke und Wasser in Flaschen.', 'Gepäckaufbewahrung für nur $10 pro Tag in unserem Reiseshop.', 'In den Hauptferienzeiten (d. h. Weihnachten, Ostern, Neujahr) kann ein Aufpreis erhoben werden.']","[Alle Stornierungen verfallen in Höhe von 25 % des empfohlenen Verkaufspreises (UVP) - nicht des ermäßigten/verkauften Preises."", ""Bei Nichterscheinen oder Kundenstornierungen innerhalb von 30 Tagen vor der Abreise verfallen 100 % des gesamten Ticketpreises."", ""Eine Erstattung im Falle einer Stornierung unterliegt sowohl unseren Stornierungsrichtlinien als auch den Bedingungen des Anbieters.""]",0
2727ffb19e4a2900,Powerplay 3D/3N - Außenriff & erweiterte Segel,sailing-whitsundays,,"Begeben Sie sich auf eine atemberaubende Reise durch die Whitsundays und das Outer Great Barrier Reef mit unserem einzigartigen 3-Nächte-Segelabenteuer. Diese Tour bietet eine unvergleichliche Erkundung von unberührten Riffen und einer atemberaubenden Unterwasserwelt, perfekt für Abenteurer und Naturliebhaber. Erleben Sie den Nervenkitzel des Segelns, Schnorchelns und Tauchens in einem der schönsten Naturwunder der Welt. Ideal für alle, die in die Schönheit des Ozeans eintauchen und die Ruhe des offenen Meeres genießen möchten.",3 Nights,Coral Sea Marina Meeting Point C,,FROM A$767,,"Segeln durch die Whitsundays und das Äußere Great Barrier Reef
Möglichkeiten zum Schnorcheln und Tauchen
Unterkunft an Bord
Mahlzeiten inklusive
Geführte Touren und Aktivitäten","3-Nächte-Segelabenteuer
Erkunden Sie das Äußere Great Barrier Reef
Schnorcheln und Tauchen in unberührten Riffen
Intimes und einzigartiges Segelerlebnis
Perfekt für Abenteuerlustige und Naturliebhaber",,,https://sailing-whitsundays.com/whitsundays/powerplay-3d3n,https://sailing-whitsundays.com/whitsundays/powerplay-3d3n,,static/tour_images/sailing-whitsundays/2727ffb19e4a2900/image_5.jpg,"static/tour_images/sailing-whitsundays/2727ffb19e4a2900/image_5.jpg,static/tour_images/sailing-whitsundays/2727ffb19e4a2900/image_7.jpg,static/tour_images/sailing-whitsundays/2727ffb19e4a2900/image_8.jpg,static/tour_images/sailing-whitsundays/2727ffb19e4a2900/image_9.jpg,static/tour_images/sailing-whitsundays/2727ffb19e4a2900/image_10.jpg,static/tour_images/sailing-whitsundays/2727ffb19e4a2900/image_11.jpg,static/tour_images/sailing-whitsundays/2727ffb19e4a2900/image_12.jpg,static/tour_images/sailing-whitsundays/2727ffb19e4a2900/image_13.jpg,static/tour_images/sailing-whitsundays/2727ffb19e4a2900/image_14.jpg,static/tour_images/sailing-whitsundays/2727ffb19e4a2900/image_15.jpg,static/tour_images/sailing-whitsundays/2727ffb19e4a2900/image_16.jpg,static/tour_images/sailing-whitsundays/2727ffb19e4a2900/image_17.jpg,static/tour_images/sailing-whitsundays/2727ffb19e4a2900/image_18.jpg,static/tour_images/sailing-whitsundays/2727ffb19e4a2900/image_19.jpg,static/tour_images/sailing-whitsundays/2727ffb19e4a2900/image_20.jpg",,True,https://sailing-whitsundays.com/whitsundays/powerplay-3d3n,"Shared Saloon Accom: FROM A$767 | Shared Double Accom (for 2 people): A$1,788 Total | Private Quad Cabin (for 4 people): Price not specified",,3.0,multi_day,combo,"Airlie Beach,Great Barrier Reef,Hamilton Island,Hill Inlet,Whitehaven,Whitsunday Island","adventure,luxury,private,small-group",general,adventurous,,,Alle Altersgruppen willkommen,"Abenteuerlustige, Naturliebhaber und all jene, die das Great Barrier Reef eingehend erkunden möchten.",,"['Diese Tour ist ausschließlich für Personen ab 16 Jahren.', 'Wenn Sie mit Gästen unter 16 Jahren buchen, wird Ihnen der Zutritt verweigert.', 'Sie MÜSSEN schwimmen können, um an Bord zu gehen.', 'Aus Sicherheitsgründen müssen Sie auch Englisch sprechen können.']","['Kleidung zum Wechseln und Badebekleidung', 'Toilettenartikel', 'Strandtuch', 'Sonnenschutz (Sonnencreme, Hut, Sonnenbrille usw.)', 'Insektenschutzmittel', 'Bequeme Wanderschuhe', 'Warmer Pullover für die Abende (saisonbedingt)', 'Zusätzliches Geld für den Kauf von Softdrinks/Flaschenwasser']","['BYO-Alkohol - keine Glasflaschen oder Rotwein.', 'Erfrischungsgetränke können an Bord gekauft werden.', 'Für bestimmte Diätwünsche und -anforderungen kann ein Aufpreis von $30 erhoben werden.', 'Passagiere mit bestimmten Diätanforderungen (vegan, milchfrei, glutenfrei usw.) müssen einen Aufpreis von $30 pro Person zahlen, der beim Check-in zu entrichten ist.', 'In den Hauptferienzeiten (d. h. Weihnachten, Ostern, Neujahr) kann ein Aufpreis erhoben werden.']",Bei Nichterscheinen oder Stornierung durch den Kunden innerhalb von 30 Tagen vor der Abfahrt verfallen 100 % des gesamten Ticketpreises.,0
