id,name,company_name,summary,description,duration,departure_location,departure_times,price_adult,price_child,includes,highlights,keywords,duration_hours,link_booking,link_more_info,phone,image_url,image_urls,commission_rate,active,price_source_url,price_tiers,raw_text,duration_days,duration_category,tour_type,locations,tags,audience,intensity_level,itinerary,menu,age_requirements,ideal_for,important_information,what_to_bring,whats_extra,cancellation_policy,booking_connected
7e123dff452a3bef,Northern Exposure Öko-Abenteuer,oceanrafting,,"Begeben Sie sich auf das Northern Exposure Eco Adventure, eine aufregende Reise durch die Whitsundays, perfekt für passionierte Schnorchler und Naturliebhaber. Diese Tour bietet eine aufregende Fahrt zum berühmten Whitehaven Beach und Hill Inlet sowie unberührte Schnorchelerlebnisse an zwei verschiedenen Orten, darunter Mantaray Bay auf Hook Island und Maureens Cove. Genießen Sie die einmalige Gelegenheit, die abgelegenen Strände von Hill Inlet zu erkunden, zu denen Sie nur auf dieser Tour direkten Zugang haben, und genießen Sie die atemberaubende Aussicht vom Aussichtspunkt des Nationalparks. Diese Tour ist ideal für alle, die eine Mischung aus Abenteuer und Entspannung suchen, denn sie verspricht unvergessliche Unterwasserbegegnungen und atemberaubende Naturschönheiten.",Full Day,Coral Sea Marina Meeting Point C,,A$209,A$138,"Besuch des Whitehaven Beach und Hill Inlet
Geführte Wanderungen im Nationalpark
Schnorcheln am inneren Saumkorallenriff
Benutzung von Schnorchelausrüstung und Schwimmhilfen
Vorträge von Riff- und Insel-Naturforschern","Aufregende Fahrt zum Whitehaven Beach und Hill Inlet
Schnorcheln rund um Hook Island, einschließlich Mantaray Bay und Maureens Cove
Geführte Wanderung im Nationalpark zum Aussichtspunkt Hill Inlet
Direkter Zugang zu den Stränden von Hill Inlet
Kleingruppenerlebnis für ein intimeres Abenteuer",,8.0,https://oceanrafting.com.au/tours/northern-exposure/,https://oceanrafting.com.au/tours/northern-exposure/,,,,,True,https://oceanrafting.com.au/tours/northern-exposure/,Adult (15+): A$209 | Child (2-14): A$138 | Family (2 adults and 2 children): A$635,,,full_day,combo,"Airlie Beach,Daydream Island,Great Barrier Reef,Hamilton Island,Hill Inlet,Hook Island,Whitehaven,Whitsunday Island","adventure,family-friendly,private,relaxation,small-group",family,adventurous,,,Alter 2+,"Begeisterte Schnorchler, Naturliebhaber und alle, die eine Mischung aus Abenteuer und Entspannung suchen","['Erwachsener: $209 (15 Jahre und älter)', 'Kind: $138 (2-14 Jahre, Kleinkinder von 0-23 Monaten kostenlos)', 'Stornierungen nach 12:00 Uhr am Tag vor dem Abreisedatum sind nicht erstattungsfähig.']","['Eine Strandtasche mit Handtuch, Hut und Schuhen.', 'Eine Jacke im Winter zum Schutz vor Wind und zum Wärmen nach dem Schnorcheln.', 'Kameras in einer wasserdichten Tasche oder Tupperware.', 'Bargeld für Wasser, Softdrinks, Bier, Fruchtsäfte und Schokolade, die an Bord verkauft werden.', 'Wenn Sie sich nicht für unser frisches tropisches Lunchpaket entschieden haben, bringen Sie bitte Ihr eigenes mit, da wir tagsüber keine Resorts besuchen.']","['Sunsuit/Wetsuit Hire - $8', 'Prescription Mask Hire - $20', 'Optional fresh tropical lunch pack served at the beach.']","Bei Stornierungen bis 12:00 Uhr mittags am Tag vor dem Abreisedatum werden 95 % der Kosten abzüglich 1,6 % Kreditkartenzuschlag erstattet.",1
2fa3646d546c5cd2,Fliegenfloß - Northern Exposure,oceanrafting,,"Erleben Sie die Whitsundays von allen Seiten mit der Fly Raft Northern Exposure Tour. Dieses Abenteuer kombiniert einen atemberaubenden Rundflug über das berühmte Heart Reef und Whitehaven Beach mit einer aufregenden Ocean Rafting Fahrt. Diese Tour ist perfekt für Abenteuerlustige und Naturliebhaber und bietet die besten Aussichten über, auf und unter Wasser. Genießen Sie geführte Wanderungen, unberührte Schnorchelriffe und eine aufregende Fahrt zum Whitehaven Beach - ein unvergessliches Erlebnis für alle, die die natürliche Schönheit der Whitsundays erkunden möchten.",,Coral Sea Marina Meeting Point C,,A$535,A$472,"60-minütiger Rundflug über Riffe und Inseln mit garantierten Fensterplätzen
Tour zum Whitehaven Beach und Hill Inlet
Geführte Wanderungen im Nationalpark
Schnorcheln am inneren Korallenriff
Frisches tropisches Lunchpaket
Benutzung von Schnorchelausrüstung und Schwimmhilfen
Vorträge von Riff- und Insel-Naturforschern","Rundflug über die Whitsunday Islands und das Great Barrier Reef
Blick auf das Heart Reef, Whitehaven Beach und Hill Inlet
Ocean Rafting Abenteuer mit mehr Zeit zum Schnorcheln
Geführte Wanderungen in den Whitsunday Island National Parks
Garantierte Fensterplätze mit Kommentaren des Piloten",,,https://oceanrafting.com.au/tours/fly-and-raft/,https://oceanrafting.com.au/tours/fly-and-raft/,,,,,True,https://oceanrafting.com.au/tours/fly-and-raft/,Adult (15+): A$535 | Child (2-14): A$472 | Infant (0-23 months): Free,,,unknown,combo,"Airlie Beach,Daydream Island,Great Barrier Reef,Hamilton Island,Hill Inlet,Whitehaven,Whitsunday Island","adventure,family-friendly,private,relaxation",family,adventurous,,,Alle Altersgruppen willkommen,"Abenteuerlustige, Naturliebhaber und alle, die die Whitsundays von oben und unten erkunden möchten","['Erwachsener: $535 (15 Jahre und älter)', 'Kind: $472 (2-14 Jahre, Kleinkinder von 0-23 Monaten kostenlos)', 'Das maximale Gewicht pro Sitzplatz beträgt 125 kg.', 'Aus rechtlichen und sicherheitstechnischen Gründen werden alle Passagiere vor dem Einsteigen gewogen, und bei Gewichtsabweichungen oder Passagieren, die das Gewichtslimit überschreiten, wird eine Gebühr von 100 % erhoben, und die Teilnahme ist nicht möglich.', 'Dieses Paket ist leider nicht für Gäste von Long Island, Hamilton Island, Hayman Island oder Daydream Island verfügbar.']","['Eine Strandtasche mit Handtuch, Hut und Schuhen', 'Eine Jacke im Winter zum Schutz vor Wind und zum Wärmen nach dem Schnorcheln', 'Kameras in einer wasserdichten Tasche oder Tupperware', 'Bargeld für Wasser, Softdrinks, Fruchtsäfte und Pralinen, die an Bord verkauft werden']","['Prescription Mask Hire - $20', 'Water Soft Drinks/Juice Beer/Cider Chocolate', 'Everything you need for the day as you will not return to your accommodation between tours.']","Bei Stornierungen bis 12:00 Uhr mittags am Tag vor dem Abreisedatum werden 95 % der Kosten abzüglich einer Kreditkartengebühr von 1,6 % erstattet. Stornierungen nach 12:00 Uhr am Tag vor dem Abreisedatum sind nicht erstattungsfähig.",1
ddf4d96cc5e282ec,Südliche Lichter,oceanrafting,,"Erleben Sie den Nervenkitzel der Whitsundays auf der Ocean Rafting Southern Lights Tour, die für ihren Abenteuergeist und ihre lehrreiche Reise bekannt ist. Diese Tour ist perfekt für Nervenkitzel und Naturliebhaber und bietet eine einzigartige Kombination aus Hochgeschwindigkeitsbootsfahrt und eingehender Erkundung der Naturwunder des Great Barrier Reefs. Mit direktem Zugang zum Hill Inlet und exklusiven Schnorchelspots können die Gäste in das pulsierende Meeresleben und die atemberaubenden Landschaften eintauchen. Diese Tour ist ideal für alle, die Abenteuer und Entdeckungen lieben und verspricht ein unvergessliches Erlebnis an einem der schönsten Orte der Welt.",Full Day,Coral Sea Marina Meeting Point C,,A$209,A$138,"Besuch des Whitehaven Beach und Hill Inlet
Geführte Wanderungen im Nationalpark
Schnorcheln im Inneren des Korallenriffs
Benutzung von Schnorchelausrüstung und Schwimmhilfen
Vorträge von Riff- und Insel-Naturforschern","Geführte Buschwanderung zum Hill Inlet Lookout
Direkter Zugang zu allen Strandbereichen von Hill Inlet
Schnorcheln auf Border Island, Dumbell Island oder an geheimen Plätzen
Schnellste Tagesboote in den Whitsundays
Halbstarre Schlauchboote für eine lustige Fahrt",,8.0,https://oceanrafting.com.au/tours/southern-lights/,https://oceanrafting.com.au/tours/southern-lights/,,,,,True,https://oceanrafting.com.au/tours/southern-lights/,Adult (15+): A$209 | Child (2-14): A$138 | Family (2 adults and 2 children): A$635,,,full_day,combo,"Airlie Beach,Daydream Island,Great Barrier Reef,Hamilton Island,Hill Inlet,Whitehaven,Whitsunday Island","adventure,family-friendly,private",family,adventurous,,,Alter 2+,"Nervenkitzel, Naturliebhaber und Familien, die in den Whitsundays Abenteuer und Entdeckungen suchen.","['Erwachsener: $209 (15 Jahre und älter)', 'Kind: $138 (2-14 Jahre, Kleinkinder von 0-23 Monaten kostenlos)', 'Stornierungen nach 12:00 Uhr am Tag vor dem Abreisedatum sind nicht erstattungsfähig.']","['Eine Strandtasche mit Handtuch, Hut und Schuhen.', 'Eine Jacke im Winter zum Schutz vor Wind und zum Wärmen nach dem Schnorcheln.', 'Kameras in einer wasserdichten Tasche oder Tupperware.', 'Bargeld für Wasser, Softdrinks, Bier, Fruchtsäfte und Schokolade, die an Bord verkauft werden.', 'Wenn Sie sich nicht für unser frisches tropisches Lunchpaket entschieden haben, bringen Sie bitte Ihr eigenes mit, da wir tagsüber keine Resorts besuchen.']","['Sunsuit/Wetsuit Hire - $8', 'Prescription Mask Hire - $20']","Bei Stornierungen bis 12:00 Uhr mittags am Tag vor dem Abreisedatum werden 95 % der Kosten abzüglich 1,6 % Kreditkartenzuschlag erstattet.",1
64fa24ebe474042c,Fly Raft - Südliche Lichter,oceanrafting,,"Erleben Sie die Whitsundays aus jedem Blickwinkel mit der Fly Raft - Southern Lights Tour. Dieses Abenteuer kombiniert einen atemberaubenden Rundflug über die berühmten Whitsunday Islands und das Great Barrier Reef, einschließlich des berühmten Heart Reef und Whitehaven Beach, mit einer aufregenden Ocean Rafting-Tour. Genießen Sie mehr Zeit zum Entspannen am unberührten Sandstrand von Whitehaven Beach und erkunden Sie das atemberaubende Hill Inlet. Perfekt für alle, die Sonne tanken und die natürliche Schönheit der Whitsundays sowohl aus der Luft als auch vom Meer aus genießen möchten.",,Coral Sea Marina Meeting Point C,,A$535,A$472,"60-minütiger Rundflug über Riffe und Inseln mit garantierten Fensterplätzen
Tour zum Whitehaven Beach und Hill Inlet
Geführte Wanderungen im Nationalpark
Schnorcheln am inneren Korallenriff
Frisches tropisches Lunchpaket
Benutzung von Schnorchelausrüstung und Schwimmhilfen
Vorträge von Riff- und Insel-Naturforschern","Rundflug über die Whitsunday-Inseln und das Great Barrier Reef
Besuch des legendären Heart Reef und des Whitehaven Beach
Aufregende Ocean-Rafting-Fahrt
Geführte Wanderungen in den Whitsunday Island National Parks
Schnorcheln an unberührten Riffen",,,https://oceanrafting.com.au/tours/fly-and-raft-south/,https://oceanrafting.com.au/tours/fly-and-raft-south/,,,,,True,https://oceanrafting.com.au/tours/fly-and-raft-south/,Adult (15 years and over): A$535 | Child (2-14 years): A$472 | Infant (0-23 months): Free,,,unknown,combo,"Airlie Beach,Daydream Island,Great Barrier Reef,Hamilton Island,Hill Inlet,Whitehaven,Whitsunday Island","adventure,family-friendly,private,relaxation",family,adventurous,,,Alle Altersgruppen willkommen,"Ideal für Abenteurer, Naturliebhaber und alle, die einen umfassenden Blick auf die Whitsundays aus der Luft und vom Meer aus genießen möchten.","[Erwachsene: $535 (15 Jahre und älter)', 'Kind: $472 (2-14 Jahre, Kleinkinder 0-23 Monate alt kostenlos)', 'Das maximale Gewicht pro Sitzplatz beträgt 125 kg.', 'Größere Abweichungen zwischen dem bei der Buchung angegebenen Gewicht und dem tatsächlichen Gewicht am Flughafen können zur Nichtteilnahme an der Reise führen.', 'Aus rechtlichen und sicherheitstechnischen Gründen werden alle Passagiere vor dem Einsteigen gewogen, und bei Gewichtsabweichungen oder Überschreitung des Gewichtslimits wird eine Gebühr von 100 % erhoben und die Teilnahme an der Reise verweigert.', 'Dieses Paket ist leider nicht für Gäste von Long Island, Hamilton Island, Hayman Island oder Daydream Island verfügbar.']","['Eine Strandtasche mit Handtuch, Hut und Schuhen', 'Eine Jacke im Winter zum Schutz vor Wind und zum Wärmen nach dem Schnorcheln', 'Kameras in einer wasserdichten Tasche oder Tupperware', 'Bargeld für Wasser, Softdrinks, Fruchtsäfte und Pralinen, die an Bord verkauft werden']","['Prescription Mask Hire - $20', 'Water Soft Drinks/Juice Beer/Cider Chocolate', 'Everything you need for the day as you will not return to your accommodation between tours.']","Bei Stornierungen bis 12:00 Uhr mittags am Tag vor dem Abreisedatum werden 95 % der Kosten abzüglich einer Kreditkartengebühr von 1,6 % erstattet. Stornierungen nach 12:00 Uhr am Tag vor dem Abreisedatum sind nicht erstattungsfähig.",1
36635757166fc815,Pfingstsonntag 60 Minuten Rundflug,oceanrafting,,"Erleben Sie die atemberaubende Schönheit der Whitsundays von oben bei einem 60-minütigen Rundflug. Dieses Abenteuer bietet einen Blick aus der Vogelperspektive auf die atemberaubenden Whitsunday Islands, den kultigen Whitehaven Beach und das malerische Hill Inlet. Fliegen Sie über das Great Barrier Reef und bestaunen Sie das berühmte Heart Reef, eines der meistfotografierten Riffe. Diese Tour ist perfekt für Fotografie- und Naturliebhaber und garantiert ein unvergessliches Erlebnis mit garantierten Fensterplätzen und informativen Kommentaren des Piloten.",60 Minutes,Coral Sea Marina Meeting Point C,,A$335,A$335,"60 Minuten Rundflug über Riffe und Inseln
Garantierter Fensterplatz
Aussicht auf Whitehaven Beach, Hill Inlet und Heart Reef
Höfliche Abholung und Transfer","Rundflug über die Whitsunday Islands und das Great Barrier Reef
Blick auf das Heart Reef, Whitehaven Beach und Hill Inlet
Garantierte Fensterplätze für alle Passagiere
Pilotenkommentar während des Fluges
Bequemer Abflug vom Whitsunday Airport",,,https://oceanrafting.com.au/tours/heart-reef-scenic-flight/,https://oceanrafting.com.au/tours/heart-reef-scenic-flight/,,,,,True,https://oceanrafting.com.au/tours/heart-reef-scenic-flight/,Adult (15+): A$335 | Child (2-14): A$335 | Infant (0-23 months): Free,,,unknown,combo,"Airlie Beach,Daydream Island,Great Barrier Reef,Hamilton Island,Hill Inlet,Whitehaven,Whitsunday Island","adventure,family-friendly,private,relaxation",family,adventurous,,,Alle Altersgruppen willkommen,"Fotofreunde, Naturliebhaber und alle, die die Whitsundays aus einer einzigartigen Perspektive erleben möchten.","['Erwachsener: $335 (15 Jahre und älter)', 'Kind: $335 (2-14 Jahre, Kleinkinder von 0-23 Monaten kostenlos)', 'Das maximale Gewicht pro Sitzplatz beträgt 125 kg.', 'Aus rechtlichen und sicherheitstechnischen Gründen werden alle Passagiere vor dem Einsteigen gewogen, und alle Gewichtsabweichungen oder Passagiere, die das Gewichtslimit überschreiten, führen zu einer Gebühr von 100 % und zur Nichtteilnahme.', 'Die Rundflüge starten vom Festland und sind leider nicht für Gäste von Long Island, Hamilton Island, Hayman Island oder Daydream Island verfügbar.']","['Kamera', 'Sonnenbrille']","['Bei Stornierungen nach 12 Uhr am Vortag fallen 100% Stornogebühren an.', 'Die angegebenen Preise gelten für Reisen bis zum 31. März 26. Für Reisen nach diesem Datum werden die entsprechenden Preise angezeigt, wenn zukünftige Daten in der Buchungstabelle ausgewählt werden.""]",bei Stornierungen nach dem Mittag des Vortages fallen 100% Stornogebühren an.,1
