id,name,company_name,summary,description,duration,departure_location,departure_times,price_adult,price_child,includes,highlights,keywords,duration_hours,link_booking,link_more_info,phone,image_url,image_urls,commission_rate,active,price_source_url,price_tiers,raw_text,duration_days,duration_category,tour_type,locations,tags,audience,intensity_level,itinerary,menu,age_requirements,ideal_for,video_urls,important_information,what_to_bring,whats_extra,cancellation_policy
e417664eb55f9833,반나절 이너 아일랜드 거북이 투어,saltydog,,"반나절 이너 아일랜드 터틀 투어는 숙련된 패들러와 초보자 모두에게 재미와 즐거움에 중점을 둔 흥미진진한 모험을 제공합니다. 슈테 하버의 청록색 바다를 노를 저으며 주변 산호초와 인근 열대 섬을 탐험하세요. 바다거북과 하늘을 나는 독수리 등 놀랍도록 다양한 해양 생물과 조류도 만나보세요. 자연과 모험을 즐기는 분들에게 이상적인 이 투어는 독특한 해변에서 수영, 탐험 또는 휴식을 취할 수 있는 기회를 제공합니다. 기억에 남는 카약 체험을 원하는 가족 및 개인 여행객에게 안성맞춤입니다.",Half Day,Shute Harbour,,FROM A$120,$100 under 15 years old,"차가운 음료
뮤즐리 바
과일 플래터
가이드 카약 투어","프린지 산호초 위에서 카약 타기
인근 열대 섬 탐험하기
바다거북과 독수리 관찰하기
혹등고래를 만날 수 있는 기회 (7월~9월)
독특한 해변에서 수영하고 탐험할 수 있는 기회",,3.5,https://www.saltydog.com.au/tours/half-day-inner-island-turtle-tour/,https://www.saltydog.com.au/tours/half-day-inner-island-turtle-tour/,,static/tour_images/saltydog/e417664eb55f9833/image_11.jpg,"static/tour_images/saltydog/e417664eb55f9833/image_1.jpg,static/tour_images/saltydog/e417664eb55f9833/image_2.jpg,static/tour_images/saltydog/e417664eb55f9833/image_4.jpg,static/tour_images/saltydog/e417664eb55f9833/image_7.jpg,static/tour_images/saltydog/e417664eb55f9833/image_9.jpg,static/tour_images/saltydog/e417664eb55f9833/image_10.jpg,static/tour_images/saltydog/e417664eb55f9833/image_11.jpg,static/tour_images/saltydog/e417664eb55f9833/image_12.jpg",,True,https://www.saltydog.com.au/tours/half-day-inner-island-turtle-tour/,,,,half_day,water,Airlie Beach,"adventure,family-friendly,relaxation",family,relaxed,,,어린이 환영 - 7세 이상(어린이 1명당 성인 1명),"초보자부터 숙련된 패들러, 가족, 자연 애호가까지 흥미롭고 즐거운 카약 경험을 원하는 모든 분들을 위한 카약 투어입니다",,"['중간 수준의 체력이 필요합니다.', '카약 투어 중 기상 조건이 변경될 수 있습니다.', '크리스마스, 박싱데이, 설날은 휴무입니다.']","['차가운 음료, 뮤즐리 바, 과일 플래터가 제공됩니다.']",,
9839383cb56c02ca,전일 열대 섬 카약 및 스노클링 어드벤처,saltydog,,"전일 열대 섬 카약과 스노클링 어드벤처로 휘트선데이 아일랜드를 전에 없던 방식으로 경험하세요. 이 투어는 수정처럼 맑은 바다와 활기찬 해양 생물을 탐험하고 싶은 자연 애호가 및 모험을 즐기는 분들에게 완벽한 투어입니다. 고요한 내섬을 노를 저으며 화이트 록에서 휴식을 취하고 수영을 즐기고, 이동 시즌에는 거북이, 돌고래, 혹등고래를 볼 수 있는 사우스 몰레 섬으로 건너가세요. 이 투어는 경치 좋은 마운트 제프리스 워킹 트랙을 트레킹하며 섬 전체의 숨막히는 전경을 감상할 수 있는 특별한 기회를 제공합니다. 맛있는 해변식 뷔페 점심을 즐기며 낙원에서의 잊지 못할 하루를 보내세요.",Full Day,Shute Harbour,,FROM A$220,,"숙련된 가이드
소규모 패들러 그룹
카약 장비
안전 브리핑
해변 뷔페 점심
리프 세금
GST","내부 섬을 지나 화이트 록까지 카약 타기
화이트 록에서 휴식과 수영 즐기기
사우스 몰레 섬으로 건너가기
거북이, 돌고래, 바다 독수리 등 해양 생물 관찰하기
날씨가 좋으면 프린지 산호초에서 스노클링 체험하기
마운트 제프리스 워킹 트랙 트레킹으로 탁 트인 전망 감상하기
혹등고래 이동 시즌(7~9월) 동안 혹등고래 구경하기",,8.0,https://www.saltydog.com.au/tours/full-day-tropical-island-tour/,https://www.saltydog.com.au/tours/full-day-tropical-island-tour/,,static/tour_images/saltydog/9839383cb56c02ca/image_5.jpg,"static/tour_images/saltydog/9839383cb56c02ca/image_1.jpg,static/tour_images/saltydog/9839383cb56c02ca/image_3.jpg,static/tour_images/saltydog/9839383cb56c02ca/image_4.jpg,static/tour_images/saltydog/9839383cb56c02ca/image_5.jpg,static/tour_images/saltydog/9839383cb56c02ca/image_7.jpg,static/tour_images/saltydog/9839383cb56c02ca/image_9.jpg,static/tour_images/saltydog/9839383cb56c02ca/image_12.jpg",,True,https://www.saltydog.com.au/tours/full-day-tropical-island-tour/,"Standard: A$220 (includes lunch, reef tax and GST)",,,full_day,combo,"Airlie Beach,Whitsunday Island","adventure,relaxation,small-group",general,relaxed,,"**메뉴:**
- 해변 뷔페 점심",15세 이상,"자연 애호가, 모험을 즐기는 사람, 모든 수준의 카약을 즐기는 사람",,,"['의류 추천', '개인 물품(선크림, 모자, 선글라스, 타월)']]",,
1b390fe19a2dc6fc,6일 휘트선데이 가이드 카약 투어,saltydog,,"6일간의 가이드 카약 탐험으로 최고의 휘트선데이 모험을 떠나세요. 아웃도어 애호가와 자연 애호가에게 완벽한 이 투어는 아름다운 휘트선데이 아일랜드에서 몰입감 넘치는 경험을 선사합니다. 청록색 바다를 노를 저으며 활기찬 산호초를 탐험하고 한적한 해변에서 별빛 아래에서 캠핑을 즐기세요. 노련한 카약 선수든 호기심 많은 초보자든 이 탐험은 숨막히는 경치, 독특한 야생동물과의 만남, 잊을 수 없는 추억을 선사할 것입니다.",6 Days,Shute Harbour,,"FROM A$3,295",,"5일간의 바다 카약
스노클링 장비
캠핑 장비
숙련된 가이드
에어리 비치에서 슈트 하버까지 교통편
화이트헤이븐 비치까지 고속 수상 택시
탐험 중 모든 식사","휘트선데이 야생지대 탐험하기
생생한 산호초에서 스노클링 즐기기
별빛 아래에서 캠핑하기
화이트헤이븐 비치와 힐 인렛 방문하기
챈스 베이 전망대까지 부시워크하기
동쪽 해안을 따라 케언 캠프장까지 패들링하기
케언 룩아웃에서 숨막히는 경치 감상하기
모린스 코브에서 해양 생물 발견하기
발리 하이로 가는 마지막 패들",,,https://www.saltydog.com.au/tours/6-day-kayaking-expedition/,https://www.saltydog.com.au/tours/6-day-kayaking-expedition/,,static/tour_images/saltydog/1b390fe19a2dc6fc/image_2.jpg,"static/tour_images/saltydog/1b390fe19a2dc6fc/image_1.jpg,static/tour_images/saltydog/1b390fe19a2dc6fc/image_2.jpg,static/tour_images/saltydog/1b390fe19a2dc6fc/image_4.jpg,static/tour_images/saltydog/1b390fe19a2dc6fc/image_5.jpg,static/tour_images/saltydog/1b390fe19a2dc6fc/image_6.jpg,static/tour_images/saltydog/1b390fe19a2dc6fc/image_7.jpeg,static/tour_images/saltydog/1b390fe19a2dc6fc/image_8.jpg,static/tour_images/saltydog/1b390fe19a2dc6fc/image_9.jpg,static/tour_images/saltydog/1b390fe19a2dc6fc/image_12.jpg",,True,https://www.saltydog.com.au/tours/6-day-kayaking-expedition/,"Per Person: A$3,295",,6.0,multi_day,combo,"Airlie Beach,Hill Inlet,Hook Island,Whitehaven,Whitsunday Island","adventure,private",general,adventurous,"**1일: 에어리 비치에 도착해 가이드를 만나고 슈트 하버로 이동합니다. 쾌속 수상 택시로 화이트헤이븐 비치로 이동해 하셀우드 아일랜드(Haselwood Island)를 탐험하고 챈스 베이 전망대(Chance Bay Lookout)까지 트래킹을 합니다.
**2일: 해안선을 따라 북쪽으로 패들링하고 힐 인렛에서 수영을 한 후 케언 캠프장으로 이동합니다.
**3일: 이른 아침 케언 룩아웃까지 도보로 이동한 후, 후크 아일랜드의 크레이피쉬 비치로 이동합니다.
**4일: 후크 아일랜드 주변에서 카약을 타고 모린스 코브까지 이동해 스노클링을 즐기세요.
**5일차: 발리 하이로 마지막 패들링, 산호 정원 탐험.
**6일: 에어리 비치로 돌아오기.",,모든 연령대 환영,"아웃도어 애호가, 자연 애호가, 모험을 즐기는 사람, 독특한 섬 경험을 원하는 가족에게 적합합니다.",,"['16세 이상에게 적합', '영어를 구사하고 이해할 수 있어야 합니다', '수영할 수 있어야 합니다', '카약을 타는 사람은 이 액티비티에 안전하게 참여하기 위해 건강하고 적절한 신체 상태를 유지해야 합니다', '본인 또는 담당 의사가 이 액티비티에 참여하기에 충분히 건강하고 양호하다는 것을 확인해야 합니다', '솔티독 씨 카약은 참가자 및 직원들의 안전과 원활한 활동 진행에 유해하다고 판단되면 의학적인 이유로 예약을 거부할 권리를 갖습니다', '카약은 예약을 거부할 수 있는 권리를 갖습니다']",,,
58dbdabd60de8265,전일 열대 섬 카약 및 스노클링 어드벤처,saltydog,,"하루 종일 즐기는 카약 모험으로 휘트선데이 아일랜드의 아름다움을 경험하세요. 숙련된 인솔자의 안내에 따라 소규모 그룹과 함께 고요한 바다를 노를 저어 보세요. 거북이, 돌고래, 다채로운 열대어를 비롯한 활기찬 해양 생물을 만나보세요. 이 투어는 자연 애호가 및 이 지역의 아름다운 자연과 교감하고자 하는 모험가에게 완벽한 투어입니다. 해변에서 즐기는 뷔페 점심 식사와 프린지 산호초에서 스노클링을 즐길 수 있는 기회가 제공되어 천국에서 잊지 못할 하루를 보낼 수 있습니다.",Full Day,Shute Harbour,,FROM A$220,,"숙련된 가이드
카약 장비
안전 브리핑
해변 뷔페 점심
리프 세금
GST","휘트선데이 아일랜드에서 카약 타기
화이트 록에서 휴식과 수영 즐기기
프린지 산호초에서 스노클링 체험하기
거북이, 돌고래 등 해양 생물 관찰하기
마운트 제프리스 워킹 트랙 트레킹하기
휘트선데이 아일랜드의 파노라마 뷰 감상하기
소규모 그룹 체험",,8.0,https://www.saltydog.com.au/tours/full-day-tour/,https://www.saltydog.com.au/tours/full-day-tour/,,static/tour_images/saltydog/58dbdabd60de8265/image_5.jpg,"static/tour_images/saltydog/58dbdabd60de8265/image_1.jpg,static/tour_images/saltydog/58dbdabd60de8265/image_3.jpg,static/tour_images/saltydog/58dbdabd60de8265/image_4.jpg,static/tour_images/saltydog/58dbdabd60de8265/image_5.jpg,static/tour_images/saltydog/58dbdabd60de8265/image_7.jpg,static/tour_images/saltydog/58dbdabd60de8265/image_9.jpg,static/tour_images/saltydog/58dbdabd60de8265/image_12.jpg",,True,https://www.saltydog.com.au/tours/full-day-tour/,"Standard: A$220 (includes lunch, reef tax and GST)",,,full_day,combo,"Airlie Beach,Whitsunday Island","adventure,relaxation,small-group",general,relaxed,,"**메뉴:**
- 해변 뷔페 점심",15세 이상,"자연 애호가, 모험을 즐기는 사람, 휘트선데이 아일랜드에서 활동적이고 매력적인 방식으로 탐험을 즐기고 싶은 분들에게 적합합니다.",,,"['의류 추천', '개인 물품(선크림, 모자, 선글라스, 타월)']]",,
75c72eecdb7c4d82,6일 휘트선데이 가이드 카약 투어,saltydog,,"숨막히는 휘트선데이 아일랜드에서 6일간의 궁극의 바다 카약 탐험을 떠나보세요. 이 어드벤처는 카약의 스릴과 별빛 아래 캠핑의 평온함을 결합하여 자연에 몰입하는 경험을 원하는 분들에게 완벽한 프로그램입니다. 화이트헤이븐 비치의 청록색 바다와 하얀 실리카 모래를 탐험하고, 활기찬 산호 정원에서 스노클링을 즐기고, 힐 인렛에서 상징적인 경치를 감상하세요. 모험을 즐기고 자연을 사랑하는 사람들에게 이상적인 이 투어는 휘트선데이즈의 아름다운 해양 및 육지 환경과 교감할 수 있는 특별한 기회를 제공합니다.",6 Days,Shute Harbour,,"FROM A$3,295",,"5일간의 바다 카약 체험
스노클링
부시 워킹
캠핑 장비
전문 씨카약 가이드와 함께하는 가이드 투어
에어리 비치에서 슈트 하버로 이동하기","휘트선데이 야생지대 탐험하기
생생한 프린지 산호초에서 스노클링 즐기기
청정 해변에서 별빛 아래 캠핑하기
상징적인 화이트헤이븐 비치와 힐 인렛 방문하기
다양한 전망대에서 멋진 경치 감상하기
청록색 바다에서 스릴 넘치는 카약 체험하기
거북이와 가오리를 포함한 다양한 해양 생물 관찰하기",,,https://www.saltydog.com.au/tours/6-day/,https://www.saltydog.com.au/tours/6-day/,,static/tour_images/saltydog/75c72eecdb7c4d82/image_2.jpg,"static/tour_images/saltydog/75c72eecdb7c4d82/image_1.jpg,static/tour_images/saltydog/75c72eecdb7c4d82/image_2.jpg,static/tour_images/saltydog/75c72eecdb7c4d82/image_4.jpg,static/tour_images/saltydog/75c72eecdb7c4d82/image_5.jpg,static/tour_images/saltydog/75c72eecdb7c4d82/image_6.jpg,static/tour_images/saltydog/75c72eecdb7c4d82/image_7.jpeg,static/tour_images/saltydog/75c72eecdb7c4d82/image_8.jpg,static/tour_images/saltydog/75c72eecdb7c4d82/image_9.jpg,static/tour_images/saltydog/75c72eecdb7c4d82/image_12.jpg",,True,https://www.saltydog.com.au/tours/6-day/,,,6.0,multi_day,combo,"Airlie Beach,Hill Inlet,Hook Island,Whitehaven,Whitsunday Island","adventure,private",general,adventurous,"**1일차: **
그룹 호텔에 도착하여 여장을 푼다. 가이드를 만나 브리핑을 받습니다. 수상 택시를 타고 슈트 하버로 이동한 후 화이트헤븐 비치로 이동합니다. 캠프를 설치하고 스노클링과 챈스 베이 전망대까지의 부시워크를 통해 하셀우드 섬을 탐험합니다.
**2일: **일
해안선을 따라 북쪽으로 노를 저어 힐 인렛으로 가서 수영과 전망대 방문을 즐기세요. 케언 캠프장으로 계속 이동합니다.
*3일: **일 3:**
이른 아침 케언 룩아웃까지 걸어서 이동한 후 후크 아일랜드의 크레이피쉬 비치로 이동합니다. 세계적인 수준의 산호와 해양 생물을 감상하세요.
**4일: **
후크 아일랜드에서 모린스 코브까지 카약을 타고 스노클링과 캠핑을 즐기세요.
**5일: **
서쪽으로 발리 하이로 향하여 산호 정원을 탐험하고 다양한 해양 생물을 만나보세요.
**6일: **
돌아오는 여정 및 투어 마무리.",,12세 이상,"모험을 즐기는 사람, 자연을 사랑하는 사람, 휘트선데이 아일랜드에서 활동적이고 몰입감 넘치는 방식으로 탐험을 즐기고 싶은 사람에게 적합합니다.",,"['16세 이상에게 적합', '영어를 구사하고 이해할 수 있어야 합니다', '수영할 수 있어야 합니다', '카약을 타는 사람은 이 액티비티에 안전하게 참여하기 위해 건강하고 적절한 신체 상태를 유지해야 합니다', '본인 또는 담당 의사가 이 액티비티에 참여하기에 충분히 건강하고 양호하다는 것을 확인해야 합니다', '솔티독 씨 카약은 참가자 및 직원들의 안전과 원활한 활동 진행에 유해하다고 판단되는 경우 의학적 이유로 예약을 거부할 수 있습니다.'], '카약은 건강 상태를 고려하여 예약을 거부할 수 있는 권리를 보유합니다",,,
ece3460586cd6245,반나절 이너 아일랜드 거북이 투어,saltydog,,"반나절 이너 아일랜드 터틀 투어는 숙련된 패들러와 초보자 모두에게 적합한 흥미진진한 카약 어드벤처를 제공합니다. 슈트 하버에서 출발해 활기찬 산호초 위를 노를 저으며 바다거북과 독수리 등 다양한 해양 생물이 서식하는 아름다운 열대 섬을 탐험하게 됩니다. 7~9월에는 혹등 고래를 볼 수 있는 기회도 있습니다. 이 투어는 수영, 휴식, 지식이 풍부한 가이드의 설명과 함께 자연 속에서 재미있고 몰입감 있는 경험을 원하는 분들에게 안성맞춤입니다.",Half Day,Shute Harbour,,FROM A$120,A$100,"차가운 음료
뮤즐리 바
과일 플래터","프린지 산호초 위에서 카약 타기
인근 열대 섬 탐험하기
다양한 해양 생물과 조류 만나기
혹등고래를 볼 수 있는 기회(7월~9월)
독특한 해변 또는 섬에서 수영 및 탐험하기
가이드의 현지 지식 공유",,3.5,https://www.saltydog.com.au/tours/half-day-2/,https://www.saltydog.com.au/tours/half-day-2/,,static/tour_images/saltydog/ece3460586cd6245/image_11.jpg,"static/tour_images/saltydog/ece3460586cd6245/image_1.jpg,static/tour_images/saltydog/ece3460586cd6245/image_2.jpg,static/tour_images/saltydog/ece3460586cd6245/image_4.jpg,static/tour_images/saltydog/ece3460586cd6245/image_7.jpg,static/tour_images/saltydog/ece3460586cd6245/image_9.jpg,static/tour_images/saltydog/ece3460586cd6245/image_10.jpg,static/tour_images/saltydog/ece3460586cd6245/image_11.jpg,static/tour_images/saltydog/ece3460586cd6245/image_12.jpg",,True,https://www.saltydog.com.au/tours/half-day-2/,,,,half_day,water,Airlie Beach,"adventure,family-friendly,relaxation",family,relaxed,,,어린이 환영 - 7세 이상(어린이 1명당 성인 1명),"초보자부터 숙련된 패들러, 자연 애호가, 가족, 즐거운 아웃도어 모험을 원하는 분들까지 모두 만족하실 수 있습니다.",,"['중간 수준의 체력이 필요합니다.', '카약 투어 중 기상 조건이 변경될 수 있습니다.', '크리스마스, 박싱데이, 설날은 휴무입니다.']","['차가운 음료, 뮤즐리 바, 과일 플래터가 제공됩니다.']",,
