id,name,company_name,summary,description,duration,departure_location,departure_times,price_adult,price_child,includes,highlights,keywords,duration_hours,link_booking,link_more_info,phone,image_url,image_urls,commission_rate,active,price_source_url,price_tiers,raw_text,duration_days,duration_category,tour_type,locations,tags,audience,intensity_level,video_urls,important_information,what_to_bring,whats_extra,cancellation_policy,booking_connected
atlantic_clipper_2d_2n_overnight_sailing_tour,Atlantic Clipper Overnight Tour,truebluesailing,,"Experience the ultimate fun and social sailing adventure aboard the Atlantic Clipper, the largest sailing boat in the Whitsundays. Perfect for young and adventurous travelers, this tour offers a vibrant atmosphere with lively banter, exciting water activities, and scenic walks. Enjoy the unique amenities like waterslides, heated spas, and paddleboards. Delight in freshly prepared meals and the stunning beauty of the Whitsunday Islands. Whether you're diving into the blue or relaxing on the sun deck, the Atlantic Clipper promises an unforgettable experience.",2 Days 2 Nights,Coral Sea Marina,,FROM A$755,,"21 cabins with air conditioning
5 heated showers
Scuba diving
Snorkelling
TWO waterslides
6 metre dive platform
Freshly prepared breakfast, lunch, dinner and all snacks
BYO alcohol and drinks with onboard fridges
Free use of snorkel equipment, stinger suit/wet suit hire, and flotation devices
Indoor seating area for 60 people
Sun tanning deck and sheltered covers
A Master Reef Guide","Largest sailing boat in the Whitsundays
Unrivalled facilities and water activities
Heated spas and paddleboards
Stunning views of the Great Barrier Reef
Social and fun atmosphere
Delicious food and lively banter
Scenic walks and sunset beach parties",,,https://truebluesailing.com.au/atlantic-clipper-overnight-tour/,https://truebluesailing.com.au/atlantic-clipper-overnight-tour/,,static/tour_images/truebluesailing/atlantic_clipper_2d_2n_overnight_sailing_tour/image_15.jpg,"static/tour_images/truebluesailing/atlantic_clipper_2d_2n_overnight_sailing_tour/image_1.jpg,static/tour_images/truebluesailing/atlantic_clipper_2d_2n_overnight_sailing_tour/image_10.jpg,static/tour_images/truebluesailing/atlantic_clipper_2d_2n_overnight_sailing_tour/image_12.jpg,static/tour_images/truebluesailing/atlantic_clipper_2d_2n_overnight_sailing_tour/image_15.jpg,static/tour_images/truebluesailing/atlantic_clipper_2d_2n_overnight_sailing_tour/image_16.jpg,static/tour_images/truebluesailing/atlantic_clipper_2d_2n_overnight_sailing_tour/image_23.jpg,static/tour_images/truebluesailing/atlantic_clipper_2d_2n_overnight_sailing_tour/image_26.jpg,static/tour_images/truebluesailing/atlantic_clipper_2d_2n_overnight_sailing_tour/image_27.jpg,static/tour_images/truebluesailing/atlantic_clipper_2d_2n_overnight_sailing_tour/image_37.jpg,static/tour_images/truebluesailing/atlantic_clipper_2d_2n_overnight_sailing_tour/image_41.jpg,static/tour_images/truebluesailing/atlantic_clipper_2d_2n_overnight_sailing_tour/image_42.jpg,static/tour_images/truebluesailing/atlantic_clipper_2d_2n_overnight_sailing_tour/image_48.jpg,static/tour_images/truebluesailing/atlantic_clipper_2d_2n_overnight_sailing_tour/image_64.jpg,static/tour_images/truebluesailing/atlantic_clipper_2d_2n_overnight_sailing_tour/image_85.jpg,static/tour_images/truebluesailing/atlantic_clipper_2d_2n_overnight_sailing_tour/image_86.jpg,static/tour_images/truebluesailing/atlantic_clipper_2d_2n_overnight_sailing_tour/image_92.jpg,static/tour_images/truebluesailing/atlantic_clipper_2d_2n_overnight_sailing_tour/image_97.jpg,static/tour_images/truebluesailing/atlantic_clipper_2d_2n_overnight_sailing_tour/image_98.jpg",,True,https://truebluesailing.com.au/atlantic-clipper-overnight-tour/,,,2.0,multi_day,combo,"Airlie Beach,Great Barrier Reef,Hill Inlet,Langford,Whitehaven,Whitsunday Island","adventure,private,relaxation,sunset",general,adventurous,,,,,,0
new_horizon_overnight_tour,New Horizon Overnight Tour,truebluesailing,,"Embark on an adventurous 2-day, 2-night journey aboard the New Horizon, a charming sailing vessel that combines old-world allure with modern comforts. Perfect for solo travelers, couples, and groups, this tour offers an exhilarating experience in the Whitsundays. Enjoy the thrill of snorkeling and scuba diving in the Great Barrier Reef Marine Park, and unwind with sunset beach parties. The New Horizon is ideal for those seeking a budget-friendly yet comprehensive exploration of one of the world's most coveted tropical destinations.",2 Days 2 Nights,Coral Sea Marina,,FROM A$705,,"Meals & Snacks Included
Freshly prepared breakfast, lunch, dinner, and all snacks
BYO alcohol and drinks
Free use of snorkel equipment, stinger suit/wet suit hire, and flotation devices
A Master Reef Guide
3 sectioned cabins (shared) with air conditioning
2 heated showers
Scuba diving equipment
6 metre dive platform","Beautiful beaches and stunning wildlife
Snorkeling and scuba diving
Incredible sunsets
Inflatable waterslide
Sunset beach party at Langford Island
Visit to Hill Inlet and Whitehaven Beach
Anchor at Blue Pearl Bay for snorkeling and scuba diving",,,https://truebluesailing.com.au/new-horizon-overnight-tour/,https://truebluesailing.com.au/new-horizon-overnight-tour/,,static/tour_images/truebluesailing/new_horizon_overnight_tour/image_18.jpg,"static/tour_images/truebluesailing/new_horizon_overnight_tour/image_6.jpg,static/tour_images/truebluesailing/new_horizon_overnight_tour/image_7.jpg,static/tour_images/truebluesailing/new_horizon_overnight_tour/image_9.jpg,static/tour_images/truebluesailing/new_horizon_overnight_tour/image_10.jpg,static/tour_images/truebluesailing/new_horizon_overnight_tour/image_12.jpg,static/tour_images/truebluesailing/new_horizon_overnight_tour/image_13.jpg,static/tour_images/truebluesailing/new_horizon_overnight_tour/image_14.jpg,static/tour_images/truebluesailing/new_horizon_overnight_tour/image_15.jpg,static/tour_images/truebluesailing/new_horizon_overnight_tour/image_17.jpg,static/tour_images/truebluesailing/new_horizon_overnight_tour/image_18.jpg,static/tour_images/truebluesailing/new_horizon_overnight_tour/image_22.jpg,static/tour_images/truebluesailing/new_horizon_overnight_tour/image_23.jpg,static/tour_images/truebluesailing/new_horizon_overnight_tour/image_24.jpg,static/tour_images/truebluesailing/new_horizon_overnight_tour/image_25.jpg,static/tour_images/truebluesailing/new_horizon_overnight_tour/image_26.jpg,static/tour_images/truebluesailing/new_horizon_overnight_tour/image_27.jpg,static/tour_images/truebluesailing/new_horizon_overnight_tour/image_29.jpg,static/tour_images/truebluesailing/new_horizon_overnight_tour/image_30.jpg,static/tour_images/truebluesailing/new_horizon_overnight_tour/image_31.jpg,static/tour_images/truebluesailing/new_horizon_overnight_tour/image_32.jpg,static/tour_images/truebluesailing/new_horizon_overnight_tour/image_33.jpg,static/tour_images/truebluesailing/new_horizon_overnight_tour/image_34.jpg,static/tour_images/truebluesailing/new_horizon_overnight_tour/image_35.jpg,static/tour_images/truebluesailing/new_horizon_overnight_tour/image_38.jpg,static/tour_images/truebluesailing/new_horizon_overnight_tour/image_39.jpg,static/tour_images/truebluesailing/new_horizon_overnight_tour/image_40.jpg,static/tour_images/truebluesailing/new_horizon_overnight_tour/image_44.jpg,static/tour_images/truebluesailing/new_horizon_overnight_tour/image_45.jpg,static/tour_images/truebluesailing/new_horizon_overnight_tour/image_49.jpg,static/tour_images/truebluesailing/new_horizon_overnight_tour/image_50.jpg,static/tour_images/truebluesailing/new_horizon_overnight_tour/image_51.jpg,static/tour_images/truebluesailing/new_horizon_overnight_tour/image_52.jpg,static/tour_images/truebluesailing/new_horizon_overnight_tour/image_54.jpg,static/tour_images/truebluesailing/new_horizon_overnight_tour/image_56.jpg,static/tour_images/truebluesailing/new_horizon_overnight_tour/image_57.jpg,static/tour_images/truebluesailing/new_horizon_overnight_tour/image_59.jpg,static/tour_images/truebluesailing/new_horizon_overnight_tour/image_60.jpg,static/tour_images/truebluesailing/new_horizon_overnight_tour/image_61.jpg,static/tour_images/truebluesailing/new_horizon_overnight_tour/image_62.jpg,static/tour_images/truebluesailing/new_horizon_overnight_tour/image_64.jpg,static/tour_images/truebluesailing/new_horizon_overnight_tour/image_65.jpg,static/tour_images/truebluesailing/new_horizon_overnight_tour/image_69.jpg,static/tour_images/truebluesailing/new_horizon_overnight_tour/image_71.jpg,static/tour_images/truebluesailing/new_horizon_overnight_tour/image_75.jpg,static/tour_images/truebluesailing/new_horizon_overnight_tour/image_76.jpg,static/tour_images/truebluesailing/new_horizon_overnight_tour/image_77.jpg,static/tour_images/truebluesailing/new_horizon_overnight_tour/image_79.jpg,static/tour_images/truebluesailing/new_horizon_overnight_tour/image_80.jpg,static/tour_images/truebluesailing/new_horizon_overnight_tour/image_82.jpg,static/tour_images/truebluesailing/new_horizon_overnight_tour/image_83.jpg,static/tour_images/truebluesailing/new_horizon_overnight_tour/image_85.jpg,static/tour_images/truebluesailing/new_horizon_overnight_tour/image_88.jpg,static/tour_images/truebluesailing/new_horizon_overnight_tour/image_90.jpg,static/tour_images/truebluesailing/new_horizon_overnight_tour/image_91.jpg,static/tour_images/truebluesailing/new_horizon_overnight_tour/image_92.jpg,static/tour_images/truebluesailing/new_horizon_overnight_tour/image_93.jpg,static/tour_images/truebluesailing/new_horizon_overnight_tour/image_94.jpg,static/tour_images/truebluesailing/new_horizon_overnight_tour/image_95.jpg,static/tour_images/truebluesailing/new_horizon_overnight_tour/image_102.jpg,static/tour_images/truebluesailing/new_horizon_overnight_tour/image_103.jpg,static/tour_images/truebluesailing/new_horizon_overnight_tour/image_104.jpg,static/tour_images/truebluesailing/new_horizon_overnight_tour/image_105.jpg,static/tour_images/truebluesailing/new_horizon_overnight_tour/image_107.jpg,static/tour_images/truebluesailing/new_horizon_overnight_tour/image_108.jpg,static/tour_images/truebluesailing/new_horizon_overnight_tour/image_109.jpg,static/tour_images/truebluesailing/new_horizon_overnight_tour/image_112.jpg,static/tour_images/truebluesailing/new_horizon_overnight_tour/image_125.jpg,static/tour_images/truebluesailing/new_horizon_overnight_tour/image_129.jpg,static/tour_images/truebluesailing/new_horizon_overnight_tour/image_133.jpg,static/tour_images/truebluesailing/new_horizon_overnight_tour/image_134.jpg,static/tour_images/truebluesailing/new_horizon_overnight_tour/image_136.jpg,static/tour_images/truebluesailing/new_horizon_overnight_tour/image_137.jpg,static/tour_images/truebluesailing/new_horizon_overnight_tour/image_138.jpg,static/tour_images/truebluesailing/new_horizon_overnight_tour/image_139.jpg,static/tour_images/truebluesailing/new_horizon_overnight_tour/image_142.jpg,static/tour_images/truebluesailing/new_horizon_overnight_tour/image_143.jpg,static/tour_images/truebluesailing/new_horizon_overnight_tour/image_144.jpg,static/tour_images/truebluesailing/new_horizon_overnight_tour/image_149.jpg,static/tour_images/truebluesailing/new_horizon_overnight_tour/image_150.jpg,static/tour_images/truebluesailing/new_horizon_overnight_tour/image_155.jpg,static/tour_images/truebluesailing/new_horizon_overnight_tour/image_156.jpg,static/tour_images/truebluesailing/new_horizon_overnight_tour/image_158.jpg,static/tour_images/truebluesailing/new_horizon_overnight_tour/image_167.jpg,static/tour_images/truebluesailing/new_horizon_overnight_tour/image_172.jpg,static/tour_images/truebluesailing/new_horizon_overnight_tour/image_174.jpg,static/tour_images/truebluesailing/new_horizon_overnight_tour/image_176.jpg,static/tour_images/truebluesailing/new_horizon_overnight_tour/image_180.jpg,static/tour_images/truebluesailing/new_horizon_overnight_tour/image_183.jpg,static/tour_images/truebluesailing/new_horizon_overnight_tour/image_184.jpg,static/tour_images/truebluesailing/new_horizon_overnight_tour/image_187.jpg,static/tour_images/truebluesailing/new_horizon_overnight_tour/image_188.jpg,static/tour_images/truebluesailing/new_horizon_overnight_tour/image_189.jpg,static/tour_images/truebluesailing/new_horizon_overnight_tour/image_190.jpg,static/tour_images/truebluesailing/new_horizon_overnight_tour/image_193.jpg,static/tour_images/truebluesailing/new_horizon_overnight_tour/image_196.jpg,static/tour_images/truebluesailing/new_horizon_overnight_tour/image_197.jpg,static/tour_images/truebluesailing/new_horizon_overnight_tour/image_200.jpg,static/tour_images/truebluesailing/new_horizon_overnight_tour/image_201.jpg,static/tour_images/truebluesailing/new_horizon_overnight_tour/image_203.jpg,static/tour_images/truebluesailing/new_horizon_overnight_tour/image_210.jpg,static/tour_images/truebluesailing/new_horizon_overnight_tour/image_216.jpg,static/tour_images/truebluesailing/new_horizon_overnight_tour/image_223.jpg,static/tour_images/truebluesailing/new_horizon_overnight_tour/image_224.jpg,static/tour_images/truebluesailing/new_horizon_overnight_tour/image_225.jpg,static/tour_images/truebluesailing/new_horizon_overnight_tour/image_226.jpg,static/tour_images/truebluesailing/new_horizon_overnight_tour/image_229.jpg,static/tour_images/truebluesailing/new_horizon_overnight_tour/image_233.jpg,static/tour_images/truebluesailing/new_horizon_overnight_tour/image_236.jpg,static/tour_images/truebluesailing/new_horizon_overnight_tour/image_241.jpg,static/tour_images/truebluesailing/new_horizon_overnight_tour/image_242.jpg,static/tour_images/truebluesailing/new_horizon_overnight_tour/image_243.jpg,static/tour_images/truebluesailing/new_horizon_overnight_tour/image_249.jpg,static/tour_images/truebluesailing/new_horizon_overnight_tour/image_251.jpg,static/tour_images/truebluesailing/new_horizon_overnight_tour/image_252.jpg,static/tour_images/truebluesailing/new_horizon_overnight_tour/image_255.jpg,static/tour_images/truebluesailing/new_horizon_overnight_tour/image_257.jpg,static/tour_images/truebluesailing/new_horizon_overnight_tour/image_267.jpg,static/tour_images/truebluesailing/new_horizon_overnight_tour/image_269.jpg,static/tour_images/truebluesailing/new_horizon_overnight_tour/image_271.jpg,static/tour_images/truebluesailing/new_horizon_overnight_tour/image_273.jpg,static/tour_images/truebluesailing/new_horizon_overnight_tour/image_274.jpg,static/tour_images/truebluesailing/new_horizon_overnight_tour/image_279.jpg,static/tour_images/truebluesailing/new_horizon_overnight_tour/image_281.jpg,static/tour_images/truebluesailing/new_horizon_overnight_tour/image_287.jpg,static/tour_images/truebluesailing/new_horizon_overnight_tour/image_288.jpg,static/tour_images/truebluesailing/new_horizon_overnight_tour/image_289.jpg,static/tour_images/truebluesailing/new_horizon_overnight_tour/image_290.jpg,static/tour_images/truebluesailing/new_horizon_overnight_tour/image_293.jpg,static/tour_images/truebluesailing/new_horizon_overnight_tour/image_300.jpg,static/tour_images/truebluesailing/new_horizon_overnight_tour/image_308.jpg,static/tour_images/truebluesailing/new_horizon_overnight_tour/image_312.jpg,static/tour_images/truebluesailing/new_horizon_overnight_tour/image_314.jpg,static/tour_images/truebluesailing/new_horizon_overnight_tour/image_316.jpg,static/tour_images/truebluesailing/new_horizon_overnight_tour/image_318.jpg,static/tour_images/truebluesailing/new_horizon_overnight_tour/image_320.jpg,static/tour_images/truebluesailing/new_horizon_overnight_tour/image_321.jpg,static/tour_images/truebluesailing/new_horizon_overnight_tour/image_326.jpg,static/tour_images/truebluesailing/new_horizon_overnight_tour/image_333.jpg,static/tour_images/truebluesailing/new_horizon_overnight_tour/image_336.jpg,static/tour_images/truebluesailing/new_horizon_overnight_tour/image_338.jpg,static/tour_images/truebluesailing/new_horizon_overnight_tour/image_339.jpg,static/tour_images/truebluesailing/new_horizon_overnight_tour/image_343.jpg,static/tour_images/truebluesailing/new_horizon_overnight_tour/image_344.jpg,static/tour_images/truebluesailing/new_horizon_overnight_tour/image_346.jpg,static/tour_images/truebluesailing/new_horizon_overnight_tour/image_348.jpg,static/tour_images/truebluesailing/new_horizon_overnight_tour/image_354.jpg,static/tour_images/truebluesailing/new_horizon_overnight_tour/image_358.jpg,static/tour_images/truebluesailing/new_horizon_overnight_tour/image_361.jpg,static/tour_images/truebluesailing/new_horizon_overnight_tour/image_363.jpg,static/tour_images/truebluesailing/new_horizon_overnight_tour/image_370.jpg,static/tour_images/truebluesailing/new_horizon_overnight_tour/image_374.jpg,static/tour_images/truebluesailing/new_horizon_overnight_tour/image_376.jpg,static/tour_images/truebluesailing/new_horizon_overnight_tour/image_381.jpg,static/tour_images/truebluesailing/new_horizon_overnight_tour/image_385.jpg,static/tour_images/truebluesailing/new_horizon_overnight_tour/image_386.jpg,static/tour_images/truebluesailing/new_horizon_overnight_tour/image_389.jpg,static/tour_images/truebluesailing/new_horizon_overnight_tour/image_390.jpg,static/tour_images/truebluesailing/new_horizon_overnight_tour/image_391.jpg,static/tour_images/truebluesailing/new_horizon_overnight_tour/image_395.jpg,static/tour_images/truebluesailing/new_horizon_overnight_tour/image_402.jpg,static/tour_images/truebluesailing/new_horizon_overnight_tour/image_405.jpg,static/tour_images/truebluesailing/new_horizon_overnight_tour/image_406.jpg,static/tour_images/truebluesailing/new_horizon_overnight_tour/image_408.jpg,static/tour_images/truebluesailing/new_horizon_overnight_tour/image_409.jpg,static/tour_images/truebluesailing/new_horizon_overnight_tour/image_411.jpg,static/tour_images/truebluesailing/new_horizon_overnight_tour/image_412.jpg,static/tour_images/truebluesailing/new_horizon_overnight_tour/image_416.jpg,static/tour_images/truebluesailing/new_horizon_overnight_tour/image_419.jpg,static/tour_images/truebluesailing/new_horizon_overnight_tour/image_429.jpg,static/tour_images/truebluesailing/new_horizon_overnight_tour/image_431.jpg,static/tour_images/truebluesailing/new_horizon_overnight_tour/image_432.jpg,static/tour_images/truebluesailing/new_horizon_overnight_tour/image_440.jpg,static/tour_images/truebluesailing/new_horizon_overnight_tour/image_443.jpg,static/tour_images/truebluesailing/new_horizon_overnight_tour/image_444.jpg,static/tour_images/truebluesailing/new_horizon_overnight_tour/image_447.jpg,static/tour_images/truebluesailing/new_horizon_overnight_tour/image_452.jpg,static/tour_images/truebluesailing/new_horizon_overnight_tour/image_454.jpg,static/tour_images/truebluesailing/new_horizon_overnight_tour/image_456.jpg,static/tour_images/truebluesailing/new_horizon_overnight_tour/image_457.jpg,static/tour_images/truebluesailing/new_horizon_overnight_tour/image_459.jpg,static/tour_images/truebluesailing/new_horizon_overnight_tour/image_460.jpg,static/tour_images/truebluesailing/new_horizon_overnight_tour/image_461.jpg,static/tour_images/truebluesailing/new_horizon_overnight_tour/image_462.jpg,static/tour_images/truebluesailing/new_horizon_overnight_tour/image_463.jpg,static/tour_images/truebluesailing/new_horizon_overnight_tour/image_464.jpg,static/tour_images/truebluesailing/new_horizon_overnight_tour/image_466.jpg,static/tour_images/truebluesailing/new_horizon_overnight_tour/image_467.jpg,static/tour_images/truebluesailing/new_horizon_overnight_tour/image_469.jpg,static/tour_images/truebluesailing/new_horizon_overnight_tour/image_471.jpg,static/tour_images/truebluesailing/new_horizon_overnight_tour/image_472.jpg,static/tour_images/truebluesailing/new_horizon_overnight_tour/image_476.jpg,static/tour_images/truebluesailing/new_horizon_overnight_tour/image_478.jpg,static/tour_images/truebluesailing/new_horizon_overnight_tour/image_481.jpg,static/tour_images/truebluesailing/new_horizon_overnight_tour/image_482.jpg,static/tour_images/truebluesailing/new_horizon_overnight_tour/image_483.jpg,static/tour_images/truebluesailing/new_horizon_overnight_tour/image_490.jpg,static/tour_images/truebluesailing/new_horizon_overnight_tour/image_491.jpg,static/tour_images/truebluesailing/new_horizon_overnight_tour/image_497.jpg,static/tour_images/truebluesailing/new_horizon_overnight_tour/image_502.jpg,static/tour_images/truebluesailing/new_horizon_overnight_tour/image_503.jpg,static/tour_images/truebluesailing/new_horizon_overnight_tour/image_504.jpg,static/tour_images/truebluesailing/new_horizon_overnight_tour/image_507.jpg,static/tour_images/truebluesailing/new_horizon_overnight_tour/image_509.jpg,static/tour_images/truebluesailing/new_horizon_overnight_tour/image_510.jpg,static/tour_images/truebluesailing/new_horizon_overnight_tour/image_513.jpg,static/tour_images/truebluesailing/new_horizon_overnight_tour/image_514.jpg,static/tour_images/truebluesailing/new_horizon_overnight_tour/image_515.jpg,static/tour_images/truebluesailing/new_horizon_overnight_tour/image_516.jpg,static/tour_images/truebluesailing/new_horizon_overnight_tour/image_529.jpg,static/tour_images/truebluesailing/new_horizon_overnight_tour/image_530.jpg,static/tour_images/truebluesailing/new_horizon_overnight_tour/image_534.jpg,static/tour_images/truebluesailing/new_horizon_overnight_tour/image_536.jpg,static/tour_images/truebluesailing/new_horizon_overnight_tour/image_537.jpg,static/tour_images/truebluesailing/new_horizon_overnight_tour/image_545.jpg,static/tour_images/truebluesailing/new_horizon_overnight_tour/image_547.jpg,static/tour_images/truebluesailing/new_horizon_overnight_tour/image_548.jpg,static/tour_images/truebluesailing/new_horizon_overnight_tour/image_552.jpg,static/tour_images/truebluesailing/new_horizon_overnight_tour/image_555.jpg,static/tour_images/truebluesailing/new_horizon_overnight_tour/image_557.jpg,static/tour_images/truebluesailing/new_horizon_overnight_tour/image_563.jpg,static/tour_images/truebluesailing/new_horizon_overnight_tour/image_565.jpg,static/tour_images/truebluesailing/new_horizon_overnight_tour/image_566.jpg,static/tour_images/truebluesailing/new_horizon_overnight_tour/image_569.jpg,static/tour_images/truebluesailing/new_horizon_overnight_tour/image_572.jpg,static/tour_images/truebluesailing/new_horizon_overnight_tour/image_577.jpg,static/tour_images/truebluesailing/new_horizon_overnight_tour/image_578.jpg,static/tour_images/truebluesailing/new_horizon_overnight_tour/image_582.jpg,static/tour_images/truebluesailing/new_horizon_overnight_tour/image_589.jpg,static/tour_images/truebluesailing/new_horizon_overnight_tour/image_591.jpg,static/tour_images/truebluesailing/new_horizon_overnight_tour/image_592.jpg,static/tour_images/truebluesailing/new_horizon_overnight_tour/image_594.jpg,static/tour_images/truebluesailing/new_horizon_overnight_tour/image_598.jpg,static/tour_images/truebluesailing/new_horizon_overnight_tour/image_602.jpg,static/tour_images/truebluesailing/new_horizon_overnight_tour/image_603.jpg,static/tour_images/truebluesailing/new_horizon_overnight_tour/image_606.jpg,static/tour_images/truebluesailing/new_horizon_overnight_tour/image_607.jpg,static/tour_images/truebluesailing/new_horizon_overnight_tour/image_609.jpg,static/tour_images/truebluesailing/new_horizon_overnight_tour/image_618.jpg,static/tour_images/truebluesailing/new_horizon_overnight_tour/image_619.jpg,static/tour_images/truebluesailing/new_horizon_overnight_tour/image_620.jpg,static/tour_images/truebluesailing/new_horizon_overnight_tour/image_622.jpg,static/tour_images/truebluesailing/new_horizon_overnight_tour/image_626.jpg,static/tour_images/truebluesailing/new_horizon_overnight_tour/image_632.jpg,static/tour_images/truebluesailing/new_horizon_overnight_tour/image_633.jpg,static/tour_images/truebluesailing/new_horizon_overnight_tour/image_634.jpg,static/tour_images/truebluesailing/new_horizon_overnight_tour/image_637.jpg,static/tour_images/truebluesailing/new_horizon_overnight_tour/image_638.jpg,static/tour_images/truebluesailing/new_horizon_overnight_tour/image_645.jpg,static/tour_images/truebluesailing/new_horizon_overnight_tour/image_646.jpg,static/tour_images/truebluesailing/new_horizon_overnight_tour/image_650.jpg,static/tour_images/truebluesailing/new_horizon_overnight_tour/image_651.jpg,static/tour_images/truebluesailing/new_horizon_overnight_tour/image_654.jpg,static/tour_images/truebluesailing/new_horizon_overnight_tour/image_655.jpg,static/tour_images/truebluesailing/new_horizon_overnight_tour/image_667.jpg,static/tour_images/truebluesailing/new_horizon_overnight_tour/image_671.jpg,static/tour_images/truebluesailing/new_horizon_overnight_tour/image_675.jpg,static/tour_images/truebluesailing/new_horizon_overnight_tour/image_676.jpg,static/tour_images/truebluesailing/new_horizon_overnight_tour/image_678.jpg,static/tour_images/truebluesailing/new_horizon_overnight_tour/image_689.jpg,static/tour_images/truebluesailing/new_horizon_overnight_tour/image_690.jpg,static/tour_images/truebluesailing/new_horizon_overnight_tour/image_693.jpg,static/tour_images/truebluesailing/new_horizon_overnight_tour/image_694.jpg,static/tour_images/truebluesailing/new_horizon_overnight_tour/image_697.jpg,static/tour_images/truebluesailing/new_horizon_overnight_tour/image_699.jpg,static/tour_images/truebluesailing/new_horizon_overnight_tour/image_701.jpg,static/tour_images/truebluesailing/new_horizon_overnight_tour/image_703.jpg",,True,https://truebluesailing.com.au/new-horizon-overnight-tour/,,,2.0,multi_day,water,"Great Barrier Reef,Hill Inlet,Langford,Whitehaven,Whitsunday Island","adventure,private,sunset",general,adventurous,,,,,,0
