id,name,company_name,summary,description,duration,departure_location,departure_times,price_adult,price_child,includes,highlights,keywords,duration_hours,link_booking,link_more_info,phone,image_url,image_urls,commission_rate,active,price_source_url,price_tiers,raw_text,duration_days,duration_category,tour_type,locations,tags,audience,intensity_level,video_urls,important_information,what_to_bring,whats_extra,cancellation_policy
9c03c8c916ad0866,大堡礁全日浮潜,exploregroup,,登上我们的高级特制船只，踏上难忘的大堡礁探险之旅。这个全日游非常适合家庭、情侣和独行游客，提供在饵礁充满活力的水域浮潜的独特机会。享受圣灵群岛的风景之旅，在到达珊瑚礁之前在汉密尔顿岛停留。在我们经验丰富的浮潜导游的指导下体验水下世界，确保安全而难忘地探索这一自然奇观。,10 hours 45 mins,"Shute Harbour, Airlie Beach",,FROM A$149,,"经汉密尔顿岛转机
诱饵礁 3.5 小时
在两个不同地点浮潜
健康自助式午餐、早茶和下午茶
高品质浮潜设备，包括潜水衣/毒刺服和漂浮夹克
由经验丰富的教练指导的浮潜之旅和水中支持","在饵礁浮潜观赏生机勃勃的珊瑚和海洋生物
优质的专用船只，方便取水
经验丰富且友好的团队
穿越圣灵群岛的风景路线
有机会看到多种海洋生物，包括鹦嘴鱼、神仙鱼，可能还有海龟或礁鲨
豪华游船配有舒适的空调和休闲风格的座椅",,10.0,https://www.exploregroup.com.au/airlie-beach/snorkel-great-barrier-reef-shute-harbour/,https://www.exploregroup.com.au/airlie-beach/snorkel-great-barrier-reef-shute-harbour/,,static/tour_images/exploregroup/9c03c8c916ad0866/image_14.jpg,"static/tour_images/exploregroup/9c03c8c916ad0866/image_1.jpg,static/tour_images/exploregroup/9c03c8c916ad0866/image_2.jpg,static/tour_images/exploregroup/9c03c8c916ad0866/image_3.jpg,static/tour_images/exploregroup/9c03c8c916ad0866/image_4.jpg,static/tour_images/exploregroup/9c03c8c916ad0866/image_5.jpg,static/tour_images/exploregroup/9c03c8c916ad0866/image_6.jpg,static/tour_images/exploregroup/9c03c8c916ad0866/image_7.jpg,static/tour_images/exploregroup/9c03c8c916ad0866/image_8.jpg,static/tour_images/exploregroup/9c03c8c916ad0866/image_9.jpg,static/tour_images/exploregroup/9c03c8c916ad0866/image_11.jpg,static/tour_images/exploregroup/9c03c8c916ad0866/image_12.jpg,static/tour_images/exploregroup/9c03c8c916ad0866/image_13.jpg,static/tour_images/exploregroup/9c03c8c916ad0866/image_14.jpg,static/tour_images/exploregroup/9c03c8c916ad0866/image_15.jpg,static/tour_images/exploregroup/9c03c8c916ad0866/image_16.jpg",,True,https://www.exploregroup.com.au/airlie-beach/snorkel-great-barrier-reef-shute-harbour/,,,,multi_day,water,"Airlie Beach,Great Barrier Reef,Hamilton Island,Whitehaven","adventure,family-friendly,luxury",family,relaxed,,"['此行程建议 5 岁及以上儿童参加。', '欢迎 5 岁以下儿童参加，但参与有限制。', '您必须对水有信心并会游泳才能参加。']",[“防晒霜”、“帽子”、“太阳镜”、“毛巾”],[“价格包括环境管理 (EMC) 和国家公园的任何适用费用。”、“定价可能会发生变化。”],在游轮出发时间前 48 小时取消 - 免费。在游轮出发前 24 至 48 小时之间取消 - 收取 50% 的费用。在游轮出发前 24 小时内取消 - 收取 100% 费用。如果我们因天气原因取消预订，客人将获得全额退款或改期。
48c94773728d9cb0,从舒特港全日潜水大堡礁,exploregroup,,前往僻静的饵礁进行惊心动魄的全日潜水冒险，这里非常适合中级到高级潜水员。这次旅行从艾尔利海滩的舒特港出发，提供了探索大堡礁充满活力的海洋生物的独特机会。在经验丰富的导游的带领下，您将发现一个充满鲨鱼、鳐鱼、海龟和色彩缤纷的鱼类的世界。对于想要在世界上最令人惊叹的水下景观之一获得亲密且信息丰富的体验的潜水爱好者来说，这里是理想的选择。,Full Day,"Shute Harbour, Airlie Beach","Departs Shute Harbour, transfers via Hamilton Island",FROM A$300,,"在珊瑚礁潜水两次
所有装备租赁
由经验丰富的潜水大师或教练指导
健康的自助式午餐
上午茶和下午茶
高品质装备，包括潜水服/毒刺服
前往目的地的 2 小时游船期间提供信息丰富的解说","探索中级到高级潜水地点 Bait Reef
小团体潜水体验
发现各种海洋生物，包括鲨鱼、鳐鱼和海龟
参观至少 2 个不同的潜水地点
乘坐高级定制设计的潜水/浮潜船巡游
船上配有空调的豪华休息室式座椅
配有全梁游泳平台，可舒适地进出水面",,8.0,https://www.exploregroup.com.au/airlie-beach/dive-great-barrier-reef-shute-harbour/,https://www.exploregroup.com.au/airlie-beach/dive-great-barrier-reef-shute-harbour/,,static/tour_images/exploregroup/48c94773728d9cb0/image_4.jpg,"static/tour_images/exploregroup/48c94773728d9cb0/image_1.jpg,static/tour_images/exploregroup/48c94773728d9cb0/image_2.jpg,static/tour_images/exploregroup/48c94773728d9cb0/image_3.jpg,static/tour_images/exploregroup/48c94773728d9cb0/image_4.jpg,static/tour_images/exploregroup/48c94773728d9cb0/image_5.jpg,static/tour_images/exploregroup/48c94773728d9cb0/image_6.jpg,static/tour_images/exploregroup/48c94773728d9cb0/image_8.jpg,static/tour_images/exploregroup/48c94773728d9cb0/image_9.jpg,static/tour_images/exploregroup/48c94773728d9cb0/image_10.jpg",,True,https://www.exploregroup.com.au/airlie-beach/dive-great-barrier-reef-shute-harbour/,,,,full_day,water,"Airlie Beach,Great Barrier Reef,Hamilton Island,Whitehaven","adventure,family-friendly,luxury,small-group",family,adventurous,,[“儿童必须年满 12 岁才能参加潜水。”、“12 至 14 岁的潜水员必须在经过认证的父母或监护人的陪同下潜水。”、“您必须先填写潜水医疗调查问卷才能与我们一起潜水。”、“所有经过认证的潜水员在预订时必须出示认证卡或日志。”],,[“自 2025 年 4 月 1 日起价格上涨。”，“价格可能会发生变化。”],
