id,name,company_name,description,highlights,includes,duration,departure_times,departure_location,price_adult,price_child,price_tiers,age_requirements,ideal_for,itinerary,menu,important_info,tags,tour_type,intensity_level,group_size,booking_url,images,thumbnail,promotion,source_url,_csv_file,summary,link_booking,link_more_info,phone,video_urls,image_url,image_urls
b764da4d10d30b0d,Forfait détente et relaxation à Whitehaven,airliebeachhelicopters,"Survolez les îles Whitsunday à bord d'un hélicoptère Robinson 44. Visitez l'une des plus belles plages du monde, Whitehaven Beach, pour un séjour relaxant d'une heure et demie avec canapés et boissons rafraîchissantes. Promenez-vous sur la magnifique plage de sable blanc et visitez les sables tourbillonnants de Hill Inlet, l'un des endroits les plus photographiés au monde.",Vol panoramique en hélicoptère au-dessus des îles Whitsunday | Visite d'une heure et demie à Whitehaven Beach | Vues sur Hill Inlet | Canapés et boissons inclus | Hélicoptère Robinson 44,Vol en hélicoptère | Séjour de 1h30 à la plage | Canapés | Boissons rafraîchissantes,2 heures,,"Aéroport de Whitsunday (Shute Harbour), 12 Air Whitsunday Road, Flametree, Queensland, Australie, 4802",A$525,,Adulte : 525 $A | 3e siège : 265 $A,,Couples | Jeunes mariés | Passionnés de photographie | Amateurs de luxe,**Survol : Shute Harbour** - Porte d'entrée vers les Whitsundays avec vue sur les petits récifs | **Survol : Long Island** - Île la plus proche du continent avec des récifs coralliens frangeants | **Survol : Hamilton Island** - Île populaire avec un complexe hôtelier et une marina | **Survol : Whitsunday Island** - La plus grande île avec une superficie de 275 km² | **Terre : Whitehaven Beach (1 h 30)** - Détendez-vous avec des canapés et des boissons | **Survol : Hill Inlet** - Célèbre pour ses sables tourbillonnants | **Survol : Whitsunday Islands National Park** - Terrain montagneux et Dugong Beach | **Survol : South Molle Island** - Dernières vues sur les îles avant l'atterrissage,,,"scenic-flight,luxury,private,relaxation",scenic,relaxed,,,,,,,data/airliebeachhelicopters/en/tours_airliebeachhelicopters_cleaned_with_media.csv,,https://airliebeachhelicopters.com.au/tours/whitehaven-rest-and-relax/,,,,static/tour_images/airliebeachhelicopters/b764da4d10d30b0d/image_1.jpg,static/tour_images/airliebeachhelicopters/b764da4d10d30b0d/image_1.jpg
204e604859d2f2f8,Forfait de 2 heures comprenant un tour en hélicoptère et la visite d'un complexe hôtelier,airliebeachhelicopters,"Embarquez pour la toute nouvelle excursion d'Airlie Beach Helicopters ! Votre pilote vous transportera d'Airlie Beach à l'un des secrets les mieux gardés des Whitsundays, Cape Gloucester. Admirez la vue sur les îles et les récifs voisins avant d'atterrir sur la plage pour une heure et demie, où vous aurez libre accès au complexe hôtelier pour déjeuner, boire un verre et vous baigner.",Vol panoramique en hélicoptère | Accès au Cape Gloucester Resort | Moment de détente à la plage,Vol en hélicoptère | Accès à la station,2 heures,,Airlie Beach,AUD$469.00,AUD$235.00,"Adulte : 469,00 AUD | Enfant (3e siège) : 235,00 AUD",,Couples | Amateurs d'aventure | Amoureux de la plage,Survol : Airlie Beach et Cannonvale | Survol : Réserve forestière de Dryander | Survol : Cap Gloucester | Atterrissage pendant 1 h 30 : Cap Gloucester Resort | Survol : Hideaway Bay | Survol : Dingo Beach,Nourriture et boissons non comprises.,Food and drinks not included.,"helicopter tour, Cape Gloucester, resort visit, scenic flight",Day Tour,Easy,,,,,,manual_entry,data/airliebeachhelicopters/en/tours_airliebeachhelicopters_cleaned_with_media.csv,,https://airliebeachhelicopters.com.au/tours/cape-gloucester-getaway/,,,,static/tour_images/airliebeachhelicopters/204e604859d2f2f8/image_2.jpg,static/tour_images/airliebeachhelicopters/204e604859d2f2f8/image_2.jpg
e09fe17c9e0bb247,Forfait détente et relaxation Heart Reef et Whitehaven Forfait visite de l'île et vol en hélicoptère de 2 heures 30 minutes,airliebeachhelicopters,"Vous rêvez de visiter Whitehaven Beach ou le magnifique Heart Reef ? Ce circuit en hélicoptère de deux heures et demie vous emmène à Whitehaven Beach pour un séjour d'une heure et demie, avec collations et boissons fraîches. Profitez d'une vue imprenable sur la Grande Barrière de Corail et les magnifiques îles Whitsunday en survolant des sites emblématiques.",Visite de Whitehaven Beach | Vue aérienne de Heart Reef | Vol panoramique en hélicoptère,Tour en hélicoptère | Canapés | Boissons,2 heures 30 minutes,,Port de Shute,AUD$969.00,AUD$485.00,"Adulte : 969,00 AUD | Enfant (3e siège) : 485,00 AUD",,Couples | Amateurs d'aventure | Amoureux de la plage,Survol : Shute Harbour | Survol : South Molle Island | Survol : Whitsunday Island | Atterrissage pendant 1 h 30 : Whitehaven Beach | Survol : Whitehaven Beach | Survol : Hill Inlet | Survol : Whitsunday Islands en direction de la Grande Barrière de Corail | Survol : Heart Reef | Survol : Bait Reef | Survol : Hayman Island | Survol : Hook Island | Survol : Molle Islands,Canapés et boissons compris,Bring your camera for stunning views; check weather conditions before departure.,"helicopter tour, whitehaven beach, heart reef, great barrier reef",Helicopter Tour,Easy,,,,,,manual_entry,data/airliebeachhelicopters/en/tours_airliebeachhelicopters_cleaned_with_media.csv,,https://airliebeachhelicopters.com.au/tours/heart-reef-and-whitehaven-rest-and-relax/,,,,static/tour_images/airliebeachhelicopters/e09fe17c9e0bb247/image_1.jpg,static/tour_images/airliebeachhelicopters/e09fe17c9e0bb247/image_1.jpg
85182e143b1b0964,Whitsunday Whirl : circuit en hélicoptère de 20 minutes,airliebeachhelicopters,"Découvrez les vues imprenables sur Airlie Beach, Shute Harbour et les îles et récifs environnants lors de ce tour panoramique en hélicoptère de 20 minutes. Au départ de l'aéroport de Shute Harbour, vous survolerez les eaux turquoise cristallines et admirerez des paysages époustouflants qui expliquent pourquoi cette région d'Australie est si appréciée des visiteurs du monde entier.",Vol panoramique en hélicoptère | Vues à couper le souffle | Îles Whitsunday emblématiques,,20 minutes,,Aéroport de Shute Harbour,AUD$279.00,AUD$140.00,"Adulte : 279,00 AUD | Enfant (3e siège) : 140,00 AUD",,Touristes | Amateurs d'aventure,"Survolez Funnel Bay et Airlie Beach | Survolez Pioneer Bay | Survolez Pioneer Rocks et Almora Reef | Survolez North Molle Island | Survolez Daydream Island | Survolez South Molle Island | Survolez Mount Rooper | Survolez Shute Harbour, Shute Reef et White Rock Reef | Retour à l'aéroport de Whitsunday | Survol de Long Island | Survol de Shute Harbour | Survol de Long Island | Survol des îles North et South Molle | Survol d'Airlie Beach",,Be sure to have a camera for stunning views.,"helicopter tour, scenic flight, Whitsundays",Helicopter Tour,Easy,,,,,,manual_entry,data/airliebeachhelicopters/en/tours_airliebeachhelicopters_cleaned_with_media.csv,,https://airliebeachhelicopters.com.au/tours/whitsunday-whirl/,,,,static/tour_images/airliebeachhelicopters/85182e143b1b0964/image_1.jpg,static/tour_images/airliebeachhelicopters/85182e143b1b0964/image_1.jpg
92a8bbeaa83cef4d,Visite aérienne de Whitehaven Visite en hélicoptère de 30 minutes,airliebeachhelicopters,"Découvrez l'un des sites les plus emblématiques d'Australie, Whitehaven Beach, depuis les airs. Ce tour en hélicoptère à couper le souffle offre une vue imprenable sur les 74 îles Whitsunday, dont la célèbre Hill Inlet, connue pour ses sables tourbillonnants et ses eaux turquoise. Capturez la beauté des sables blancs immaculés et des récifs coralliens aux couleurs vives en survolant ce paradis pittoresque.",Vues aériennes époustouflantes | Survolez Whitehaven Beach | Découvrez Hill Inlet,,30 minutes,,"Aéroport de Whitsunday (Shute Harbour), 12 Air Whitsunday Road, Flametree, Queensland, Australie, 4802",AUD$429.00,AUD$215.00,"Adulte : 429,00 AUD | Enfant (3e siège) : 215,00 AUD",,Amoureux de la nature | Aventuriers | Photographes,Survol : Shute Harbour | Survol : Île South Molle | Survol : Île Whitsunday | Survol : Plage Whitehaven | Survol : Hill Inlet | Survol : Parc national de Whitsunday Island | Survol : Îles Molle,,Make sure to have your camera ready for stunning views.,"helicopter tour, Whitehaven Beach, Whitsunday Islands",Helicopter Tour,Easy,,,,,,manual_entry,data/airliebeachhelicopters/en/tours_airliebeachhelicopters_cleaned_with_media.csv,,https://airliebeachhelicopters.com.au/tours/whitehaven-from-above-tour/,,,,static/tour_images/airliebeachhelicopters/92a8bbeaa83cef4d/image_1.jpg,static/tour_images/airliebeachhelicopters/92a8bbeaa83cef4d/image_1.jpg
a00eaea492560dfc,Spectaculaire tour en hélicoptère de 60 minutes au-dessus du récif et de Whitehaven,airliebeachhelicopters,"Découvrez la beauté époustouflante des îles Whitsunday et de la Grande Barrière de Corail depuis les airs lors de cette excursion d'une heure en hélicoptère. Au départ de Shute Harbour, vous survolerez des sites emblématiques tels que Whitehaven Beach, Hill Inlet et le célèbre Heart Reef, et profiterez d'une vue imprenable qui ne manquera pas de vous émerveiller.",Vue aérienne des îles Whitsunday | Vol panoramique au-dessus de Whitehaven Beach | Visite de Heart Reef,,60 minutes,,Port de Shute,AUD$789.00,AUD$395.00,"Adulte : 789,00 AUD | 3e siège : 395,00 AUD",,Amateurs d'aventure | Couples | Amoureux de la nature,Survol : Shute Harbour | Survol : Île South Molle | Survol : Île Whitsunday | Survol : Plage Whitehaven | Survol : Hill Inlet | Survol : Îles Whitsunday en direction de la Grande Barrière de Corail | Survol : Heart Reef | Survol : Bait Reef | Survol : Île Hayman | Survol : Île Hook | Survol : Îles Molle,,,"helicopter tour, great barrier reef, whitsunday islands",Helicopter Tour,Easy,,,,,,manual_entry,data/airliebeachhelicopters/en/tours_airliebeachhelicopters_cleaned_with_media.csv,,https://airliebeachhelicopters.com.au/tours/reef-and-whitehaven-spectacular-tour/,,,,static/tour_images/airliebeachhelicopters/a00eaea492560dfc/image_1.jpg,static/tour_images/airliebeachhelicopters/a00eaea492560dfc/image_1.jpg
