id,name,company_name,summary,description,duration,departure_location,departure_times,price_adult,price_child,includes,highlights,keywords,duration_hours,link_booking,link_more_info,phone,image_url,image_urls,commission_rate,active,price_source_url,price_tiers,raw_text,duration_days,duration_category,tour_type,locations,tags,audience,intensity_level,itinerary,menu,age_requirements,ideal_for,important_information,what_to_bring,whats_extra,cancellation_policy,booking_connected
d90e6cec2c09d66d,Excursion d'une journée dans les Whitsundays avec Big Fury,magicwhitsundays,,"Découvrez les Whitsundays à bord du Big Fury, un bateau de sport dynamique et ouvert qui propose une excursion d'une journée pleine d'aventures. Cette excursion est idéale pour les célibataires, les couples, les familles et les amis à la recherche d'une exploration palpitante des superbes îles de la Grande Barrière de Corail. Profitez de la plongée avec masque et tuba, de promenades pittoresques et d'un délicieux déjeuner buffet sur la célèbre plage de Whitehaven. Grâce à son faible tirant d'eau, le Big Fury offre une vue intime et rapprochée des îles, garantissant une expérience mémorable et unique.",Full Day,Coral Sea Marina,,FROM A$220,,"Délicieux buffet frais servi sur la plage de Whitehaven
Gâteaux de l'après-midi
Équipement de plongée avec tuba, y compris masques, palmes, tubas, combinaisons de plongée avec palmes, dispositifs de flottaison et visionneuse de coraux
Bus de courtoisie pour les transferts vers le lieu d'hébergement","Visitez les trois principales destinations de l'île - Whitehaven Beach, Hill Inlet Lookout et un site de plongée libre sur la Grande Barrière de Corail
2 à 2,5 heures à l'extrémité sud de la plage de Whitehaven
Courte marche jusqu'à Hill Inlet Lookout pour une vue imprenable
Plongée avec masque et tuba sur les récifs frangeants de l'île, avec équipement et cours fournis
Commentaires divertissants et instructifs de l'équipage du Big Fury
Observation de tortues, d'oiseaux, de poissons et éventuellement de baleines à bosse (juillet-septembre)
Maximum de 35 personnes pour une croisière plus privée",,8.0,,https://www.magicwhitsundays.com/big-fury-whitsundays/,,,,,True,https://www.magicwhitsundays.com/big-fury-whitsundays/,Adult: A$220,,,full_day,combo,"Great Barrier Reef,Hamilton Island,Hill Inlet,Whitehaven,Whitsunday Island","adventure,family-friendly,private,relaxation,small-group",family,adventurous,,"**Menu:**
- Salades fraîches comprenant salade de pommes de terre, salade de pâtes aux macaronis, salade de riz indien au curry et salade de légumes
- Plateau de viandes froides comprenant du jambon, du rôti de bœuf, de la côte de bœuf, du poulet et du porc
- Crevettes fraîches et plateau de fruits produits localement
- Petits pains frais et wraps
- Gâteaux et biscuits de l'après-midi",3 ans et plus,"Célibataires, couples, groupes familiaux et amis à la recherche d'une journée amusante et aventureuse dans les Whitsundays.","[""Le circuit convient à la plupart des groupes d'âge (à partir de 3 ans jusqu'aux jeunes de cœur !)""]","[""Crème solaire"", ""Chapeau"", ""Lunettes de soleil"", ""Serviette""]","[""Eau embouteillée réfrigérée et boissons non alcoolisées 2,50 $ chacune (en espèces uniquement à bord)"", ""Les régimes alimentaires spéciaux tels que les régimes végétaliens et sans gluten peuvent être pris en charge moyennant un préavis d'au moins 24 heures""]",,0
