id,name,company_name,summary,description,duration,departure_location,departure_times,price_adult,price_child,includes,highlights,keywords,duration_hours,link_booking,link_more_info,phone,image_url,image_urls,commission_rate,active,price_source_url,price_tiers,raw_text,duration_days,duration_category,tour_type,locations,tags,audience,intensity_level,itinerary,menu,age_requirements,ideal_for,video_urls,important_information,what_to_bring,whats_extra,cancellation_policy,booking_connected
534bd6c9edbb17fa,Powerplay 2D/2N - Arrecife exterior y velas extendidas,sailing-whitsundays,,"Embárquese en una emocionante aventura de 3 noches a la Gran Barrera de Coral Exterior, donde experimentará la mezcla definitiva de relajación y exploración. Esta excursión es perfecta para los aventureros y los amantes de la naturaleza que deseen sumergirse en la vibrante vida marina y las prístinas aguas del arrecife. Disfrute de largas navegaciones, que le permitirán empaparse de las impresionantes vistas y puestas de sol. Ideal para quienes aprecian la belleza del océano y buscan una experiencia única y envolvente.",3 Nights,Coral Sea Marina Meeting Point C,,FROM A$635,,"Salón compartido
Alojamiento doble compartido (requiere 2 personas)","Explore la Gran Barrera de Coral exterior
Largas travesías para relajarse al máximo
Posibilidades de practicar snorkel y submarinismo
Impresionantes vistas del océano y puestas de sol
Ideal para aventureros y amantes de la naturaleza",,,https://sailing-whitsundays.com/whitsundays/powerplay-2d2n,https://sailing-whitsundays.com/whitsundays/powerplay-2d2n,,static/tour_images/sailing-whitsundays/534bd6c9edbb17fa/image_7.jpg,"static/tour_images/sailing-whitsundays/534bd6c9edbb17fa/image_2.jpg,static/tour_images/sailing-whitsundays/534bd6c9edbb17fa/image_5.jpg,static/tour_images/sailing-whitsundays/534bd6c9edbb17fa/image_6.jpg,static/tour_images/sailing-whitsundays/534bd6c9edbb17fa/image_7.jpg,static/tour_images/sailing-whitsundays/534bd6c9edbb17fa/image_9.jpg,static/tour_images/sailing-whitsundays/534bd6c9edbb17fa/image_10.jpg,static/tour_images/sailing-whitsundays/534bd6c9edbb17fa/image_11.jpg,static/tour_images/sailing-whitsundays/534bd6c9edbb17fa/image_12.jpg,static/tour_images/sailing-whitsundays/534bd6c9edbb17fa/image_13.jpg,static/tour_images/sailing-whitsundays/534bd6c9edbb17fa/image_14.jpg,static/tour_images/sailing-whitsundays/534bd6c9edbb17fa/image_15.jpg,static/tour_images/sailing-whitsundays/534bd6c9edbb17fa/image_16.jpg,static/tour_images/sailing-whitsundays/534bd6c9edbb17fa/image_17.jpg,static/tour_images/sailing-whitsundays/534bd6c9edbb17fa/image_18.jpg,static/tour_images/sailing-whitsundays/534bd6c9edbb17fa/image_19.jpg,static/tour_images/sailing-whitsundays/534bd6c9edbb17fa/image_20.jpg",,True,https://sailing-whitsundays.com/whitsundays/powerplay-2d2n,"Shared Saloon Accom (01 Jul 2025 - 30 Jun 2026): A$635 | Shared Double Accom (for 2 people): A$1,570 Total",,3.0,multi_day,combo,"Airlie Beach,Great Barrier Reef,Hamilton Island,Hill Inlet,Whitehaven,Whitsunday Island","adventure,luxury,private,relaxation,sunset",general,adventurous,,,,"Aventureros, amantes de la naturaleza y quienes aprecian las vistas del océano y la vida marina.",,"['Esta excursión es estrictamente para mayores de 16 años', 'Si reserva con menores de 16 años, se le denegará el embarque', 'DEBE saber nadar para subir al barco', 'Por razones de seguridad, también debe saber hablar inglés']","['Muda de ropa y bañador', 'Artículos de aseo', 'Toalla de playa', 'Protección solar (crema solar, sombrero, gafas de sol, etc.)', 'Repelente de insectos', 'Calzado cómodo para caminar', 'Jersey de abrigo para las noches (de temporada)', 'Dinero extra para comprar refrescos/agua embotellada']","['BYO alcohol - no botellas de vidrio o vino tinto.', 'Refrescos están disponibles para su compra a bordo.', 'Un recargo de $ 20 se puede aplicar para algunas peticiones y requisitos dietéticos.', 'Refrescos y agua embotellada.', 'Almacenamiento de equipaje por tan sólo $ 10 al día en nuestra tienda de viajes.', 'Temporadas altas de vacaciones (es decir, Navidad, Semana Santa, Año Nuevo) puede incurrir en un recargo.']","[Todas las cancelaciones suponen la pérdida del 25% del precio de venta recomendado (PVR), no del precio de venta con descuento"", ""Los clientes que no se presenten o cancelen la reserva en los 30 días anteriores a la salida perderán el 100% del precio total de la entrada"", ""El reembolso en caso de cancelación está sujeto tanto a nuestra política de cancelación como a las condiciones del proveedor""]",0
2727ffb19e4a2900,Powerplay 3D/3N - Arrecife exterior y velas extendidas,sailing-whitsundays,,"Embárquese en un impresionante viaje por las Whitsundays y la Gran Barrera de Coral exterior con nuestra exclusiva aventura de 3 noches en velero. Esta excursión ofrece una exploración sin igual de arrecifes vírgenes e impresionante vida marina, perfecta para aventureros y amantes de la naturaleza. Experimente la emoción de navegar, hacer snorkel y bucear en una de las maravillas naturales más bellas del mundo. Ideal para quienes buscan sumergirse en la belleza del océano y disfrutar de la serenidad del mar abierto.",3 Nights,Coral Sea Marina Meeting Point C,,FROM A$767,,"Navegación por las islas Whitsunday y la Gran Barrera de Coral exterior
Esnórquel y submarinismo
Alojamiento a bordo
Comidas incluidas
Visitas guiadas y actividades","3 noches de aventura en velero
Explore la Gran Barrera de Coral exterior
Snorkel y buceo en arrecifes vírgenes
Una experiencia de navegación íntima y única
Perfecto para aventureros y amantes de la naturaleza",,,https://sailing-whitsundays.com/whitsundays/powerplay-3d3n,https://sailing-whitsundays.com/whitsundays/powerplay-3d3n,,static/tour_images/sailing-whitsundays/2727ffb19e4a2900/image_5.jpg,"static/tour_images/sailing-whitsundays/2727ffb19e4a2900/image_5.jpg,static/tour_images/sailing-whitsundays/2727ffb19e4a2900/image_7.jpg,static/tour_images/sailing-whitsundays/2727ffb19e4a2900/image_8.jpg,static/tour_images/sailing-whitsundays/2727ffb19e4a2900/image_9.jpg,static/tour_images/sailing-whitsundays/2727ffb19e4a2900/image_10.jpg,static/tour_images/sailing-whitsundays/2727ffb19e4a2900/image_11.jpg,static/tour_images/sailing-whitsundays/2727ffb19e4a2900/image_12.jpg,static/tour_images/sailing-whitsundays/2727ffb19e4a2900/image_13.jpg,static/tour_images/sailing-whitsundays/2727ffb19e4a2900/image_14.jpg,static/tour_images/sailing-whitsundays/2727ffb19e4a2900/image_15.jpg,static/tour_images/sailing-whitsundays/2727ffb19e4a2900/image_16.jpg,static/tour_images/sailing-whitsundays/2727ffb19e4a2900/image_17.jpg,static/tour_images/sailing-whitsundays/2727ffb19e4a2900/image_18.jpg,static/tour_images/sailing-whitsundays/2727ffb19e4a2900/image_19.jpg,static/tour_images/sailing-whitsundays/2727ffb19e4a2900/image_20.jpg",,True,https://sailing-whitsundays.com/whitsundays/powerplay-3d3n,"Shared Saloon Accom: FROM A$767 | Shared Double Accom (for 2 people): A$1,788 Total | Private Quad Cabin (for 4 people): Price not specified",,3.0,multi_day,combo,"Airlie Beach,Great Barrier Reef,Hamilton Island,Hill Inlet,Whitehaven,Whitsunday Island","adventure,luxury,private,small-group",general,adventurous,,,Todas las edades son bienvenidas,"Aventureros, amantes de la naturaleza y quienes deseen explorar a fondo la Gran Barrera de Coral.",,"['Esta excursión es estrictamente para mayores de 16 años', 'Si reserva con menores de 16 años, se le denegará el embarque', 'DEBE saber nadar para subir al barco', 'Por razones de seguridad, también debe saber hablar inglés']","['Muda de ropa y bañador', 'Artículos de aseo', 'Toalla de playa', 'Protección solar (crema solar, sombrero, gafas de sol, etc.)', 'Repelente de insectos', 'Calzado cómodo para caminar', 'Jersey de abrigo para las noches (de temporada)', 'Dinero extra para comprar refrescos/agua embotellada']","[Los pasajeros con algún tipo de requisito dietético (veganos, sin lácteos, sin gluten, etc.) deberán abonar un recargo de 30 $ por persona, que se abonará en el momento de la facturación"", ""En temporada alta (Navidad, Semana Santa, Año Nuevo) puede aplicarse un recargo""]",Los clientes que no se presenten o cancelen la reserva en los 30 días anteriores a la salida perderán el 100% del precio total del billete.,0
