id,name,company_name,summary,description,duration,departure_location,departure_times,price_adult,price_child,includes,highlights,keywords,duration_hours,link_booking,link_more_info,phone,image_url,image_urls,commission_rate,active,price_source_url,price_tiers,raw_text,duration_days,duration_category,tour_type,locations,tags,audience,intensity_level,itinerary,menu,age_requirements,ideal_for,video_urls,important_information,what_to_bring,whats_extra,cancellation_policy,booking_connected
fd56a077ec5a503c,Aventurero de las Whitsunday 2D/2N - Arrecife exterior y navegación prolongada,sailing-whitsundays,,"Embárquese en un viaje inolvidable por las Whitsundays y la Gran Barrera de Coral. Esta aventura es perfecta para quienes buscan explorar arrecifes vírgenes y playas solitarias, mientras disfrutan de la comodidad y el lujo de una embarcación bien equipada. Ideal para aventureros y amantes de la naturaleza, esta excursión ofrece una oportunidad única de practicar snorkel o submarinismo en algunos de los entornos marinos más impresionantes del mundo. Con la opción de personalizar su experiencia, puede adaptar su viaje para incluir vuelos panorámicos, motos acuáticas y mucho más.",3 Nights,Coral Sea Marina Meeting Point C,,FROM A$677,,"Alojamiento compartido o camarote doble privado
Posibilidad de practicar snorkel y submarinismo
Acceso a arrecifes y playas vírgenes
Experiencias personalizables que incluyen vuelos panorámicos y motos acuáticas","Explore la Gran Barrera de Coral exterior
Practique snorkel o submarinismo en arrecifes vírgenes
Báñese y tome el sol en la playa de Whitehaven
Experiencias personalizables con vuelos panorámicos y motos acuáticas
Lujosa embarcación con cómodos alojamientos",,,https://sailing-whitsundays.com/whitsundays/whitsunday-adventurer-2d2n,https://sailing-whitsundays.com/whitsundays/whitsunday-adventurer-2d2n,,static/tour_images/sailing-whitsundays/fd56a077ec5a503c/image_1.jpg,"static/tour_images/sailing-whitsundays/fd56a077ec5a503c/image_1.jpg,static/tour_images/sailing-whitsundays/fd56a077ec5a503c/image_2.jpg,static/tour_images/sailing-whitsundays/fd56a077ec5a503c/image_3.jpg,static/tour_images/sailing-whitsundays/fd56a077ec5a503c/image_6.jpg,static/tour_images/sailing-whitsundays/fd56a077ec5a503c/image_7.jpg,static/tour_images/sailing-whitsundays/fd56a077ec5a503c/image_9.jpg,static/tour_images/sailing-whitsundays/fd56a077ec5a503c/image_10.jpg,static/tour_images/sailing-whitsundays/fd56a077ec5a503c/image_12.jpg,static/tour_images/sailing-whitsundays/fd56a077ec5a503c/image_13.jpg,static/tour_images/sailing-whitsundays/fd56a077ec5a503c/image_14.jpg,static/tour_images/sailing-whitsundays/fd56a077ec5a503c/image_15.jpg,static/tour_images/sailing-whitsundays/fd56a077ec5a503c/image_16.jpg,static/tour_images/sailing-whitsundays/fd56a077ec5a503c/image_17.jpg,static/tour_images/sailing-whitsundays/fd56a077ec5a503c/image_18.jpg",,True,https://sailing-whitsundays.com/whitsundays/whitsunday-adventurer-2d2n,"Shared Accommodation (16+): A$677 | Private Double Cabin (requires 2 people): A$1,614 (for 2 people)",,3.0,multi_day,combo,"Airlie Beach,Great Barrier Reef,Hamilton Island,Hill Inlet,Whitehaven,Whitsunday Island","adventure,luxury,private",general,adventurous,,,Mayores de 16 años en alojamiento compartido,"Aventureros, amantes de la naturaleza y quienes buscan una experiencia lujosa y aventurera en las Whitsundays y la Gran Barrera de Coral.",,"['La edad mínima es de 6 años', 'Los niños de entre 6 y 15 años deben reservar un camarote privado', 'Los mayores de 16 años pueden reservar un camarote individual abierto', 'Los niños viajan en esta excursión con tarifa de adulto']","['Ropa de recambio', 'Bañador', 'Toalla de playa', 'Artículos de aseo', 'Repelente de insectos', 'Botellas de agua para rellenar (por favor, no botellas de metal)', 'Cámara', 'Calzado cómodo para caminar', 'Protección solar (crema solar, sombrero, gafas de sol, etc.)', 'Ropa de abrigo/pullo para las noches (de temporada)', 'Dinero en efectivo si desea comprar refrescos a bordo']","[""Alcohol y refrescos (BYO - consulte 'Qué llevar' para obtener más información.)"", 'Puede comprar refrescos a bordo (sólo en efectivo)', 'Cualquier requisito dietético (como dietas veganas, sin gluten y sin lactosa) tendrá que pagar un recargo de $ 20 por persona a pagar en el check in.', 'Las dietas Kosher y Halal no pueden ser atendidas.', 'Almacenamiento de equipaje en nuestra tienda de viajes Airlie Beach']",Los clientes que no se presenten o cancelen la reserva en los 30 días anteriores a la salida perderán el 100% del precio total del billete.,0
fa0bf69d1ff5e9ca,Coral Sea Marina - Visita Premium,sailing-whitsundays,,"Embárquese en una aventura de primera desde el puerto deportivo Coral Sea Marina, que ofrece una experiencia exclusiva perfecta para quienes buscan tanto relax como aventura. Esta excursión combina la belleza de las Whitsundays con la emoción de explorar la Gran Barrera de Coral. Ideal para parejas y grupos pequeños, promete un viaje inolvidable por algunos de los paisajes marinos más impresionantes.",Full day,Coral Sea Marina Meeting Point C,Departs 12:00 pm,FROM A$798,,"Alojamiento compartido
Opción de camarote doble privado
Acceso a instalaciones premium","Explore la Gran Barrera de Coral
Visite las impresionantes islas Whitsunday
Practique snorkel y submarinismo
Relájese en la playa de Whitehaven
Itinerarios personalizables para charters privados",,,https://sailing-whitsundays.com/whitsundays/whitsunday-adventurer-3d3n,https://sailing-whitsundays.com/whitsundays/whitsunday-adventurer-3d3n,,static/tour_images/sailing-whitsundays/fa0bf69d1ff5e9ca/image_1.jpg,"static/tour_images/sailing-whitsundays/fa0bf69d1ff5e9ca/image_1.jpg,static/tour_images/sailing-whitsundays/fa0bf69d1ff5e9ca/image_3.jpg,static/tour_images/sailing-whitsundays/fa0bf69d1ff5e9ca/image_5.jpg,static/tour_images/sailing-whitsundays/fa0bf69d1ff5e9ca/image_6.jpg,static/tour_images/sailing-whitsundays/fa0bf69d1ff5e9ca/image_7.jpg,static/tour_images/sailing-whitsundays/fa0bf69d1ff5e9ca/image_10.jpg,static/tour_images/sailing-whitsundays/fa0bf69d1ff5e9ca/image_11.jpg,static/tour_images/sailing-whitsundays/fa0bf69d1ff5e9ca/image_12.jpg,static/tour_images/sailing-whitsundays/fa0bf69d1ff5e9ca/image_13.jpg,static/tour_images/sailing-whitsundays/fa0bf69d1ff5e9ca/image_14.jpg,static/tour_images/sailing-whitsundays/fa0bf69d1ff5e9ca/image_15.png,static/tour_images/sailing-whitsundays/fa0bf69d1ff5e9ca/image_16.jpg,static/tour_images/sailing-whitsundays/fa0bf69d1ff5e9ca/image_17.jpg",,True,https://sailing-whitsundays.com/whitsundays/whitsunday-adventurer-3d3n,Shared Accommodation (16+): A$798 | Private Double Cabin (requires 2 people): A$2051 Total,,,full_day,combo,"Airlie Beach,Great Barrier Reef,Hamilton Island,Hill Inlet,Whitehaven,Whitsunday Island","adventure,luxury,private,relaxation,small-group",general,adventurous,,,Alojamiento compartido (16+),"Parejas, grupos pequeños y aventureros",,"['La edad mínima es de 6 años', 'Los niños de entre 6 y 15 años deben reservar un camarote privado', 'Los mayores de 16 años pueden reservar un camarote individual abierto', 'Los niños viajan en esta excursión con tarifa completa de adulto', 'Los huéspedes de 15 años o menos deben reservar un alojamiento privado', 'Por razones de seguridad, todos los pasajeros deben saber nadar y hablar inglés con fluidez']","['Muda', 'Bañador', 'Toalla de playa', 'Artículos de aseo', 'Repelente de insectos', 'Botellas de agua para rellenar (por favor, no botellas de agua de metal)', 'Cámara', 'Calzado cómodo para caminar', 'Protección solar (crema solar, sombrero, gafas de sol, etc.)', 'Ropa de abrigo/pullo para las noches (de temporada)', 'Dinero en efectivo si desea comprar refrescos a bordo']","[Alcohol y refrescos (no se aceptan botellas de cristal ni vino tinto, por favor)', 'Los pasajeros con cualquier requisito dietético (veganos, sin lácteos, sin gluten, etc.) deberán abonar un recargo de 30 $ por persona, que se abonará en el momento de la entrada. Esto no incluye a los vegetarianos', 'Buceo certificado (con todo el equipo incluido) 1ª inmersión - 120 $ 2ª inmersión - 100 $ Inmersiones adicionales - 70 $ cada una', 'Consigna de equipaje en nuestra tienda de viajes de Airlie Beach']",Los clientes que no se presenten o cancelen su reserva en los 30 días anteriores a la salida perderán el 100% del precio total del billete. El reembolso en caso de cancelación está sujeto tanto a nuestra Política de cancelación como a las condiciones del proveedor.,0
c0ac7d40f6616188,Whitsunday Adventurer Charter Privado,sailing-whitsundays,,Regálese un exclusivo chárter privado a bordo de uno de los catamaranes más populares de las Whitsundays. Evite las grandes multitudes y disfrute de una excursión personalizada para satisfacer todos sus deseos. Experimente la máxima relajación mientras su capitán y anfitrión profesionales le llevan a todos los lugares de interés de las islas Whitsunday al ritmo que prefiera. Perfecto para quienes buscan una aventura personalizada e íntima por las impresionantes Islas Whitsunday.,Full day,Coral Sea Marina Meeting Point C,,FROM A$9190,,,"Experiencia exclusiva de chárter privado
Evite las grandes multitudes con un itinerario personalizado
Patrón y anfitrión profesionales
Visite todos los lugares de interés de las islas Whitsunday
Máxima relajación a bordo de un popular catamarán",,,https://sailing-whitsundays.com/whitsundays/whitsunday-adventurer-private-charter,https://sailing-whitsundays.com/whitsundays/whitsunday-adventurer-private-charter,,static/tour_images/sailing-whitsundays/c0ac7d40f6616188/image_2.jpg,"static/tour_images/sailing-whitsundays/c0ac7d40f6616188/image_1.jpg,static/tour_images/sailing-whitsundays/c0ac7d40f6616188/image_2.jpg,static/tour_images/sailing-whitsundays/c0ac7d40f6616188/image_4.jpg,static/tour_images/sailing-whitsundays/c0ac7d40f6616188/image_7.jpg,static/tour_images/sailing-whitsundays/c0ac7d40f6616188/image_10.jpg,static/tour_images/sailing-whitsundays/c0ac7d40f6616188/image_11.jpg,static/tour_images/sailing-whitsundays/c0ac7d40f6616188/image_12.jpg,static/tour_images/sailing-whitsundays/c0ac7d40f6616188/image_13.jpg,static/tour_images/sailing-whitsundays/c0ac7d40f6616188/image_14.jpg,static/tour_images/sailing-whitsundays/c0ac7d40f6616188/image_15.jpg",,True,https://sailing-whitsundays.com/whitsundays/whitsunday-adventurer-private-charter,Private Charter (Between 01 Jul 2025 and 30 Jun 2026): A$9190,,,full_day,combo,"Airlie Beach,Great Barrier Reef,Hamilton Island,Hill Inlet,Whitehaven,Whitsunday Island","adventure,private,relaxation,small-group",general,adventurous,,,,Quienes busquen una aventura personalizada e íntima por las islas Whitsunday.,,"['La edad mínima para Adventurer Private Charter es de 6 años', 'Por razones de seguridad TODOS los pasajeros deben saber nadar y hablar inglés con fluidez']","['Muda', 'Traje de baño', 'Toalla de playa', 'Artículos de aseo', 'Repelente de insectos', 'Botella de agua para rellenar (por favor, no botellas de agua de metal)', 'Cámara', 'Calzado cómodo para caminar', 'Protección solar (crema solar, sombrero, gafas de sol, etc.)', 'Ropa de abrigo/pullo para las noches (de temporada)']","[BYO alcohol and soft drinks (refer to 'What to bring')"", 'Any dietary requirements (such as vegetarian, vegan, pescatarian, gluten-free diets and dairy/lactose-free) will need to pay a surcharge of $15 per person payable on check in.', 'Kosher and Halal diets are unable to be catered for.', 'Peak holiday seasons (i.e. Las excursiones en el mar entre el 24 de diciembre y el 2 de enero tendrán un recargo único de 20 $ por persona y noche, a pagar directamente en el momento del check-in.', 'Las excursiones con salida el viernes, sábado, domingo o lunes de Pascua tendrán un recargo único de 20 $ por persona y noche, a pagar directamente en el momento del check-in.']","[Si no se abona el saldo restante antes de la fecha prevista, se cancelará el alquiler y se perderá el depósito no reembolsable"", ""Una vez efectuado el pago del saldo, los clientes que no se presenten o cancelen la reserva en los 30 días anteriores a la salida perderán el 100% del precio total del billete""]",0
38a7091013a51a3f,Perla de las Whitsunday,sailing-whitsundays,,"Escápese al paraíso a bordo del elegante catamarán Whitsunday Pearl. Esta lujosa embarcación ofrece una experiencia íntima con alojamiento para sólo 8 personas en cuatro camarotes dobles privados, cada uno con baño. Esta excursión, perfecta para parejas y grupos pequeños que buscan una aventura única, combina la relajación con la exploración. Disfrute buceando en arrecifes vírgenes, visitando la emblemática playa de Whitehaven y practicando deportes acuáticos. Con amplias cubiertas, cafetera y Starlink Wifi, tendrá todo lo necesario para un viaje confortable.",2 days 2 nights,Coral Sea Marina Meeting Point C,,FROM A$1695,,"Alojamiento en cabañas dobles privadas con baño
Visita a la playa de Whitehaven
Snorkel en arrecifes vírgenes
Deportes acuáticos
Amplias cubiertas
Cafetera
Wifi Starlink","Catamarán elegante y con estilo
Experiencia íntima para un máximo de 8 invitados
Camarotes dobles privados con baño
Visita a la playa de Whitehaven
Snorkel en arrecifes vírgenes
Deportes acuáticos disponibles
Amplias cubiertas para relajarse
Cafetera a bordo
Conexión Wifi Starlink",,,https://sailing-whitsundays.com/whitsundays/whitsunday-pearl-3d3n,https://sailing-whitsundays.com/whitsundays/whitsunday-pearl-3d3n,,static/tour_images/sailing-whitsundays/38a7091013a51a3f/image_6.JPG,"static/tour_images/sailing-whitsundays/38a7091013a51a3f/image_1.jpg,static/tour_images/sailing-whitsundays/38a7091013a51a3f/image_2.jpg,static/tour_images/sailing-whitsundays/38a7091013a51a3f/image_3.jpg,static/tour_images/sailing-whitsundays/38a7091013a51a3f/image_4.jpg,static/tour_images/sailing-whitsundays/38a7091013a51a3f/image_5.jpg,static/tour_images/sailing-whitsundays/38a7091013a51a3f/image_6.JPG,static/tour_images/sailing-whitsundays/38a7091013a51a3f/image_8.jpg,static/tour_images/sailing-whitsundays/38a7091013a51a3f/image_10.png,static/tour_images/sailing-whitsundays/38a7091013a51a3f/image_13.jpg,static/tour_images/sailing-whitsundays/38a7091013a51a3f/image_14.jpg,static/tour_images/sailing-whitsundays/38a7091013a51a3f/image_15.jpg,static/tour_images/sailing-whitsundays/38a7091013a51a3f/image_16.jpg,static/tour_images/sailing-whitsundays/38a7091013a51a3f/image_17.jpg",,True,https://sailing-whitsundays.com/whitsundays/whitsunday-pearl-3d3n,Private Queen Ensuite Cabin (sleeps 2): A$1695,,,multi_day,combo,"Airlie Beach,Great Barrier Reef,Hamilton Island,Hill Inlet,Whitehaven,Whitsunday Island","adventure,luxury,private,relaxation,small-group",general,adventurous,,,,Parejas y grupos pequeños que buscan una aventura lujosa e íntima,,"['El Whitsunday Pearl sólo es apto para adultos, por lo que la edad mínima es de 18 años.', 'Un pasajero sólo puede participar en actividades acuáticas si tiene un nivel de experiencia en natación.', 'Para cumplir nuestras normas mínimas de seguridad, los pasajeros deben poder salir del barco sin ayuda en el improbable caso de una emergencia.']","['Muda', 'Traje de baño', 'Artículos de aseo', 'Repelente de insectos', 'Botella de agua para rellenar', 'Cámara', 'Calzado cómodo para caminar', 'Protección solar (crema solar, sombrero, gafas de sol, etc.)', 'Ropa de abrigo/chompa para las noches (de temporada)', 'Su propio juego de aletas si las tiene']","[Puede que se aplique un recargo de 15$ al día por algunas peticiones y requisitos dietéticos"", ""Las temporadas altas de vacaciones (es decir, Navidad, Semana Santa y Año Nuevo) pueden conllevar un recargo"", ""Puedes guardar el equipaje que te sobre en nuestro almacén de equipaje de Airlie Beach, situado en la calle principal, por un módico precio""]","['Los clientes que no se presenten o cancelen su reserva en los 30 días anteriores a la salida perderán el 100% del precio total del billete', 'Las cancelaciones realizadas entre 30 y 60 días antes de la salida tendrán un recargo por cancelación del 25%']",0
ba9746af968168dd,Whitsunday Blue Charter Privado,sailing-whitsundays,,"Disfrute de las Whitsunday con comodidad y estilo exclusivos a bordo del Whitsunday Blue. Este chárter privado ofrece aventuras personalizadas para aquellos que buscan una exploración única y lujosa de las Islas Whitsunday. Ideal para parejas, familias y grupos que buscan crear recuerdos inolvidables en un entorno sereno y pintoresco.",Full day,Coral Sea Marina Meeting Point C,"Departs 12:00 PM on Tue, Thu & Sat",FROM A$8660.00,,"Experiencia de chárter privado
Itinerario personalizado
Tripulación experimentada","Navegue por las impresionantes Islas Whitsunday
Experiencia de navegación lujosa y privada
Itinerario flexible adaptado a sus preferencias
Posibilidad de practicar snorkel y visitar playas
Ideal para ocasiones especiales o reuniones íntimas",,,https://sailing-whitsundays.com/whitsundays/whitsunday-blue-private-charter,https://sailing-whitsundays.com/whitsundays/whitsunday-blue-private-charter,,static/tour_images/sailing-whitsundays/ba9746af968168dd/image_2.jpg,"static/tour_images/sailing-whitsundays/ba9746af968168dd/image_1.jpg,static/tour_images/sailing-whitsundays/ba9746af968168dd/image_2.jpg,static/tour_images/sailing-whitsundays/ba9746af968168dd/image_3.jpg,static/tour_images/sailing-whitsundays/ba9746af968168dd/image_6.jpg,static/tour_images/sailing-whitsundays/ba9746af968168dd/image_10.jpg,static/tour_images/sailing-whitsundays/ba9746af968168dd/image_11.jpg,static/tour_images/sailing-whitsundays/ba9746af968168dd/image_12.jpg,static/tour_images/sailing-whitsundays/ba9746af968168dd/image_13.jpg,static/tour_images/sailing-whitsundays/ba9746af968168dd/image_14.jpg",,True,https://sailing-whitsundays.com/whitsundays/whitsunday-blue-private-charter,Private Charter: A$8660.00,,,full_day,combo,"Airlie Beach,Great Barrier Reef,Hamilton Island,Hill Inlet,Whitehaven,Whitsunday Island","adventure,private,small-group",general,adventurous,,,Todas las edades son bienvenidas,"Parejas, familias y grupos que buscan una experiencia de navegación privada y lujosa",,"[Whitsunday Blue no suministra equipamiento para niños, como trajes de neopreno, equipos de buceo o chalecos salvavidas. Es responsabilidad de los padres/tutores asegurarse de que estos equipos se obtienen en otro lugar con antelación y se suben a bordo para la salida. Por razones de seguridad, TODOS los pasajeros deben saber nadar y hablar inglés con fluidez","['Muda', 'Bañador', 'Artículos de aseo', 'Repelente de insectos', 'Botella de agua para rellenar', 'Cámara', 'Calzado cómodo para caminar', 'Protección solar (crema solar, sombrero, gafas de sol, etc.)', 'Ropa de abrigo/pullo para las noches (de temporada)']","[Alcohol (BYO - consulte la sección ""Qué llevar"" para obtener más información)"", ""Equipo adicional de snorkel (máscaras graduadas, etc.)"", ""Equipo para niños (chalecos salvavidas, trajes con aguijones, aletas, máscaras, etc.)*"", ""Las temporadas altas de vacaciones (es decir, Navidad, Semana Santa, Año Nuevo) pueden conllevar un recargo.las excursiones que se realicen en el mar entre el 24 de diciembre y el 2 de enero tendrán un recargo único de 20 $ por persona y noche, que se abonará directamente en el momento del check-in"", ""Las excursiones con salida el viernes, sábado, domingo o lunes de Pascua tendrán un recargo único de 20 $ por persona y noche, que se abonará directamente en el momento del check-in""]","[Si no se abona el saldo restante antes de la fecha prevista, se cancelará el alquiler y se perderá el depósito no reembolsable"", ""Una vez efectuado el pago del saldo, los clientes que no se presenten o cancelen la reserva en los 30 días anteriores a la salida perderán el 100% del precio total del billete""]",0
e832e98d0fa269af,Playa de Whitehaven y Hill Inlet,sailing-whitsundays,,"Disfrute de la impresionante belleza de las Whitsundays con una visita a Whitehaven Beach y Hill Inlet. Esta excursión ofrece una mezcla perfecta de aventura y relajación, ideal para los amantes de la naturaleza y los fotógrafos que buscan vistas impresionantes. Disfrute de aguas cristalinas, playas vírgenes y las emblemáticas arenas arremolinadas de Hill Inlet. Perfecto para familias, parejas y viajeros en solitario que deseen explorar uno de los lugares más pintorescos de Australia.",Full day,Coral Sea Marina Meeting Point C,,FROM A$990,,"Snorkel o submarinismo en arrecifes vírgenes
Visita a la playa de Whitehaven
Visita guiada a Hill Inlet","Explore la emblemática playa de Whitehaven
Sea testigo de los remolinos de arena de Hill Inlet
Practique snorkel o submarinismo en la Gran Barrera de Coral
Perfecto para amantes de la naturaleza y fotógrafos
Ideal para familias, parejas y viajeros en solitario",,,https://sailing-whitsundays.com/whitsundays/whitsunday-blue-2d2n,https://sailing-whitsundays.com/whitsundays/whitsunday-blue-2d2n,,static/tour_images/sailing-whitsundays/e832e98d0fa269af/image_2.jpg,"static/tour_images/sailing-whitsundays/e832e98d0fa269af/image_1.jpg,static/tour_images/sailing-whitsundays/e832e98d0fa269af/image_2.jpg,static/tour_images/sailing-whitsundays/e832e98d0fa269af/image_4.jpg,static/tour_images/sailing-whitsundays/e832e98d0fa269af/image_5.jpg,static/tour_images/sailing-whitsundays/e832e98d0fa269af/image_7.jpg,static/tour_images/sailing-whitsundays/e832e98d0fa269af/image_10.jpg,static/tour_images/sailing-whitsundays/e832e98d0fa269af/image_11.jpg,static/tour_images/sailing-whitsundays/e832e98d0fa269af/image_12.jpg,static/tour_images/sailing-whitsundays/e832e98d0fa269af/image_13.jpg,static/tour_images/sailing-whitsundays/e832e98d0fa269af/image_14.jpg,static/tour_images/sailing-whitsundays/e832e98d0fa269af/image_15.jpg,static/tour_images/sailing-whitsundays/e832e98d0fa269af/image_16.jpg,static/tour_images/sailing-whitsundays/e832e98d0fa269af/image_17.jpg,static/tour_images/sailing-whitsundays/e832e98d0fa269af/image_18.jpg",,True,https://sailing-whitsundays.com/whitsundays/whitsunday-blue-2d2n,Private Double with Shared Bathroom (for 2 people): A$1980 Total | Private Double Cabin with Ensuite (for 2 people): A$2150 Total,,,full_day,combo,"Airlie Beach,Great Barrier Reef,Hamilton Island,Hill Inlet,Whitehaven,Whitsunday Island","adventure,private,relaxation",general,adventurous,,,Todas las edades son bienvenidas,"Amantes de la naturaleza, fotógrafos, familias, parejas y viajeros en solitario",,"['La edad mínima de los pasajeros del Whitsunday Blue es de 18 años', 'Cualquier requisito dietético (vegetariano, vegano, sin lácteos, sin gluten, etc.) deberá abonar un recargo de 45 $ por persona pagadero en el momento de la facturación', 'No se pueden atender dietas kosher ni halal']","['Muda de ropa', 'Sombrero', 'Bañador', 'Protector solar 30+', 'Jersey de abrigo para las noches (de temporada)', 'Traiga sus propias bebidas alcohólicas, disponibles para su compra en la ciudad - no botellas de vidrio por favor']","[BYO alcohol - no botellas de vidrio, con la excepción de vino y champán', 'Refrescos disponibles para su compra a bordo', 'Cualquier requisito dietético (como vegetariano, vegano, pescatariano, dietas sin gluten y sin lácteos / lactosa) tendrá que pagar un recargo de $ 15 por persona por día a pagar en el check in.', 'Recargos de vacaciones: Las excursiones en el mar entre el 24 de diciembre y el 2 de enero tendrán un recargo único de 20 $ por persona y noche, pagadero directamente en el momento del check-in.', 'Las excursiones con salida el viernes, sábado, domingo o lunes de Pascua tendrán un recargo único de 20 $ por persona y noche, pagadero directamente en el momento del check-in.']",Los clientes que no se presenten o cancelen su reserva en los 30 días anteriores a la salida perderán el 100% del precio total del billete. El reembolso en caso de cancelación está sujeto tanto a nuestra Política de cancelación como a las condiciones del proveedor.,0
