id,name,company_name,summary,description,duration,departure_location,departure_times,price_adult,price_child,includes,highlights,keywords,duration_hours,link_booking,link_more_info,phone,image_url,image_urls,commission_rate,active,price_source_url,price_tiers,raw_text,duration_days,duration_category,tour_type,locations,tags,audience,intensity_level,itinerary,menu,age_requirements,ideal_for,video_urls,important_information,what_to_bring,whats_extra,cancellation_policy,booking_connected
514805acd6445e40,Camarote doble privado con baño compartido,sailing-whitsundays,,"Embárquese en un lujoso viaje por las Whitsundays con una estancia en un camarote doble privado. Esta experiencia ofrece una escapada íntima y confortable, perfecta para parejas que buscan una escapada romántica. Disfrute del impresionante paisaje de la Gran Barrera de Coral y deléitese con la serena belleza de las islas Whitsunday. Este viaje es ideal para quienes buscan relajarse con estilo mientras exploran uno de los destinos más emblemáticos de Australia.",2 days 1 night,Coral Sea Marina Meeting Point C,,"FROM A$1,249",,,,,,https://sailing-whitsundays.com/whitsundays/whitsunday-blue-3d3n,https://sailing-whitsundays.com/whitsundays/whitsunday-blue-3d3n,,static/tour_images/sailing-whitsundays/514805acd6445e40/image_7.jpg,"static/tour_images/sailing-whitsundays/514805acd6445e40/image_1.jpg,static/tour_images/sailing-whitsundays/514805acd6445e40/image_3.jpg,static/tour_images/sailing-whitsundays/514805acd6445e40/image_6.jpg,static/tour_images/sailing-whitsundays/514805acd6445e40/image_7.jpg,static/tour_images/sailing-whitsundays/514805acd6445e40/image_9.jpg,static/tour_images/sailing-whitsundays/514805acd6445e40/image_11.jpg,static/tour_images/sailing-whitsundays/514805acd6445e40/image_12.jpg,static/tour_images/sailing-whitsundays/514805acd6445e40/image_13.jpg,static/tour_images/sailing-whitsundays/514805acd6445e40/image_15.jpg,static/tour_images/sailing-whitsundays/514805acd6445e40/image_16.jpg,static/tour_images/sailing-whitsundays/514805acd6445e40/image_17.jpg,static/tour_images/sailing-whitsundays/514805acd6445e40/image_18.jpg,static/tour_images/sailing-whitsundays/514805acd6445e40/image_19.jpg,static/tour_images/sailing-whitsundays/514805acd6445e40/image_20.jpg,static/tour_images/sailing-whitsundays/514805acd6445e40/image_21.jpg,static/tour_images/sailing-whitsundays/514805acd6445e40/image_22.jpg",,True,https://sailing-whitsundays.com/whitsundays/whitsunday-blue-3d3n,"Private Double Cabin with Shared Bath (01 Jul 2025 - 30 Apr 2026): A$2,548 Total",,,multi_day,combo,"Airlie Beach,Great Barrier Reef,Hamilton Island,Hill Inlet,Whitehaven,Whitsunday Island","adventure,luxury,private,relaxation,small-group",general,adventurous,,,,Parejas que buscan una escapada romántica y lujosa,,"[""Debe ser mayor de 18 años para reservar una excursión en el viaje 3D3N de Whitsunday Blue"", ""Los pasajeros con cualquier requisito dietético (vegetarianos, veganos, sin lácteos, sin gluten, etc.) deberán abonar un recargo de 45 $ por persona pagadero en el momento de la facturación""]","['pequeña bolsa blanda con ropa de recambio', 'gorra', 'ropa de baño', 'crema solar 30+', 'jersey de abrigo para las noches (de temporada)', 'bebidas alcohólicas propias, disponibles para su compra en la ciudad']","[Los pasajeros con necesidades dietéticas especiales (vegetarianos, veganos, sin productos lácteos, sin gluten, etc.) deberán abonar un suplemento de 45 $ por persona en el momento de la facturación"", ""Consigna de equipaje""]",Los clientes que no se presenten o cancelen su reserva en los 30 días anteriores a la salida perderán el 100% del precio total del billete. El reembolso en caso de cancelación está sujeto tanto a nuestra Política de cancelación como a las condiciones del proveedor.,0
454ce2730756e741,Escapada a las Whitsunday 3D/3N,sailing-whitsundays,,"Navegue por las Whitsundays a bordo del Whitsunday Getaway y disfrute de una inolvidable escapada al paraíso tropical Disfrute del esplendor de un viaje prolongado, de 3 días y 3 noches, más largo que la mayoría de las excursiones por las Whitsundays. La escapada perfecta para parejas y recién casados que deseen ver las Whitsundays con estilo, diseñada para ofrecer a las parejas la oportunidad de ser agasajadas mientras exploran el impresionante paisaje.",3 Days 3 Nights,Coral Sea Marina Meeting Point C,,FROM A$1420,,,"Crucero por las Whitsundays a bordo de un lujoso barco
Circuito de 3 días y 3 noches
Perfecto para parejas y recién casados
Explore el paraíso tropical con estilo
Disfrute de una cena de lujo",,,https://sailing-whitsundays.com/whitsundays/whitsunday-getaway-3d3n,https://sailing-whitsundays.com/whitsundays/whitsunday-getaway-3d3n,,static/tour_images/sailing-whitsundays/454ce2730756e741/image_9.jpg,"static/tour_images/sailing-whitsundays/454ce2730756e741/image_2.jpg,static/tour_images/sailing-whitsundays/454ce2730756e741/image_3.jpg,static/tour_images/sailing-whitsundays/454ce2730756e741/image_5.jpg,static/tour_images/sailing-whitsundays/454ce2730756e741/image_8.jpg,static/tour_images/sailing-whitsundays/454ce2730756e741/image_9.jpg,static/tour_images/sailing-whitsundays/454ce2730756e741/image_11.jpg,static/tour_images/sailing-whitsundays/454ce2730756e741/image_12.jpg,static/tour_images/sailing-whitsundays/454ce2730756e741/image_14.jpg,static/tour_images/sailing-whitsundays/454ce2730756e741/image_15.jpg,static/tour_images/sailing-whitsundays/454ce2730756e741/image_16.jpg,static/tour_images/sailing-whitsundays/454ce2730756e741/image_17.jpg,static/tour_images/sailing-whitsundays/454ce2730756e741/image_18.jpg,static/tour_images/sailing-whitsundays/454ce2730756e741/image_19.jpg,static/tour_images/sailing-whitsundays/454ce2730756e741/image_20.jpg",,True,https://sailing-whitsundays.com/whitsundays/whitsunday-getaway-3d3n,Private Queen Ensuite Cabin (sleeps 2): FROM A$1420,,3.0,multi_day,combo,"Airlie Beach,Great Barrier Reef,Hamilton Island,Hill Inlet,Whitehaven,Whitsunday Island","adventure,luxury,private",general,adventurous,,,Sólo adultos (18+),Parejas y recién casados que buscan una escapada lujosa y romántica,,"[Cada pasajero debe tener una comprensión clara de las instrucciones de seguridad dadas en inglés por la tripulación y ser capaz de rellenar los formularios de seguridad requeridos en inglés"", ""Un pasajero sólo puede participar en actividades acuáticas si tiene un nivel de experiencia en natación"", ""Si un pasajero no sabe nadar, podrá participar en el viaje en velero, pero no podrá participar en actividades acuáticas como el snorkel"".si un pasajero no sabe nadar, podrá participar en el viaje en velero, pero no podrá participar en actividades acuáticas como el snorkel"", ""Para cumplir nuestras normas mínimas de seguridad, los pasajeros deben poder salir del barco sin ayuda en el improbable caso de una emergencia"", ""La edad mínima para viajar en el Whitsunday Getaway es de 18 años""]","['Muda', 'Traje de baño', 'Artículos de aseo', 'Repelente de insectos', 'Botella de agua para rellenar', 'Cámara', 'Calzado cómodo para caminar', 'Protección solar (crema solar, sombrero, gafas de sol, etc.)', 'Ropa de abrigo/chompa para las noches (de temporada)', 'Su propio juego de aletas si las tiene']","[Traiga alcohol y refrescos, no se permiten botellas de vidrio (excepto botellas de vino)"", ""Se puede aplicar un recargo de 15 $ al día por algunas peticiones y requisitos dietéticos"", ""Equipo de buceo adicional (aletas, máscaras, etc.)"", ""Las temporadas altas de vacaciones (Navidad, Semana Santa, Año Nuevo) pueden conllevar un recargo"", ""Consigna de equipaje""]",Los clientes que no se presenten o cancelen la reserva en los 30 días anteriores a la salida perderán el 100% del precio total del billete. Las cancelaciones realizadas entre 30 y 60 días antes de la salida conllevan una tasa de cancelación del 25%. El reembolso en caso de cancelación está sujeto tanto a nuestra Política de cancelación como a las condiciones del proveedor.,0
3e9255da12060a9f,Soñador de Whitehaven,sailing-whitsundays,,"Regálese una idílica escapada de dos días por las islas Whitsunday a bordo del lujoso Whitehaven Dreamer Esta lujosa experiencia de navegación le llevará a destinos emblemáticos como Whitehaven Beach y Hill Inlet. Perfecto para quienes buscan una mezcla de relax y aventura, el Whitehaven Dreamer ofrece la posibilidad de practicar snorkel en la mundialmente famosa Gran Barrera de Coral, lo que garantiza un viaje inolvidable tanto para los amantes de la naturaleza como para los aventureros.",2 Days,Coral Sea Marina Meeting Point C,,FROM A$1360,,"Navegación a la playa de Whitehaven y Hill Inlet
Snorkel en la Gran Barrera de Coral
Alojamiento en camarote doble privado con baño","Lujosa experiencia de navegación
Visite la playa de Whitehaven
Explorar Hill Inlet
Practique snorkel en la Gran Barrera de Coral
Alojamiento en camarote doble privado",,,https://sailing-whitsundays.com/whitsundays/whitehaven-dreamer-2d2n,https://sailing-whitsundays.com/whitsundays/whitehaven-dreamer-2d2n,,static/tour_images/sailing-whitsundays/3e9255da12060a9f/image_1.jpg,"static/tour_images/sailing-whitsundays/3e9255da12060a9f/image_1.jpg,static/tour_images/sailing-whitsundays/3e9255da12060a9f/image_3.jpg,static/tour_images/sailing-whitsundays/3e9255da12060a9f/image_4.png,static/tour_images/sailing-whitsundays/3e9255da12060a9f/image_6.png,static/tour_images/sailing-whitsundays/3e9255da12060a9f/image_7.jpg,static/tour_images/sailing-whitsundays/3e9255da12060a9f/image_10.jpg,static/tour_images/sailing-whitsundays/3e9255da12060a9f/image_11.png,static/tour_images/sailing-whitsundays/3e9255da12060a9f/image_12.jpg,static/tour_images/sailing-whitsundays/3e9255da12060a9f/image_13.jpg,static/tour_images/sailing-whitsundays/3e9255da12060a9f/image_14.jpg,static/tour_images/sailing-whitsundays/3e9255da12060a9f/image_15.jpg,static/tour_images/sailing-whitsundays/3e9255da12060a9f/image_16.jpg,static/tour_images/sailing-whitsundays/3e9255da12060a9f/image_17.png",,True,https://sailing-whitsundays.com/whitsundays/whitehaven-dreamer-2d2n,Private Double Cabin with Ensuite (sleeps 2): A$2720 Total,,2.0,multi_day,combo,"Airlie Beach,Great Barrier Reef,Hamilton Island,Hill Inlet,Whitehaven,Whitsunday Island","adventure,private,relaxation",general,adventurous,,,,Amantes de la naturaleza y aventureros en busca de una escapada lujosa y relajante.,,"[La edad mínima para los niños es de 6 años"", ""Los menores de 18 años deben saber nadar y los niños deben estar supervisados por sus padres durante todo el viaje"", ""Los menores de 18 años no pueden reservar alojamiento compartido, excepto si el grupo ocupa toda una zona compartida"", ""En los demás casos, los padres deben ocupar la zona compartida y el niño debe compartir un camarote privado con el otro progenitor"", ""Tenga en cuenta que no hay dos camas individuales compartidas en la misma zona, sino que están repartidas por todo el barco"".', 'Tenga en cuenta también que no hay 2 camas individuales compartidas juntas en la misma zona, están repartidas por todo el barco.', 'Se trata de una actividad acuática, por razones de seguridad TODOS los pasajeros deben saber nadar y hablar inglés con fluidez.', 'Esta aventura en velero sólo es apta para personas activas.', 'Se requiere un nivel básico de forma física y movilidad.', 'A título orientativo, los huéspedes deben poder subir una escalera con facilidad.']","['Muda', 'Bañador', 'Artículos de aseo', 'Toalla de playa', 'Repelente de insectos', 'Botellas de agua para rellenar', 'Cámara', 'Calzado cómodo para caminar', 'Protección solar (crema solar, sombrero, gafas de sol)', 'Ropa de abrigo/pullo para las noches (de temporada)', 'Su propio alcohol (no botellas pequeñas de cristal)']","['Refrescos, agua embotellada y aperitivos', 'BYO alcohol', 'Consigna de equipaje']",Los clientes que no se presenten o cancelen su reserva en los 30 días anteriores a la salida perderán el 100% del precio total del billete. El reembolso en caso de cancelación está sujeto tanto a nuestra Política de cancelación como a las condiciones del proveedor.,0
6ddec421fe7ddb42,Whitehaven Dreamer Charter Privado,sailing-whitsundays,,"Embárquese en un viaje exclusivo con el chárter privado Whitehaven Dreamer, que ofrece una escapada de lujo a las playas vírgenes y la vibrante vida marina de las Whitsundays. Perfecto para quienes buscan una experiencia personalizada e íntima, este chárter está pensado para grupos pequeños y fiestas privadas. Disfrute de la libertad de explorar calas solitarias, practicar snorkel en aguas cristalinas y relajarse en la emblemática playa de Whitehaven. Ideal para familias, parejas y amigos que buscan una aventura a medida en el paraíso.",Full day,Coral Sea Marina Meeting Point C,"Tues, Thurs, Sat",FROM A$8950,,"Experiencia de chárter privado
Acceso a playas solitarias
Equipo de snorkel
Tripulación experimentada","Itinerario personalizado
Visita a la playa de Whitehaven
Snorkel en la Gran Barrera de Coral
Entorno lujoso e íntimo
Ideal para grupos pequeños y fiestas privadas",,,https://sailing-whitsundays.com/whitsundays/whitehaven-dreamer-private-charter,https://sailing-whitsundays.com/whitsundays/whitehaven-dreamer-private-charter,,static/tour_images/sailing-whitsundays/6ddec421fe7ddb42/image_1.jpg,"static/tour_images/sailing-whitsundays/6ddec421fe7ddb42/image_1.jpg,static/tour_images/sailing-whitsundays/6ddec421fe7ddb42/image_3.jpg,static/tour_images/sailing-whitsundays/6ddec421fe7ddb42/image_5.jpg,static/tour_images/sailing-whitsundays/6ddec421fe7ddb42/image_6.jpg,static/tour_images/sailing-whitsundays/6ddec421fe7ddb42/image_9.jpg,static/tour_images/sailing-whitsundays/6ddec421fe7ddb42/image_10.jpg,static/tour_images/sailing-whitsundays/6ddec421fe7ddb42/image_11.jpg,static/tour_images/sailing-whitsundays/6ddec421fe7ddb42/image_12.jpg,static/tour_images/sailing-whitsundays/6ddec421fe7ddb42/image_13.jpg,static/tour_images/sailing-whitsundays/6ddec421fe7ddb42/image_14.jpg,static/tour_images/sailing-whitsundays/6ddec421fe7ddb42/image_15.jpg,static/tour_images/sailing-whitsundays/6ddec421fe7ddb42/image_16.jpg,static/tour_images/sailing-whitsundays/6ddec421fe7ddb42/image_17.png",,True,https://sailing-whitsundays.com/whitsundays/whitehaven-dreamer-private-charter,,,,full_day,combo,"Airlie Beach,Great Barrier Reef,Hamilton Island,Hill Inlet,Whitehaven,Whitsunday Island","adventure,private,relaxation,small-group",general,adventurous,,,,"Familias, parejas y grupos que buscan una aventura privada y personalizada en las Whitsunday.",,"[La edad mínima para los niños es de 6 años"", ""Los menores de 18 años deben saber nadar y los niños deben estar supervisados por sus padres durante todo el viaje"", ""Los menores de 18 años no pueden reservar alojamiento compartido, excepto si el grupo ocupa toda una zona compartida"", ""En los demás casos, los padres deben ocupar la zona compartida y el niño debe compartir un camarote privado con el otro progenitor"", ""Tenga en cuenta que no hay dos camas individuales compartidas en la misma zona, sino que están repartidas por todo el barco"".', 'Tenga en cuenta también que no hay 2 camas individuales compartidas juntas en la misma zona, están repartidas por todo el barco.', 'Se trata de una actividad acuática, por razones de seguridad TODOS los pasajeros deben saber nadar y hablar inglés con fluidez.', 'Esta aventura en velero sólo es apta para personas activas.', 'Se requiere un nivel básico de forma física y movilidad.', 'A título orientativo, los huéspedes deben poder subir una escalera con facilidad.']","['Muda', 'Bañador', 'Artículos de aseo', 'Toalla de playa', 'Repelente de insectos', 'Botellas de agua para rellenar', 'Cámara', 'Calzado cómodo para caminar', 'Protección solar (crema solar, sombrero, gafas de sol)', 'Ropa de abrigo/pullo para las noches (de temporada)', 'Su propio alcohol (no botellas pequeñas de cristal)']","['Refrescos, agua embotellada y aperitivos', 'BYO alcohol', 'Consigna de equipaje']","Todas las cancelaciones suponen la pérdida del 25% del precio de venta recomendado (PVR), no del precio con descuento/de venta. Los clientes que no se presenten o cancelen la reserva en los 30 días anteriores a la salida perderán el 100% del precio total del billete. El reembolso en caso de cancelación está sujeto tanto a nuestra Política de cancelación como a las condiciones del proveedor.",0
34b4bf275e1c715d,Paquete especial On Ice,sailing-whitsundays,,"Explore las Whitsundays y la Gran Barrera de Coral con una gran variedad de emocionantes excursiones y paquetes. Tanto si busca una aventura náutica de varios días como una noche única en un hotel submarino, hay opciones para todos los gustos. Disfrute practicando snorkel o submarinismo en arrecifes vírgenes, relájese en la impresionante playa de Whitehaven o elija entre una serie de emocionantes actividades como vuelos panorámicos y motos acuáticas. Ideal para aventureros, familias y parejas que buscan experimentar la belleza del paraíso tropical australiano.",2 days 2 nights,Coral Sea Marina Meeting Point C,,A$725,,,"Snorkel y submarinismo en arrecifes vírgenes
Relajarse en la playa de Whitehaven
Vuelos panorámicos y moto acuática
Alojamiento único
Charters privados personalizables",,,https://sailing-whitsundays.com/whitsundays/on-ice,https://sailing-whitsundays.com/whitsundays/on-ice,,static/tour_images/sailing-whitsundays/34b4bf275e1c715d/image_3.jpg,"static/tour_images/sailing-whitsundays/34b4bf275e1c715d/image_1.jpg,static/tour_images/sailing-whitsundays/34b4bf275e1c715d/image_2.jpg,static/tour_images/sailing-whitsundays/34b4bf275e1c715d/image_3.jpg,static/tour_images/sailing-whitsundays/34b4bf275e1c715d/image_5.jpg,static/tour_images/sailing-whitsundays/34b4bf275e1c715d/image_7.jpg,static/tour_images/sailing-whitsundays/34b4bf275e1c715d/image_8.jpg,static/tour_images/sailing-whitsundays/34b4bf275e1c715d/image_11.jpg,static/tour_images/sailing-whitsundays/34b4bf275e1c715d/image_12.jpg,static/tour_images/sailing-whitsundays/34b4bf275e1c715d/image_13.jpg,static/tour_images/sailing-whitsundays/34b4bf275e1c715d/image_14.jpg,static/tour_images/sailing-whitsundays/34b4bf275e1c715d/image_15.jpg,static/tour_images/sailing-whitsundays/34b4bf275e1c715d/image_17.jpg",,True,https://sailing-whitsundays.com/whitsundays/on-ice,,,,full_day,combo,"Airlie Beach,Great Barrier Reef,Hamilton Island,Hill Inlet,Whitehaven,Whitsunday Island","adventure,luxury,private,relaxation",general,adventurous,,,,"Aventureros, familias y parejas",,"[La edad mínima para los niños es de 6 años"", ""Los menores de 18 años deben saber nadar y los niños deben estar supervisados por sus padres durante todo el viaje"", ""Los menores de 18 años no pueden alojarse en habitaciones compartidas, excepto si el grupo ocupa toda una zona compartida"", ""Se trata de una actividad acuática, por lo que, por motivos de seguridad, TODOS los pasajeros deben saber nadar y hablar inglés con fluidez"", ""Esta aventura en velero sólo es apta para personas activas. Se requiere un nivel básico de forma física y movilidad']","['Muda', 'Bañador', 'Artículos de aseo', 'Toalla de playa', 'Repelente de insectos', 'Botellas de agua para rellenar', 'Cámara', 'Calzado cómodo para caminar', 'Protección solar (crema solar, sombrero, gafas de sol, etc.)', 'Ropa de abrigo/pullo para las noches (de temporada)']","[""Alcohol (BYO - consulte ""Qué llevar"" para más información)"", ""Refrescos, agua embotellada y aperitivos"", ""Consigna de equipaje""]",Los clientes que no se presenten o cancelen la reserva en los 30 días anteriores a la salida perderán el 100% del precio total del billete.,0
83caea5dc452753a,Aventura Powerplay Whitsundays,sailing-whitsundays,,"Disfrute de las Whitsundays con todo lujo a bordo del Powerplay, uno de los buques más lujosos de la flota. Esta aventura de primera clase es perfecta para quienes buscan una exploración exclusiva y estimulante de los atrevidos paisajes de las Whitsundays. Con increíbles características y actividades, Powerplay ofrece una mezcla única de confort y aventura, ideal para parejas, familias y buscadores de emociones por igual.",Full day,Coral Sea Marina Meeting Point C,,"FROM A$12,550",,"Barco de lujo Powerplay
Recorrido exclusivo por las Whitsundays
Características y actividades increíbles","Viaje a toda velocidad y con estilo
Explore los atrevidos paisajes de las Whitsundays
Experimente el lujo a bordo de una de las embarcaciones más lujosas
Perfecto para parejas, familias y amantes de las emociones fuertes",,,https://sailing-whitsundays.com/whitsundays/powerplay-private-charter,https://sailing-whitsundays.com/whitsundays/powerplay-private-charter,,static/tour_images/sailing-whitsundays/83caea5dc452753a/image_7.jpg,"static/tour_images/sailing-whitsundays/83caea5dc452753a/image_3.jpg,static/tour_images/sailing-whitsundays/83caea5dc452753a/image_6.jpg,static/tour_images/sailing-whitsundays/83caea5dc452753a/image_7.jpg,static/tour_images/sailing-whitsundays/83caea5dc452753a/image_9.jpg,static/tour_images/sailing-whitsundays/83caea5dc452753a/image_10.jpg,static/tour_images/sailing-whitsundays/83caea5dc452753a/image_11.jpg,static/tour_images/sailing-whitsundays/83caea5dc452753a/image_12.jpg,static/tour_images/sailing-whitsundays/83caea5dc452753a/image_13.jpg,static/tour_images/sailing-whitsundays/83caea5dc452753a/image_14.jpg,static/tour_images/sailing-whitsundays/83caea5dc452753a/image_15.jpg,static/tour_images/sailing-whitsundays/83caea5dc452753a/image_16.jpg,static/tour_images/sailing-whitsundays/83caea5dc452753a/image_17.jpg,static/tour_images/sailing-whitsundays/83caea5dc452753a/image_18.jpg,static/tour_images/sailing-whitsundays/83caea5dc452753a/image_19.jpg",,True,https://sailing-whitsundays.com/whitsundays/powerplay-private-charter,"Adult (Standard): A$12,550",,,full_day,combo,"Airlie Beach,Great Barrier Reef,Hamilton Island,Hill Inlet,Whitehaven,Whitsunday Island","adventure,luxury,private",general,adventurous,,,,"Parejas, familias y amantes de las emociones fuertes que buscan lujo y aventura",,"['Powerplay es apto para pasajeros mayores de 6 años.', 'Los menores de 18 años deben ir acompañados de uno de sus padres o de un tutor legal.', 'Esta aventura en velero sólo es apta para personas activas.', 'Se requiere un nivel básico de forma física y movilidad.', 'Los huéspedes deben poder subir una escalera con facilidad.', 'DEBE saber nadar para subir al barco.', 'Por razones de seguridad, también debe saber hablar inglés.']","['Muda', 'Bañador', 'Artículos de aseo', 'Toalla de playa', 'Repelente de insectos', 'Botellas de agua para rellenar', 'Cámara', 'Calzado cómodo para caminar', 'Protección solar (crema solar, sombrero, gafas de sol, etc.)', 'Ropa de abrigo/pullo para las noches (de temporada)']","['BYO alcohol - No se permiten botellas de cristal (NO vino tinto, por favor)', 'Se aplica un recargo a algunas peticiones y requisitos dietéticos: 20 $pp por 2 días, 2 noches; 30 $pp por 3 días, 3 noches"", ""Equipo adicional de snorkel (máscaras, etc.)"", ""Equipo para niños (chalecos salvavidas, trajes de buceo, máscaras, etc.)"", ""Las temporadas altas de vacaciones (Navidad, Semana Santa, Año Nuevo) pueden conllevar un recargo""]","['Todas las cancelaciones suponen la pérdida del depósito no reembolsable.', 'El pago del saldo vence 2 meses antes de la salida.', 'El impago del saldo restante antes de la fecha prevista supondrá la cancelación del chárter y la pérdida del depósito no reembolsable.', 'Una vez efectuado el pago del saldo, los clientes que no se presenten o cancelen el chárter perderán el 100% del precio total del billete.']",0
