id,name,company_name,summary,description,duration,departure_location,departure_times,price_adult,price_child,includes,highlights,keywords,duration_hours,link_booking,link_more_info,phone,image_url,image_urls,commission_rate,active,price_source_url,price_tiers,raw_text,duration_days,duration_category,tour_type,locations,tags,audience,intensity_level,video_urls,important_information,what_to_bring,whats_extra,cancellation_policy,booking_connected
d7b1525f2192dd0c,鲍文礁潜水之旅,airliebeachdiving,,参加我们的导游潜水之旅，踏上前往鲍恩著名的马蹄湾礁石的难忘之旅。从艾尔利海滩潜水中心出发，您可以在充满活力的珊瑚花园中进行令人着迷的潜水体验。鲍文礁 (Bowen Reef) 的水下世界虽浅，但生机勃勃，最大深度仅为 7 米，是各种级别认证潜水员的理想选择，为探索提供了便利且令人惊叹的环境。在清澈的海水中邂逅健康的珊瑚、幼鱼、海龟等，非常适合水下摄影和观察脆弱的珊瑚礁生态系统。,6 Hours,Airlie Beach Dive Centre,,FROM A$145,,"所有潜水装备
从艾尔利海滩到鲍文礁的往返旅程
专业潜水指导","探索鲍恩著名的马蹄湾礁
潜入生机勃勃的珊瑚花园
邂逅各种海洋生物，包括海龟和海鳗
非常适合水下摄影
深度浅，能见度高",,6.0,,https://airliebeachdiving.com/shore-reef-diving/,,static/tour_images/airliebeachdiving/d7b1525f2192dd0c/image_1.jpg,static/tour_images/airliebeachdiving/d7b1525f2192dd0c/image_1.jpg,,True,https://airliebeachdiving.com/shore-reef-diving/,Adult: A$145,,,full_day,water,"Airlie Beach,Bowen,Whitsunday Island","adventure,family-friendly",family,moderate,,,,,,0
b2b14cb5bde5955d,有趣的夜潜之旅,airliebeachdiving,,潜入圣灵群岛珊瑚礁迷人的夜晚，享受难忘的夜间潜水冒险。这次旅行非常适合寻求独特而亲密的水下体验的认证潜水员，提供了一个见证鲍文礁珊瑚花园充满活力的夜生活的激动人心的机会。探索珊瑚礁健康、色彩缤纷的珊瑚，邂逅各种夜间活动的海洋生物，包括海龟、海鳗和发光浮游生物。这种安全和支持性的环境确保为各个级别的潜水员带来难忘的体验。,6 Hours,Airlie Beach Dive Centre,,FROM A$199,,"所有潜水装备
潜水指南
从艾尔利海滩到鲍文礁的往返旅程","体验鲍文礁珊瑚花园充满活力的夜生活
目睹夜间海洋生物的活动
邂逅海龟、海鳗和生物发光浮游生物
安全刺激的潜水环境
适合所有级别的认证潜水员",,6.0,,https://airliebeachdiving.com/night-dive-tour/,,static/tour_images/airliebeachdiving/b2b14cb5bde5955d/image_1.jpeg,static/tour_images/airliebeachdiving/b2b14cb5bde5955d/image_1.jpeg,,True,https://airliebeachdiving.com/night-dive-tour/,Adult: A$199,,,full_day,water,"Airlie Beach,Bowen,Whitsunday Island","adventure,family-friendly,small-group",family,adventurous,,,,,,0
f621e9a988a854c0,SS Yongala 沉船潜水,airliebeachdiving,,在传奇的 SS Yongala 沉船潜水点开启一生一次的潜水冒险之旅，这里是世界著名的沉船潜水点，被誉为澳大利亚最迷人的水下景点之一。这种体验完美地融合了丰富的历史、多样化的海洋生物和令人惊叹的探索。探索 SS Yongala 号客轮，深入了解历史，这艘客船于 1911 年不幸沉没，后来变成了充满活力的水下天堂。这片沉船是众多海洋生物的家园，这里有巨大的石斑鱼、好奇的海龟、鹰鳐、色彩缤纷的珊瑚群，甚至还有鲨鱼。无论您是着迷于海洋生物还是历史奥秘，这次潜水都会为您提供真正独特的体验，您将永远珍惜。,,Airlie Beach Dive Centre,,A$250,,"两次沉船引导潜水
所有必备装备
沉船潜水和深潜电子学习
艾尔利海滩的往返交通","探索雄伟的 SS Yongala
由训练有素的潜水教练指导
深入了解 1911 年沉船的历史
见证充满活力的水下生态系统
邂逅巨型石斑鱼、海龟、鹰鳐和鲨鱼",,,,https://airliebeachdiving.com/ss-yongala-wreck-dive/,,static/tour_images/airliebeachdiving/f621e9a988a854c0/image_1.jpeg,static/tour_images/airliebeachdiving/f621e9a988a854c0/image_1.jpeg,,True,https://airliebeachdiving.com/ss-yongala-wreck-dive/,PADI Advanced Open Water Certification: A$250,,,unknown,water,"Airlie Beach,Whitsunday Island","adventure,family-friendly",family,moderate,,,,,,0
