id,name,company_name,summary,description,duration,departure_location,departure_times,price_adult,price_child,includes,highlights,keywords,duration_hours,link_booking,link_more_info,phone,image_url,image_urls,commission_rate,active,price_source_url,price_tiers,raw_text,duration_days,duration_category,tour_type,locations,tags,audience,intensity_level,itinerary,menu,age_requirements,ideal_for,_csv_file
52d9fa82cd0dded5,エアリービーチ観光バス,airlieadventuretours,聖霊降臨祭の冒険,エアリービーチ観光バスで、リラックスしたエコ認証取得の1日ツアーでウィットサンデー諸島本土を体験しましょう。初めて訪れる方、ご家族連れ、カップルに最適で、地元のコーヒー文化、熱帯雨林での水泳、そしてクラシックなオーストラリア風ランチスポットを組み合わせてお楽しみいただけます。このツアーでは、ウィットサンデー地域を快適にガイド付きで探索でき、計画や運転の手間なく、くつろぎながら景色を楽しむことができます。 フレンドリーな現地ガイドと冷房完備の快適さで、楽しく気楽な冒険を求める方に最適なツアーです。,4.5時間,宿泊施設または港,午前11時,A$135,A$95,当社のエアコン付きミニバスでの座席水筒の補充旅行用スナック（キャンディー、チョコレート、ポップコーン）,リラックスしたガイド付きエアリービーチ日帰りツアーウィットサンデー・ゴールドコーヒー農園見学シダークリーク滝で泳ぎ熱帯雨林を探索ジョージズダイナーでランチ休憩（食事は別途購入可）快適な移動手段と現地ガイド付き,,,https://www.airlieadventuretours.com.au/theairliesightseeingbus/,https://www.airlieadventuretours.com.au/theairliesightseeingbus/,,,,,TRUE,https://www.airlieadventuretours.com.au/theairliesightseeingbus/,,,,unknown,combo,"Airlie Beach,Cannonvale,Proserpine","adventure,family-friendly,relaxation",family,relaxed,,,全年齢対象,初めてのお客様、カップル、ご家族、そしてウィットサンデー地域を快適にガイド付きで一日かけて探検したい方へ,data/airlieadventuretours/en/tours_airlieadventuretours_cleaned_with_media.csv
7716e9dfc85b5cc3,エアリービーチ発 シーダークリークエクスプレスツアー,airlieadventuretours,,シダークリーク・エクスプレスツアーで、緑豊かな内陸部への爽やかな逃避行を体験してください。このエコ認証を受けたアドベンチャーツアーは、エアリービーチから静かなシダークリーク滝へとご案内します。自然の岩の円形劇場に囲まれた熱帯雨林の水場と滝です。カップル、ご家族、一人旅の方に最適なこの半日ツアーは、賑やかなビーチの喧騒から離れて、静かなひとときを過ごせます。 熱帯雨林の静けさに包まれ、爽やかな水泳を楽しみ、ウィットサンデー諸島の隠れた名所の一つで自然と触れ合ってください。, 3時間,ブルーバスはデッキカフェの裏にあるラグーン駐車場に停車します。,午前8時、午前11時、午後2時,A$89,A$69,冷房付きミニバス座席午前または午後のティータイム水ボトルの補充旅行用スナック,エコ認証取得の自然優先ツアー短時間で充実：半日冒険に最適現地ガイド付き完全案内ツアーエアリービーチ近郊の熱帯雨林淡水域混雑を避けた爽やかな水泳に最適,,3.5,https://www.airlieadventuretours.com.au/cedarcreekexpress,https://www.airlieadventuretours.com.au/cedarcreekexpress,,,,,TRUE,https://www.airlieadventuretours.com.au/cedarcreekexpress,,,,half_day,combo,"Airlie Beach,Proserpine,Whitsunday Island","adventure,family-friendly,relaxation",family,relaxed,,,全年齢対象,自然の中での休息を求める訪問者、ガイド付き外出を探している家族、景色の良い冒険を望むカップル、そしてビーチの混雑を避けて泳ぎたいと熱望するすべての人々。,data/airlieadventuretours/en/tours_airlieadventuretours_cleaned_with_media.csv
97ccada6f946c189,エングエラ野生カモノハシ観察ツアー – エアリービーチ発エコ認証デイツアー（ウィットサンデー諸島）,airlieadventuretours,,エアリービーチ発、エングエラ国立公園の緑豊かな熱帯雨林へ。エコ認証を受けた日帰りツアー「エングエラ野生カモノハシ観察ツアー」で、潮風を涼やかな山の霧と交換しましょう。絶景の展望台、熱帯雨林の遊歩道、そして自然の生息地で野生のカモノハシを観察できるチャンスが、充実した本土体験を提供します。 自然愛好家、写真家、ご家族に最適なこのツアーでは、囲いや演出のない本物の野生生物体験を提供します。熱帯の海岸線から霧深い山脈へと変化する風景を楽しみながら、知識豊富な現地ガイドが洞察や物語を共有します。野生での野生生物観察のスリルを体験し、見どころはカモノハシの目撃で知られる有名なブロークンリバー地域です。,8時間,宿泊施設または港,午前10時,$165,$135,エコ認証取得の環境負荷低減対策地元ガイド同行ピナクル・パブでの昼食地元解説付きの内陸景観ドライブブロークン・リバーでの観察ポイント解説と静かな観察短距離・易しい散策路と遊歩道区間,エングエラ国立公園の緑豊かな熱帯雨林を体験ブロークン・リバーで野生のカモノハシを自然の生息地で観察景色の良い展望台と熱帯雨林の遊歩道を散策知識豊富な現地ガイド同行ピナクル・パブでの昼食付きエコ認証取得、自然を最優先にしたツアー,,8.0,https://www.airlieadventuretours.com.au/eungellawildplatypusencounter,https://www.airlieadventuretours.com.au/eungellawildplatypusencounter,,,,,TRUE,https://www.airlieadventuretours.com.au/eungellawildplatypusencounter,,,,full_day,combo,"Airlie Beach,Whitehaven","adventure,relaxation",general,adventurous,,,全年齢対象,自然愛好家、写真家、カップル、家族連れ、そしてエアリービーチ発の本物の野生動物観察日帰り旅行を求める旅行者。,data/airlieadventuretours/en/tours_airlieadventuretours_cleaned_with_media.csv
0890d3801d9149a3,エコ野生生物2日間ツアー – カモノハシ＆カンガルー,airlieadventuretours,,北クイーンズランドで最も印象的な野生生物との出会いを2つ、忘れられないエコ認証アドベンチャーで体験しましょう。このゆったりとした少人数ツアーでは、自然の熱帯雨林の小川に生息する、普段は姿を見せない野生のカモノハシを観察する貴重な機会と、ケープ・ヒルズボロ・ビーチでカンガルーやワラビーと共に迎える日の出をお楽しみいただけます。 自然愛好家や野生動物ファンに最適な本ツアーでは、快適なキャビン宿泊、ガイド付き自然散策、本格的な地元料理を組み合わせつつ、環境への負荷を抑えたエコフレンドリーな体験を保証します。,2日間1泊,宿泊施設または港,午前10時,A$625,,快適なキャビン宿泊施設ガイド付き自然散策本場の郷土料理と温かいおもてなし新鮮な地元食材を使った食事・軽食、キャンプスタイルBBQディナー12人乗りエコツアー車両での移動少人数グループと環境に配慮した体験オーストラリア・エコツーリズム協会認定エコ認証取得,自然の熱帯雨林の小川で生息するワイルドなカモノハシを観察ケープヒルズボロビーチでカンガルーやワラビーと共に迎える日の出自然に囲まれたキャビンでの宿泊経験豊富な現地ガイドによる自然散策と野生生物解説新型12人乗りエコツアー車両での快適な移動少人数グループと環境に配慮した体験 – エコ認証取得,,,https://www.airlieadventuretours.com.au/ecowildlifetwodaytour,https://www.airlieadventuretours.com.au/ecowildlifetwodaytour,,,,,TRUE,https://www.airlieadventuretours.com.au/ecowildlifetwodaytour,,,2.0,multi_day,land,Airlie Beach,"adventure,relaxation,small-group",general,relaxed,,,全年齢対象,自然愛好家や野生生物愛好家が求める、リラックスしたエコフレンドリーな冒険,data/airlieadventuretours/en/tours_airlieadventuretours_cleaned_with_media.csv
e6eb79dbf585eb37,エアリー・アドベンチャー・ツアーズ – 美しいボーウェンビーチ日帰りツアー（エアリービーチ／ウィットサンデーズ発）,airlieadventuretours,,エアリーアドベンチャーツアーズで、ボーウェンの象徴的なビーチの息をのむ美しさを体験してください。エアリービーチ発のこのゆったりとした日帰りツアーは、風光明媚な海岸線、地元の文化、そして美味しいシーフードを完璧に融合させています。のんびりしながらも思い出に残る逃避行を求める方に理想的なこのツアーでは、有名なビッグマンゴーやフラッグスタッフヒル展望台など、ボーウェンの隠れた名所へご案内します。 ビーチ散策や写真撮影、地元シーフードの試食にたっぷり時間を割いたこのツアーは、熱帯北クイーンズランドでのくつろぎと発見に満ちた一日をお約束します。,6時間,宿泊施設または港,午前10時,A$155,A$125,快適な移動親切なガイドバーズ・フィッシュ・バーの海老料理フラッグスタッフ・ヒル展望台で味わうイエローグレンのスパークリングワインフラッグスタッフ・ヒル展望台で楽しむチーズ、ベリー、軽食,象徴的なビッグマンゴーを訪れよう美しいボーウェンのビーチを探索しようバーズ・フィッシュ・バーで地元のシーフードを味わおうボーウェンの第二次大戦カタリナ機の歴史を学ぼうフラッグスタッフ・ヒル展望台でゴールデンアワーの景色を体験しよう,,8.0,https://www.airlieadventuretours.com.au/beautifulbowenbeaches,https://www.airlieadventuretours.com.au/beautifulbowenbeaches,,,,,TRUE,https://www.airlieadventuretours.com.au/beautifulbowenbeaches,,,,full_day,combo,"Airlie Beach,Bowen","adventure,relaxation,sunset",general,adventurous,"**第1スポット：** ビッグ・マンゴー – ボーウェンの象徴的な写真スポット**第2スポット：** 美しいボーウェンのビーチ – 入り江、岬、透き通る海**第3スポット：** バードズ・フィッシュ・バー – フィッシャーマンズ・ワーフのシーフード（エビは当店サービス）
**第4のスポット：** カタリナ展示 – ボーウェンの第二次世界大戦水上機物語**第5のスポット：** フラッグスタッフヒル展望台 – 夕焼けの景色とシャンパン、軽食を楽しみながら",,,海岸の美しさと地元の文化、そしてゆったりとした探索を兼ね備えた旅を求める旅行者。,data/airlieadventuretours/en/tours_airlieadventuretours_cleaned_with_media.csv
0452bd1c81f6460e,日の出の浜辺のカンガルー,airlieadventuretours, エアリービーチ発 エコ認証取得のケープ・ヒルズボロツアー,ケープヒルズボロ国立公園へのエコ認証を受けた夜明けツアーで、オーストラリアの象徴的な瞬間を体験してください。砂浜に最初の光が差し込む中、カンガルーやワラビーが浜辺に姿を現す魔法のような光景を目の当たりにしましょう。このツアーは、手つかずの自然の中で自然とつながりを求める方にぴったりの、静かで忘れられない体験を提供します。カップル、ご家族、一人旅の方、写真愛好家に最適なこのツアーは、オーストラリアの風景の美しさを捉えるユニークな機会を提供します。,8時間,宿泊施設または港,午前三時,A$155,A$105,ホテル送迎（指定エリア）エアコン付きミニバス座席国立公園入場料温かい朝食水ボトルの補充,日の出のビーチでカンガルーやワラビーを観察野生生物を尊重したエコ認証ツアー現地の知識を活かしたガイド付き体験温かい朝食付きケープヒルズボロ国立公園の自然美を体験,,,https://www.airlieadventuretours.com.au/kangaroosatsunrise,https://www.airlieadventuretours.com.au/kangaroosatsunrise,,,,,TRUE,https://www.airlieadventuretours.com.au/kangaroosatsunrise,,,,unknown,combo,Airlie Beach,"adventure,family-friendly,relaxation",family,adventurous,,,,カップル、家族連れ、一人旅の方、写真家、そして自然環境の中でユニークな野生動物体験を求めるすべての方々。,data/airlieadventuretours/en/tours_airlieadventuretours_cleaned_with_media.csv
