id,name,company_name,summary,description,duration,departure_location,departure_times,price_adult,price_child,includes,highlights,keywords,duration_hours,link_booking,link_more_info,phone,image_url,image_urls,commission_rate,active,price_source_url,price_tiers,raw_text,duration_days,duration_category,tour_type,locations,tags,audience,intensity_level,itinerary,menu,age_requirements,ideal_for,video_urls,important_information,what_to_bring,whats_extra,cancellation_policy,booking_connected
62dac13c972c7d5b,Playa de Whitehaven Todo el día,zigzagwhitsundays,,"Disfrute de las Whitsundays con estilo a bordo del Super Flyer, su club de playa flotante por un día. Navegue por las aguas turquesas y sienta la brisa salada al pisar las blancas y puras arenas de sílice de Whitehaven Beach. Esta aventura es perfecta para los amantes de la playa y los que buscan relajarse, con traslados ilimitados entre el barco y la playa, lo que le permitirá explorar a su propio ritmo. Disfrute de un paseo guiado hasta el impresionante Mirador Sur de Whitehaven y saboree un delicioso almuerzo bufé a bordo, convirtiéndolo en un día memorable en una de las playas más emblemáticas del mundo.",Full Day,Coral Sea Marina,,FROM A$229,A$179,"Traslados ilimitados de playa a barco
Almuerzo y aperitivos
Traje Stinger
Paseo guiado al mirador sur de Whitehaven","Traslados ilimitados entre el barco y la playa
Relájese en las blancas arenas de la playa de Whitehaven
Paseo guiado hasta el mirador sur de Whitehaven
Almuerzo buffet a bordo
Bar y tumbonas a bordo
Amplia zona interior con cómodos asientos
Zona sólo para adultos en la cubierta superior
Traslados a la carta para una máxima flexibilidad",,8.0,https://zigzagwhitsundays.com.au/tour-whitehaven-beach-all-day/,https://zigzagwhitsundays.com.au/tour-whitehaven-beach-all-day/,,static/tour_images/zigzagwhitsundays/62dac13c972c7d5b/image_24.jpg,"static/tour_images/zigzagwhitsundays/62dac13c972c7d5b/image_1.jpg,static/tour_images/zigzagwhitsundays/62dac13c972c7d5b/image_2.jpg,static/tour_images/zigzagwhitsundays/62dac13c972c7d5b/image_3.jpg,static/tour_images/zigzagwhitsundays/62dac13c972c7d5b/image_4.jpg,static/tour_images/zigzagwhitsundays/62dac13c972c7d5b/image_6.jpg,static/tour_images/zigzagwhitsundays/62dac13c972c7d5b/image_7.jpg,static/tour_images/zigzagwhitsundays/62dac13c972c7d5b/image_8.jpg,static/tour_images/zigzagwhitsundays/62dac13c972c7d5b/image_9.jpg,static/tour_images/zigzagwhitsundays/62dac13c972c7d5b/image_11.jpg,static/tour_images/zigzagwhitsundays/62dac13c972c7d5b/image_12.jpg,static/tour_images/zigzagwhitsundays/62dac13c972c7d5b/image_13.jpg,static/tour_images/zigzagwhitsundays/62dac13c972c7d5b/image_14.jpg,static/tour_images/zigzagwhitsundays/62dac13c972c7d5b/image_15.jpg,static/tour_images/zigzagwhitsundays/62dac13c972c7d5b/image_17.jpg,static/tour_images/zigzagwhitsundays/62dac13c972c7d5b/image_18.webp,static/tour_images/zigzagwhitsundays/62dac13c972c7d5b/image_19.jpg,static/tour_images/zigzagwhitsundays/62dac13c972c7d5b/image_20.jpg,static/tour_images/zigzagwhitsundays/62dac13c972c7d5b/image_21.jpg,static/tour_images/zigzagwhitsundays/62dac13c972c7d5b/image_22.jpg,static/tour_images/zigzagwhitsundays/62dac13c972c7d5b/image_23.jpg,static/tour_images/zigzagwhitsundays/62dac13c972c7d5b/image_24.jpg,static/tour_images/zigzagwhitsundays/62dac13c972c7d5b/image_25.jpg,static/tour_images/zigzagwhitsundays/62dac13c972c7d5b/image_26.jpg,static/tour_images/zigzagwhitsundays/62dac13c972c7d5b/image_27.jpg,static/tour_images/zigzagwhitsundays/62dac13c972c7d5b/image_28.jpg,static/tour_images/zigzagwhitsundays/62dac13c972c7d5b/image_29.jpg,static/tour_images/zigzagwhitsundays/62dac13c972c7d5b/image_30.jpg,static/tour_images/zigzagwhitsundays/62dac13c972c7d5b/image_31.jpg",,True,https://zigzagwhitsundays.com.au/tour-whitehaven-beach-all-day/,Adult: FROM A$229 | Child (4+): A$179 | Age 1 to 3: Free,,,full_day,combo,"Airlie Beach,Whitehaven","adventure,family-friendly,relaxation,sunset",adults_only,adventurous,,"**Menú:**
- Ensaladas frescas
- Carnes variadas
- Verduras
- Selección de aperitivos",Todas las edades son bienvenidas,"Amantes de la playa, familias y quienes buscan un día de relax en las Whitsundays",,"['Los niños de 1 a 3 años entran gratis', 'Los niños a partir de 4 años necesitan entrada']","['Cámara', 'Protector solar', 'Botella de agua reutilizable']","['Experiencia de snorkel - No incluida en este billete', 'Bar a bordo (de pago a bordo)', 'Máquina de café (de pago a bordo)']",reembolso del 100% hasta 24 horas antes de la salida.,0
de74cd397dbf3da3,Super Flyer Whitehaven Beach Plus Snorkel,zigzagwhitsundays,,"Viva las Whitsundays como nunca a bordo del Super Flyer, un club de playa flotante diseñado para la aventura y la relajación. Esta excursión combina la emoción de bucear en vibrantes arrecifes de coral con la serena belleza de las arenas de sílice puro de Whitehaven Beach. Perfecta para familias, parejas y aventureros en solitario, esta excursión ofrece traslados ilimitados entre el barco y la playa, permitiéndole explorar a su propio ritmo. Con cómodos asientos, un bar a bordo y tumbonas, el Super Flyer garantiza un día memorable lleno de sol, mar e impresionantes paisajes.",Full Day,Coral Sea Marina,,FROM A$259,FROM A$199,"Snorkel en los arrecifes de coral de las islas Whitsunday
Traslados ilimitados entre el barco y Whitehaven Beach
Almuerzo y aperitivos a bordo
Traje Stinger y equipo de snorkel
Paseos guiados y aventuras de snorkel
Acceso a tumbonas en el barco
Bar y cafetera a bordo (pago a bordo)","Navegue por las aguas turquesas de las Whitsundays
Visite la emblemática playa de Whitehaven, con sus arenas de sílice blanco puro
Aventura de snorkel en un arrecife de coral conocido por su vibrante vida marina
Traslados ilimitados a la carta entre el barco y la playa
Amplias y cómodas zonas de asientos en el Super Flyer
Zona exclusiva para adultos en la cubierta superior
Barco dedicado al snorkel para acceder fácilmente a los arrecifes de coral",,8.0,https://zigzagwhitsundays.com.au/tour-whitehaven-beach-plus-snorkelling/,https://zigzagwhitsundays.com.au/tour-whitehaven-beach-plus-snorkelling/,,static/tour_images/zigzagwhitsundays/de74cd397dbf3da3/image_23.jpg,"static/tour_images/zigzagwhitsundays/de74cd397dbf3da3/image_1.jpg,static/tour_images/zigzagwhitsundays/de74cd397dbf3da3/image_2.jpg,static/tour_images/zigzagwhitsundays/de74cd397dbf3da3/image_3.jpg,static/tour_images/zigzagwhitsundays/de74cd397dbf3da3/image_4.jpg,static/tour_images/zigzagwhitsundays/de74cd397dbf3da3/image_5.jpg,static/tour_images/zigzagwhitsundays/de74cd397dbf3da3/image_7.jpg,static/tour_images/zigzagwhitsundays/de74cd397dbf3da3/image_8.jpg,static/tour_images/zigzagwhitsundays/de74cd397dbf3da3/image_9.jpg,static/tour_images/zigzagwhitsundays/de74cd397dbf3da3/image_10.jpg,static/tour_images/zigzagwhitsundays/de74cd397dbf3da3/image_12.jpg,static/tour_images/zigzagwhitsundays/de74cd397dbf3da3/image_13.jpg,static/tour_images/zigzagwhitsundays/de74cd397dbf3da3/image_14.jpg,static/tour_images/zigzagwhitsundays/de74cd397dbf3da3/image_15.jpg,static/tour_images/zigzagwhitsundays/de74cd397dbf3da3/image_17.jpg,static/tour_images/zigzagwhitsundays/de74cd397dbf3da3/image_18.webp,static/tour_images/zigzagwhitsundays/de74cd397dbf3da3/image_19.jpg,static/tour_images/zigzagwhitsundays/de74cd397dbf3da3/image_20.jpg,static/tour_images/zigzagwhitsundays/de74cd397dbf3da3/image_21.jpg,static/tour_images/zigzagwhitsundays/de74cd397dbf3da3/image_22.jpg,static/tour_images/zigzagwhitsundays/de74cd397dbf3da3/image_23.jpg,static/tour_images/zigzagwhitsundays/de74cd397dbf3da3/image_24.jpg,static/tour_images/zigzagwhitsundays/de74cd397dbf3da3/image_25.jpg,static/tour_images/zigzagwhitsundays/de74cd397dbf3da3/image_26.jpg,static/tour_images/zigzagwhitsundays/de74cd397dbf3da3/image_27.jpg,static/tour_images/zigzagwhitsundays/de74cd397dbf3da3/image_28.jpg,static/tour_images/zigzagwhitsundays/de74cd397dbf3da3/image_29.jpg,static/tour_images/zigzagwhitsundays/de74cd397dbf3da3/image_30.jpg,static/tour_images/zigzagwhitsundays/de74cd397dbf3da3/image_31.jpg,static/tour_images/zigzagwhitsundays/de74cd397dbf3da3/image_32.jpg,static/tour_images/zigzagwhitsundays/de74cd397dbf3da3/image_33.jpg,static/tour_images/zigzagwhitsundays/de74cd397dbf3da3/image_34.jpg",,True,https://zigzagwhitsundays.com.au/tour-whitehaven-beach-plus-snorkelling/,Adult (15+): A$259 | Child (4-14): A$199 | Infant (3 and under): Free,,,full_day,combo,"Airlie Beach,Whitehaven,Whitsunday Island","adventure,family-friendly,relaxation,sunset",adults_only,adventurous,,,Todas las edades son bienvenidas,"Familias, parejas, aventureros en solitario y cualquiera que desee explorar las Whitsundays con estilo y comodidad.",,"['Adultos a partir de (15+) $259', 'Niños (de 4 a 14) $199', 'Bebés de 3 meses a 3 gratis', 'Los padres se repartirán en 2 sesiones diferentes de snorkel']","['Cámara', 'Protector solar', 'Botella de agua reutilizable']","['Bar a bordo (de pago a bordo)', 'Máquina de café (de pago a bordo)']",reembolso del 100% hasta 24 horas antes de la salida.,0
