id,name,company_name,summary,description,duration,departure_location,departure_times,price_adult,price_child,includes,highlights,keywords,duration_hours,link_booking,link_more_info,phone,image_url,image_urls,commission_rate,active,price_source_url,price_tiers,raw_text,raw_html
3d594d812e348d63,Half-Day Fishing Trips in the Whitsundays,whitsundayfishingcharters,,,Half Day,,"7:00 am, 7:00 pm",,,,,,,https://www.whitsundayfishingcharters.com.au/half-day-fishing,https://www.whitsundayfishingcharters.com.au/half-day-fishing,,,,,TRUE,https://www.whitsundayfishingcharters.com.au/half-day-fishing,,"=== TOUR START: Half-Day Fishing Trips in the Whitsundays ===
0457 822 553 Book Now Half-Day Fishing Trips in the Whitsundays Contact Us What Our Half-Day Charters Include Experience the best of the Whitsundays with our half-day fishing trips, designed for fun, relaxation, and adventure. Whether you’re a seasoned angler or a first-timer, we provide everything you need to make your time on the water unforgettable. High-Quality Fishing Gear: We provide rods, reels, and tackle so you can focus on reeling in the catch of the day. Expert Guidance: Our experienced crew is on hand to help you every step of the way, no matter your skill level. Refreshments On Board: Enjoy light snacks and drinks to keep you energised throughout your trip. Scenic Locations: Explore the vibrant fishing grounds of the Whitsundays, surrounded by stunning views. Friendly Atmosphere: Our trips are relaxed and welcoming, ensuring a memorable experience for everyone. Ready to join us for an exciting day on the water? Call us to book your half-day fishing trip. Book Now - Morning Book Now - Afternoon Button Fun, Affordable & Flexible Charters Looking for an unforgettable fishing adventure in the Whitsundays without taking up your whole day? At Whitsunday Fishing Charters, our half-day fishing trips are the perfect way to experience the beauty of the region while enjoying a few hours on the water. Whether you’re a seasoned angler or trying fishing for the first time, we cater to all skill levels with expert guidance and plenty of fun. Our half-day trips, available in the morning or afternoon, are designed to explore the vibrant fishing grounds of the Whitsundays. You’ll have the chance to reel in species like Giant Trevally, Queen Fish, and Coral Trout. With high-quality gear, refreshments, and a friendly crew, we make your time on board both seamless and enjoyable. Ready to cast off and create some memories? Call us today at 0457 822 553 to book your half-day fishing adventure! In addition to half-day fishing charters in the Whitsundays, we offer full-day tours , private charters , sightseeing tours and much more. Reach Out Today All-Inclusive Service Custom-Built Charter Boats Optional “Cook Your Catch” Services We Proudly Service Airlie Beach 0457 822 553 Arrange a Fishing Charter in the Whitsundays Get in Touch Site links Fishing Charters Charter Boat Service Areas Arlie Beach Trading Hours Monday 7:00 am - 7:00 pm Tuesday 7:00 am - 7:00 pm Wednesday 7:00 am - 7:00 pm Thursday 7:00 am - 7:00 pm Friday 7:00 am - 7:00 pm Saturday 7:00 am - 7:00 pm Sunday 7:00 am - 7:00 pm Contacts T. 0457 822 553 E. wfc@live.com.au sales@whitsundayfishing.com.au A. Airlie Beach, QLD 4802 ABN. 88 674 526 937 © 2026 | Whitsunday Fishing Charters
0457 822 553 Book Now
Book Now
Half-Day Fishing Trips in the Whitsundays Contact Us What Our Half-Day Charters Include Experience the best of the Whitsundays with our half-day fishing trips, designed for fun, relaxation, and adventure. Whether you’re a seasoned angler or a first-timer, we provide everything you need to make your time on the water unforgettable. High-Quality Fishing Gear: We provide rods, reels, and tackle so you can focus on reeling in the catch of the day. Expert Guidance: Our experienced crew is on hand to help you every step of the way, no matter your skill level. Refreshments On Board: Enjoy light snacks and drinks to keep you energised throughout your trip. Scenic Locations: Explore the vibrant fishing grounds of the Whitsundays, surrounded by stunning views. Friendly Atmosphere: Our trips are relaxed and welcoming, ensuring a memorable experience for everyone. Ready to join us for an exciting day on the water? Call us to book your half-day fishing trip. Book Now - Morning Book Now - Afternoon Button Fun, Affordable & Flexible Charters Looking for an unforgettable fishing adventure in the Whitsundays without taking up your whole day? At Whitsunday Fishing Charters, our half-day fishing trips are the perfect way to experience the beauty of the region while enjoying a few hours on the water. Whether you’re a seasoned angler or trying fishing for the first time, we cater to all skill levels with expert guidance and plenty of fun. Our half-day trips, available in the morning or afternoon, are designed to explore the vibrant fishing grounds of the Whitsundays. You’ll have the chance to reel in species like Giant Trevally, Queen Fish, and Coral Trout. With high-quality gear, refreshments, and a friendly crew, we make your time on board both seamless and enjoyable. Ready to cast off and create some memories? Call us today at 0457 822 553 to book your half-day fishing adventure! In addition to half-day fishing charters in the Whitsundays, we offer full-day tours , private charters , sightseeing tours and much more. Reach Out Today All-Inclusive Service Custom-Built Charter Boats Optional “Cook Your Catch” Services We Proudly Service Airlie Beach
Half-Day Fishing Trips in the Whitsundays Contact Us
Half-Day Fishing Trips in the Whitsundays
Contact Us
What Our Half-Day Charters Include Experience the best of the Whitsundays with our half-day fishing trips, designed for fun, relaxation, and adventure. Whether you’re a seasoned angler or a first-timer, we provide everything you need to make your time on the water unforgettable. High-Quality Fishing Gear: We provide rods, reels, and tackle so you can focus on reeling in the catch of the day. Expert Guidance: Our experienced crew is on hand to help you every step of the way, no matter your skill level. Refreshments On Board: Enjoy light snacks and drinks to keep you energised throughout your trip. Scenic Locations: Explore the vibrant fishing grounds of the Whitsundays, surrounded by stunning views. Friendly Atmosphere: Our trips are relaxed and welcoming, ensuring a memorable experience for everyone. Ready to join us for an exciting day on the water? Call us to book your half-day fishing trip. Book Now - Morning Book Now - Afternoon Button
What Our Half-Day Charters Include
Experience the best of the Whitsundays with our half-day fishing trips, designed for fun, relaxation, and adventure. Whether you’re a seasoned angler or a first-timer, we provide everything you need to make your time on the water unforgettable. High-Quality Fishing Gear: We provide rods, reels, and tackle so you can focus on reeling in the catch of the day. Expert Guidance: Our experienced crew is on hand to help you every step of the way, no matter your skill level. Refreshments On Board: Enjoy light snacks and drinks to keep you energised throughout your trip. Scenic Locations: Explore the vibrant fishing grounds of the Whitsundays, surrounded by stunning views. Friendly Atmosphere: Our trips are relaxed and welcoming, ensuring a memorable experience for everyone. Ready to join us for an exciting day on the water? Call us to book your half-day fishing trip.
• High-Quality Fishing Gear: We provide rods, reels, and tackle so you can focus on reeling in the catch of the day.
High-Quality Fishing Gear:
We provide rods, reels, and tackle so you can focus on reeling in the catch of the day.
• Expert Guidance: Our experienced crew is on hand to help you every step of the way, no matter your skill level.
Expert Guidance:
Our experienced crew is on hand to help you every step of the way, no matter your skill level.
• Refreshments On Board: Enjoy light snacks and drinks to keep you energised throughout your trip.
Refreshments On Board:
Enjoy light snacks and drinks to keep you energised throughout your trip.
• Scenic Locations: Explore the vibrant fishing grounds of the Whitsundays, surrounded by stunning views.
Scenic Locations:
Explore the vibrant fishing grounds of the Whitsundays, surrounded by stunning views.
• Friendly Atmosphere: Our trips are relaxed and welcoming, ensuring a memorable experience for everyone.
Friendly Atmosphere:
Our trips are relaxed and welcoming, ensuring a memorable experience for everyone.
=== TOUR END: Half-Day Fishing Trips in the Whitsundays ===",
9ad7df1b4e580755,Full-Day Fishing Trips in the Whitsundays,whitsundayfishingcharters,,,Full Day,,"7:00 am, 7:00 pm",,,,,,,https://www.whitsundayfishingcharters.com.au/full-day-fishing,https://www.whitsundayfishingcharters.com.au/full-day-fishing,,,,,TRUE,https://www.whitsundayfishingcharters.com.au/full-day-fishing,,"=== TOUR START: Full-Day Fishing Trips in the Whitsundays ===
0457 822 553 Book Now Full-Day Fishing Trips in the Whitsundays Contact Us Experience the Wonders of the Whitsundays The Whitsundays is a world-class destination for fishing enthusiasts, offering unmatched beauty and exceptional fishing opportunities. With stunning landscapes and abundant marine life, it’s the perfect place to cast a line and create lasting memories. With our full-day charter, you will experience: Rich Marine Biodiversity: The waters are home to an incredible variety of fish species, including Coral Trout, Giant Trevally, and Spanish Mackerel. Stunning Scenery: Fishing in the Whitsundays means being surrounded by crystal-clear waters, vibrant coral reefs, and lush islands. Perfect Weather: The region’s warm, sunny climate makes it enjoyable to fish year-round. Great Barrier Reef Access: The Whitsundays provide a gateway to one of the most iconic fishing destinations in the world. Ideal for All Skill Levels: Whether you’re a beginner or an experienced angler, the Whitsundays offers something for everyone. Ready to experience the fishing trip of a lifetime? Contact us today to book your Whitsunday fishing adventure today! Book Now Button The Perfect Experience for Fishing Fanatics Ready for an unforgettable adventure on the water? At Whitsunday Fishing Charters, our full-day fishing trips take you deep into the vibrant fishing grounds of the Great Barrier Reef. Whether you’re a seasoned angler or trying your luck for the first time, this is your chance to connect with nature and reel in prized fish species in one of the world’s most breathtaking locations. Spend a full day soaking in stunning ocean views, exploring prime fishing spots, and enjoying the thrill of catching Giant Trevally, Coral Trout, and more. Our custom-built boats provide a smooth, comfortable ride, and we include everything you need—high-quality gear, refreshments, and expert guidance. It’s the perfect way to combine adventure and relaxation in the Whitsundays. Don’t miss the fishing trip of a lifetime. Call us at 0457 822 553 to book your full-day fishing adventure today. We also run half-day fishing trips , private charters and much more. Get in Touch Spacious 12m Charter Boat Exclusive Access to Prime Fishing Spots Immersive Fishing Experience We Proudly Service Airlie Beach 0457 822 553 Arrange a Fishing Charter in the Whitsundays Get in Touch Site links Fishing Charters Charter Boat Service Areas Arlie Beach Trading Hours Monday 7:00 am - 7:00 pm Tuesday 7:00 am - 7:00 pm Wednesday 7:00 am - 7:00 pm Thursday 7:00 am - 7:00 pm Friday 7:00 am - 7:00 pm Saturday 7:00 am - 7:00 pm Sunday 7:00 am - 7:00 pm Contacts T. 0457 822 553 E. wfc@live.com.au sales@whitsundayfishing.com.au A. Airlie Beach, QLD 4802 ABN. 88 674 526 937 © 2026 | Whitsunday Fishing Charters
0457 822 553 Book Now
Book Now
Full-Day Fishing Trips in the Whitsundays Contact Us Experience the Wonders of the Whitsundays The Whitsundays is a world-class destination for fishing enthusiasts, offering unmatched beauty and exceptional fishing opportunities. With stunning landscapes and abundant marine life, it’s the perfect place to cast a line and create lasting memories. With our full-day charter, you will experience: Rich Marine Biodiversity: The waters are home to an incredible variety of fish species, including Coral Trout, Giant Trevally, and Spanish Mackerel. Stunning Scenery: Fishing in the Whitsundays means being surrounded by crystal-clear waters, vibrant coral reefs, and lush islands. Perfect Weather: The region’s warm, sunny climate makes it enjoyable to fish year-round. Great Barrier Reef Access: The Whitsundays provide a gateway to one of the most iconic fishing destinations in the world. Ideal for All Skill Levels: Whether you’re a beginner or an experienced angler, the Whitsundays offers something for everyone. Ready to experience the fishing trip of a lifetime? Contact us today to book your Whitsunday fishing adventure today! Book Now Button The Perfect Experience for Fishing Fanatics Ready for an unforgettable adventure on the water? At Whitsunday Fishing Charters, our full-day fishing trips take you deep into the vibrant fishing grounds of the Great Barrier Reef. Whether you’re a seasoned angler or trying your luck for the first time, this is your chance to connect with nature and reel in prized fish species in one of the world’s most breathtaking locations. Spend a full day soaking in stunning ocean views, exploring prime fishing spots, and enjoying the thrill of catching Giant Trevally, Coral Trout, and more. Our custom-built boats provide a smooth, comfortable ride, and we include everything you need—high-quality gear, refreshments, and expert guidance. It’s the perfect way to combine adventure and relaxation in the Whitsundays. Don’t miss the fishing trip of a lifetime. Call us at 0457 822 553 to book your full-day fishing adventure today. We also run half-day fishing trips , private charters and much more. Get in Touch Spacious 12m Charter Boat Exclusive Access to Prime Fishing Spots Immersive Fishing Experience We Proudly Service Airlie Beach
Full-Day Fishing Trips in the Whitsundays Contact Us
Full-Day Fishing Trips in the Whitsundays
Contact Us
Experience the Wonders of the Whitsundays The Whitsundays is a world-class destination for fishing enthusiasts, offering unmatched beauty and exceptional fishing opportunities. With stunning landscapes and abundant marine life, it’s the perfect place to cast a line and create lasting memories. With our full-day charter, you will experience: Rich Marine Biodiversity: The waters are home to an incredible variety of fish species, including Coral Trout, Giant Trevally, and Spanish Mackerel. Stunning Scenery: Fishing in the Whitsundays means being surrounded by crystal-clear waters, vibrant coral reefs, and lush islands. Perfect Weather: The region’s warm, sunny climate makes it enjoyable to fish year-round. Great Barrier Reef Access: The Whitsundays provide a gateway to one of the most iconic fishing destinations in the world. Ideal for All Skill Levels: Whether you’re a beginner or an experienced angler, the Whitsundays offers something for everyone. Ready to experience the fishing trip of a lifetime? Contact us today to book your Whitsunday fishing adventure today! Book Now Button
Experience the Wonders of the Whitsundays
The Whitsundays is a world-class destination for fishing enthusiasts, offering unmatched beauty and exceptional fishing opportunities. With stunning landscapes and abundant marine life, it’s the perfect place to cast a line and create lasting memories. With our full-day charter, you will experience: Rich Marine Biodiversity: The waters are home to an incredible variety of fish species, including Coral Trout, Giant Trevally, and Spanish Mackerel. Stunning Scenery: Fishing in the Whitsundays means being surrounded by crystal-clear waters, vibrant coral reefs, and lush islands. Perfect Weather: The region’s warm, sunny climate makes it enjoyable to fish year-round. Great Barrier Reef Access: The Whitsundays provide a gateway to one of the most iconic fishing destinations in the world. Ideal for All Skill Levels: Whether you’re a beginner or an experienced angler, the Whitsundays offers something for everyone. Ready to experience the fishing trip of a lifetime? Contact us today to book your Whitsunday fishing adventure today!
• Rich Marine Biodiversity: The waters are home to an incredible variety of fish species, including Coral Trout, Giant Trevally, and Spanish Mackerel.
Rich Marine Biodiversity:
The waters are home to an incredible variety of fish species, including Coral Trout, Giant Trevally, and Spanish Mackerel.
• Stunning Scenery: Fishing in the Whitsundays means being surrounded by crystal-clear waters, vibrant coral reefs, and lush islands.
Stunning Scenery:
Fishing in the Whitsundays means being surrounded by crystal-clear waters, vibrant coral reefs, and lush islands.
=== TOUR END: Full-Day Fishing Trips in the Whitsundays ===",
8ecc63dede6171fa,Sunset Charters in the Whitsundays,whitsundayfishingcharters,,,Half Day,Airlie Beach,"7:00 am, 7:00 pm",$1250,,,,,,https://www.whitsundayfishingcharters.com.au/sunset-charters,https://www.whitsundayfishingcharters.com.au/sunset-charters,,,,,TRUE,https://www.whitsundayfishingcharters.com.au/sunset-charters,,"=== TOUR START: Sunset Charters in the Whitsundays ===
0457 822 553 Book Now Sunset Charters in the Whitsundays Contact Us Why Book a Sunset Charter? Experience the magic of the Whitsundays with our unforgettable sunset charters. Whether you’re seeking relaxation, breathtaking views, or a unique way to celebrate, our sunset charters offer the perfect way to end your day. Here are just a few reasons to book a sunset charter in the Whitsundays: Stunning Scenery: Enjoy the vibrant colours of the sunset over the Whitsundays’ picturesque islands. Relaxing Atmosphere: Unwind in the tranquil surroundings of calm waters and peaceful skies. Perfect for Any Occasion: Celebrate special moments with loved ones or simply treat yourself to a serene escape. Onboard Refreshments : Sip on some bubbly and enjoy light snacks as you soak in the view. Unforgettable Memories: Capture incredible photos and create lasting memories of your time on the water. ﻿ Ready to make your evening truly special? Contact us today to book your sunset charter and experience the beauty of the Whitsundays. Pricing From AUD $1250 Book Now Button The Perfect Way to End the Day! What could be better than ending your day with the stunning views of a sunset over the Whitsundays? At Whitsunday Fishing Charters, our sunset charters in the Whitsundays offer a relaxing and picturesque evening on the water, perfect for couples, families, or groups. Sip on refreshing drinks while taking in the breathtaking scenery as the sun dips below the horizon. Our sunset charters are designed to provide a peaceful and memorable experience for everyone. Whether you’re celebrating a special occasion or simply unwinding after a day of exploration, this tranquil journey showcases the natural beauty of the Whitsundays. With our friendly crew and comfortable boats, you’ll enjoy every moment of this magical experience. Whether you want to enjoy a spot of sunset fishing or just relax and take in the atmosphere, we'll exceed your expectations. Ready to experience the perfect end to your day? Call us at 0457 822 553 to book your sunset charter in the Whitsundays today. Our dedicated crew will make sure your experience is truly unforgettable. Get in Touch Scenic Sunset Views Relaxed, Laid-Back Atmosphere Refreshments Provided Onboard We Proudly Service Airlie Beach 0457 822 553 Arrange a Fishing Charter in the Whitsundays Get in Touch Site links Fishing Charters Charter Boat Service Areas Arlie Beach Trading Hours Monday 7:00 am - 7:00 pm Tuesday 7:00 am - 7:00 pm Wednesday 7:00 am - 7:00 pm Thursday 7:00 am - 7:00 pm Friday 7:00 am - 7:00 pm Saturday 7:00 am - 7:00 pm Sunday 7:00 am - 7:00 pm Contacts T. 0457 822 553 E. wfc@live.com.au sales@whitsundayfishing.com.au A. Airlie Beach, QLD 4802 ABN. 88 674 526 937 © 2026 | Whitsunday Fishing Charters
0457 822 553 Book Now
Book Now
Sunset Charters in the Whitsundays Contact Us Why Book a Sunset Charter? Experience the magic of the Whitsundays with our unforgettable sunset charters. Whether you’re seeking relaxation, breathtaking views, or a unique way to celebrate, our sunset charters offer the perfect way to end your day. Here are just a few reasons to book a sunset charter in the Whitsundays: Stunning Scenery: Enjoy the vibrant colours of the sunset over the Whitsundays’ picturesque islands. Relaxing Atmosphere: Unwind in the tranquil surroundings of calm waters and peaceful skies. Perfect for Any Occasion: Celebrate special moments with loved ones or simply treat yourself to a serene escape. Onboard Refreshments : Sip on some bubbly and enjoy light snacks as you soak in the view. Unforgettable Memories: Capture incredible photos and create lasting memories of your time on the water. ﻿ Ready to make your evening truly special? Contact us today to book your sunset charter and experience the beauty of the Whitsundays. Pricing From AUD $1250 Book Now Button The Perfect Way to End the Day! What could be better than ending your day with the stunning views of a sunset over the Whitsundays? At Whitsunday Fishing Charters, our sunset charters in the Whitsundays offer a relaxing and picturesque evening on the water, perfect for couples, families, or groups. Sip on refreshing drinks while taking in the breathtaking scenery as the sun dips below the horizon. Our sunset charters are designed to provide a peaceful and memorable experience for everyone. Whether you’re celebrating a special occasion or simply unwinding after a day of exploration, this tranquil journey showcases the natural beauty of the Whitsundays. With our friendly crew and comfortable boats, you’ll enjoy every moment of this magical experience. Whether you want to enjoy a spot of sunset fishing or just relax and take in the atmosphere, we'll exceed your expectations. Ready to experience the perfect end to your day? Call us at 0457 822 553 to book your sunset charter in the Whitsundays today. Our dedicated crew will make sure your experience is truly unforgettable. Get in Touch Scenic Sunset Views Relaxed, Laid-Back Atmosphere Refreshments Provided Onboard We Proudly Service Airlie Beach
Sunset Charters in the Whitsundays Contact Us
Sunset Charters in the Whitsundays
Contact Us
Why Book a Sunset Charter? Experience the magic of the Whitsundays with our unforgettable sunset charters. Whether you’re seeking relaxation, breathtaking views, or a unique way to celebrate, our sunset charters offer the perfect way to end your day. Here are just a few reasons to book a sunset charter in the Whitsundays: Stunning Scenery: Enjoy the vibrant colours of the sunset over the Whitsundays’ picturesque islands. Relaxing Atmosphere: Unwind in the tranquil surroundings of calm waters and peaceful skies. Perfect for Any Occasion: Celebrate special moments with loved ones or simply treat yourself to a serene escape. Onboard Refreshments : Sip on some bubbly and enjoy light snacks as you soak in the view. Unforgettable Memories: Capture incredible photos and create lasting memories of your time on the water. ﻿ Ready to make your evening truly special? Contact us today to book your sunset charter and experience the beauty of the Whitsundays. Pricing From AUD $1250 Book Now Button
Why Book a Sunset Charter?
Experience the magic of the Whitsundays with our unforgettable sunset charters. Whether you’re seeking relaxation, breathtaking views, or a unique way to celebrate, our sunset charters offer the perfect way to end your day. Here are just a few reasons to book a sunset charter in the Whitsundays: Stunning Scenery: Enjoy the vibrant colours of the sunset over the Whitsundays’ picturesque islands. Relaxing Atmosphere: Unwind in the tranquil surroundings of calm waters and peaceful skies. Perfect for Any Occasion: Celebrate special moments with loved ones or simply treat yourself to a serene escape. Onboard Refreshments : Sip on some bubbly and enjoy light snacks as you soak in the view. Unforgettable Memories: Capture incredible photos and create lasting memories of your time on the water. ﻿ Ready to make your evening truly special? Contact us today to book your sunset charter and experience the beauty of the Whitsundays.
• Stunning Scenery: Enjoy the vibrant colours of the sunset over the Whitsundays’ picturesque islands.
Stunning Scenery:
Enjoy the vibrant colours of the sunset over the Whitsundays’ picturesque islands.
• Relaxing Atmosphere: Unwind in the tranquil surroundings of calm waters and peaceful skies.
Relaxing Atmosphere:
Unwind in the tranquil surroundings of calm waters and peaceful skies.
• Perfect for Any Occasion: Celebrate special moments with loved ones or simply treat yourself to a serene escape.
Perfect for Any Occasion:
Celebrate special moments with loved ones or simply treat yourself to a serene escape.
• Onboard Refreshments : Sip on some bubbly and enjoy light snacks as you soak in the view.
Onboard Refreshments
: Sip on some bubbly and enjoy light snacks as you soak in the view.
=== TOUR END: Sunset Charters in the Whitsundays ===",
