id,name,company_name,summary,description,duration,departure_location,departure_times,price_adult,price_child,includes,highlights,keywords,duration_hours,link_booking,link_more_info,phone,image_url,image_urls,commission_rate,active,price_source_url,price_tiers,raw_text,raw_html
2cd86c2c9772ee16,Let The Sea Set You Free,whitsundaybullet,,,8 Hours,,,$20,,,,,,https://whitsundaybullet.com.au/,https://whitsundaybullet.com.au/,,,,,TRUE,https://whitsundaybullet.com.au/,,"=== TOUR START: Let The Sea Set You Free ===
Let The Sea Set You Free
8 hours of fun, activity & adventure!
Experience the very best of the Whitsundays on board this premium and beloved day tour!
is a fast power catamaran in the Whitsundays and is here to take you on the ride of your life!
The ultimate day trip that includes North and South Whitehaven Beach
Snorkel in the colourful fringing reefs of the Great Barrier Reef Marine Park
Visit Hill Inlet Lookout for the best views of the swirling silica sands
Cruise along at a speedy 25 knots, maximising your time to explore
Buffet lunch, wetsuits, snorkel gear, and paddleboards included
Please note that on public holidays, a $20 per adult and $10 per child surcharge applies to all tickets. Please see our
for more information on which dates this surcharge applies to.
=== TOUR END: Let The Sea Set You Free ===
[ALL PRICE LINES FOUND IN HTML:]
Please note that on public holidays, a $20 per adult and $10 per child surcharge applies to all tickets. Please see our","<body class=""mat-typography"">
<app-root _nghost-ng-c3528527526="""" ng-version=""16.2.10""><app-navigation _ngcontent-ng-c3528527526="""" _nghost-ng-c322009741=""""><directs-base-navigation _ngcontent-ng-c322009741="""" _nghost-ng-c3307073647="""" class=""ng-tns-c3307073647-0""><div _ngcontent-ng-c3307073647="""" class=""nav-wrapper ng-tns-c3307073647-0""><div _ngcontent-ng-c3307073647="""" class=""flex flex-col w-full z-50 absolute ng-tns-c3307073647-0 ng-star-inserted""><mat-toolbar _ngcontent-ng-c3307073647="""" class=""mat-toolbar !h-10 !py-6 ng-tns-c3307073647-0 mat-primary mat-toolbar-single-row"" color=""primary""><div _ngcontent-ng-c3307073647="""" class=""w-full items-center flex justify-between font-accent""><span _ngcontent-ng-c3307073647="""" class=""ng-tns-c3307073647-0""><img _ngcontent-ng-c3307073647="""" alt=""Whitsunday Bullet Main Website Logo"" class=""h-4 nav-logo ng-tns-c3307073647-0"" src=""https://s3.ap-southeast-2.amazonaws.com/sailing-withsundays.com/images/websites/Whitsunday_Bullet_logo.jpg""/></span><div _ngcontent-ng-c3307073647="""" class=""ng-tns-c3307073647-0""><!-- --><!-- --></div></div></mat-toolbar><mat-toolbar _ngcontent-ng-c3307073647="""" class=""mat-toolbar flex flex-row items-center navBar uppercase ng-tns-c3307073647-0 mat-toolbar-single-row""><div _ngcontent-ng-c3307073647="""" class=""ng-tns-c3307073647-0 ng-star-inserted""><a _ngcontent-ng-c3307073647="""" class=""linkNoDecoration ng-tns-c3307073647-0 ng-star-inserted"" href=""/""><span _ngcontent-ng-c3307073647="""" class=""ng-tns-c3307073647-0""> Homepage </span></a><!-- --><!-- --><!-- --></div><!-- --><div _ngcontent-ng-c3307073647="""" class=""ng-tns-c3307073647-0 ng-star-inserted""><a _ngcontent-ng-c3307073647="""" class=""linkNoDecoration ng-tns-c3307073647-0 ng-star-inserted"" href=""/itinerary""><span _ngcontent-ng-c3307073647="""" class=""ng-tns-c3307073647-0""> Itinerary </span></a><!-- --><!-- --><!-- --></div><!-- --><div _ngcontent-ng-c3307073647="""" class=""ng-tns-c3307073647-0 ng-star-inserted""><a _ngcontent-ng-c3307073647="""" class=""linkNoDecoration ng-tns-c3307073647-0 ng-star-inserted"" href=""/menu""><span _ngcontent-ng-c3307073647="""" class=""ng-tns-c3307073647-0""> Menu </span></a><!-- --><!-- --><!-- --></div><!-- --><div _ngcontent-ng-c3307073647="""" class=""ng-tns-c3307073647-0 ng-star-inserted""><a _ngcontent-ng-c3307073647="""" class=""linkNoDecoration ng-tns-c3307073647-0 ng-star-inserted"" href=""/faq""><span _ngcontent-ng-c3307073647="""" class=""ng-tns-c3307073647-0""> FAQ </span></a><!-- --><!-- --><!-- --></div><!-- --><div _ngcontent-ng-c3307073647="""" class=""ng-tns-c3307073647-0 ng-star-inserted""><a _ngcontent-ng-c3307073647="""" class=""linkNoDecoration ng-tns-c3307073647-0 ng-star-inserted"" href=""/vessel""><span _ngcontent-ng-c3307073647="""" class=""ng-tns-c3307073647-0""> Vessel </span></a><!-- --><!-- --><!-- --></div><!-- --><div _ngcontent-ng-c3307073647="""" class=""ng-tns-c3307073647-0 ng-star-inserted""><a _ngcontent-ng-c3307073647="""" class=""linkNoDecoration ng-tns-c3307073647-0 ng-star-inserted"" href=""/gallery""><span _ngcontent-ng-c3307073647="""" class=""ng-tns-c3307073647-0""> Gallery </span></a><!-- --><!-- --><!-- --></div><!-- --><div _ngcontent-ng-c3307073647="""" class=""ng-tns-c3307073647-0 ng-star-inserted""><a _ngcontent-ng-c3307073647="""" class=""linkNoDecoration ng-tns-c3307073647-0 ng-star-inserted"" href=""/reviews""><span _ngcontent-ng-c3307073647="""" class=""ng-tns-c3307073647-0""> Reviews </span></a><!-- --><!-- --><!-- --></div><!-- --><div _ngcontent-ng-c3307073647="""" class=""ng-tns-c3307073647-0 ng-star-inserted""><a _ngcontent-ng-c3307073647="""" class=""linkNoDecoration ng-tns-c3307073647-0 ng-star-inserted"" href=""/contact""><span _ngcontent-ng-c3307073647="""" class=""ng-tns-c3307073647-0""> Contact </span></a><!-- --><!-- --><!-- --></div><!-- --><div _ngcontent-ng-c3307073647="""" class=""ng-tns-c3307073647-0 last-nav ng-star-inserted""><a _ngcontent-ng-c3307073647="""" class=""linkNoDecoration ng-tns-c3307073647-0 ng-star-inserted"" href=""/availability""><span _ngcontent-ng-c3307073647="""" class=""ng-tns-c33070"
