id,name,company_name,summary,description,duration,departure_location,departure_times,price_adult,price_child,includes,highlights,keywords,duration_hours,link_booking,link_more_info,phone,image_url,image_urls,commission_rate,active,price_source_url,price_tiers,raw_text,raw_html
0452bd1c81f6460e,Kangaroos on the Beach at Sunrise — Eco-Certified Cape Hillsborough Tour from Airlie Beach (Whitsundays),airlieadventuretours,,See wild kangaroos at sunrise on a guided eco-certified tour from Airlie Beach to Cape Hillsborough. Includes a classic Drover’s breakfast by the beach; optional café stop at own expense.,24 Hours,Airlie Beach,,"$,",,,,,,https://www.airlieadventuretours.com.au/kangaroosatsunrise,https://www.airlieadventuretours.com.au/kangaroosatsunrise,,,,,TRUE,https://www.airlieadventuretours.com.au/kangaroosatsunrise,,"=== TOUR START: Kangaroos on the Beach at Sunrise — Eco-Certified Cape Hillsborough Tour from Airlie Beach (Whitsundays) ===
top of page Kangaroos on the Beach at Sunrise — Eco-Certified Cape Hillsborough Tour from Airlie Beach (Whitsundays) ​ If you’re searching for a truly iconic, pinch-me Australian moment, kangaroos on the beach at sunrise is the one. This eco-certified dawn tour departs from Airlie Beach / the Whitsundays, Queensland and takes you to the legendary coastline of Cape Hillsborough National Park, where the day begins in soft pastel light and the shoreline comes alive with wildlife. There are plenty of great things to do in Airlie Beach—but kangaroos on the beach at sunrise is the kind of experience people talk about for years. As the first light spills across the sand, you’ll have the chance to witness wild kangaroos and wallabies emerging from the grassy edges and moving onto the beach. It’s quiet, natural, and unforgettable—one of Queensland’s most photographed sunrise scenes, and for good reason. ​ Why Cape Hillsborough is so special ​ Cape Hillsborough National Park is famous for its rugged headlands, calm bays, and sweeping views across the Coral Sea. But what makes it bucket-list famous is the rare chance to see kangaroos on the beach at sunrise in a setting that still feels wild and untouched. The combination of coastal forest, open sand, and early-morning calm creates ideal conditions for animals to move down to the shoreline. ​ This isn’t a zoo, a staged show, or a fenced encounter. Kangaroos on the beach at sunrise happen in nature, on nature’s schedule—making the moment feel even more real. Your guide will help you understand the area, point out wildlife signs, and share local knowledge so you get more than just a photo—you get the story behind the place. ​ ​ Cancel up to 24 hours before departure time for a full refund. What the morning feels like ​ Your adventure begins pre-dawn with a comfortable pickup in Airlie Beach and surrounding areas. With your seat on an air-conditioned minibus, you can relax on the drive, watch the sky begin to change colour, and feel the anticipation build. The goal is simple: arrive in time for kangaroos on the beach at sunrise, when the light is at its most magical and the beach is at its quietest. When you reach Cape Hillsborough, you’ll step into cool morning air and the gentle sound of waves. Your guide will lead you to the best viewing areas and help you move calmly and respectfully so the animals remain comfortable. This is where kangaroos on the beach at sunrise becomes more than a phrase—it becomes a full-sensory experience: the glow on the horizon, the silhouettes on the sand, the stillness that makes every movement feel special. You’ll have time to take photos, soak it in, and simply be present. Some guests love capturing wide scenic shots, while others prefer close-in moments (always from a respectful distance). Either way, kangaroos on the beach at sunrise offer a rare kind of beauty—natural, unhurried, and deeply “Australian.” ​ A hot breakfast, made even better by the sunrise ​ After the wildlife viewing, it’s time to warm up and refuel. A hot breakfast is provided, and it tastes even better after an early start. Whether you’re a coffee-first person, a hungry adventurer, or travelling with kids who need a morning boost, the breakfast inclusion makes the whole experience feel easy and complete. It’s one thing to tick off kangaroos on the beach at sunrise; it’s another to follow it with a satisfying, hearty meal while you relive the best moments and scroll through your photos. The pace stays relaxed—no rushing, no pressure—just a comfortable, well-planned morning that balances adventure with enjoyment. ​ Eco-certified and wildlife-respectful ​ This tour is designed to deliver kangaroos on the beach at sunrise in a way that is calm, respectful, and aligned with eco-certified principles. Wildlife encounters are most meaningful when animals can behave naturally, without being chased, crowded, or disturbed. Your guide will share simple viewing guidelines—like moving slowly, staying quiet, and giving animals space—so everyone gets a better experience, including the wildlife. Choosing an eco-certified tour also means you’re supporting responsible tourism in the Whitsundays region. Kangaroos on the beach at sunrise is a privilege, and our approach is built around protecting that privilege—so future travellers can experience it too. ​ Wildlife and weather: the real, honest version ​ Because this is a wild environment, sightings can vary. Kangaroos and wallabies are not guaranteed every single day, and sunrise conditions change with weather, cloud cover, and seasonal patterns. That said, many guests find that the unpredictability is part of the magic: every morning looks different, and every visit to kangaroos on the beach at sunrise feels uniquely your own. Your guide will do everything possible to maximise your chances—timing, locations, and local know-how make a big difference—while keeping the experience respectful. And even on mornings when wildlife keeps its distance, Cape Hillsborough is still a stunning coastal national park with dramatic headlands, beaches, and a sunrise that can stop you in your tracks. Kangaroos on the beach at sunrise is the headline, but the whole setting is the reason people fall in love with it. ​ What’s included ​ Everything is set up to make your morning simple and comfortable, so you can focus on the experience. Hotel pickup and drop-off (selected areas) Your seat on our air-conditioned minibus Entry to the national park A hot breakfast is provided (included) Water bottle refills It’s an easy, all-in-one way to experience kangaroos on the beach at sunrise without needing to plan a car, navigate in the dark, or guess the best spots. ​ What to bring ​ To make the most of your morning, we recommend bringing: A refillable water bottle A light rain jacket (especially in the wet season) Swimmers and a towel (if you’d like a quick dip and conditions allow) Personal insect repellent A camera or phone for photos Your sense of fun and adventure ​ A little preparation goes a long way when you’re heading out for kangaroos on the beach at sunrise, especially in the cooler early-morning air. ​ Who this tour is perfect for ​ This experience suits a wide range of travellers: couples chasing an iconic moment, families looking for an easy wildlife adventure, solo travellers who want a safe and social tour option, and photographers seeking that dreamy dawn light. If your wish list includes “wildlife,” “national parks,” and “something uniquely Australian,” kangaroos on the beach at sunrise belongs at the top. It’s also ideal if you’re visiting the Whitsundays and want something beyond the islands—something grounded, local, and deeply connected to Queensland’s natural landscape. bottom of page
top of page
Kangaroos on the Beach at Sunrise — Eco-Certified Cape Hillsborough Tour from Airlie Beach (Whitsundays) ​ If you’re searching for a truly iconic, pinch-me Australian moment, kangaroos on the beach at sunrise is the one. This eco-certified dawn tour departs from Airlie Beach / the Whitsundays, Queensland and takes you to the legendary coastline of Cape Hillsborough National Park, where the day begins in soft pastel light and the shoreline comes alive with wildlife. There are plenty of great things to do in Airlie Beach—but kangaroos on the beach at sunrise is the kind of experience people talk about for years. As the first light spills across the sand, you’ll have the chance to witness wild kangaroos and wallabies emerging from the grassy edges and moving onto the beach. It’s quiet, natural, and unforgettable—one of Queensland’s most photographed sunrise scenes, and for good reason. ​ Why Cape Hillsborough is so special ​ Cape Hillsborough National Park is famous for its rugged headlands, calm bays, and sweeping views across the Coral Sea. But what makes it bucket-list famous is the rare chance to see kangaroos on the beach at sunrise in a setting that still feels wild and untouched.
=== TOUR END: Kangaroos on the Beach at Sunrise — Eco-Certified Cape Hillsborough Tour from Airlie Beach (Whitsundays) ===",
