id,name,company_name,summary,description,duration,departure_location,departure_times,price_adult,price_child,includes,highlights,keywords,duration_hours,link_booking,link_more_info,phone,image_url,image_urls,commission_rate,active,price_source_url,price_tiers,raw_text,raw_html
52d9fa82cd0dded5,"The Airlie Beach Sightseeing Bus, a Whitsunday Adventure",airlieadventuretours,,"Explore Airlie Beach’s lookouts, landmarks and local hotspots with the Airlie Sightseeing bus. A relaxed, family-friendly way to see the best of town and surrounds.",24 Hours,Airlie Beach,,"$,",,,,,,https://www.airlieadventuretours.com.au/theairliesightseeingbus/,https://www.airlieadventuretours.com.au/theairliesightseeingbus/,,,,,TRUE,https://www.airlieadventuretours.com.au/theairliesightseeingbus/,,"=== TOUR START: The Airlie Beach Sightseeing Bus, a Whitsunday Adventure ===
top of page The Airlie Beach Sightseeing Bus, a Whitsunday Adventure ​ If you’re searching for Airlie Beach Sightseeing that’s easy, fun, and packed with local highlights, this is your perfect day out. The Airlie Beach Sightseeing Bus is an eco-certified, land-based Whitsundays day tour that takes you beyond the lagoon and marinas to experience the mainland’s best bits in one relaxed itinerary—local coffee, rainforest swimming, and an iconic lunch stop. ​ This tour is designed for travellers who want a “little bit of everything” without the stress of driving, planning, or juggling multiple bookings. It’s ideal for first-time visitors, couples, families, and anyone wanting a comfortable, guided day exploring the Whitsundays region from Airlie Beach, Queensland. ​ From the moment you step aboard The Airlie Beach Sightseeing Bus, you’ll enjoy friendly local guiding, air-conditioned comfort, and scenic drives through tropical landscapes—plus plenty of time to take photos, cool off at a freshwater swimming hole, and taste local flavours along the way. ​ Why choose Airlie Beach Sightseeing on our sightseeing bus? ​ There’s a reason Airlie Beach Sightseeing is one of the most searched experiences for Whitsundays visitors: it’s the best way to see more of the region when you’ve only got a short stay. The Airlie Beach Sightseeing Bus brings together three local favourites in one easy day—coffee, rainforest, and a classic Aussie diner—while keeping the pace comfortable and the experience genuinely enjoyable. ​ Whether you’re travelling solo, as a couple, or with the kids, The Airlie Beach Sightseeing Bus makes exploring the mainland simple and fun—no rental car, no navigation, and no timetable stress. You just hop on The Airlie Beach Sightseeing Bus, relax, and enjoy the ride. Cancel up to 24 hours before departure time for a full refund. What you’ll experience Whitsundays Gold Coffee Plantation – local flavour, local stories ​ Your Airlie Beach Sightseeing day begins at the Whitsundays Gold Coffee Plantation, a true local gem where you can learn how coffee is grown and processed in the region. It’s a great “behind the scenes” stop that many visitors don’t expect to find in the Whitsundays—an easygoing, interesting start to the day with plenty of photo moments and time to browse. ​ You’ll discover how local beans become a favourite brew and why this plantation has become a must-visit for travellers who enjoy authentic regional experiences. It’s the kind of stop that turns a standard sightseeing tour into something memorable—local, relaxed, and uniquely Whitsundays. Cedar Creek Falls – rainforest scenery and a freshwater swim spot ​ Next, we head to Cedar Creek Falls, one of the most loved natural swimming spots near Airlie Beach. Tucked into lush rainforest, Cedar Creek is all about that refreshing “escape into nature” feeling—cool creek water, tropical greenery, and a peaceful atmosphere that’s a world away from the busy waterfront. ​ This stop is perfect for: a refreshing dip in a freshwater waterhole scenic rainforest photos an easy nature break on a warm Whitsundays day a taste of the region beyond the islands ​ Good to know: Cedar Creek Falls is most impressive in the wet season or after rain. In drier months, the waterfall may not be flowing unless there’s been recent rainfall—but the waterhole can still be a beautiful place to cool off and enjoy the rainforest setting. ​ George’s Diner – iconic lunch stop (meals available to purchase) ​ After your swim and rainforest break, the Airlie Beach Sightseeing Bus rolls on to an Airlie/Whitsundays classic—George’s Diner. This is a fun, laid-back lunch stop that feels like a proper Aussie road-trip moment. Meals are available to purchase, and many guests go straight for the favourites like a burger and fries to refuel for the rest of the day. It’s a relaxed stop with plenty of character, and a great chance to swap stories with other travellers, grab a cold drink, and enjoy that simple holiday feeling of a day well spent. ​ Tour pace and comfort: easy Airlie Beach Beach Sightseeing for real travellers ​ This isn’t a rushed “hop on, hop off” schedule that leaves you constantly checking the clock. The Airlie Beach Sightseeing experience is built with real holiday pacing in mind—time to enjoy each stop, time for photos, time to swim, and time to unwind. You’ll travel in an air-conditioned minibus, guided by locals who know the area and love sharing it. Along the way, you’ll get helpful commentary—local stories, seasonal tips, and fun facts that turn scenery into something meaningful. Whether you’re travelling as a couple, a family, or solo, this tour is a friendly, easy way to explore the Whitsundays mainland without needing to hire a car. Eco-certified and eco-friendly touring ​ As an eco-certified operator, we’re committed to responsible tourism—especially at natural sites like Cedar Creek Falls. Our approach focuses on: respectful behaviour around nature and wildlife staying on paths and following local site etiquette keeping the experience low-impact and clean encouraging a “leave no trace” mindset supporting local businesses that make the Whitsundays special ​ When you choose The Airlie Beach Sightseeing Bus, you’re supporting a style of tourism that helps protect the places visitors come to enjoy. What you’ll do (quick highlights) ​ Enjoy Airlie Beach Sightseeing on a relaxed, guided day tour Visit Whitsundays Gold Coffee Plantation and learn about local coffee Swim (seasonal) and explore the rainforest surrounds at Cedar Creek Falls Stop for lunch at George’s Diner (meals available to purchase) Take in the Whitsundays scenery with comfortable transport and local guiding What’s included ​ Your seat on our air-conditioned minibus Water bottle refills Travel snacks (lollies, chocolates, popcorn) What to bring ​ Refillable water bottle Money for lunch, alcohol and shopping Towel and swimmers Camera or phone for photos Your sense of fun and adventure Perfect for visitors staying in and around Airlie Beach ​ The Airlie Beach Sightseeing Bus is a great option if you’re based in: Airlie Beach Cannonvale Jubilee Pocket Proserpine / Whitsunday Coast area ​ If you’re short on time in the Whitsundays and want one easy day that covers local flavour, rainforest nature, and iconic stops, The Airlie Beach Sightseeing Bus makes it simple. ​ Book The Airlie Beach Sightseeing Bus – a “little bit of everything” Whitsundays day out ​ The Whitsundays aren’t just islands—there’s a whole mainland side to explore, and this tour is the easiest way to do it. For relaxed, eco-certified Airlie Beach Sightseeing with coffee plantation culture, rainforest swimming at Cedar Creek Falls, and a classic George’s Diner lunch stop, The Airlie Beach Sightseeing Bus is the day trip you’ll be talking about long after you’re home. Hop on, relax, and see the Whitsundays like a local—one scenic stop at a time. bottom of page
top of page
The Airlie Beach Sightseeing Bus, a Whitsunday Adventure ​ If you’re searching for Airlie Beach Sightseeing that’s easy, fun, and packed with local highlights, this is your perfect day out. The Airlie Beach Sightseeing Bus is an eco-certified, land-based Whitsundays day tour that takes you beyond the lagoon and marinas to experience the mainland’s best bits in one relaxed itinerary—local coffee, rainforest swimming, and an iconic lunch stop. ​ This tour is designed for travellers who want a “little bit of everything” without the stress of driving, planning, or juggling multiple bookings. It’s ideal for first-time visitors, couples, families, and anyone wanting a comfortable, guided day exploring the Whitsundays region from Airlie Beach, Queensland.
=== TOUR END: The Airlie Beach Sightseeing Bus, a Whitsunday Adventure ===",
7716e9dfc85b5cc3,Cedar Creek Express Tour from Airlie Beach (Whitsundays),airlieadventuretours,,"Eco-certified half-day tour from Airlie Beach to Cedar Creek Falls. Guided rainforest walk, time to swim in the natural rock pool (seasonal), and scenic countryside driving.",24 Hours,Airlie Beach,,"$,",,,,,,https://www.airlieadventuretours.com.au/cedarcreekexpress,https://www.airlieadventuretours.com.au/cedarcreekexpress,,,,,TRUE,https://www.airlieadventuretours.com.au/cedarcreekexpress,,"=== TOUR START: Cedar Creek Express Tour from Airlie Beach (Whitsundays) ===
top of page Cedar Creek Express Tour from Airlie Beach (Whitsundays) ​ If you’re looking for unforgettable things to do in Airlie Beach that are easy, scenic, and genuinely refreshing, Cedar Creek Express is the perfect half-day nature escape. This relaxed, eco-certified tour whisks you from Airlie Beach (Whitsundays, Queensland) into the lush hinterland to Cedar Creek Falls—a rainforest waterhole and waterfall set in a natural rock amphitheatre, surrounded by tropical greenery and birdlife. ​ In just a few hours, you’ll swap salty air and beach crowds for cool freshwater, rainforest shade, and that “wow, I can’t believe this is so close to town” feeling. Cedar Creek Falls sits roughly halfway between Airlie Beach and Proserpine on Saltwater Creek Road, making it one of the Whitsundays’ easiest and most rewarding nature experiences. ​ Why Cedar Creek Falls is such a lovely spot ​ Cedar Creek Falls is beloved for one simple reason: it’s a true rainforest oasis. Step through the trees, and you’ll find a clear rock pool tucked beneath a cliff line—an amphitheatre of stone where the waterfall spills down when conditions are right. ​ Even when the main cascade is gentle, the place still delivers: cool water, palms and vines, and that peaceful soundtrack of birds, rustling leaves, and running creek water. It’s a “reset button” kind of location—perfect for couples, families, solo travellers, and anyone who wants a nature break without committing to a full-day hike. ​ Cancel up to 24 hours before departure time for a full refund. ​ A little history and “deep time” of the landscape ​ Cedar Creek Falls sits at the edge of the Conway Range / Cape Conway peninsula, part of an area that protects the largest remaining lowland tropical rainforest in Queensland outside Tropical North Queensland. What makes this landscape special isn’t just how green it is—it’s how long it has endured. Queensland Parks notes that the rainforest here has persisted through climate fluctuations over tens of thousands of years, acting as a refuge for wildlife. And if you’ve spent any time on the Whitsunday islands, here’s a fun connection: the vegetation you’ll see around the Conway area is similar to what’s on the islands because rising sea levels thousands of years ago flooded coastal valleys and created the Whitsunday islands. In other words, this rainforest-to-reef region has been shaping itself for a very long time, and Cedar Creek is a beautiful little window into that story. ​ Respect for Country ​ This area is part of Country cared for by the Gia and Ngaro Peoples, with Queensland Parks recognising the deep cultural connection and responsibility Traditional Owners maintain for the Conway Range and surrounding places. ​ What you’ll do on Cedar Creek Express ​ Scenic transfer from Airlie Beach to the falls ​ Relax in air-conditioned comfort as we head out of Airlie Beach and into the green hinterland. Cedar Creek Falls is located between Airlie Beach and Proserpine, so you’re never far from town—yet it feels a world away once you arrive. ​ Guided rainforest time (easy and relaxed) ​ This is not a “march through the bush” tour. It’s a short, easy nature experience with a local guide who shares the little details most visitors miss—why certain plants thrive here, what wildlife to watch for, and how the seasons change the falls. ​ Swim time in the freshwater waterhole ​ Bring your swimmers and towel—this is the moment everyone talks about. The pool is the perfect place to cool down, float, relax on the rocks, or simply sit in the shade and take it all in. ​ Wildlife spotting and photo time ​ Depending on the day, you might see: Colourful butterflies and rainforest insects Birds flitting through the canopy Turtles, fish, and other creek life near the water’s edge ​ Cedar Creek Falls is known for its surrounding tropical flora—white cedar trees, Alexandra palms, wild orchids, and more—so there’s plenty to notice even if you’re not trying to “tick off” wildlife. ​ Morning or afternoon tea ​ A simple, relaxed break that fits the vibe—no rushing, no fuss, just a good snack and a moment to enjoy the rainforest. ​ Why this tour is special (and why guests love it) ​ Eco-certified touring with a nature-first focus (small footprint, big experience) Short and sweet: ideal if you want something amazing without giving up your whole day Fully guided: you’ll get more than just a swim—you’ll understand the place A true Whitsundays local favourite: rainforest freshwater close to Airlie Beach ​ When is Cedar Creek Falls “at its best”? ​ Cedar Creek Falls is famously seasonal. It’s often most spectacular in the wet season or after decent rain, when the waterfall really comes alive. In the drier months, the main cascade may be lighter—but the waterhole remains a gorgeous place to swim and unwind, and the rainforest setting is still worth the trip (especially on a hot Whitsundays day). ​ What’s included Your seat on our air-conditioned minibus Morning or afternoon tea Water bottle refills Travel snacks ​ What to bring Refillable water bottle Towel + swimmers Camera/phone for photos Your sense of fun and adventure Optional but handy: Reef/water shoes (rocks can be slippery) Light rain jacket in the wet season ​ Safety & care for the environment ​ We keep things relaxed, but we also take safety seriously—especially around natural water. A few simple rules help keep everyone safe: Never dive or jump into natural waterways (depth and submerged hazards can change). Supervise children closely near water and follow your guide’s instructions. In North and Central Queensland, it’s smart to stay CrocWise around waterways: keep a sensible distance from the water’s edge, avoid approaching the water unnecessarily, and always follow signs/advice. ​ We also love this place—so we travel gently. Please take all rubbish with you and respect the rainforest so it stays beautiful for future visitors (and the locals who cherish it). ​ Perfect for… Visitors searching “things to do in Airlie Beach” beyond the lagoon and main street Families who want a safe, guided nature outing Couples wanting a scenic, refreshing Whitsundays half-day adventure Anyone keen for a freshwater swim away from beach crowds ​ Ready to book your Cedar Creek escape? ​ If your Whitsundays itinerary needs one easy, beautiful nature moment—this is it. Cedar Creek Express delivers rainforest air, cool, fresh water, and a local-guided experience that feels like a hidden gem (because it kind of is). bottom of page
top of page
Cedar Creek Express Tour from Airlie Beach (Whitsundays) ​ If you’re looking for unforgettable things to do in Airlie Beach that are easy, scenic, and genuinely refreshing, Cedar Creek Express is the perfect half-day nature escape. This relaxed, eco-certified tour whisks you from Airlie Beach (Whitsundays, Queensland) into the lush hinterland to Cedar Creek Falls—a rainforest waterhole and waterfall set in a natural rock amphitheatre, surrounded by tropical greenery and birdlife. ​ In just a few hours, you’ll swap salty air and beach crowds for cool freshwater, rainforest shade, and that “wow, I can’t believe this is so close to town” feeling. Cedar Creek Falls sits roughly halfway between Airlie Beach and Proserpine on Saltwater Creek Road, making it one of the Whitsundays’ easiest and most rewarding nature experiences. ​ Why Cedar Creek Falls is such a lovely spot ​ Cedar Creek Falls is beloved for one simple reason: it’s a true rainforest oasis. Step through the trees, and you’ll find a clear rock pool tucked beneath a cliff line—an amphitheatre of stone where the waterfall spills down when conditions are right. ​ Even when the main cascade is gentle, the place still delivers: cool water, palms and vines, and that peaceful soundtrack of birds, rustling leaves, and running creek water.
=== TOUR END: Cedar Creek Express Tour from Airlie Beach (Whitsundays) ===",
