id,name,company_name,summary,description,duration,departure_location,departure_times,price_adult,price_child,includes,highlights,keywords,duration_hours,link_booking,link_more_info,phone,image_url,image_urls,commission_rate,active,price_source_url,price_tiers,raw_text,duration_days,duration_category,tour_type,locations,tags,audience,intensity_level,itinerary,menu,age_requirements,ideal_for,video_urls,important_information,what_to_bring,whats_extra,cancellation_policy,booking_connected
e417664eb55f9833,Excursion d'une demi-journée sur l'île intérieure pour observer les tortues,saltydog,,"L'excursion d'une demi-journée sur l'île Inner Island Turtle Tour offre une aventure passionnante aux pagayeurs expérimentés comme aux débutants, en mettant l'accent sur l'amusement et le plaisir. Pagayez dans les eaux turquoise de Shute Harbour, en explorant les récifs coralliens et les îles tropicales voisines. Découvrez une étonnante diversité d'espèces marines et d'oiseaux, notamment des tortues de mer et des aigles en plein vol. Idéal pour les amoureux de la nature et de l'aventure, ce circuit offre la possibilité de nager, d'explorer ou simplement de se détendre sur des plages uniques. Parfait pour les familles et les personnes à la recherche d'une expérience mémorable en kayak.",Half Day,Shute Harbour,,FROM A$120,$100 under 15 years old,"Boissons froides
Barres de muesli
Plateau de fruits
Excursion guidée en kayak","Kayak sur les récifs coralliens frangeants
Explorer les îles tropicales voisines
Observer les tortues de mer et les aigles en vol
Possibilité de rencontrer des baleines à bosse (de juillet à septembre)
Possibilité de se baigner et d'explorer des plages uniques",,3.5,https://www.saltydog.com.au/tours/half-day-inner-island-turtle-tour/,https://www.saltydog.com.au/tours/half-day-inner-island-turtle-tour/,,static/tour_images/saltydog/e417664eb55f9833/image_11.jpg,"static/tour_images/saltydog/e417664eb55f9833/image_1.jpg,static/tour_images/saltydog/e417664eb55f9833/image_2.jpg,static/tour_images/saltydog/e417664eb55f9833/image_4.jpg,static/tour_images/saltydog/e417664eb55f9833/image_7.jpg,static/tour_images/saltydog/e417664eb55f9833/image_9.jpg,static/tour_images/saltydog/e417664eb55f9833/image_10.jpg,static/tour_images/saltydog/e417664eb55f9833/image_11.jpg,static/tour_images/saltydog/e417664eb55f9833/image_12.jpg",,True,https://www.saltydog.com.au/tours/half-day-inner-island-turtle-tour/,,,,half_day,water,Airlie Beach,"adventure,family-friendly,relaxation",family,relaxed,,,Enfants bienvenus - à partir de 7 ans (1 adulte par enfant),"Débutants et pagayeurs expérimentés, familles et amateurs de nature à la recherche d'une expérience de kayak attrayante et agréable",,"[""Condition physique moyenne requise"", ""Les conditions météorologiques peuvent changer pendant l'excursion en kayak"", ""Fermé le jour de Noël, le lendemain de Noël et le jour de l'An""]","[""Des boissons fraîches, des barres de muesli et un plateau de fruits sont fournis""]",,,0
9839383cb56c02ca,Journée complète d'aventure en kayak et plongée en apnée sur une île tropicale,saltydog,,"Découvrez les îles Whitsunday comme jamais auparavant avec la journée complète de kayak et de plongée en apnée sur les îles tropicales. Cette excursion est idéale pour les amoureux de la nature et les personnes en quête d'aventure qui souhaitent explorer des eaux cristallines et une vie marine dynamique. Pagayez à travers les îles intérieures sereines, détendez-vous et nagez à White Rock, puis traversez l'île de South Molle où vous pourrez apercevoir des tortues, des dauphins et même des baleines à bosse pendant leur saison de migration. L'excursion offre une occasion unique de parcourir le sentier de randonnée pittoresque du mont Jeffries, qui offre des vues panoramiques à couper le souffle sur l'ensemble des îles. Un délicieux déjeuner-buffet sur la plage vous permettra de passer une journée inoubliable au paradis.",Full Day,Shute Harbour,,FROM A$220,,"Guide expérimenté
Petit groupe de pagayeurs
Équipement de kayak
Briefing sur la sécurité
Déjeuner buffet sur la plage
Taxe sur les récifs
TPS","Kayak à travers les îles intérieures et jusqu'à White Rock
Détente et baignade à White Rock
Traversée vers l'île de South Molle
Observation de la vie marine : tortues, dauphins et aigles de mer
Possibilité de plonger avec masque et tuba dans le récif corallien frangeant si les conditions sont favorables
Randonnée sur le sentier de Mount Jeffries pour des vues panoramiques
Observer les baleines à bosse pendant la saison de migration (juillet-septembre)",,8.0,https://www.saltydog.com.au/tours/full-day-tropical-island-tour/,https://www.saltydog.com.au/tours/full-day-tropical-island-tour/,,static/tour_images/saltydog/9839383cb56c02ca/image_5.jpg,"static/tour_images/saltydog/9839383cb56c02ca/image_1.jpg,static/tour_images/saltydog/9839383cb56c02ca/image_3.jpg,static/tour_images/saltydog/9839383cb56c02ca/image_4.jpg,static/tour_images/saltydog/9839383cb56c02ca/image_5.jpg,static/tour_images/saltydog/9839383cb56c02ca/image_7.jpg,static/tour_images/saltydog/9839383cb56c02ca/image_9.jpg,static/tour_images/saltydog/9839383cb56c02ca/image_12.jpg",,True,https://www.saltydog.com.au/tours/full-day-tropical-island-tour/,"Standard: A$220 (includes lunch, reef tax and GST)",,,full_day,combo,"Airlie Beach,Whitsunday Island","adventure,relaxation,small-group",general,relaxed,,"**Menu:**
- Déjeuner buffet sur la plage",15 ans et plus,"Les amateurs de nature, les chercheurs d'aventure et les kayakistes de tous niveaux",,,"[""Recommandations en matière d'habillement"", ""Articles personnels (crème solaire, chapeau, lunettes de soleil, serviette)""]",,,0
1b390fe19a2dc6fc,6 jours d'excursion guidée en kayak dans les Whitsunday,saltydog,,"Embarquez pour l'ultime aventure des Whitsunday avec cette expédition guidée de 6 jours en kayak. Parfaite pour les amateurs d'activités de plein air et les amoureux de la nature, cette excursion offre une expérience immersive dans les magnifiques îles Whitsunday. Pagayez dans des eaux turquoise, explorez les récifs coralliens et campez à la belle étoile sur des plages isolées. Que vous soyez un kayakiste chevronné ou un débutant curieux, cette expédition vous promet des vues à couper le souffle, des rencontres uniques avec la faune et la flore, et des souvenirs inoubliables.",6 Days,Shute Harbour,,"FROM A$3,295",,"5 jours complets de kayak de mer
Équipement de plongée en apnée
Matériel de camping
Guides expérimentés
Transferts d'Airlie Beach à Shute Harbour
Taxi nautique rapide jusqu'à la plage de Whitehaven
Tous les repas pendant l'expédition","Explorer la nature sauvage des Whitsunday
Plongée avec masque et tuba dans les récifs coralliens
Camper sous les étoiles
Visite de la plage de Whitehaven et de Hill Inlet
Marcher jusqu'au belvédère de Chance Bay
Pagayez le long de la côte est jusqu'au camping de Cairn
Découvrez des vues à couper le souffle depuis le belvédère de Cairn
Découverte de la vie marine à Maureen's Cove
Pagayage final jusqu'à Bali Hai",,,https://www.saltydog.com.au/tours/6-day-kayaking-expedition/,https://www.saltydog.com.au/tours/6-day-kayaking-expedition/,,static/tour_images/saltydog/1b390fe19a2dc6fc/image_2.jpg,"static/tour_images/saltydog/1b390fe19a2dc6fc/image_1.jpg,static/tour_images/saltydog/1b390fe19a2dc6fc/image_2.jpg,static/tour_images/saltydog/1b390fe19a2dc6fc/image_4.jpg,static/tour_images/saltydog/1b390fe19a2dc6fc/image_5.jpg,static/tour_images/saltydog/1b390fe19a2dc6fc/image_6.jpg,static/tour_images/saltydog/1b390fe19a2dc6fc/image_7.jpeg,static/tour_images/saltydog/1b390fe19a2dc6fc/image_8.jpg,static/tour_images/saltydog/1b390fe19a2dc6fc/image_9.jpg,static/tour_images/saltydog/1b390fe19a2dc6fc/image_12.jpg",,True,https://www.saltydog.com.au/tours/6-day-kayaking-expedition/,"Per Person: A$3,295",,6.0,multi_day,combo,"Airlie Beach,Hill Inlet,Hook Island,Whitehaven,Whitsunday Island","adventure,private",general,adventurous,"**Jour 1:** Arrivée à Airlie Beach, rencontre avec les guides et transfert à Shute Harbour. Taxi nautique rapide jusqu'à la plage de Whitehaven, exploration de l'île de Haselwood et randonnée jusqu'au belvédère de Chance Bay.
**Jour 2:** Pagayez vers le nord le long de la côte, nagez à Hill Inlet et continuez jusqu'au Cairn Camp Site.
**Jour 3:** Marche matinale jusqu'à Cairn Lookout, puis pagaie jusqu'à Crayfish Beach sur Hook Island.
**Jour 4:** Kayak autour de Hook Island jusqu'à Maureen's Cove, plongée en apnée dans la région.
**Jour 5:** Pagaie finale jusqu'à Bali Hai, exploration des jardins de corail.
**Jour 6:** Retour à Airlie Beach.",,Tous les âges sont les bienvenus,"Les amateurs de plein air, les amoureux de la nature, les chercheurs d'aventure et les familles à la recherche d'une expérience unique sur l'île.",,"[""Convient aux personnes âgées de plus de 16 ans"", ""DOIT PARLER ET COMPRENDRE L'ANGLAIS"", ""DOIT SAVOIR NAGER"", ""Les kayakistes doivent être en bonne santé et en bonne condition physique pour participer à cette activité en toute sécurité"", ""Vous et/ou votre médecin devrez confirmer que vous êtes suffisamment en forme et en bonne santé pour participer à cette activité"", ""Salty Dog Sea Kayaking se réserve le droit de refuser une réservation pour des raisons médicales, si cela est considéré comme préjudiciable à la sécurité des participants et du personnel, et au bon déroulement de l'activité""]",,,,0
58dbdabd60de8265,Journée complète d'aventure en kayak et plongée en apnée sur une île tropicale,saltydog,,"Découvrez la beauté des îles Whitsunday lors d'une journée complète d'aventure en kayak. Pagayez dans les eaux sereines avec un petit groupe, guidé par un chef expérimenté. Découvrez la vie marine, notamment les tortues, les dauphins et les poissons tropicaux colorés. Cette excursion est idéale pour les amoureux de la nature et les amateurs d'aventure qui cherchent à se rapprocher de la beauté naturelle de la région. Profitez d'un déjeuner buffet sur la plage et de la possibilité de faire de la plongée avec masque et tuba sur le récif corallien frangeant, ce qui en fait une journée inoubliable au paradis.",Full Day,Shute Harbour,,FROM A$220,,"Guide expérimenté
Équipement de kayak
Briefing sur la sécurité
Déjeuner buffet sur la plage
Taxe sur les récifs
TPS","Kayak dans les îles Whitsunday
Détente et baignade à White Rock
Possibilité de faire de la plongée avec masque et tuba sur le récif corallien frangeant
Repérer la vie marine comme les tortues et les dauphins
Randonnée sur le sentier de Mount Jeffries
Vues panoramiques des îles Whitsunday
Expérience en petit groupe",,8.0,https://www.saltydog.com.au/tours/full-day-tour/,https://www.saltydog.com.au/tours/full-day-tour/,,static/tour_images/saltydog/58dbdabd60de8265/image_5.jpg,"static/tour_images/saltydog/58dbdabd60de8265/image_1.jpg,static/tour_images/saltydog/58dbdabd60de8265/image_3.jpg,static/tour_images/saltydog/58dbdabd60de8265/image_4.jpg,static/tour_images/saltydog/58dbdabd60de8265/image_5.jpg,static/tour_images/saltydog/58dbdabd60de8265/image_7.jpg,static/tour_images/saltydog/58dbdabd60de8265/image_9.jpg,static/tour_images/saltydog/58dbdabd60de8265/image_12.jpg",,True,https://www.saltydog.com.au/tours/full-day-tour/,"Standard: A$220 (includes lunch, reef tax and GST)",,,full_day,combo,"Airlie Beach,Whitsunday Island","adventure,relaxation,small-group",general,relaxed,,"**Menu:**
- Déjeuner buffet sur la plage",15 ans et plus,"Les passionnés de nature, les amateurs d'aventure et ceux qui souhaitent explorer les îles Whitsunday d'une manière active et engageante.",,,"[""Recommandations en matière d'habillement"", ""Articles personnels (crème solaire, chapeau, lunettes de soleil, serviette)""]",,,0
75c72eecdb7c4d82,6 jours d'excursion guidée en kayak dans les Whitsunday,saltydog,,"Embarquez pour l'ultime expédition de 6 jours en kayak de mer à travers les époustouflantes îles Whitsunday. Cette aventure est parfaite pour ceux qui recherchent une expérience immersive dans la nature, combinant les sensations du kayak avec la tranquillité du camping sous les étoiles. Explorez les eaux turquoise et le sable blanc de la plage de Whitehaven, faites de la plongée en apnée dans les jardins de coraux et admirez les vues emblématiques de Hill Inlet. Idéale pour les amateurs d'aventure et les amoureux de la nature, cette excursion offre une occasion unique de se rapprocher des magnifiques environnements marins et terrestres des Whitsundays.",6 Days,Shute Harbour,,"FROM A$3,295",,"5 jours complets de kayak de mer
Plongée avec masque et tuba
Marche en brousse
Matériel de camping
Visites guidées avec des guides experts en kayak de mer
Transferts d'Airlie Beach à Shute Harbour","Explorer la nature sauvage des Whitsunday
Plongée avec masque et tuba dans les récifs coralliens frangeants
Camper à la belle étoile sur des plages immaculées
Visitez la plage emblématique de Whitehaven et Hill Inlet
Profitez de vues imprenables depuis divers points d'observation
Faites l'expérience du kayak dans des eaux turquoises
Observez la diversité de la vie marine, notamment les tortues et les raies pastenagues",,,https://www.saltydog.com.au/tours/6-day/,https://www.saltydog.com.au/tours/6-day/,,static/tour_images/saltydog/75c72eecdb7c4d82/image_2.jpg,"static/tour_images/saltydog/75c72eecdb7c4d82/image_1.jpg,static/tour_images/saltydog/75c72eecdb7c4d82/image_2.jpg,static/tour_images/saltydog/75c72eecdb7c4d82/image_4.jpg,static/tour_images/saltydog/75c72eecdb7c4d82/image_5.jpg,static/tour_images/saltydog/75c72eecdb7c4d82/image_6.jpg,static/tour_images/saltydog/75c72eecdb7c4d82/image_7.jpeg,static/tour_images/saltydog/75c72eecdb7c4d82/image_8.jpg,static/tour_images/saltydog/75c72eecdb7c4d82/image_9.jpg,static/tour_images/saltydog/75c72eecdb7c4d82/image_12.jpg",,True,https://www.saltydog.com.au/tours/6-day/,,,6.0,multi_day,combo,"Airlie Beach,Hill Inlet,Hook Island,Whitehaven,Whitsunday Island","adventure,private",general,adventurous,"**Jour 1:**
Arrivée et installation à l'hôtel du groupe. Rencontre avec vos guides et briefing. Transfert à Shute Harbour puis à Whitehaven Beach en bateau-taxi. Installation du campement et exploration de l'île de Haselwood avec plongée en apnée et randonnée pédestre jusqu'au belvédère de Chance Bay.
**Jour 2:**
Pagayez vers le nord en suivant la côte jusqu'à Hill Inlet pour vous baigner et visiter le point de vue. Continuez jusqu'au site de Cairn Camp.
**Jour 3:**
Marche matinale jusqu'à Cairn Lookout, puis pagaie jusqu'à Crayfish Beach sur Hook Island. Admirez les coraux et la vie marine de classe mondiale.
**Jour 4:**
Kayak autour de Hook Island jusqu'à Maureen's Cove pour la plongée en apnée et le camping.
**Jour 5:**
Dirigez-vous vers l'ouest jusqu'à Bali Hai, explorez les jardins de coraux et observez la vie marine dans toute sa diversité.
**Jour 6:**
Retour et conclusion de l'excursion.",,12 ans et plus,"Les amateurs d'aventure, les amoureux de la nature et ceux qui souhaitent explorer les îles Whitsunday de manière active et immersive.",,"[""Convient aux personnes âgées de plus de 16 ans"", ""DOIT PARLER ET COMPRENDRE L'ANGLAIS"", ""DOIT SAVOIR NAGER"", ""Les kayakistes doivent être en bonne santé et en bonne condition physique pour participer à cette activité en toute sécurité"", ""Vous et/ou votre médecin devrez confirmer que vous êtes suffisamment en forme et en bonne santé pour participer à cette activité"", ""Salty Dog Sea Kayaking se réserve le droit de refuser une réservation pour des raisons médicales, si cela est considéré comme préjudiciable à la sécurité des participants et du personnel, et au bon déroulement de l'activité""]",,,,0
ece3460586cd6245,Excursion d'une demi-journée sur l'île intérieure pour observer les tortues,saltydog,,"L'excursion d'une demi-journée sur l'île Inner Island Turtle Tour offre une aventure passionnante en kayak qui convient aussi bien aux pagayeurs expérimentés qu'aux débutants. Au départ de Shute Harbour, vous pagayerez sur de vibrants récifs coralliens et explorerez les étonnantes îles tropicales, qui abritent une vie marine diversifiée, notamment des tortues de mer et des aigles. De juillet à septembre, il est possible d'observer des baleines à bosse. Cette excursion est idéale pour ceux qui recherchent une expérience amusante et immersive dans la nature, avec des possibilités de nager, de se détendre et d'apprendre avec des guides compétents.",Half Day,Shute Harbour,,FROM A$120,A$100,"Boissons froides
Barres de muesli
Plateau de fruits","Kayak sur les récifs coralliens frangeants
Explorer les îles tropicales voisines
Rencontre avec une faune marine et aviaire variée
Possibilité de voir des baleines à bosse (juillet à septembre)
Nager et explorer des plages ou des îles uniques
Les guides partagent leurs connaissances locales",,3.5,https://www.saltydog.com.au/tours/half-day-2/,https://www.saltydog.com.au/tours/half-day-2/,,static/tour_images/saltydog/ece3460586cd6245/image_11.jpg,"static/tour_images/saltydog/ece3460586cd6245/image_1.jpg,static/tour_images/saltydog/ece3460586cd6245/image_2.jpg,static/tour_images/saltydog/ece3460586cd6245/image_4.jpg,static/tour_images/saltydog/ece3460586cd6245/image_7.jpg,static/tour_images/saltydog/ece3460586cd6245/image_9.jpg,static/tour_images/saltydog/ece3460586cd6245/image_10.jpg,static/tour_images/saltydog/ece3460586cd6245/image_11.jpg,static/tour_images/saltydog/ece3460586cd6245/image_12.jpg",,True,https://www.saltydog.com.au/tours/half-day-2/,,,,half_day,water,Airlie Beach,"adventure,family-friendly,relaxation",family,relaxed,,,Enfants bienvenus - à partir de 7 ans (1 adulte par enfant),"Les débutants comme les pagayeurs expérimentés, les amoureux de la nature, les familles et tous ceux qui recherchent une aventure amusante en plein air.",,"[""Condition physique moyenne requise"", ""Les conditions météorologiques peuvent changer pendant l'excursion en kayak"", ""Fermé le jour de Noël, le lendemain de Noël et le jour de l'An""]","[""Des boissons fraîches, des barres de muesli et un plateau de fruits sont fournis""]",,,0
