id,name,company_name,summary,description,duration,departure_location,departure_times,price_adult,price_child,includes,highlights,keywords,duration_hours,link_booking,link_more_info,phone,image_url,image_urls,commission_rate,active,price_source_url,price_tiers,raw_text,duration_days,duration_category,tour_type,locations,tags,audience,intensity_level,video_urls,important_information,what_to_bring,whats_extra,cancellation_policy,booking_connected
2fea6fc96f22dd13,왈츠 마틸다 선셋 크루즈,waltzing-matilda,,"에어리 비치에서 왈츠잉 마틸다를 타고 고요한 선셋 투어를 떠나 자연의 걸작을 가장 앞자리에서 감상하세요. 휘트선데이 아일랜드를 통과하는 이 매혹적인 항해는 혼자 여행하는 여행객, 단체, 커플, 가족, 친구 등 고요한 탈출을 원하는 모든 이들에게 완벽한 여행입니다. 넓고 편안한 갑판에서 음료와 스낵을 즐기며 휴식을 취하는 동안 바다 위로 펼쳐지는 숨막히는 일몰을 감상하세요. 휘트선데이즈와 에어리 비치의 탁 트인 전망을 감상하며 잊지 못할 저녁을 보내세요.",,"9/33 포트 닥터 숍, 포트 에얼리, 호주",,A$79,A$47,"무료 버블 1잔
넓고 편안한 데크 공간
올 인클루시브(추가 비용 없음)
휘트선데이즈와 에어리 비치의 파노라마 전망","파이오니어 베이 항해하기
바다 위로 펼쳐지는 숨막히는 일몰 감상하기
음료와 스낵을 즐기며 휴식 취하기
혼자 여행하는 여행객, 단체, 커플, 가족, 친구에게 적합
매주 금요일과 토요일 이용 가능",,,,https://explorewhitsundays.com/waltzing-matilda-sunset-cruise/,,static/tour_images/explorewhitsundays/Waltzing Matilda Sunset Cruise/image_1.jpg,"static/tour_images/explorewhitsundays/Waltzing Matilda Sunset Cruise/image_1.jpg,static/tour_images/explorewhitsundays/Waltzing Matilda Sunset Cruise/image_3.jpg,static/tour_images/explorewhitsundays/Waltzing Matilda Sunset Cruise/image_4.jpg,static/tour_images/explorewhitsundays/Waltzing Matilda Sunset Cruise/image_5.jpg,static/tour_images/explorewhitsundays/Waltzing Matilda Sunset Cruise/image_6.jpg,static/tour_images/explorewhitsundays/Waltzing Matilda Sunset Cruise/image_7.jpg,static/tour_images/explorewhitsundays/Waltzing Matilda Sunset Cruise/image_10.jpg",,True,https://explorewhitsundays.com/waltzing-matilda-sunset-cruise/,성인 A$79 | 어린이(12세 이하): A$47,,,unknown,combo,"Airlie Beach,Great Barrier Reef,Whitsunday Island","private,relaxation,sunset",family,relaxed,,"['성인 12세 이상', '만 12세 이하 어린이', '혼자 여행하는 여행자, 단체, 커플, 가족, 친구에게 적합']]","['멋진 석양을 담을 카메라', '따뜻한 옷(겨울)', '모자(여름)', '출발 시 선글라스', '우비(필요 시)', 'BYO 음료(선택 사항)']","['BYO(얼음 제공)', '무료 버블 한 잔', '무료 핑거 푸드', '올 인클루시브(추가 요금 없음)']",,0
a2d895c62988ac65,왈츠하는 마틸다: 휘트선데이즈 1박 2일 크루즈,waltzing-matilda,,"왈츠 마틸다와 함께 아름다운 휘트선데이즈에서 잊을 수 없는 세일링 어드벤처를 경험하세요. 이 특별한 소규모 그룹 투어는 망망대해에서 편안함과 스타일을 추구하는 이들에게 완벽한 친밀하고 개인화된 여행을 제공합니다. 게스트들 간의 커뮤니티를 조성하기 위해 세심하게 설계된 선박을 타고 목가적인 섬, 한적한 해변, 활기찬 산호초를 탐험하게 됩니다. 커플, 가족, 모험을 추구하는 여행객들에게 이상적인 왈츠잉 마틸다를 타고 보내는 모든 순간이 마법 같은 추억이 될 것입니다.",1박 2일,"9/33 포트 닥터 숍, 포트 에얼리, 호주",,FROM A$490,,"매우 지식이 풍부하고 친절하고 친절한 승무원
그늘막 차양이 있는 넓은 평평한 갑판
신선한 현지 농산물을 사용한 선상 식사
스노클링 장비 및 강습료 제공
모든 해양 및 공원 입장료 포함","독점적인 소규모 그룹 세일링 어드벤처
친밀하고 개인화된 경험
편안하고 스타일리시한 선박
커뮤니티와 연결을 위해 세심하게 설계된 레이아웃
목가적인 섬 위치, 한적한 해변, 생동감 넘치는 산호초",,,,https://explorewhitsundays.com/waltzing-matilda-2-day-1-night-whitsundays-cruise/,,static/tour_images/explorewhitsundays/a2d895c62988ac65/image_2.jpg,"static/tour_images/explorewhitsundays/a2d895c62988ac65/image_1.jpg,static/tour_images/explorewhitsundays/a2d895c62988ac65/image_2.jpg,static/tour_images/explorewhitsundays/a2d895c62988ac65/image_4.jpg",,True,https://explorewhitsundays.com/waltzing-matilda-2-day-1-night-whitsundays-cruise/,"프라이빗 더블 캐빈: A$1,125(2인 기준) | 쉐어드 싱글: A$490 | 쉐어드 더블: A$985(2인 기준) | 트리플 캐빈: A$1,470 | 쿼드 캐빈: A$1,960 | 그룹 캐빈: A$1,960",,2.0,multi_day,combo,"Airlie Beach,Great Barrier Reef","adventure,private,small-group",general,adventurous,,"['특정 연령 제한이 언급되지 않았습니다.', '체력 요건이 언급되지 않았습니다.', '수영 능력이 명시되지 않았습니다.', '감독 필요성이 언급되지 않았습니다.', '제한 사항이 언급되지 않았습니다.']","['카메라', '선글라스', '따뜻한 옷(겨울철)', '선크림 및 모자(여름철)', '우비(날씨에 따라 다름)', '모자 및 햇빛에 안전한 옷', '수영복', '타월']","['BYO 주류', '음식 BYO 정책에 대한 언급 없음', '수하물 보관소에 대한 언급 없음', '환승에 대한 언급 없음', '추가 옵션에 대한 언급 없음', '추가 비용에 대한 언급 없음']",,0
