id,name,company_name,summary,description,duration,departure_location,departure_times,price_adult,price_child,includes,highlights,keywords,duration_hours,link_booking,link_more_info,phone,image_url,image_urls,commission_rate,active,price_source_url,price_tiers,raw_text,duration_days,duration_category,tour_type,locations,tags,audience,intensity_level,video_urls,important_information,what_to_bring,whats_extra,cancellation_policy
f57f6e18b43896db,Excursiones en moto acuática por las Whitsunday,oceandynamics,,"Descubra la emoción de las Whitsundays con Ocean Dynamics, que ofrece una gran variedad de excursiones en moto acuática desde Airlie Beach. Nuestras excursiones en moto acuática por las Whitsunday son una forma estimulante de disfrutar de la impresionante belleza de la región, sus aguas cristalinas y su variada vida marina. Perfectas para los amantes de la aventura, nuestras excursiones prometen un viaje inolvidable por uno de los destinos más pintorescos de Australia.",1 Hour,Port of Airlie,"Departs 8 am, Returns 5 pm",FROM A$249,,"Sesión informativa exhaustiva sobre seguridad
Todo el equipo necesario
Acceso completo a las piscinas e instalaciones de Daydream Island (para Daydream Island Ultimate Jet Ski Adventure)","Emocionante excursión guiada en moto acuática de una hora
Emocionante experiencia a través de la impresionante belleza de las Whitsundays
Excursiones privadas exclusivas disponibles
Acceso a los servicios de Daydream Island
Seguridad y equipamiento incluidos
Perfecto para los amantes de la aventura",,1.0,https://www.oceandynamics.com.au/jet-ski,https://www.oceandynamics.com.au/jet-ski,,static/tour_images/oceandynamics/f57f6e18b43896db/image_2.jpg,"static/tour_images/oceandynamics/f57f6e18b43896db/image_2.jpg,static/tour_images/oceandynamics/f57f6e18b43896db/image_3.jpg",,True,https://www.oceandynamics.com.au/jet-ski,"Airlie Adrenaline Jet Ski Tour: A$249 per jet ski (1 or 2 people) | Private One-Hour Tour: FROM A$1950 | Daydream Island Ultimate Jet Ski Adventure: A$425 per single passenger jet ski, A$475 for 2 passengers",,,half_day,water,"Airlie Beach,Daydream Island","adventure,private",general,adventurous,,"['Conductor mínimo 16 años, pasajero mínimo 8 años (debe medir 120 cm y saber nadar)', 'No apto para personas con problemas de movilidad; debe saber nadar 25 m y hablar inglés', 'Se aplican restricciones de peso y altura; se requiere un número mínimo de participantes para realizar la excursión', 'Conductor mínimo 16 años, pasajero mínimo 12 años', 'No apto para personas con problemas de movilidad, problemas de cuello o espalda o mujeres embarazadas', 'Debe saber nadar 100 m, hablar inglés y sentirse cómodo en aguas abiertas', 'Se aplican restricciones de peso y altura; se requiere un número mínimo de participantes para realizar la excursión']",,['El consumo de alcohol en Daydream Island está limitado; consulte las condiciones completas para más detalles'],"['Más de 48 horas: sin gastos', '48-24 horas: 50% de gastos de cancelación"", ""24 horas o menos (incluido el no-show): 100% de gastos de cancelación""]"
