id,name,company_name,summary,description,duration,departure_location,departure_times,price_adult,price_child,includes,highlights,keywords,duration_hours,link_booking,link_more_info,phone,image_url,image_urls,commission_rate,active,price_source_url,price_tiers,raw_text,duration_days,duration_category,tour_type,locations,tags,audience,intensity_level,video_urls,important_information,what_to_bring,whats_extra,cancellation_policy,booking_connected
2fea6fc96f22dd13,"Croisière ""Waltzing Matilda"" au coucher du soleil",waltzing-matilda,,"Partez d'Airlie Beach pour une excursion sereine au coucher du soleil à bord du Waltzing Matilda, qui vous permettra d'être aux premières loges pour admirer le chef-d'œuvre de la nature. Ce voyage enchanteur à travers les îles Whitsunday est parfait pour les voyageurs solitaires, les groupes, les couples, les familles et les amis à la recherche d'une évasion tranquille. Admirez le coucher de soleil époustouflant sur l'océan tout en vous détendant avec un verre et des amuse-gueules sur le pont spacieux et confortable. Les vues panoramiques sur les Whitsundays et Airlie Beach font de cette soirée un moment inoubliable.",,"Shop 9/33 Port Dr, Port of Airlie",,A$79,A$47,"Un verre de bulles gratuit
Pont spacieux et confortable
Tout compris (rien à payer en plus)
Vue panoramique sur les Whitsundays et Airlie Beach","Naviguer dans la baie des pionniers
Admirez le coucher de soleil à couper le souffle sur l'océan
Détendez-vous en buvant un verre et en grignotant des amuse-gueules
Convient aux voyageurs solitaires, aux groupes, aux couples, aux familles et aux amis
Disponible tous les vendredis et samedis",,,,https://explorewhitsundays.com/waltzing-matilda-sunset-cruise/,,static/tour_images/explorewhitsundays/Waltzing Matilda Sunset Cruise/image_1.jpg,"static/tour_images/explorewhitsundays/Waltzing Matilda Sunset Cruise/image_1.jpg,static/tour_images/explorewhitsundays/Waltzing Matilda Sunset Cruise/image_3.jpg,static/tour_images/explorewhitsundays/Waltzing Matilda Sunset Cruise/image_4.jpg,static/tour_images/explorewhitsundays/Waltzing Matilda Sunset Cruise/image_5.jpg,static/tour_images/explorewhitsundays/Waltzing Matilda Sunset Cruise/image_6.jpg,static/tour_images/explorewhitsundays/Waltzing Matilda Sunset Cruise/image_7.jpg,static/tour_images/explorewhitsundays/Waltzing Matilda Sunset Cruise/image_10.jpg",,True,https://explorewhitsundays.com/waltzing-matilda-sunset-cruise/,Adulte : A$79 | Enfant (12 ans et moins) : A$47,,,unknown,combo,"Airlie Beach,Great Barrier Reef,Whitsunday Island","private,relaxation,sunset",family,relaxed,,"['Adulte 12 ans et plus', 'Enfant 12 ans et moins', 'Convient aux voyageurs solitaires, aux groupes, aux couples, aux familles et aux amis']","[""Un appareil photo pour immortaliser l'incroyable coucher de soleil"", ""Vêtements chauds (hiver)"", ""Chapeau (été)"", ""Lunettes de soleil pour le départ"", ""Veste de pluie (si nécessaire)"", ""Boissons à emporter (facultatif)""]","[""BYO (glace fournie)"", ""Verre de bulles gratuit"", ""Amuse-gueule gratuit"", ""Tout compris (rien à payer)""]",,0
a2d895c62988ac65,Waltzing Matilda : Croisière de 2 jours et 1 nuit dans les Whitsundays,waltzing-matilda,,"Rejoignez-nous à bord de Waltzing Matilda pour une aventure inoubliable à bord d'un voilier dans les magnifiques Whitsundays. Cette expérience exclusive en petit groupe offre un voyage intime et personnalisé, parfait pour ceux qui recherchent le confort et le style en pleine mer. Grâce à un navire bien conçu qui favorise la communauté entre les invités, vous explorerez des îles idylliques, des plages isolées et des récifs coralliens vibrants. Idéal pour les couples, les familles et les amateurs d'aventure, chaque moment à bord du Waltzing Matilda est conçu pour créer des souvenirs magiques.",2 jours 1 nuit,"Shop 9/33 Port Dr, Port of Airlie",,FROM A$490,,"Une équipe très compétente, serviable et amicale
Larges ponts plats avec auvents d'ombrage
Repas préparés à bord à partir de produits locaux frais
Matériel de plongée avec masque et tuba et cours de plongée fournis
Tous les droits d'entrée dans les parcs et en mer sont inclus","Aventures exclusives en petits groupes
Expérience intime et personnalisée
Navire confortable et élégant
Un aménagement bien pensé pour favoriser la communauté et les contacts
Des îles idylliques, des plages isolées et des récifs coralliens dynamiques",,,,https://explorewhitsundays.com/waltzing-matilda-2-day-1-night-whitsundays-cruise/,,static/tour_images/explorewhitsundays/a2d895c62988ac65/image_2.jpg,"static/tour_images/explorewhitsundays/a2d895c62988ac65/image_1.jpg,static/tour_images/explorewhitsundays/a2d895c62988ac65/image_2.jpg,static/tour_images/explorewhitsundays/a2d895c62988ac65/image_4.jpg",,True,https://explorewhitsundays.com/waltzing-matilda-2-day-1-night-whitsundays-cruise/,"Cabine double privée : 1 125 $A (pour 2 personnes) | Cabine simple partagée : 490 $A | Double partagée : A$985 (pour 2 personnes) | Cabine triple : 1 470 $A | Cabine quadruple : 1 960 $A | Cabines de groupe : A$1,960",,2.0,multi_day,combo,"Airlie Beach,Great Barrier Reef","adventure,private,small-group",general,adventurous,,"[""Aucune limite d'âge spécifique n'est mentionnée"", ""Aucune condition physique n'est mentionnée"", ""Capacité de nage non spécifiée"", ""Aucun besoin de surveillance n'est mentionné"", ""Aucune restriction n'est mentionnée""]","[""Appareil photo"", ""Lunettes de soleil"", ""Vêtements plus chauds (pendant les mois d'hiver)"", ""Crème solaire et chapeau (pendant les mois d'été)"", ""Imperméable (selon les conditions météorologiques)"", ""Chapeau et vêtements protégeant du soleil"", ""Maillot de bain"", ""Serviette de bain""]","[""Alcool à consommer sans modération"", ""Pas de mention de la politique de consommation sans modération"", ""Pas de mention de la consigne à bagages"", ""Pas de mention des transferts"", ""Pas de mention des suppléments optionnels"", ""Pas de mention des frais supplémentaires""]",,0
