id,name,company_name,summary,description,duration,departure_location,departure_times,price_adult,price_child,includes,highlights,keywords,duration_hours,link_booking,link_more_info,phone,image_url,image_urls,commission_rate,active,price_source_url,price_tiers,raw_text,duration_days,duration_category,tour_type,locations,tags,audience,intensity_level,video_urls,important_information,what_to_bring,whats_extra,cancellation_policy
f57f6e18b43896db,Whitsunday Jet Ski Tours,oceandynamics,,"Discover the thrill of the Whitsundays with Ocean Dynamics, offering a variety of jet ski tour options from Airlie Beach. Our Whitsunday jet ski tours provide an exhilarating way to experience the region’s stunning beauty, crystal-clear waters, and diverse marine life. Perfect for adventure seekers, our tours promise an unforgettable journey through one of Australia’s most picturesque destinations.",1 Hour,Port of Airlie,"Departs 8 am, Returns 5 pm",FROM A$249,,"Comprehensive safety briefing
All necessary equipment
Full access to Daydream Island pools and facilities (for Daydream Island Ultimate Jet Ski Adventure)","Thrilling one-hour guided jet ski tour
Exhilarating experience through stunning beauty of Whitsundays
Exclusive private tours available
Access to Daydream Island amenities
Safety and equipment included
Perfect for adventure seekers",,1.0,https://www.oceandynamics.com.au/jet-ski,https://www.oceandynamics.com.au/jet-ski,,static/tour_images/oceandynamics/f57f6e18b43896db/image_2.jpg,"static/tour_images/oceandynamics/f57f6e18b43896db/image_2.jpg,static/tour_images/oceandynamics/f57f6e18b43896db/image_3.jpg",,True,https://www.oceandynamics.com.au/jet-ski,"Airlie Adrenaline Jet Ski Tour: A$249 per jet ski (1 or 2 people) | Private One-Hour Tour: FROM A$1950 | Daydream Island Ultimate Jet Ski Adventure: A$425 per single passenger jet ski, A$475 for 2 passengers",,,half_day,water,"Airlie Beach,Daydream Island","adventure,private",general,adventurous,,"['Minimum driver age 16, minimum passenger age 8 (must be 120cm tall and able to swim)', 'Not suitable for guests with mobility concerns; must be able to swim 25m and speak English', 'Weight and height restrictions apply; minimum numbers required for tour operation', 'Minimum driver age 16, minimum passenger age 12', 'Not suitable for guests with mobility issues, neck or back problems, or pregnant women', 'Must be able to swim 100m, speak English, and feel comfortable in open water', 'Weight and height restrictions apply; minimum numbers required for the tour']",,['Alcohol consumption on Daydream Island is limited; see full terms for details'],"['More than 48 hours: no fee', '48-24 hours: 50% cancellation fee', '24 hours or less (including no-show): 100% cancellation fee']"
