id,name,company_name,summary,description,duration,departure_location,departure_times,price_adult,price_child,includes,highlights,keywords,duration_hours,link_booking,link_more_info,phone,image_url,image_urls,commission_rate,active,price_source_url,price_tiers,raw_text,duration_days,duration_category,tour_type,locations,tags,audience,intensity_level,video_urls,important_information,what_to_bring,whats_extra,cancellation_policy
b8aee9e709ef4afa,व्हिटसंडे मगरमच्छ सफारी,crocodilesafari,,"एक अद्वितीय ऑस्ट्रेलियाई प्रकृति साहसिक, व्हिट्संडे क्रोकोडाइल सफारी के साथ व्हिट्संडेज़ के जंगली पक्ष का अनुभव करें।व्हिटसंडे समुद्र तट के मुहाने और आर्द्रभूमि का अन्वेषण करें और प्रतिष्ठित मुहाना मगरमच्छों सहित उनके प्राकृतिक आवास में आकर्षक वन्य जीवन को देखें।प्रकृति के प्रति उत्साही लोगों और परिवारों के लिए बिल्कुल उपयुक्त, यह दौरा रोमांच और शिक्षा का मिश्रण प्रदान करता है, जिसमें विशेषज्ञ गाइड स्थानीय वनस्पतियों, जीवों और इतिहास के बारे में जानकारी प्रदान करते हैं।स्वादिष्ट बारबेक्यू लंच और पारंपरिक बुश टकर व्यंजनों के साथ शानदार आउटडोर में एक आरामदायक दिन का आनंद लें।",Full Day,Shute Harbour,,,,"विशेषज्ञ गाइड और कमेंटरी के साथ सभी मौसमों में दिन का दौरा
एयरली बीच और प्रोसेरपाइन से सौजन्य वापसी बस स्थानान्तरण
पारंपरिक बिली चाय और डम्पर
आवश्यकतानुसार वर्षा पोंचो
आवश्यकतानुसार कीट विकर्षक
प्रोसेरपाइन में टूर कैंपसाइट के लिए पिक-अप और स्थानांतरण
प्रोसेरपाइन नदी पर परिभ्रमण
बारबेक्यू और सलाद बार से दोपहर का भोजन
शिविर स्थल पर निःशुल्क ठंडा पेयजल","एस्टुरीन मगरमच्छों को उनके प्राकृतिक आवास में देखें
व्हिटसंडे तटरेखा के अनूठे उष्णकटिबंधीय वातावरण का अन्वेषण करें
मीठे पानी वाले आर्द्रभूमि आवासों में वनस्पति और वन्य जीवन की खोज करें
मैत्रीपूर्ण स्थानीय गाइडों से पेशेवर विशेषज्ञ टिप्पणियों का आनंद लें
बिली टी और डैम्पर जैसे पारंपरिक ऑस्ट्रेलियाई 'बुश टकर' का नमूना लें
ऐतिहासिक महत्व वाले सुसज्जित शिविर स्थल पर आराम करें",,8.0,https://crocodilesafari.com.au/whitsundays-crocodile-tour/,https://crocodilesafari.com.au/whitsundays-crocodile-tour/,,static/tour_images/crocodilesafari/b8aee9e709ef4afa/image_3.jpg,"static/tour_images/crocodilesafari/b8aee9e709ef4afa/image_2.jpg,static/tour_images/crocodilesafari/b8aee9e709ef4afa/image_3.jpg,static/tour_images/crocodilesafari/b8aee9e709ef4afa/image_6.jpg,static/tour_images/crocodilesafari/b8aee9e709ef4afa/image_10.jpg,static/tour_images/crocodilesafari/b8aee9e709ef4afa/image_13.jpg,static/tour_images/crocodilesafari/b8aee9e709ef4afa/image_15.jpg,static/tour_images/crocodilesafari/b8aee9e709ef4afa/image_18.jpg,static/tour_images/crocodilesafari/b8aee9e709ef4afa/image_19.jpg,static/tour_images/crocodilesafari/b8aee9e709ef4afa/image_21.jpg,static/tour_images/crocodilesafari/b8aee9e709ef4afa/image_22.jpg,static/tour_images/crocodilesafari/b8aee9e709ef4afa/image_23.jpg",,True,https://crocodilesafari.com.au/whitsundays-crocodile-tour/,,,,full_day,water,"Airlie Beach,Proserpine","adventure,relaxation",general,relaxed,,,"['टोपी', 'कैमरा', 'नकद (कोल्ड ड्रिंक के लिए)', 'जैकेट (ठंड या हवा वाले दिनों में)', 'जूते (कोई भी प्रकार उपयुक्त है)']","['ठंडा शीतल पेय, जूस और बोतलबंद पानी कैंपसाइट पर खरीदा जा सकता है', 'स्नैक आइटम खरीद के लिए उपलब्ध नहीं हैं']",
