id,name,company_name,summary,description,duration,departure_location,departure_times,price_adult,price_child,includes,highlights,keywords,duration_hours,link_booking,link_more_info,phone,image_url,image_urls,commission_rate,active,price_source_url,price_tiers,raw_text,duration_days,duration_category,tour_type,locations,tags,audience,intensity_level,video_urls,important_information,what_to_bring,whats_extra,cancellation_policy,booking_connected
15f295d64f046cd1,Thundercat Whitsundays - All Inclusive Day Tour,redcatadventures,,"Thundercat offers an exhilarating ride around the Whitsunday Islands, perfect for those seeking adventure and breathtaking scenery. This award-winning tour provides a thrilling yet comfortable experience, ideal for families, couples, and groups eager to explore the iconic Whitehaven Beach and the vibrant marine life of the Great Barrier Reef. With its emphasis on stability and speed, Thundercat is designed to accommodate passengers concerned about seasickness, ensuring a smooth and enjoyable journey. The tour combines adventure with comfort, featuring guided bush walks, snorkeling opportunities, and delicious meals prepared by qualified chefs.",Full Day,Coral Sea Marina,,FROM A$230,A$199,"Lycra suit
Snorkelling equipment (mask & snorkel only)
Wet suit (winter months)
On-board toilet
Lunch and snacks catered by qualified chefs
Local bus transfers
BYO Alcohol (eski and ice provided)","Visit Whitehaven Beach (1.5 hours)
Guided bush walk to Hill Inlet Lookout
Snorkel two different locations on the fringing Great Barrier Reef
Travel with accredited Climate Action Leaders
Mantaray Bay – Teeming with an abundance of Marine Life
Stone Haven Bay – Snorkel the stunning Coral Gardens
Experience the iconic swirling sands of Hill Inlet Lookout
Enjoy fresh homemade baking for morning tea, afternoon tea and a buffet lunch",,8.0,https://redcatadventures.com.au/package/thundercat/,https://redcatadventures.com.au/package/thundercat/,,static/tour_images/redcatadventures/thundercat_whitsundays___all_inclusive_day_tour/image_1.jpg,"static/tour_images/redcatadventures/thundercat_whitsundays___all_inclusive_day_tour/image_1.jpg,static/tour_images/redcatadventures/thundercat_whitsundays___all_inclusive_day_tour/image_2.jpg,static/tour_images/redcatadventures/thundercat_whitsundays___all_inclusive_day_tour/image_3.jpg,static/tour_images/redcatadventures/thundercat_whitsundays___all_inclusive_day_tour/image_4.jpg,static/tour_images/redcatadventures/thundercat_whitsundays___all_inclusive_day_tour/image_5.jpg,static/tour_images/redcatadventures/thundercat_whitsundays___all_inclusive_day_tour/image_6.jpg,static/tour_images/redcatadventures/thundercat_whitsundays___all_inclusive_day_tour/image_7.jpg,static/tour_images/redcatadventures/thundercat_whitsundays___all_inclusive_day_tour/image_8.jpg,static/tour_images/redcatadventures/thundercat_whitsundays___all_inclusive_day_tour/image_9.jpg,static/tour_images/redcatadventures/thundercat_whitsundays___all_inclusive_day_tour/image_11.jpg,static/tour_images/redcatadventures/thundercat_whitsundays___all_inclusive_day_tour/image_13.jpg,static/tour_images/redcatadventures/thundercat_whitsundays___all_inclusive_day_tour/image_14.jpg,static/tour_images/redcatadventures/thundercat_whitsundays___all_inclusive_day_tour/image_15.jpg,static/tour_images/redcatadventures/thundercat_whitsundays___all_inclusive_day_tour/image_16.jpg,static/tour_images/redcatadventures/thundercat_whitsundays___all_inclusive_day_tour/image_17.jpg,static/tour_images/redcatadventures/thundercat_whitsundays___all_inclusive_day_tour/image_19.jpg,static/tour_images/redcatadventures/thundercat_whitsundays___all_inclusive_day_tour/image_20.jpg,static/tour_images/redcatadventures/thundercat_whitsundays___all_inclusive_day_tour/image_21.jpg",,True,https://redcatadventures.com.au/package/thundercat/,A$230 per adult | A$199 per child,,,full_day,combo,"Airlie Beach,Great Barrier Reef,Hill Inlet,Langford,Whitehaven,Whitsunday Island","adventure,family-friendly,relaxation",family,adventurous,,"['Children aged between 2 and 14 years old.', 'Children under two years old must be approved before departure and supply their own lifejacket.', 'Children one or under must have a baby carrier with a parent.', 'A ticket MUST be purchased for anyone 12 months and over.', 'Snorkelling is a physical activity. A certain level of fitness and ability is required to participate.']","['Pack a small waterproof bag and include: Sunscreen, sunglasses, a towel and a hat', 'Practical clothing and footwear (warmer items during winter)', 'Underwater camera', 'BYO alcohol (no glass or red wine) for the boat only', 'Refillable water bottle', 'A sense of fun and adventure!']","['Thundercat does not cater to dietary requirements. Therefore, if the above menu does not satisfy the customer, they are welcome to bring their own snacks and place them in our esky.', 'We do not sell alcohol on the boat, but all guests are welcome to BYO and place cans in the esky.', 'No red wine or glass is allowed on the vessel.']",,0
44fe2ed6394c6bf6,Tongarra Day Sailing Tour,redcatadventures,,"Experience a thrilling day of sailing and adventure aboard Tongarra, where relaxation meets excitement in the stunning Whitsundays. This tour is perfect for those seeking a mix of leisure and adrenaline, offering activities like snorkeling, banana boat rides, and scenic beach walks. With a fantastic crew dedicated to ensuring an unforgettable experience, enjoy the spacious deck with comfy beanbags, savor delicious meals, and witness a breathtaking sunset as you sail back to Airlie Beach. Ideal for families, couples, and groups looking to explore the Whitsundays' hidden gems with a fun and vibrant atmosphere.",Full Day,Coral Sea Marina,"Departs morning, Returns sunset",FROM A$199,,"Snorkelling equipment (mask and snorkel only)
Environmental Management Charge (EMC)
Queensland Parks and Wildlife fees
Lunch and snacks
BYO alcohol (eski and ice provided)","Sail on the spacious deck of Tongarra with bean bags
Snorkel at the best fringing reef in the region
Experience a thrilling banana boat ride
Enjoy a sunset sail back to Airlie Beach
Explore Langford Island and sandbar
Fun and informative ECO tour guides
Spot humpback whales (June to September)",,8.0,https://redcatadventures.com.au/package/day-sailing-tour/,https://redcatadventures.com.au/package/day-sailing-tour/,,static/tour_images/redcatadventures/tongarra_day_sailing_tour/image_1.jpg,"static/tour_images/redcatadventures/tongarra_day_sailing_tour/image_1.jpg,static/tour_images/redcatadventures/tongarra_day_sailing_tour/image_2.jpg,static/tour_images/redcatadventures/tongarra_day_sailing_tour/image_4.jpg,static/tour_images/redcatadventures/tongarra_day_sailing_tour/image_5.jpg,static/tour_images/redcatadventures/tongarra_day_sailing_tour/image_7.jpg,static/tour_images/redcatadventures/tongarra_day_sailing_tour/image_9.jpg,static/tour_images/redcatadventures/tongarra_day_sailing_tour/image_10.jpg,static/tour_images/redcatadventures/tongarra_day_sailing_tour/image_11.jpg",,True,https://redcatadventures.com.au/package/day-sailing-tour/,,,,full_day,combo,"Airlie Beach,Great Barrier Reef,Hill Inlet,Langford,Whitehaven,Whitsunday Island","adventure,relaxation,sunset",general,adventurous,,"['Age range – recommended 12+ years', 'Snorkelling is a physical activity. A certain level of fitness and ability is required to participate.']","['Pack a small waterproof bag and include: Sunscreen, sunglasses, a towel and a hat', 'Practical clothing and footwear (warmer items during winter)', 'Underwater camera', 'BYO alcohol (no glass or red wine) for the boat only']","['BYO Alcohol (and we provide the eski and ice)', 'Snorkelling equipment (excluding prescription masks)']",,0
0ccf1c0576808ea5,Great Barrier Reef Snorkel Adventure,redcatadventures,,"Experience the beauty of the world-famous Great Barrier Reef on this snorkelling eco-adventure. Travel on the smoothest, most comfortable vessel to visit the incredible coral wonderland of the outer reefs. This all-inclusive day trip is perfect for those seeking to bond while reconnecting with nature. Whether you're a couple searching for a romantic escape or a small group craving adventure and fun, this once-in-a-lifetime experience will deliver unbeatable memories. Enjoy the panoramic views from the 360° rooftop deck and relax in premium seating designed for extra comfort. The tour is led by Proud Climate Action Leaders with exceptional local knowledge, ensuring an eco-friendly and informative journey.",Full Day,Coral Sea Marina,"Departs 9:00 am, Returns 5:00 pm",FROM A$299,A$249,"Free courtesy bus transfers
Lycra suits, snorkelling equipment, and wet suits (winter months)
Locally catered lunch and snacks
Fully licenced bar onboard (cash and card accepted)
Travel with accredited Climate Action Leaders","Snorkel the world-famous Great Barrier Reef
360° rooftop deck for panoramic views
Relax in premium seating designed for extra comfort
Travel in style aboard a fully air-conditioned vessel
Guest numbers are kept personalised and well below capacity
See Humpback Whales during winter in their natural habitat
Swim & Snorkel in crystal clear waters
A day of adventure with creature comforts
Proudly Australian-owned business for the past 14 years
2018-2022 Gold National Tourism Award Winners",,8.0,https://redcatadventures.com.au/package/outer-reef-snorkeling-adventure/,https://redcatadventures.com.au/package/outer-reef-snorkeling-adventure/,,static/tour_images/redcatadventures/great_barrier_reef_snorkel_adventure/image_1.jpg,"static/tour_images/redcatadventures/great_barrier_reef_snorkel_adventure/image_1.jpg,static/tour_images/redcatadventures/great_barrier_reef_snorkel_adventure/image_2.jpg,static/tour_images/redcatadventures/great_barrier_reef_snorkel_adventure/image_4.jpg,static/tour_images/redcatadventures/great_barrier_reef_snorkel_adventure/image_5.jpg,static/tour_images/redcatadventures/great_barrier_reef_snorkel_adventure/image_6.jpg,static/tour_images/redcatadventures/great_barrier_reef_snorkel_adventure/image_7.jpg,static/tour_images/redcatadventures/great_barrier_reef_snorkel_adventure/image_8.jpg,static/tour_images/redcatadventures/great_barrier_reef_snorkel_adventure/image_9.jpg,static/tour_images/redcatadventures/great_barrier_reef_snorkel_adventure/image_12.jpg,static/tour_images/redcatadventures/great_barrier_reef_snorkel_adventure/image_13.jpg",,True,https://redcatadventures.com.au/package/outer-reef-snorkeling-adventure/,,,,full_day,combo,"Great Barrier Reef,Whitsunday Island","adventure,family-friendly,luxury,relaxation,small-group",family,relaxed,,"['This tour is not recommended for Children under six years old.', 'Children under six years old must be approved before departure, and there are limitations regarding their participation in water activities.', 'Snorkelling is a physical activity. A certain level of fitness and ability is required to participate.', 'Recommended for confident swimmers that have previously snorkelled.']","['Pack a small waterproof bag and include: Sunscreen, sunglasses, a towel and a hat', 'Practical clothing and footwear (warmer items during winter)', 'Underwater camera', 'Cash or card for onboard purchases', 'Refillable water bottle', 'A sense of fun and adventure!']","['Prescription Masks are not provided, so please BYO or visit Aqua Dive Hire & Services.', 'Enjoy a cold drink onboard with our fully licenced bar. We accept both cash and card on board for any additional purchases.']",,0
9ebfef1715ea29c7,Falls to Paradise – Waterfall Tour,redcatadventures,,"Experience the ultimate tropical getaway with the Falls to Paradise tour, an all-inclusive day trip that combines nature exploration and relaxation. Swim in the refreshing rockpools of Cedar Creek Falls, surrounded by lush tropical flora and vibrant wildlife. After a morning of adventure, unwind at the award-winning Northerlies Beach Bar & Grill, where you can enjoy a delicious lunch and soak up stunning views of the Coral Sea. This tour is perfect for families and friends looking to connect with nature and enjoy a laid-back afternoon by the beach.",Full Day,Coral Sea Marina,"Departs 10:30 am, Returns 3:30 pm",FROM A$159,A$149,"Swim in the rockpools at Cedar Creek Falls
Fun and informative tour guide
Delicious lunch prepared by a local chef
Alcoholic or non-alcoholic drink included
Courtesy coach available for extended stay at Northerlies","Swim in one of Queensland’s most beautiful waterfalls
Enjoy the views from the beach bar while sipping creative cocktails
Private beach for the kids to explore
Award-winning restaurant and bar
ECO walk to the top of the falls",,8.0,https://redcatadventures.com.au/package/falls-to-paradise/,https://redcatadventures.com.au/package/falls-to-paradise/,,static/tour_images/redcatadventures/falls_to_paradise___waterfall_tour/image_1.jpg,"static/tour_images/redcatadventures/falls_to_paradise___waterfall_tour/image_1.jpg,static/tour_images/redcatadventures/falls_to_paradise___waterfall_tour/image_2.jpg,static/tour_images/redcatadventures/falls_to_paradise___waterfall_tour/image_3.jpg,static/tour_images/redcatadventures/falls_to_paradise___waterfall_tour/image_4.jpg,static/tour_images/redcatadventures/falls_to_paradise___waterfall_tour/image_7.jpg,static/tour_images/redcatadventures/falls_to_paradise___waterfall_tour/image_8.jpg,static/tour_images/redcatadventures/falls_to_paradise___waterfall_tour/image_9.jpg,static/tour_images/redcatadventures/falls_to_paradise___waterfall_tour/image_10.jpg,static/tour_images/redcatadventures/falls_to_paradise___waterfall_tour/image_12.jpg",,True,https://redcatadventures.com.au/package/falls-to-paradise/,,,,full_day,combo,"Airlie Beach,Great Barrier Reef,Hill Inlet,Whitehaven,Whitsunday Island","adventure,family-friendly,private,relaxation",family,adventurous,,"['Adult Ages 15+', 'Child Ages 4 - 14', 'Ages: Ages 4+']","['Practical clothing (waterproof jacket)', 'Enclosed footwear', 'Sunscreen, beach towel, and swimmers', 'Camera', 'A sense of adventure.']","['Depending on the season, the waterfalls may not be running on your tour date.']",,0
