id,name,company_name,summary,description,duration,departure_location,departure_times,price_adult,price_child,includes,highlights,keywords,duration_hours,link_booking,link_more_info,phone,image_url,image_urls,commission_rate,active,price_source_url,price_tiers,raw_text,duration_days,duration_category,tour_type,locations,tags,audience,intensity_level,video_urls,important_information,what_to_bring,whats_extra,cancellation_policy,booking_connected
d7b1525f2192dd0c,Tour de buceo en el arrecife Bowen,airliebeachdiving,,"Embárcate en un viaje inolvidable al famoso arrecife Horseshoe Bay de Bowen con nuestra visita guiada de buceo.Esta experiencia, que sale del centro de buceo de Airlie Beach, ofrece una inmersión fascinante en vibrantes jardines de coral.Ideal para buceadores certificados de todos los niveles, el poco profundo pero próspero mundo submarino de Bowen Reef, con una profundidad máxima de sólo 7 metros, proporciona un entorno accesible e impresionante para la exploración.Encuentre un arcoíris de corales saludables, peces juveniles, tortugas y más en aguas cristalinas, perfectas para fotografías submarinas y observar delicados ecosistemas de arrecifes.",6 Hours,Airlie Beach Dive Centre,,FROM A$145,,"Todo el equipo de buceo.
Viaje de regreso desde Airlie Beach a Bowen Reef
Guía de buceo profesional.","Explora el famoso arrecife Horseshoe Bay de Bowen
Sumérgete en vibrantes jardines de coral
Encuentra una variedad de vida marina, incluidas tortugas y morenas.
Ideal para fotografía submarina
Profundidades poco profundas con gran visibilidad.",,6.0,https://airliebeachdiving.com/shore-reef-diving/,https://airliebeachdiving.com/shore-reef-diving/,,static/tour_images/airliebeachdiving/d7b1525f2192dd0c/image_1.jpg,static/tour_images/airliebeachdiving/d7b1525f2192dd0c/image_1.jpg,,True,https://airliebeachdiving.com/shore-reef-diving/,Adult: A$145,,,full_day,water,"Airlie Beach,Bowen,Whitsunday Island","adventure,family-friendly",family,moderate,,,,,,0
b2b14cb5bde5955d,Divertido tour de buceo nocturno,airliebeachdiving,,"Sumérgete en las encantadoras noches de los arrecifes Whitsundays en una inolvidable aventura de buceo nocturno.Perfecto para buceadores certificados que buscan una experiencia submarina única e íntima, este recorrido ofrece una emocionante oportunidad de presenciar la vibrante vida nocturna del Coral Garden de Bowen Reef.Explore los coloridos y saludables corales del arrecife y encuentre una variedad de vida marina nocturna, incluidas tortugas, morenas y plancton bioluminiscente.Este entorno seguro y de apoyo garantiza una experiencia memorable para buceadores de todos los niveles.",6 Hours,Airlie Beach Dive Centre,,FROM A$199,,"Todo el equipo de buceo.
guía de buceo
Viaje de regreso desde Airlie Beach a Bowen Reef","Experimente la vibrante vida nocturna del Coral Garden de Bowen Reef
Sea testigo de la vida marina nocturna en acción.
Encuentra tortugas, morenas y plancton bioluminiscente.
Entorno de buceo seguro y emocionante
Apto para buceadores certificados de todos los niveles.",,6.0,https://airliebeachdiving.com/night-dive-tour/,https://airliebeachdiving.com/night-dive-tour/,,static/tour_images/airliebeachdiving/b2b14cb5bde5955d/image_1.jpeg,static/tour_images/airliebeachdiving/b2b14cb5bde5955d/image_1.jpeg,,True,https://airliebeachdiving.com/night-dive-tour/,Adult: A$199,,,full_day,water,"Airlie Beach,Bowen,Whitsunday Island","adventure,family-friendly,small-group",family,adventurous,,,,,,0
f621e9a988a854c0,Buceo en naufragio SS Yongala,airliebeachdiving,,"Embárquese en una aventura de buceo única en la vida en el legendario SS Yongala, un sitio de buceo en naufragios de renombre mundial celebrado como una de las atracciones submarinas más cautivadoras de Australia.Esta experiencia ofrece una combinación perfecta de rica historia, diversa vida marina y exploración impresionante.Sumérgete en la historia mientras exploras el SS Yongala, un barco de pasajeros que se hundió trágicamente en 1911 y desde entonces se ha transformado en un vibrante paraíso submarino.Hogar de una espectacular variedad de vida marina, este naufragio está repleto de meros gigantes, curiosas tortugas marinas, rayas águila, coloridas formaciones de coral e incluso tiburones.Ya sea que esté cautivado por la vida marina o los misterios de la historia, esta inmersión ofrece una experiencia verdaderamente única que atesorará para siempre.",,Airlie Beach Dive Centre,,A$250,,"Dos inmersiones guiadas en pecios
Todo el equipo esencial
Aprendizaje electrónico sobre buceo en pecios y buceo profundo
Transporte de ida y vuelta desde Airlie Beach","Explora el majestuoso SS Yongala
Guiado por instructores de buceo altamente capacitados.
Sumérgete en la historia con un naufragio de 1911
Sea testigo de un vibrante ecosistema submarino
Encuentra meros gigantes, tortugas marinas, rayas águila y tiburones.",,,https://airliebeachdiving.com/ss-yongala-wreck-dive/,https://airliebeachdiving.com/ss-yongala-wreck-dive/,,static/tour_images/airliebeachdiving/f621e9a988a854c0/image_1.jpeg,static/tour_images/airliebeachdiving/f621e9a988a854c0/image_1.jpeg,,True,https://airliebeachdiving.com/ss-yongala-wreck-dive/,PADI Advanced Open Water Certification: A$250,,,unknown,water,"Airlie Beach,Whitsunday Island","adventure,family-friendly",family,moderate,,,,,,0
