id,name,company_name,summary,description,duration,departure_location,departure_times,price_adult,price_child,includes,highlights,keywords,duration_hours,link_booking,link_more_info,phone,image_url,image_urls,commission_rate,active,price_source_url,price_tiers,raw_text,duration_days,duration_category,tour_type,locations,tags,audience,intensity_level,video_urls,important_information,what_to_bring,whats_extra,cancellation_policy,booking_connected
f649adbc75a985f7,Solway Lass 3D/2N,explorewhitsundays,,"Disfrute de las Whitsundays a bordo del Solway Lass, un velero conservado que ofrece una mezcla única de historia y aventura. Con un amplio espacio en cubierta, un bar con licencia y camarotes con aire acondicionado, esta excursión ofrece comodidad y emoción. Perfecto para mochileros y aventureros, disfrute de la emoción de navegar, bucear y explorar las impresionantes playas y arrecifes de coral. Solway Lass promete un viaje inolvidable lleno de impresionantes puestas de sol, vibrante vida marina y la oportunidad de crear recuerdos para toda la vida con sus compañeros de viaje.",3 días 2 noches,"Tienda 9/33 Port Dr, Puerto de Airlie",,"FROM A$2,150",,"Servicios de patrón y tripulación
Todas las comidas y aperitivos
Agua del grifo, té y café
Toalla de baño
Tablas de paddle surf
Equipo de snorkel y clases básicas
Traje Stinger
Todos los impuestos del puerto deportivo","Navegue a bordo de un velero histórico
Explore las islas Whitsunday
Disfrute de comidas al aire libre en cubierta
Participe en actividades de vela
Practique snorkel en vibrantes arrecifes de coral
Relájese en la playa de Whitehaven
Disfrute de impresionantes puestas de sol y amaneceres
Conozca a otros viajeros durante la hora feliz",,,,https://explorewhitsundays.com/all-tours/overnight-trips/solway-voyager-3d2n/,,static/tour_images/explorewhitsundays/f649adbc75a985f7/image_8.jpg,"static/tour_images/explorewhitsundays/f649adbc75a985f7/image_1.jpg,static/tour_images/explorewhitsundays/f649adbc75a985f7/image_2.jpg,static/tour_images/explorewhitsundays/f649adbc75a985f7/image_4.jpg,static/tour_images/explorewhitsundays/f649adbc75a985f7/image_5.jpg,static/tour_images/explorewhitsundays/f649adbc75a985f7/image_6.jpg,static/tour_images/explorewhitsundays/f649adbc75a985f7/image_8.jpg,static/tour_images/explorewhitsundays/f649adbc75a985f7/image_9.jpg,static/tour_images/explorewhitsundays/f649adbc75a985f7/image_10.jpg,static/tour_images/explorewhitsundays/f649adbc75a985f7/image_12.jpg",,True,https://explorewhitsundays.com/all-tours/overnight-trips/solway-voyager-3d2n/,Adulto: 2.150 dólares australianos,,3.0,multi_day,combo,"Airlie Beach,Great Barrier Reef,Hook Island,Whitehaven,Whitsunday Island","adventure,private,relaxation,sunset",general,adventurous,,"['Edades: 18+', 'Pasajeros máximos: 32']","['Ropa', 'Toalla de playa', 'Artículos de aseo', 'Sombrero', 'Bañador', 'Protector solar', 'Chaqueta/suéter', 'Cámara', 'Gafas de sol', 'Zapatillas o sandalias para pasear por la isla', 'Dinero en efectivo o tarjeta de crédito para compras a bordo']","['Solway Voyager es BYO', 'Por favor, empaquete sus pertenencias para el viaje en una bolsa blanda']",,0
3db466b62ae0d157,Siska 2D/1N,explorewhitsundays,,"Disfrute de las Whitsundays a bordo del Siska, un velero clásico que ofrece un ambiente juvenil y social. Perfecto para quienes disponen de poco tiempo y desean hacer nuevos amigos y explorar lugares emblemáticos de las Whitsunday. Disfrute de una divertida aventura a vela con un amplio espacio para sentarse y un alojamiento diáfano, ideal para socializar y contemplar las puestas de sol con una copa en la mano. Esta excursión es perfecta para viajeros jóvenes en busca de aventura y camaradería.",2 días 1 noche,"Tienda 9/33 Port Dr, Puerto de Airlie",Salida a las 9.00 y regreso a las 16.00,A$460.60,,"Servicios de patrón y tripulación
Todas las comidas y aperitivos
Agua del grifo, té y café
Equipo de snorkel y enseñanza básica
Traje de neopreno
Toda la ropa de cama","Paseo guiado hasta el mirador de Hill Inlet
Visita a la playa de Whitehaven
Bebidas al atardecer y aperitivos antes de la cena
Snorkel en los arrecifes de coral circundantes
Comidas comunitarias recién preparadas a bordo
Alojamiento diáfano con camas individuales y dobles",,,,https://explorewhitsundays.com/all-tours/overnight-trips/siska-iv/,,static/tour_images/explorewhitsundays/3db466b62ae0d157/image_7.jpeg,"static/tour_images/explorewhitsundays/3db466b62ae0d157/image_1.jpg,static/tour_images/explorewhitsundays/3db466b62ae0d157/image_2.jpg,static/tour_images/explorewhitsundays/3db466b62ae0d157/image_3.jpg,static/tour_images/explorewhitsundays/3db466b62ae0d157/image_4.jpg,static/tour_images/explorewhitsundays/3db466b62ae0d157/image_6.jpg,static/tour_images/explorewhitsundays/3db466b62ae0d157/image_7.jpeg,static/tour_images/explorewhitsundays/3db466b62ae0d157/image_9.jpg,static/tour_images/explorewhitsundays/3db466b62ae0d157/image_10.jpg,static/tour_images/explorewhitsundays/3db466b62ae0d157/image_11.jpg,static/tour_images/explorewhitsundays/3db466b62ae0d157/image_12.jpg,static/tour_images/explorewhitsundays/3db466b62ae0d157/image_13.jpg,static/tour_images/explorewhitsundays/3db466b62ae0d157/image_14.jpg,static/tour_images/explorewhitsundays/3db466b62ae0d157/image_15.jpg,static/tour_images/explorewhitsundays/3db466b62ae0d157/image_16.jpg,static/tour_images/explorewhitsundays/3db466b62ae0d157/image_18.jpg,static/tour_images/explorewhitsundays/3db466b62ae0d157/image_19.jpg",,True,https://explorewhitsundays.com/all-tours/overnight-trips/siska-iv/,Litera individual: A$460.60 | Media litera doble (tarifa de reserva): A$460.60,,2.0,multi_day,combo,"Airlie Beach,Great Barrier Reef,Hill Inlet,Whitehaven","adventure,private,sunset",general,adventurous,,"['Edades: 15+', 'No se especifican requisitos de forma física', 'Se requiere saber nadar para las actividades de snorkel', 'No se especifican necesidades de supervisión', 'No se mencionan restricciones específicas']","['Ropa', 'Toalla de playa y baño', 'Artículos de aseo', 'Sombrero', 'Bañador', 'Protector solar', 'Chaqueta/suéter', 'Cámara', 'Gafas de sol', 'Corredores o sandalias para los paseos por la isla']","[Por favor, no traigas botellas de cristal ni vino tinto"", ""Las tiendas de botellas no abren hasta las 10 de la mañana, así que hay que organizarlo la noche anterior"", ""No hay consigna de equipaje en el puerto deportivo"", ""Hay consigna en la calle principal de Airlie Beach, en el 344 de Shute Harbour Road (de 7 de la mañana a 6 de la tarde)"", ""Aparcamiento en el puerto deportivo por 24$, que se puede organizar durante el proceso de registro"".]",,0
860462ff96e36caa,Primera 2D/1N,explorewhitsundays,,"Disfrute de las Whitsundays a bordo del Prima, un encantador y confortable velero diseñado para aventuras íntimas en pequeños grupos. Ideal para familias, escapadas románticas y quienes buscan aventuras suaves, el Prima ofrece una oportunidad única de explorar lugares idílicos de las islas. Con un toldo a la sombra y zonas acolchadas para tomar el sol, podrá relajarse y disfrutar de las impresionantes vistas. Cada viaje es una nueva aventura, con oportunidades para bucear, conocer la vida marina y disfrutar de comidas recién preparadas a bordo. Perfecto para aquellos que buscan relajarse y conectar con otros viajeros en un entorno sereno.",2 días 1 noche,"Tienda 9/33 Port Dr, Puerto de Airlie",,A$516.06,,"Servicios de patrón y tripulación
Todos los desayunos, comidas, cenas y aperitivos
Agua del grifo, té y café
Equipo de snorkel y enseñanza básica
Entrada/Admisión - Whitehaven Beach
Entrada/Admisión - Hill Inlet
Entrada/Admisión - Islas Whitsunday
Traslados a/desde el puerto deportivo
Toalla de baño, traje de buceo y toda la ropa de cama","Aventuras en velero para grupos reducidos
Lugares idílicos en las islas
Cómodos asientos y zonas para tomar el sol
Política de bebidas BYO con nevera para invitados
Comidas recién preparadas con ingredientes locales
Oportunidades para bucear y conocer la vida marina
Impresionantes puestas de sol y observación de estrellas",,,,https://explorewhitsundays.com/overnight-trips/prima/,,static/tour_images/explorewhitsundays/860462ff96e36caa/image_6.png,"static/tour_images/explorewhitsundays/860462ff96e36caa/image_2.jpg,static/tour_images/explorewhitsundays/860462ff96e36caa/image_3.jpg,static/tour_images/explorewhitsundays/860462ff96e36caa/image_4.jpg,static/tour_images/explorewhitsundays/860462ff96e36caa/image_5.jpg,static/tour_images/explorewhitsundays/860462ff96e36caa/image_6.png,static/tour_images/explorewhitsundays/860462ff96e36caa/image_7.jpg,static/tour_images/explorewhitsundays/860462ff96e36caa/image_8.jpg,static/tour_images/explorewhitsundays/860462ff96e36caa/image_9.png,static/tour_images/explorewhitsundays/860462ff96e36caa/image_10.jpg,static/tour_images/explorewhitsundays/860462ff96e36caa/image_11.jpg,static/tour_images/explorewhitsundays/860462ff96e36caa/image_12.jpg,static/tour_images/explorewhitsundays/860462ff96e36caa/image_13.png,static/tour_images/explorewhitsundays/860462ff96e36caa/image_14.jpg,static/tour_images/explorewhitsundays/860462ff96e36caa/image_16.jpg,static/tour_images/explorewhitsundays/860462ff96e36caa/image_17.jpg,static/tour_images/explorewhitsundays/860462ff96e36caa/image_18.jpg,static/tour_images/explorewhitsundays/860462ff96e36caa/image_19.jpg,static/tour_images/explorewhitsundays/860462ff96e36caa/image_20.png,static/tour_images/explorewhitsundays/860462ff96e36caa/image_21.jpg,static/tour_images/explorewhitsundays/860462ff96e36caa/image_22.png,static/tour_images/explorewhitsundays/860462ff96e36caa/image_24.jpg,static/tour_images/explorewhitsundays/860462ff96e36caa/image_25.jpg,static/tour_images/explorewhitsundays/860462ff96e36caa/image_26.jpg,static/tour_images/explorewhitsundays/860462ff96e36caa/image_27.jpg",,True,https://explorewhitsundays.com/overnight-trips/prima/,"Litera Individual: A$516.06 | Sólo cama doble (para 2 personas): A$1,098 | Private Double Cabin with Ensuite (for 2 people): A$1,156.20 | Cabaña Doble Privada con Baño (para 2 personas, llamar para reservar): A$1,291.56",,2.0,multi_day,combo,"Airlie Beach,Great Barrier Reef,Hill Inlet,Hook Island,Whitehaven,Whitsunday Island","adventure,private,relaxation,small-group,sunset",general,adventurous,,"['Edades: 4+', 'No se mencionan requisitos específicos de forma física.', 'Se recomienda saber nadar para las actividades de snorkel.', 'No se especifican las necesidades de supervisión para niños menores de 4 años.', 'No se mencionan restricciones.']","['Ropa', 'Toalla de playa/sarong', 'Artículos de aseo', 'Sombrero', 'Bañador', 'Protector solar', 'Chaqueta/suéter', 'Cámara', 'Gafas de sol', 'Corredores o sandalias para paseos por la isla']","['Política de BYO para todas las bebidas no alcohólicas y alcohólicas.', 'No se venden bebidas a bordo.', 'Empaquetar en una bolsa sin cierre de lados blandos.', 'Los traslados a/desde el puerto deportivo no están incluidos.']",,0
