id,name,company_name,summary,description,duration,departure_location,departure_times,price_adult,price_child,includes,highlights,keywords,duration_hours,link_booking,link_more_info,phone,image_url,image_urls,commission_rate,active,price_source_url,price_tiers,raw_text,duration_days,duration_category,tour_type,locations,tags,audience,intensity_level,itinerary,menu,age_requirements,ideal_for,video_urls,important_information,what_to_bring,whats_extra,cancellation_policy
e417664eb55f9833,Excursión de medio día a la Isla de las Tortugas,saltydog,,"La excursión de medio día Inner Island Turtle Tour ofrece una emocionante aventura tanto para remadores experimentados como para principiantes, centrada en la diversión y el disfrute. Reme por las aguas turquesas de Shute Harbour, explorando los arrecifes de coral y las islas tropicales cercanas. Descubra una asombrosa diversidad de fauna marina y avifauna, incluidas tortugas marinas y águilas planeadoras. Ideal para quienes disfrutan de la naturaleza y la aventura, esta excursión ofrece la oportunidad de nadar, explorar o simplemente relajarse en playas únicas. Perfecto para familias y personas que buscan una experiencia memorable en kayak.",Half Day,Shute Harbour,,FROM A$120,$100 under 15 years old,"Bebidas frías
Barritas de muesli
Plato de frutas
Excursión guiada en kayak","Recorra en kayak los arrecifes de coral periféricos
Explorar las islas tropicales cercanas
Avistar tortugas marinas y águilas planeadoras
Posibilidad de ver ballenas jorobadas (de julio a septiembre)
Oportunidad de nadar y explorar playas únicas",,3.5,https://www.saltydog.com.au/tours/half-day-inner-island-turtle-tour/,https://www.saltydog.com.au/tours/half-day-inner-island-turtle-tour/,,static/tour_images/saltydog/e417664eb55f9833/image_11.jpg,"static/tour_images/saltydog/e417664eb55f9833/image_1.jpg,static/tour_images/saltydog/e417664eb55f9833/image_2.jpg,static/tour_images/saltydog/e417664eb55f9833/image_4.jpg,static/tour_images/saltydog/e417664eb55f9833/image_7.jpg,static/tour_images/saltydog/e417664eb55f9833/image_9.jpg,static/tour_images/saltydog/e417664eb55f9833/image_10.jpg,static/tour_images/saltydog/e417664eb55f9833/image_11.jpg,static/tour_images/saltydog/e417664eb55f9833/image_12.jpg",,True,https://www.saltydog.com.au/tours/half-day-inner-island-turtle-tour/,,,,half_day,water,Airlie Beach,"adventure,family-friendly,relaxation",family,relaxed,,,Se admiten niños a partir de 7 años (1 adulto por niño),"Principiantes y expertos, familias y amantes de la naturaleza que buscan una experiencia en kayak atractiva y divertida",,"['Se requiere un nivel de forma física medio.', 'Las condiciones meteorológicas pueden cambiar durante la excursión en kayak.', 'Cerrado el día de Navidad, el día de San Esteban y el día de Año Nuevo.']","['Se proporcionan bebidas frías, barritas de muesli y bandeja de fruta']",,
9839383cb56c02ca,Aventura de día completo en kayak y snorkel en una isla tropical,saltydog,,"Descubra las islas Whitsunday como nunca antes con la excursión de un día en kayak y snorkel por las islas tropicales. Esta excursión es perfecta para los entusiastas de la naturaleza y los aventureros que buscan explorar aguas cristalinas y una vibrante vida marina. Reme por las serenas islas interiores, relájese y báñese en White Rock, y cruce hasta South Molle Island, donde podrá avistar tortugas, delfines e incluso ballenas jorobadas durante su época de migración. La excursión ofrece la oportunidad única de recorrer a pie el pintoresco sendero del Monte Jeffries, que ofrece impresionantes vistas panorámicas de las islas. Disfrute de un delicioso almuerzo bufé en la playa, haciendo de éste un día inolvidable en el paraíso.",Full Day,Shute Harbour,,FROM A$220,,"Guía experimentado
Grupo reducido de palistas
Equipo de kayak
Instrucciones de seguridad
Almuerzo buffet en la playa
Tasa de arrecife
IVA","Navegue en kayak por las islas interiores y hasta White Rock
Relájese y nade en White Rock
Cruzar a la isla de South Molle
Avistar vida marina como tortugas, delfines y águilas marinas
Oportunidad de practicar snorkel en el arrecife de coral si las condiciones son favorables
Recorrer el sendero de Mount Jeffries para disfrutar de vistas panorámicas
Ver ballenas jorobadas durante la época de migración (julio-septiembre)",,8.0,https://www.saltydog.com.au/tours/full-day-tropical-island-tour/,https://www.saltydog.com.au/tours/full-day-tropical-island-tour/,,static/tour_images/saltydog/9839383cb56c02ca/image_5.jpg,"static/tour_images/saltydog/9839383cb56c02ca/image_1.jpg,static/tour_images/saltydog/9839383cb56c02ca/image_3.jpg,static/tour_images/saltydog/9839383cb56c02ca/image_4.jpg,static/tour_images/saltydog/9839383cb56c02ca/image_5.jpg,static/tour_images/saltydog/9839383cb56c02ca/image_7.jpg,static/tour_images/saltydog/9839383cb56c02ca/image_9.jpg,static/tour_images/saltydog/9839383cb56c02ca/image_12.jpg",,True,https://www.saltydog.com.au/tours/full-day-tropical-island-tour/,"Standard: A$220 (includes lunch, reef tax and GST)",,,full_day,combo,"Airlie Beach,Whitsunday Island","adventure,relaxation,small-group",general,relaxed,,"**Menú:**
- Almuerzo buffet en la playa",Mayores de 15 años,"Aficionados a la naturaleza, aventureros y piragüistas de todos los niveles",,,"['Recomendaciones de ropa', 'Artículos personales (crema solar, sombrero, gafas de sol, toalla)']",,
1b390fe19a2dc6fc,excursión guiada de 6 días en kayak por las Whitsunday,saltydog,,"Embárquese en la aventura definitiva en las Whitsunday con esta expedición guiada de 6 días en kayak. Esta excursión, perfecta para los entusiastas de las actividades al aire libre y los amantes de la naturaleza, ofrece una experiencia envolvente en las impresionantes islas Whitsunday. Reme por aguas turquesas, explore vibrantes arrecifes de coral y acampe bajo las estrellas en playas solitarias. Tanto si es un kayakista experimentado como un principiante curioso, esta expedición promete vistas impresionantes, encuentros únicos con la fauna y recuerdos inolvidables.",6 Days,Shute Harbour,,"FROM A$3,295",,"5 días completos de kayak de mar
Equipo de snorkel
Equipo de acampada
Guías experimentados
Traslados de Airlie Beach a Shute Harbour
Taxi acuático rápido a Whitehaven Beach
Todas las comidas durante la expedición","Explore la naturaleza salvaje de las Whitsunday
Practique snorkel en los arrecifes de coral
Acampe bajo las estrellas
Visite la playa de Whitehaven y Hill Inlet
Camine hasta el mirador de Chance Bay
Reme por la costa este hasta el campamento de Cairn
Disfrute de impresionantes vistas desde el mirador de Cairn
Descubra la vida marina en Maureen's Cove
Remada final hasta Bali Hai",,,https://www.saltydog.com.au/tours/6-day-kayaking-expedition/,https://www.saltydog.com.au/tours/6-day-kayaking-expedition/,,static/tour_images/saltydog/1b390fe19a2dc6fc/image_2.jpg,"static/tour_images/saltydog/1b390fe19a2dc6fc/image_1.jpg,static/tour_images/saltydog/1b390fe19a2dc6fc/image_2.jpg,static/tour_images/saltydog/1b390fe19a2dc6fc/image_4.jpg,static/tour_images/saltydog/1b390fe19a2dc6fc/image_5.jpg,static/tour_images/saltydog/1b390fe19a2dc6fc/image_6.jpg,static/tour_images/saltydog/1b390fe19a2dc6fc/image_7.jpeg,static/tour_images/saltydog/1b390fe19a2dc6fc/image_8.jpg,static/tour_images/saltydog/1b390fe19a2dc6fc/image_9.jpg,static/tour_images/saltydog/1b390fe19a2dc6fc/image_12.jpg",,True,https://www.saltydog.com.au/tours/6-day-kayaking-expedition/,"Per Person: A$3,295",,6.0,multi_day,combo,"Airlie Beach,Hill Inlet,Hook Island,Whitehaven,Whitsunday Island","adventure,private",general,adventurous,"**Día 1:** Llegada a Airlie Beach, encuentro con los guías y traslado a Shute Harbour. Tome un taxi acuático rápido hasta la playa de Whitehaven, explore la isla de Haselwood y practique senderismo hasta el mirador de Chance Bay.
**Día 2:** Reme hacia el norte por la costa, nade en Hill Inlet y continúe hasta el campamento de Cairn.
**Día 3: Camine por la mañana hasta el mirador de Cairn y reme hasta la playa de Crayfish, en Hook Island.
**Día 4: Navegue en kayak alrededor de Hook Island hasta Maureen's Cove y practique snorkel en la zona.
**Día 5: Remada final hasta Bali Hai, exploración de los jardines de coral.
**Día 6: Regreso a Airlie Beach.",,Todas las edades son bienvenidas,"Entusiastas de las actividades al aire libre, amantes de la naturaleza, aventureros y familias que buscan una experiencia única en la isla.",,"['Apto para mayores de 16 años', 'DEBE HABLAR Y ENTENDER INGLÉS', 'DEBE SABER NADAR', 'Los kayakistas deben gozar de buena salud y una condición física adecuada para participar en esta actividad de forma segura', 'Usted y/o su médico deberán confirmar que se encuentra lo suficientemente sano y en forma para participar en esta actividad', 'Salty Dog Sea Kayaking se reserva el derecho a rechazar una reserva por motivos médicos, si se considera que puede ir en detrimento de la seguridad de los participantes y del personal y del buen funcionamiento de la actividad']",,,
58dbdabd60de8265,Aventura de día completo en kayak y snorkel en una isla tropical,saltydog,,"Disfrute de la belleza de las islas Whitsunday en una aventura de un día completo en kayak. Reme por las serenas aguas con un grupo reducido, guiado por un experimentado guía. Descubra la vibrante vida marina, que incluye tortugas, delfines y coloridos peces tropicales. Esta excursión es perfecta para los entusiastas de la naturaleza y los aventureros que buscan conectar con la impresionante belleza natural de la zona. Disfrute de un almuerzo bufé en la playa y de la oportunidad de practicar snorkel en el arrecife de coral, convirtiéndolo en un día inolvidable en el paraíso.",Full Day,Shute Harbour,,FROM A$220,,"Guía experimentado
Equipo de kayak
Instrucciones de seguridad
Almuerzo buffet en la playa
Tasa de arrecife
IVA","Navegue en kayak por las islas Whitsunday
Relájese y nade en White Rock
Oportunidad de practicar snorkel en el arrecife de coral periférico
Avistar especies marinas como tortugas y delfines
Recorrer la ruta de senderismo de Mount Jeffries
Vistas panorámicas de las islas Whitsunday
Experiencia en grupo reducido",,8.0,https://www.saltydog.com.au/tours/full-day-tour/,https://www.saltydog.com.au/tours/full-day-tour/,,static/tour_images/saltydog/58dbdabd60de8265/image_5.jpg,"static/tour_images/saltydog/58dbdabd60de8265/image_1.jpg,static/tour_images/saltydog/58dbdabd60de8265/image_3.jpg,static/tour_images/saltydog/58dbdabd60de8265/image_4.jpg,static/tour_images/saltydog/58dbdabd60de8265/image_5.jpg,static/tour_images/saltydog/58dbdabd60de8265/image_7.jpg,static/tour_images/saltydog/58dbdabd60de8265/image_9.jpg,static/tour_images/saltydog/58dbdabd60de8265/image_12.jpg",,True,https://www.saltydog.com.au/tours/full-day-tour/,"Standard: A$220 (includes lunch, reef tax and GST)",,,full_day,combo,"Airlie Beach,Whitsunday Island","adventure,relaxation,small-group",general,relaxed,,"**Menú:**
- Almuerzo buffet en la playa",Mayores de 15 años,"Entusiastas de la naturaleza, aventureros y quienes deseen explorar las islas Whitsunday de forma activa y atractiva.",,,"['Recomendaciones de ropa', 'Artículos personales (crema solar, sombrero, gafas de sol, toalla)']",,
75c72eecdb7c4d82,excursión guiada de 6 días en kayak por las Whitsunday,saltydog,,"Embárquese en la expedición definitiva de 6 días en kayak de mar por las impresionantes islas Whitsunday. Esta aventura es perfecta para quienes buscan una experiencia de inmersión en la naturaleza, combinando la emoción del kayak con la tranquilidad de acampar bajo las estrellas. Explore las aguas turquesas y las blancas arenas de sílice de la playa de Whitehaven Beach, practique snorkel en vibrantes jardines de coral y maravíllese con las emblemáticas vistas desde Hill Inlet. Ideal para aventureros y amantes de la naturaleza, esta excursión ofrece una oportunidad única de conectar con los impresionantes entornos marinos y terrestres de las Whitsundays.",6 Days,Shute Harbour,,"FROM A$3,295",,"5 días completos de kayak de mar
Snorkel
Senderismo
Equipo de acampada
Excursiones guiadas con expertos guías de kayak de mar
Traslados de Airlie Beach a Shute Harbour","Explore la naturaleza salvaje de las Whitsunday
Practique snorkel en vibrantes arrecifes de coral
Acampe bajo las estrellas en playas vírgenes
Visite la emblemática playa de Whitehaven y Hill Inlet
Disfrute de impresionantes vistas desde varios miradores
Experimente la emoción de navegar en kayak por aguas turquesas
Sea testigo de la diversa vida marina, incluidas tortugas y rayas",,,https://www.saltydog.com.au/tours/6-day/,https://www.saltydog.com.au/tours/6-day/,,static/tour_images/saltydog/75c72eecdb7c4d82/image_2.jpg,"static/tour_images/saltydog/75c72eecdb7c4d82/image_1.jpg,static/tour_images/saltydog/75c72eecdb7c4d82/image_2.jpg,static/tour_images/saltydog/75c72eecdb7c4d82/image_4.jpg,static/tour_images/saltydog/75c72eecdb7c4d82/image_5.jpg,static/tour_images/saltydog/75c72eecdb7c4d82/image_6.jpg,static/tour_images/saltydog/75c72eecdb7c4d82/image_7.jpeg,static/tour_images/saltydog/75c72eecdb7c4d82/image_8.jpg,static/tour_images/saltydog/75c72eecdb7c4d82/image_9.jpg,static/tour_images/saltydog/75c72eecdb7c4d82/image_12.jpg",,True,https://www.saltydog.com.au/tours/6-day/,,,6.0,multi_day,combo,"Airlie Beach,Hill Inlet,Hook Island,Whitehaven,Whitsunday Island","adventure,private",general,adventurous,"**Día 1:**
Llegada e instalación en el hotel del grupo. Encuentro con los guías y sesión informativa. Traslado a Shute Harbour y después a Whitehaven Beach en taxi acuático. Acampe y explore la isla de Haselwood practicando snorkel y caminando hasta el mirador de Chance Bay.
**Día 2
Reme hacia el norte siguiendo la costa hasta Hill Inlet para darse un baño y visitar el mirador. Continúe hasta el campamento de Cairn.
**Día 3
Caminata matutina hasta el mirador de Cairn y, a continuación, remada hasta la playa de Crayfish, en la isla de Hook. Disfrute de corales y vida marina de primera clase.
**Día 4
Navegue en kayak alrededor de Hook Island hasta Maureen's Cove para practicar snorkel y acampar.
**Día 5
Diríjase hacia el oeste hasta Bali Hai, explore los jardines de coral y observe la diversa vida marina.
**Día 6:**
Viaje de regreso y conclusión de la excursión.",,Mayores de 12 años,"Aventureros, amantes de la naturaleza y quienes deseen explorar las islas Whitsunday de una forma activa y envolvente.",,"['Apto para mayores de 16 años', 'DEBE HABLAR Y ENTENDER INGLÉS', 'DEBE SABER NADAR', 'Los kayakistas deben gozar de buena salud y una condición física adecuada para participar en esta actividad de forma segura', 'Usted y/o su médico deberán confirmar que se encuentra lo suficientemente sano y en forma para participar en esta actividad', 'Salty Dog Sea Kayaking se reserva el derecho a rechazar una reserva por motivos médicos, si se considera perjudicial para la seguridad de los participantes y del personal y para el buen desarrollo de la actividad']",,,
ece3460586cd6245,Excursión de medio día a la Isla de las Tortugas,saltydog,,"La excursión de medio día Inner Island Turtle Tour ofrece una emocionante aventura en kayak apta tanto para palistas experimentados como para principiantes. Partiendo de Shute Harbour, remará sobre vibrantes arrecifes de coral y explorará las impresionantes islas tropicales, hogar de una variada vida marina que incluye tortugas marinas y águilas. De julio a septiembre, existe la posibilidad de ver ballenas jorobadas. Esta excursión es perfecta para quienes buscan una experiencia divertida y de inmersión en la naturaleza, con oportunidades para nadar, relajarse y aprender de guías expertos.",Half Day,Shute Harbour,,FROM A$120,A$100,"Bebidas frías
Barritas de muesli
Plato de frutas","Recorra en kayak los arrecifes de coral periféricos
Explore las islas tropicales cercanas
Encuentre una gran variedad de fauna marina y avifauna
Posibilidad de ver ballenas jorobadas (de julio a septiembre)
Nadar y explorar playas o islas únicas
Los guías comparten sus conocimientos locales",,3.5,https://www.saltydog.com.au/tours/half-day-2/,https://www.saltydog.com.au/tours/half-day-2/,,static/tour_images/saltydog/ece3460586cd6245/image_11.jpg,"static/tour_images/saltydog/ece3460586cd6245/image_1.jpg,static/tour_images/saltydog/ece3460586cd6245/image_2.jpg,static/tour_images/saltydog/ece3460586cd6245/image_4.jpg,static/tour_images/saltydog/ece3460586cd6245/image_7.jpg,static/tour_images/saltydog/ece3460586cd6245/image_9.jpg,static/tour_images/saltydog/ece3460586cd6245/image_10.jpg,static/tour_images/saltydog/ece3460586cd6245/image_11.jpg,static/tour_images/saltydog/ece3460586cd6245/image_12.jpg",,True,https://www.saltydog.com.au/tours/half-day-2/,,,,half_day,water,Airlie Beach,"adventure,family-friendly,relaxation",family,relaxed,,,Se admiten niños a partir de 7 años (1 adulto por niño),"Desde principiantes hasta remadores experimentados, entusiastas de la naturaleza, familias y aquellos que buscan una divertida aventura al aire libre.",,"['Se requiere un nivel de forma física medio.', 'Las condiciones meteorológicas pueden cambiar durante la excursión en kayak.', 'Cerrado el día de Navidad, el día de San Esteban y el día de Año Nuevo.']","['Se proporcionan bebidas frías, barritas de muesli y bandeja de fruta']",,
