id,name,company_name,summary,description,duration,departure_location,departure_times,price_adult,price_child,includes,highlights,keywords,duration_hours,link_booking,link_more_info,phone,image_url,image_urls,commission_rate,active,price_source_url,price_tiers,raw_text,duration_days,duration_category,tour_type,locations,tags,audience,intensity_level,itinerary,menu,age_requirements,ideal_for,video_urls,important_information,what_to_bring,whats_extra,cancellation_policy,booking_connected
ac1533fcdec4bf45,半日シーカヤック・タートルツアー,whitsundaystanduppaddle,,ウィットサンデーズの静かな青い海で、穏やかなカヤックの冒険に出かけましょう。ご家族やカップル、お友達同士のグループに最適な半日ツアーで、自然との親密な触れ合いをお楽しみください。素晴らしい海の風景の中をパドリングし、雄大なウミガメに目を光らせましょう。ユニークな視点からウィットサンデーズの美しさを体験できるこのツアーは、自然愛好家や冒険好きにとって忘れられないお出かけになるでしょう。,Half Day,Shingley Beach,,FROM A$35,,"ダブルカヤックのレンタル
必要な道具一式
トイレとシャワー施設
ドライバッグ
水と日焼け止め","家族で楽しめるアクティビティ
カップルや友達同士のグループに最適
ウィットサンデー地方を探検
1時間半のカヤック・アドベンチャー
青く美しいオーストラリアの海",,3.5,,https://www.whitsundaystanduppaddle.com.au/kayak-hire-shingley-beach/,,static/tour_images/whitsundaystanduppaddle/ac1533fcdec4bf45/image_1.webp,"static/tour_images/whitsundaystanduppaddle/ac1533fcdec4bf45/image_1.webp,static/tour_images/whitsundaystanduppaddle/ac1533fcdec4bf45/image_2.jpg,static/tour_images/whitsundaystanduppaddle/ac1533fcdec4bf45/image_3.jpg,static/tour_images/whitsundaystanduppaddle/ac1533fcdec4bf45/image_4.jpg,static/tour_images/whitsundaystanduppaddle/ac1533fcdec4bf45/image_5.jpg,static/tour_images/whitsundaystanduppaddle/ac1533fcdec4bf45/image_7.jpeg,static/tour_images/whitsundaystanduppaddle/ac1533fcdec4bf45/image_8.jpeg",,True,https://www.whitsundaystanduppaddle.com.au/kayak-hire-shingley-beach/,Adult: A$35,,,half_day,combo,"Airlie Beach,Cannonvale,Great Barrier Reef","adventure,family-friendly,luxury,private,small-group",family,moderate,,,全年齢対象,家族、カップル、友人グループ、自然愛好家,,,[日焼け止め』『帽子』『サングラス』『タオル』]]。,,,0
9f83a3fcab1998be,シーニック・ショアーズ・サンセット・カヤック,whitsundaystanduppaddle,,エアリー・ビーチの絵のように美しい前浜のすぐ沖合で、リラックスした穏やかなパドルを体験しよう。家族連れ、カップル、一人旅、特にカヤック初心者の方に最適です。水面を滑るように進みながら、周囲の雰囲気と壮大な景色をお楽しみください。このツアーはパドリング未経験者にも対応しており、エアリービーチの美しい背景を際立たせながら、安全で楽しい体験をお約束します。,Half Day,Shingley Beach,,A$59,A$49,"シングル・スタビリティ・シット・オン・トップ・カヤック
ライフジャケット
ドライバッグ
カヤックガイド
写真
無料でお預かりします。","ゆったりとしたパドル
エアリービーチの壮大な眺め
家族で楽しめる
パドリング未経験者に最適
写真付き",,3.5,,https://www.whitsundaystanduppaddle.com.au/sunset-kayak/,,static/tour_images/whitsundaystanduppaddle/9f83a3fcab1998be/image_3.webp,"static/tour_images/whitsundaystanduppaddle/9f83a3fcab1998be/image_1.jpg,static/tour_images/whitsundaystanduppaddle/9f83a3fcab1998be/image_3.webp",,True,https://www.whitsundaystanduppaddle.com.au/sunset-kayak/,Adult: A$59 | Child (15 and under): A$49,,,half_day,combo,"Airlie Beach,Cannonvale,Great Barrier Reef","family-friendly,luxury,private,relaxation,sunset",family,relaxed,,,15歳以下,家族連れ、カップル、一人旅、パドリング未経験者,,"['対象年齢：5歳以上', '子供シングルカヤック対象年齢：15歳以下']]。",[カメラ』『帽子』『水』]]。,[含まれないもの：カメラ」「帽子」「水」]]。,,0
