id,name,company_name,summary,description,duration,departure_location,departure_times,price_adult,price_child,includes,highlights,keywords,duration_hours,link_booking,link_more_info,phone,image_url,image_urls,commission_rate,active,price_source_url,price_tiers,raw_text,duration_days,duration_category,tour_type,locations,tags,audience,intensity_level,video_urls,important_information,what_to_bring,whats_extra,cancellation_policy,booking_connected
d5017dff684ba31b,サマー・ジョー2D/2N,explorewhitsundays,,新しく改装されたメガヨット、サマー・ジョー号でウィットサンデーズをスタイリッシュに体験してください。冒険や自然との触れ合いを求めるカップルやご家族、ダイバーに最適です。息をのむようなウィットサンデーをクルーズし、活気あふれるサンゴ礁を探検し、世界的に有名なホワイトヘブンビーチを訪れます。この社交的でアクション満載の旅は、船上でのアドバンス・ダイビングコースでダイビングスキルのレベルアップを目指す方にも最適です。,2泊2日,ショップ 9/33 ポート・ドクター、ポート・オブ・エアリー,月・水曜午後4時発、水・金曜午後2時帰着,FROM A$653.30,,"新しく改装されたメガヨットでの豪華なご宿泊
シュノーケリングとダイビング
ホワイトヘブンビーチとその他のウィットサンデー訪問
船上でのアドバンス・ダイビングコース修了オプション
全食事付き","豪華なメガヨット体験
シュノーケリングとダイビングでアクション満載の旅
世界的に有名なホワイトヘブンビーチを訪問
ダイビングスキル向上のチャンス
船上での新鮮なお食事",,,https://explorewhitsundays.com/summer-jo-2d2n/,https://explorewhitsundays.com/summer-jo-2d2n/,,static/tour_images/explorewhitsundays/d5017dff684ba31b/image_2.png,"static/tour_images/explorewhitsundays/d5017dff684ba31b/image_1.jpg,static/tour_images/explorewhitsundays/d5017dff684ba31b/image_2.png,static/tour_images/explorewhitsundays/d5017dff684ba31b/image_5.jpg",,True,https://explorewhitsundays.com/summer-jo-2d2n/,"エンスイート付きシェアシングルA$653.30（1名利用時）｜シェアダブル（バス・トイレ付）：A$1,306.60（2名利用時A$1,306.60（2名様）｜プライベート・ツイン・キャビン（バス・トイレ付）：A$1,692（2名様A$1,692（2名様）｜プライベート・ダブルキャビン（バス・トイレ付）：A$1,692（2名様A$1,692（2名様用）｜プライベート・クイーンキャビン（バスアメニティ付）｜A$1,870.60（2名様用A$1,870.60（2名様分）",,2.0,multi_day,water,"Great Barrier Reef,Whitehaven","adventure,luxury,private,relaxation,small-group,sunset",general,adventurous,,[対象年齢12歳以上'、'特に必要な体力は記載されていません'、'シュノーケリングとダイビングのアクティビティには泳力が必要です'、'監督者の必要性は明記されていません'、'ガラス瓶や赤ワインの持ち込みは禁止されています']。,[衣類」、「ビーチタオル」、「洗面用具」、「帽子」、「水着」、「日焼け止め」、「ジャケット・セーター」、「カメラ」、「サングラス」、「島内散策用のランニングシューズまたはサンダル」、「船内購入用の現金またはクレジットカード」]。,"['サマー・ジョーはアルコール持ち込み可', 'ガラス瓶や赤ワインは持ち込み不可', '持ち物はソフトバッグに入れること', 'オプショナルにはスキューバダイビングパッケージや水中カメラのレンタルが含まれます', '食事制限のための追加料金：1日15ドル／旅行代金30ドル], '食事制限のための追加料金：1日15ドル／旅行代金30ドル.",,0
a2d895c62988ac65,ワルツィング・マチルダ：1泊2日ウィットサンデーズ・クルーズ,explorewhitsundays,,ワルツィング・マチルダ号に乗って、素晴らしいウィットサンデーを巡る忘れられないセーリング・アドベンチャーに出かけませんか。この少人数制のエクスクルーシブな船旅は、大海原での快適さとスタイリッシュさを求める方に最適です。ゲスト同士のコミュニティを育むよう配慮されたデザインの船で、のどかな島のロケーション、人里離れたビーチ、活気あるサンゴ礁を探検します。カップル、ご家族連れ、冒険好きな方に理想的なワルツィング・マチルダ号でのひとときは、魔法のような思い出を作るために作られています。,1泊2日,ショップ 9/33 ポート・ドクター、ポート・オブ・エアリー,,FROM A$490,,"知識が豊富で、親切でフレンドリーなクルー
日よけオーニング付きの広いフラットデッキ
新鮮な地元の食材を使った船上での食事
シュノーケリング用具と授業料
全てのマリン＆パークフィー込み","少人数限定のセーリング・アドベンチャー
親密でパーソナライズされた体験
快適でスタイリッシュな船
コミュニティとつながりのために考え抜かれたレイアウト
のどかな島のロケーション、人里離れたビーチ、生き生きとしたサンゴ礁",,,https://explorewhitsundays.com/waltzing-matilda-2-day-1-night-whitsundays-cruise/,https://explorewhitsundays.com/waltzing-matilda-2-day-1-night-whitsundays-cruise/,,static/tour_images/explorewhitsundays/a2d895c62988ac65/image_2.jpg,"static/tour_images/explorewhitsundays/a2d895c62988ac65/image_1.jpg,static/tour_images/explorewhitsundays/a2d895c62988ac65/image_2.jpg,static/tour_images/explorewhitsundays/a2d895c62988ac65/image_4.jpg",,True,https://explorewhitsundays.com/waltzing-matilda-2-day-1-night-whitsundays-cruise/,"プライベートダブルキャビンA$1,125（2名利用時）｜シェアシングル：490豪ドル｜シェアダブルトリプルキャビン：A$1,470トリプルキャビン：A$1,470｜クワッドキャビン：A$1,960グループキャビン：A$1,960A$1,960",,2.0,multi_day,combo,"Airlie Beach,Great Barrier Reef","adventure,private,small-group",general,adventurous,,[具体的な年齢制限は記載されていない」、「必要な体力は記載されていない」、「泳力は明記されていない」、「監督の必要性は記載されていない」、「制限は記載されていない」］。,[カメラ』、『サングラス』、『防寒着（冬場）』、『日焼け止めと帽子（夏場）』、『レインコート（天候による）』、『帽子と日焼け防止の服』、『水着』、『タオル』]。,[アルコールの持ち込み禁止」、「食べ物の持ち込み禁止に関する記載がない」、「荷物預かりに関する記載がない」、「送迎に関する記載がない」、「オプショナルエクストラに関する記載がない」、「追加料金に関する記載がない」］。,,0
