id,name,company_name,summary,description,duration,departure_location,departure_times,price_adult,price_child,includes,highlights,keywords,duration_hours,link_booking,link_more_info,phone,image_url,image_urls,commission_rate,active,price_source_url,price_tiers,raw_text,duration_days,duration_category,tour_type,locations,tags,audience,intensity_level,video_urls,important_information,what_to_bring,whats_extra,cancellation_policy,booking_connected
2fea6fc96f22dd13,ワルツィング・マチルダ サンセットクルーズ,explorewhitsundays,,エアリービーチから出航し、ワルツィング・マチルダ号で自然の傑作を最前列で眺める穏やかなサンセットツアーに出かけましょう。ウィットサンデー諸島を巡るこの魅惑的な航海は、一人旅、グループ、カップル、家族連れ、静かな逃避行を求める友人同士に最適です。広々とした快適なデッキで、お飲み物やおつまみでくつろぎながら、海に沈む息をのむようなサンセットをご体験ください。ウィットサンデーとエアリービーチのパノラマビューを楽しみながら、忘れられない夜をお過ごしください。,,ショップ 9/33 ポート・ドクター、ポート・オブ・エアリー,,A$79,A$47,"泡のグラス1杯サービス
広々とした快適なデッキエリア
オールインクルーシブ（追加料金なし）
ウィットサンデーとエアリービーチのパノラマビュー","パイオニア湾を航行
海に沈む息をのむような夕日を眺める
ドリンクとおつまみでリラックス
一人旅、グループ、カップル、ご家族、ご友人同士に最適です。
毎週金曜日と土曜日",,,https://explorewhitsundays.com/waltzing-matilda-sunset-cruise/,https://explorewhitsundays.com/waltzing-matilda-sunset-cruise/,,static/tour_images/explorewhitsundays/Waltzing Matilda Sunset Cruise/image_1.jpg,"static/tour_images/explorewhitsundays/Waltzing Matilda Sunset Cruise/image_1.jpg,static/tour_images/explorewhitsundays/Waltzing Matilda Sunset Cruise/image_3.jpg,static/tour_images/explorewhitsundays/Waltzing Matilda Sunset Cruise/image_4.jpg,static/tour_images/explorewhitsundays/Waltzing Matilda Sunset Cruise/image_5.jpg,static/tour_images/explorewhitsundays/Waltzing Matilda Sunset Cruise/image_6.jpg,static/tour_images/explorewhitsundays/Waltzing Matilda Sunset Cruise/image_7.jpg,static/tour_images/explorewhitsundays/Waltzing Matilda Sunset Cruise/image_10.jpg",,True,https://explorewhitsundays.com/waltzing-matilda-sunset-cruise/,大人子供（12歳以下）：A$79A$47,,,unknown,combo,"Airlie Beach,Great Barrier Reef,Whitsunday Island","private,relaxation,sunset",family,relaxed,,[大人12歳以上」、「子供12歳以下」、「一人旅、グループ、カップル、家族連れ、友人同士に最適」]。,[素晴らしい夕日を撮影するためのカメラ」「防寒着（冬）」「帽子（夏）」「出発時のサングラス」「レインジャケット（必要な場合）」「飲み物の持ち込み（任意）」。］,[BYO（氷をご用意します）'、'泡の無料グラス'、'無料のフィンガーフード'、'オールインクルーシブ（追加料金なし）',,0
04f13907d7f1482b,ウィットサンデー・パール2D/2N,explorewhitsundays,,ウィットサンデー・パール号で、今までに体験したことのないウィットサンデーをお楽しみください。完全クルーのスキッパーとホステス付きなので、面倒なことは一切なく、リラックスして息をのむような景色を楽しむことができます。カップルや少人数のグループに最適なこのツアーでは、象徴的なホワイトヘブンビーチやヒルインレットなど、最も風光明媚で人里離れたスポットにご案内します。船内には広々としたデッキ、スタイリッシュなダブルキャビン（専用バスルーム付）、船内製氷機やスターリンクWiFiなどの最新設備を備え、快適で贅沢な船旅をお約束します。,2泊2日,ショップ 9/33 ポート・ドクター、ポート・オブ・エアリー,,"FROM A$3,490",,"スキッパーとホステスによる完全乗船
シュノーケリング用具（マスク、シュノーケル、ウェットスーツ、浮き輪）
すべてのマリンパーク料金
ホワイトヘブンビーチとヒルインレット訪問
グレートバリアリーフでのシュノーケリング
8名様でのグループセーリング
ラグーン450
スタイリッシュなダブルキャビン4室（専用バスルーム付き
スタンドアップパドルボード
ソーラーパネル
スターリンクによる船上無線LAN
炭ろ過飲料水
製氷機とコーヒーメーカー","スタイリッシュなカタマラン船、プライベートダブルキャビン付き
8名様だけの親密なセーリング体験
ホワイトヘブンビーチとヒルインレットの訪問
グレートバリアリーフでのシュノーケリング
リラックスできる広々としたデッキ
WiFiと製氷機を含む最新設備",,,https://explorewhitsundays.com/whitsunday-pearl/,https://explorewhitsundays.com/whitsunday-pearl/,,static/tour_images/explorewhitsundays/04f13907d7f1482b/image_4.jpg,"static/tour_images/explorewhitsundays/04f13907d7f1482b/image_1.jpg,static/tour_images/explorewhitsundays/04f13907d7f1482b/image_4.jpg",,True,https://explorewhitsundays.com/whitsunday-pearl/,"プライベートダブルキャビンA$3,490",,2.0,multi_day,combo,"Airlie Beach,Great Barrier Reef,Hill Inlet,Whitehaven","private,relaxation,small-group",general,relaxed,,[具体的な年齢制限は記載されていない'、'フィットネス要件は指定されていない'、'シュノーケリングアクティビティには水泳能力を推奨する'、'監督の必要性は記載されていない'、'ガラス瓶の制限（ワインボトルを除く）'。,[着替え」、「水着」、「洗面用具」、「虫除け」、「補給用の水筒」、「カメラ」、「歩きやすい靴」、「日焼け対策（日焼け止め、帽子、サングラスなど）」、「夜の防寒着・プルオーバー（季節限定）」。］,[アルコールの持ち込み - ガラス瓶は不可（ワインボトルを除く）'、'食事に関するご要望には20ドルの追加料金がかかる場合があります'、'追加のシュノーケル用具（フィン、処方マスクなど）をご利用いただけます'、'ピークホリデーシーズン（クリスマス、イースター、年末年始など）には追加料金がかかる場合があります'、'荷物預かりは指定されていません']。,,0
053743c2bb171e4d,サマー・ジョー3D/3N,explorewhitsundays,,新しく改装された豪華なメガヨット、サマー・ジョー号でウィットサンデーズをスタイリッシュに体験し、少人数の親密なアドベンチャーをお楽しみください。一人旅、友人グループ、年長のお子様連れのご家族に最適なこの3日間の旅は、冒険と快適さを兼ね備えています。ホワイトヘブンビーチやグレートバリアリーフなど、ウィットサンデーを代表するホットスポットを探索し、スキューバダイビングやシュノーケリングをお楽しみください。船上のシェフが作る美味しいお食事を楽しみ、太陽や星空の下での社交に最適な広々としたデッキでくつろいでください。,3泊3日,ショップ 9/33 ポート・ドクター、ポート・オブ・エアリー,,FROM A$826.26,,"全食事（グルテンフリー、ビーガン、乳製品不使用の食事が必要な場合を除く）
シュノーケリング用具（マスク、シュノーケルを含む
温水シャワー（無制限
専属ダイブマスター
地元所有の船","ホワイトヘブン・ビーチ（Whitehaven Beach
グレートバリアリーフでのダイビングとシュノーケリング
船上シェフによる美味しいお食事
広々としたデッキでの交流
ダイブマスターによるダイビング指導
デサリネーターによる温水シャワー（無制限
ウィットサンデーズを紹介する地元所有の船",,,https://explorewhitsundays.com/summer-jo-3d3n/,https://explorewhitsundays.com/summer-jo-3d3n/,,static/tour_images/explorewhitsundays/053743c2bb171e4d/image_1.jpg,"static/tour_images/explorewhitsundays/053743c2bb171e4d/image_1.jpg,static/tour_images/explorewhitsundays/053743c2bb171e4d/image_3.jpg,static/tour_images/explorewhitsundays/053743c2bb171e4d/image_4.jpg,static/tour_images/explorewhitsundays/053743c2bb171e4d/image_7.jpg,static/tour_images/explorewhitsundays/053743c2bb171e4d/image_8.png,static/tour_images/explorewhitsundays/053743c2bb171e4d/image_9.jpg,static/tour_images/explorewhitsundays/053743c2bb171e4d/image_10.png,static/tour_images/explorewhitsundays/053743c2bb171e4d/image_11.jpg,static/tour_images/explorewhitsundays/053743c2bb171e4d/image_12.jpg",,True,https://explorewhitsundays.com/summer-jo-3d3n/,"シェア・シングルシェア・ダブル：A$826.26A$1,598（2名様分）｜プライベート・ダブルキャビン：A$1,879.06（2名様分A$1,879.06（2名様用）｜プライベート・ツイン・キャビン：A$1,879.06（2名様用A$1,879.06（2名様用）｜プライベート・クイーンキャビン：A$2,115（2名様用2,115豪ドル（2名様分）",,3.0,multi_day,water,"Airlie Beach,Great Barrier Reef,Whitehaven","adventure,family-friendly,private,small-group",family,moderate,,[ダイビングは年齢、健康状態、天候、ダイブインストラクターの判断によります。］,[暖かい気候に適した服装'、'洗面用具'、'日焼け防止（日焼け止め、帽子、サングラス）'、'個人的なシュノーケリング用具（必要な場合）'。,"[アルコールは持ち込み禁止：船内で購入可能な飲み物：ボトルウォーター、コーラ、コーラゼロ、スプライト各$3', 'すべてのダイビングは船上で決定し、支払うことができます', '非認証/イントロダイブ価格：1ダイブ目：160ドル（40分のスキルセッションを含む）：サーティファイドダイブの料金：1ダイブ目：$109、2ダイブ目：$99、3ダイブ目：$89、それ以降の追加ダイブ：$75：$75.']",,0
f649adbc75a985f7,ソルウェイ・ラス3D/2N,explorewhitsundays,,美しく保存されたトールシップ、ソルウェイ・ラスでウィットサンデーズを体験しましょう。広々としたデッキスペース、ライセンスバー、エアコン完備のキャビンを備えたこのツアーは、快適さと興奮をお届けします。バックパッカーや冒険を求める方に最適で、セーリング、シュノーケリング、素晴らしいビーチやサンゴ礁の探索のスリルをお楽しみください。ソルウェイ・ラスは、息をのむような夕日、生き生きとした海洋生物、そして旅仲間との一生の思い出を作る機会に満ちた、忘れられない旅をお約束します。,2泊3日,ショップ 9/33 ポート・ドクター、ポート・オブ・エアリー,,"FROM A$2,150",,"スキッパーとクルーのサービス
全ての食事とスナック
水道水、お茶、コーヒー
バスタオル
スタンドアップパドルボード
シュノーケリング用具と基本レッスン
スティンガースーツ
すべてのマリーナ使用料","歴史あるトールシップで航海
ウィットサンデー諸島を探検
デッキで屋外の食事を楽しむ
セーリング・アクティビティ
鮮やかなサンゴ礁でシュノーケリング
ホワイトヘブンビーチでリラックス
素晴らしいサンセットとサンライズを体験
ハッピーアワーでの仲間との出会い",,,https://explorewhitsundays.com/all-tours/overnight-trips/solway-voyager-3d2n/,https://explorewhitsundays.com/all-tours/overnight-trips/solway-voyager-3d2n/,,static/tour_images/explorewhitsundays/f649adbc75a985f7/image_8.jpg,"static/tour_images/explorewhitsundays/f649adbc75a985f7/image_1.jpg,static/tour_images/explorewhitsundays/f649adbc75a985f7/image_2.jpg,static/tour_images/explorewhitsundays/f649adbc75a985f7/image_4.jpg,static/tour_images/explorewhitsundays/f649adbc75a985f7/image_5.jpg,static/tour_images/explorewhitsundays/f649adbc75a985f7/image_6.jpg,static/tour_images/explorewhitsundays/f649adbc75a985f7/image_8.jpg,static/tour_images/explorewhitsundays/f649adbc75a985f7/image_9.jpg,static/tour_images/explorewhitsundays/f649adbc75a985f7/image_10.jpg,static/tour_images/explorewhitsundays/f649adbc75a985f7/image_12.jpg",,True,https://explorewhitsundays.com/all-tours/overnight-trips/solway-voyager-3d2n/,"大人：A$2,150",,3.0,multi_day,combo,"Airlie Beach,Great Barrier Reef,Hook Island,Whitehaven,Whitsunday Island","adventure,private,relaxation,sunset",general,adventurous,,[対象年齢：18歳以上」「最大乗客数：32人］,[衣類」、「ビーチタオル」、「洗面用具」、「帽子」、「水着」、「日焼け止め」、「ジャケット・セーター」、「カメラ」、「サングラス」、「島内散策用のランニングシューズまたはサンダル」、「船内購入用の現金またはクレジットカード」]。,[ソルウェイボイジャーはBYOです』、『旅の荷物はソフトサイドのバッグに入れてください』。］,,0
3db466b62ae0d157,シスカ2D/1N,explorewhitsundays,,若々しく社交的な雰囲気のクラシックなセーリングヨット、シスカでウィットサンデーを体験してください。新しい友達を作りたい、ウィットサンデーの象徴的な場所を探検したいという時間の限られた方に最適です。十分な座席スペースとオープンプランの宿泊施設で、ドリンクを片手に社交や夕日を眺めるのに理想的な、楽しいセーリングアドベンチャーをお楽しみください。このツアーは冒険と仲間意識を求める若い旅行者に最適です。,1泊2日,ショップ 9/33 ポート・ドクター、ポート・オブ・エアリー,午前9時出発、午後4時帰着,A$460.60,,"スキッパーとクルーのサービス
全ての食事とスナック
水道水、お茶、コーヒー
シュノーケリング用具と基本レッスン
スティンガースーツ
ベッドリネン","ヒル・インレット展望台へのガイド付きブッシュ・ウォーク
ホワイトヘブンビーチ訪問
サンセットドリンクと夕食前の軽食
珊瑚礁でのシュノーケリング
船上での新鮮なお食事
シングルベッドとダブルベッドのあるオープンプランの宿泊施設",,,https://explorewhitsundays.com/all-tours/overnight-trips/siska-iv/,https://explorewhitsundays.com/all-tours/overnight-trips/siska-iv/,,static/tour_images/explorewhitsundays/3db466b62ae0d157/image_7.jpeg,"static/tour_images/explorewhitsundays/3db466b62ae0d157/image_1.jpg,static/tour_images/explorewhitsundays/3db466b62ae0d157/image_2.jpg,static/tour_images/explorewhitsundays/3db466b62ae0d157/image_3.jpg,static/tour_images/explorewhitsundays/3db466b62ae0d157/image_4.jpg,static/tour_images/explorewhitsundays/3db466b62ae0d157/image_6.jpg,static/tour_images/explorewhitsundays/3db466b62ae0d157/image_7.jpeg,static/tour_images/explorewhitsundays/3db466b62ae0d157/image_9.jpg,static/tour_images/explorewhitsundays/3db466b62ae0d157/image_10.jpg,static/tour_images/explorewhitsundays/3db466b62ae0d157/image_11.jpg,static/tour_images/explorewhitsundays/3db466b62ae0d157/image_12.jpg,static/tour_images/explorewhitsundays/3db466b62ae0d157/image_13.jpg,static/tour_images/explorewhitsundays/3db466b62ae0d157/image_14.jpg,static/tour_images/explorewhitsundays/3db466b62ae0d157/image_15.jpg,static/tour_images/explorewhitsundays/3db466b62ae0d157/image_16.jpg,static/tour_images/explorewhitsundays/3db466b62ae0d157/image_18.jpg,static/tour_images/explorewhitsundays/3db466b62ae0d157/image_19.jpg",,True,https://explorewhitsundays.com/all-tours/overnight-trips/siska-iv/,シングル寝台：A$460.60｜ハーフダブル寝台（スタンバイ料金）：A$460.60,,2.0,multi_day,combo,"Airlie Beach,Great Barrier Reef,Hill Inlet,Whitehaven","adventure,private,sunset",general,adventurous,,"年齢15歳以上', '体力条件は指定されていません', 'シュノーケリングアクティビティには水泳能力が必要です', '監督の必要性は指定されていません', '特定の制限は言及されていません']].",[衣類』『ビーチ・バスタオル』『洗面用具』『帽子』『水着』『日焼け止め』『上着・セーター』『カメラ』『サングラス』『島内散策用のランナーまたはサンダル』】。］,"[ボトルショップは午前10時まで営業していないため、前日の夜に手配する必要があります。"", ""マリーナに荷物預かり所はありません。"", ""預かり所はエアリービーチのメインストリート、344 Shute Harbour roadにあります。",,0
860462ff96e36caa,最初の2D/1N,explorewhitsundays,,少人数での親密な冒険のためにデザインされた、魅力的で快適なセーリングヨット、プリマ号でウィットサンデーズを体験してください。ご家族連れ、ロマンチックな旅、ソフトな冒険を求める方に最適なプリマは、のどかな島のロケーションを探索するユニークな機会を提供します。日陰のキャノピーとクッション付きの日光浴エリアで、リラックスして素晴らしい景色を楽しむことができます。シュノーケリングや海洋生物との出会い、船上での出来立てのお食事など、毎回が新しい冒険の旅です。静かな環境でくつろぎ、仲間との交流を楽しみたい方に最適です。,1泊2日,ショップ 9/33 ポート・ドクター、ポート・オブ・エアリー,,A$516.06,,"スキッパーとクルーのサービス
朝食、昼食、夕食、軽食
水道水、紅茶、コーヒー
シュノーケリング用具と基本レッスン
ホワイトヘブンビーチへの入場料
入場料 - ヒル・インレット
ウィットサンデー諸島への入島
マリーナへの送迎
バスタオル、スティンガースーツ、ベッドリネン一式","少人数制のセーリング・アドベンチャー
のどかな島のロケーション
快適な座席と日光浴エリア
BYOドリンクポリシーとゲスト用冷蔵庫
地元の食材を使った出来立てのお食事
シュノーケリングや海洋生物との出会い
美しい夕日と星空観察",,,https://explorewhitsundays.com/overnight-trips/prima/,https://explorewhitsundays.com/overnight-trips/prima/,,static/tour_images/explorewhitsundays/860462ff96e36caa/image_6.png,"static/tour_images/explorewhitsundays/860462ff96e36caa/image_2.jpg,static/tour_images/explorewhitsundays/860462ff96e36caa/image_3.jpg,static/tour_images/explorewhitsundays/860462ff96e36caa/image_4.jpg,static/tour_images/explorewhitsundays/860462ff96e36caa/image_5.jpg,static/tour_images/explorewhitsundays/860462ff96e36caa/image_6.png,static/tour_images/explorewhitsundays/860462ff96e36caa/image_7.jpg,static/tour_images/explorewhitsundays/860462ff96e36caa/image_8.jpg,static/tour_images/explorewhitsundays/860462ff96e36caa/image_9.png,static/tour_images/explorewhitsundays/860462ff96e36caa/image_10.jpg,static/tour_images/explorewhitsundays/860462ff96e36caa/image_11.jpg,static/tour_images/explorewhitsundays/860462ff96e36caa/image_12.jpg,static/tour_images/explorewhitsundays/860462ff96e36caa/image_13.png,static/tour_images/explorewhitsundays/860462ff96e36caa/image_14.jpg,static/tour_images/explorewhitsundays/860462ff96e36caa/image_16.jpg,static/tour_images/explorewhitsundays/860462ff96e36caa/image_17.jpg,static/tour_images/explorewhitsundays/860462ff96e36caa/image_18.jpg,static/tour_images/explorewhitsundays/860462ff96e36caa/image_19.jpg,static/tour_images/explorewhitsundays/860462ff96e36caa/image_20.png,static/tour_images/explorewhitsundays/860462ff96e36caa/image_21.jpg,static/tour_images/explorewhitsundays/860462ff96e36caa/image_22.png,static/tour_images/explorewhitsundays/860462ff96e36caa/image_24.jpg,static/tour_images/explorewhitsundays/860462ff96e36caa/image_25.jpg,static/tour_images/explorewhitsundays/860462ff96e36caa/image_26.jpg,static/tour_images/explorewhitsundays/860462ff96e36caa/image_27.jpg",,True,https://explorewhitsundays.com/overnight-trips/prima/,"シングル2段ベッドA$516.06｜ダブルベッドのみ（2名様用）：A$1,098｜プライベート・ダブルキャビン（バス・トイレ付）（2名用）：A$1,156.201,156.20豪ドル｜プライベート・ダブルキャビン（バス・トイレ付）（2名用、要予約）：A$1,291.56",,2.0,multi_day,combo,"Airlie Beach,Great Barrier Reef,Hill Inlet,Hook Island,Whitehaven,Whitsunday Island","adventure,private,relaxation,small-group,sunset",general,adventurous,,年齢4歳以上'、'特に必要な体力は記載されていません。'、'シュノーケリング・アクティビティには水泳能力を推奨します。'、'4歳未満のお子様に対する監督者の必要性は明記されていません。'、'制限事項は記載されていません。']]。,[服」「ビーチタオル・サロン」「洗面用具」「帽子」「水着」「日焼け止め」「ジャケット・セーター」「カメラ」「サングラス」「島内散策用のランナーまたはサンダル」]。,[ソフトドリンク、アルコール飲料はすべて持ち込み可能です」「船内での飲み物の販売はありません」「荷物はジッパーなしのソフトバッグに入れてください」「マリーナまでの送迎は含まれていません」。］,,0
f0e5d40f952752df,ウィットサンデー・ゲッタウェイ 2D/2N,explorewhitsundays,,スタイリッシュな双胴船ウィットサンデー・ゲッタウェイ号で究極の快適さを体験してください。この親密な少人数ツアーは、ロマンチックな休暇をお望みのカップルや、リラックスしたセーリング体験をお望みの方に最適です。経験豊富なスキッパーとホステスが、最も景色の良い場所、静かなビーチ、穏やかな停泊地へご案内します。船乗りを目指す方にも、お酒を飲みながらリラックスしたい方にも、このツアーは冒険とレジャーの完璧な融合を提供し、人ごみを逃れて自然と触れ合いたい方に理想的です。,2泊2日,ショップ 9/33 ポート・ドクター、ポート・オブ・エアリー,午後2時30分出発,FROM A$1405.30,,"スキッパーとホステスによるフルクルー体制
船上でのグルメ料理
ヒル・インレット展望台へのガイド付きブッシュウォーク
シュノーケリング用具
スタンドアップパドルボード
コンチネンタルブレックファスト
ビュッフェランチ","素晴らしい島の風景の中を航行
ホワイトヘブンビーチとヒルインレット展望台を訪れる
シュノーケルで水中の世界を楽しむ
豪華な双胴船でリラックス
船上でグルメな食事とドリンクを楽しむ",,,https://explorewhitsundays.com/overnight-trips/whitsunday-getaway-2d2n/,https://explorewhitsundays.com/overnight-trips/whitsunday-getaway-2d2n/,,static/tour_images/explorewhitsundays/f0e5d40f952752df/image_3.jpg,"static/tour_images/explorewhitsundays/f0e5d40f952752df/image_2.jpg,static/tour_images/explorewhitsundays/f0e5d40f952752df/image_3.jpg,static/tour_images/explorewhitsundays/f0e5d40f952752df/image_4.jpg,static/tour_images/explorewhitsundays/f0e5d40f952752df/image_5.jpg,static/tour_images/explorewhitsundays/f0e5d40f952752df/image_7.jpg,static/tour_images/explorewhitsundays/f0e5d40f952752df/image_9.jpg,static/tour_images/explorewhitsundays/f0e5d40f952752df/image_10.jpg,static/tour_images/explorewhitsundays/f0e5d40f952752df/image_11.jpg,static/tour_images/explorewhitsundays/f0e5d40f952752df/image_12.jpg,static/tour_images/explorewhitsundays/f0e5d40f952752df/image_13.jpg,static/tour_images/explorewhitsundays/f0e5d40f952752df/image_15.jpg",,True,https://explorewhitsundays.com/overnight-trips/whitsunday-getaway-2d2n/,プライベート・ダブルキャビン・エンスイート1405.30豪ドル（2名様分）,,2.0,multi_day,combo,"Airlie Beach,Great Barrier Reef,Hill Inlet,Whitehaven,Whitsunday Island","adventure,luxury,private,relaxation,small-group",general,adventurous,,[ウィットサンデー・ゲッタウェイは大人専用の船です。］,[衣類」「洗面用具」「帽子」「水着」「日焼け止め」「ジャケット・セーター」「カメラ」「サングラス」「島内散策に適したウォーキングシューズ」「ソフトドリンク購入用の現金」】。］,"[ソフトドリンク、アルコール飲料、ボトル入り飲料水はすべてお持ち帰りください。(硬いスーツケースは不可)。', '船内WIFI - スターリンク衛星インターネットは、クルーズ期間中、1キャビンにつき$10でご購入いただけます（チェックイン時にお支払いください）。",,0
