id,name,company_name,summary,description,duration,departure_location,departure_times,price_adult,price_child,includes,highlights,keywords,duration_hours,link_booking,link_more_info,phone,image_url,image_urls,commission_rate,active,price_source_url,price_tiers,raw_text,duration_days,duration_category,tour_type,locations,tags,audience,intensity_level,itinerary,menu,age_requirements,ideal_for,video_urls,important_information,what_to_bring,whats_extra,cancellation_policy,booking_connected
d9d463300ef56401,究極のジェットボート体験,pioneeradventures,,エアリービーチで究極のジェットボートライドのスリルを体験しよう。冒険と息をのむような景色が融合する場所です。このアドレナリン全開のツアーは、忘れられない体験を求めるスリル追求者やご家族に最適です。 コーラル・シー・マリーナ＆リゾートを疾走しながら、360度や180度の回転、急停止、ドリフトといったスリリングな技を披露。息をのむようなウィットサンデー諸島の景色に感動し、ウミガメ、ジュゴン、アカエイなどの野生生物にも注目してください。ユーモアと知識に満ちた船内解説で、笑いと興奮が保証されたこのツアーは、エアリービーチ滞在のハイライトとなるでしょう。,30分,コーラル・シー・マリーナ＆リゾート,午前または午後の出発の選択,A$89,A$79,パイオニア湾周辺30分ジェットボートツアーライフジャケット・防滴ジャケット防滴メガネ貴重品ボックス／小型荷物預かりユーモアと知識満載の解説無料GoPro写真サービス,エアリービーチ発パイオニア湾周辺30分ジェットボートツアー笑いと水とアドレナリンの究極の融合180度・360度ターン、急停止、ドリフトなど大胆なスタントを体験湾内でウミガメ、ジュゴン、アカエイなどの野生生物を観察無料写真サービス（当社Facebookページで公開）経験不要：全年齢（5歳以上）・全レベル対応,,,,https://www.pioneeradventures.com.au/tours/jet-boat-airlie-beach/,,static/tour_images/pioneeradventures/d9d463300ef56401/image_6.jpeg,"static/tour_images/pioneeradventures/d9d463300ef56401/image_1.jpg,static/tour_images/pioneeradventures/d9d463300ef56401/image_2.jpg,static/tour_images/pioneeradventures/d9d463300ef56401/image_3.jpg,static/tour_images/pioneeradventures/d9d463300ef56401/image_4.jpg,static/tour_images/pioneeradventures/d9d463300ef56401/image_6.jpeg,static/tour_images/pioneeradventures/d9d463300ef56401/image_7.jpg,static/tour_images/pioneeradventures/d9d463300ef56401/image_8.jpg,static/tour_images/pioneeradventures/d9d463300ef56401/image_9.jpg,static/tour_images/pioneeradventures/d9d463300ef56401/image_10.jpg,static/tour_images/pioneeradventures/d9d463300ef56401/image_11.jpg,static/tour_images/pioneeradventures/d9d463300ef56401/image_12.jpg,static/tour_images/pioneeradventures/d9d463300ef56401/image_13.jpg,static/tour_images/pioneeradventures/d9d463300ef56401/image_14.jpeg,static/tour_images/pioneeradventures/d9d463300ef56401/image_15.jpg,static/tour_images/pioneeradventures/d9d463300ef56401/image_16.jpg",,True,https://www.pioneeradventures.com.au/tours/jet-boat-airlie-beach/,大人：89オーストラリアドル | 子供（5～13歳）：79オーストラリアドル,,,unknown,water,"Airlie Beach,Great Barrier Reef","adventure,private,sunset",family,adventurous,,,5歳以上,スリルを求める人、家族連れ、そしてアドベンチャー愛好家が、エアリービーチでアドレナリン全開の体験を求めています。,,"['最低年齢は5歳以上、最低身長は120cm以上です。', 'お子様のチェックインには必ず大人の同伴が必要です。', '背骨や首に問題がある方、心臓疾患のある方、妊娠中の方、その他の重篤な健康状態にある方には適していません。', '車椅子でのご利用はできません。']",[水着]、[タオル]、[日焼け止め],機内への手荷物の持ち込みは禁止されています。例：カメラ、帽子など。これらは用意された収納ボックスに預けてください。濡れてはいけない物品用の小さな収納スペースをご用意しています。,悪天候によるキャンセルの場合、別の日程への変更または全額返金をご案内いたします。最低人数に達しない場合のキャンセルの場合、別の日程・体験への変更または全額返金をご案内いたします。,0.0
25f0d62ea4d42c7c,ボトムズ・アップ サンセット・ボートツアー,pioneeradventures,,ボトムズ・アップ号で夕日を巡るクルーズ。シュート・ハーバー周辺のゆったりとした景観を楽しむ航海です。このユニークな1時間の夜間ツアーでは、夜の海洋生物の世界に没入し、暗闇に包まれたウィットサンデー諸島の隠れた驚異を解き明かします。静けさとスリルを兼ね備えた冒険を求める方に最適で、自然愛好家やグレートバリアリーフを新たな視点で体験したい方におすすめです。,1時間,コーラル・シー・マリーナ＆リゾート,出発 午前8時、帰着 午後5時,FROM A$79,,ガラス底ボートツアーサンセットクルーズ夜の海洋生物に没入する体験,シュート・ハーバーの夕日を体験しようウィットサンデー諸島の夜の海洋生物を探検リラックスできる景観クルーズ暗闇に包まれたユニークな冒険自然愛好家に最適,,1.0,,https://www.pioneeradventures.com.au/airlie-beach-glass-bottom-boat-tour/,,,,,True,https://www.pioneeradventures.com.au/airlie-beach-glass-bottom-boat-tour/,大人：79オーストラリアドル,,,half_day,combo,"Airlie Beach,Great Barrier Reef","adventure,luxury,private,relaxation,sunset",general,adventurous,,,全年齢対象,自然愛好家、カップル、そしてユニークな夕日体験を求めるご家族,,[0～2歳の乳幼児は無料です。],,,,0.0
d473b6b06dedf85a,エアリービーチ グラスボトムボートツアー,pioneeradventures,,特注のガラス底ボート「ボトムズ・アップ」で、エアリービーチの鮮やかな珊瑚礁を探索するユニークな体験へ。このツアーでは、グレートバリアリーフの多様な生態系を水に濡れずに没入感あふれる形で楽しめます。ご家族、一人旅、友人同士に最適で、美しいウィットサンデー諸島を巡るガイド付き航海では、解説付きの解説とライオンズ・ルックアウトでの写真撮影スポットが特典として付いています。,70分,コーラル・シー・マリーナ＆リゾート,,A$89,A$79,70分ガイド付きグラスボトムボート探検ツアーサンゴ礁の生態系についてのユーモアと知識満載の解説未成年者用ライフジャケットライオンズ展望台でのボーナス写真撮影スポット指定場所からの送迎サービス,ユニークなガラスボトムボート体験エアリービーチの珊瑚礁を探索珊瑚礁に関する解説付きライオンズ・ルックアウトでの写真撮影スポット全年齢層に最適多様な海洋生物を観察できる機会完全日除け仕様の船体船内バー（酒類提供可）,,,,https://www.pioneeradventures.com.au/tours/day-tour/,,static/tour_images/pioneeradventures/d473b6b06dedf85a/image_61.jpg,"static/tour_images/pioneeradventures/d473b6b06dedf85a/image_1.jpg,static/tour_images/pioneeradventures/d473b6b06dedf85a/image_2.jpg,static/tour_images/pioneeradventures/d473b6b06dedf85a/image_3.jpg,static/tour_images/pioneeradventures/d473b6b06dedf85a/image_4.jpg,static/tour_images/pioneeradventures/d473b6b06dedf85a/image_5.jpg,static/tour_images/pioneeradventures/d473b6b06dedf85a/image_6.jpeg,static/tour_images/pioneeradventures/d473b6b06dedf85a/image_7.jpg,static/tour_images/pioneeradventures/d473b6b06dedf85a/image_8.jpg,static/tour_images/pioneeradventures/d473b6b06dedf85a/image_9.jpg,static/tour_images/pioneeradventures/d473b6b06dedf85a/image_10.jpg,static/tour_images/pioneeradventures/d473b6b06dedf85a/image_11.jpg,static/tour_images/pioneeradventures/d473b6b06dedf85a/image_12.jpg,static/tour_images/pioneeradventures/d473b6b06dedf85a/image_13.jpg,static/tour_images/pioneeradventures/d473b6b06dedf85a/image_14.jpg,static/tour_images/pioneeradventures/d473b6b06dedf85a/image_15.jpg,static/tour_images/pioneeradventures/d473b6b06dedf85a/image_16.jpeg,static/tour_images/pioneeradventures/d473b6b06dedf85a/image_17.jpg,static/tour_images/pioneeradventures/d473b6b06dedf85a/image_18.jpg,static/tour_images/pioneeradventures/d473b6b06dedf85a/image_19.jpg,static/tour_images/pioneeradventures/d473b6b06dedf85a/image_20.jpg,static/tour_images/pioneeradventures/d473b6b06dedf85a/image_21.jpg,static/tour_images/pioneeradventures/d473b6b06dedf85a/image_22.jpg,static/tour_images/pioneeradventures/d473b6b06dedf85a/image_23.jpg,static/tour_images/pioneeradventures/d473b6b06dedf85a/image_24.jpg,static/tour_images/pioneeradventures/d473b6b06dedf85a/image_25.jpg,static/tour_images/pioneeradventures/d473b6b06dedf85a/image_26.jpg,static/tour_images/pioneeradventures/d473b6b06dedf85a/image_27.jpeg,static/tour_images/pioneeradventures/d473b6b06dedf85a/image_28.jpg,static/tour_images/pioneeradventures/d473b6b06dedf85a/image_29.jpg,static/tour_images/pioneeradventures/d473b6b06dedf85a/image_30.jpg,static/tour_images/pioneeradventures/d473b6b06dedf85a/image_31.jpg,static/tour_images/pioneeradventures/d473b6b06dedf85a/image_32.jpg,static/tour_images/pioneeradventures/d473b6b06dedf85a/image_33.jpg,static/tour_images/pioneeradventures/d473b6b06dedf85a/image_34.jpg,static/tour_images/pioneeradventures/d473b6b06dedf85a/image_35.jpg,static/tour_images/pioneeradventures/d473b6b06dedf85a/image_36.jpeg,static/tour_images/pioneeradventures/d473b6b06dedf85a/image_37.jpg,static/tour_images/pioneeradventures/d473b6b06dedf85a/image_38.jpg,static/tour_images/pioneeradventures/d473b6b06dedf85a/image_39.jpg,static/tour_images/pioneeradventures/d473b6b06dedf85a/image_40.jpg,static/tour_images/pioneeradventures/d473b6b06dedf85a/image_42.jpg,static/tour_images/pioneeradventures/d473b6b06dedf85a/image_43.jpg,static/tour_images/pioneeradventures/d473b6b06dedf85a/image_44.jpeg,static/tour_images/pioneeradventures/d473b6b06dedf85a/image_45.jpg,static/tour_images/pioneeradventures/d473b6b06dedf85a/image_46.jpg,static/tour_images/pioneeradventures/d473b6b06dedf85a/image_47.jpg,static/tour_images/pioneeradventures/d473b6b06dedf85a/image_48.jpg,static/tour_images/pioneeradventures/d473b6b06dedf85a/image_49.jpg,static/tour_images/pioneeradventures/d473b6b06dedf85a/image_50.jpg,static/tour_images/pioneeradventures/d473b6b06dedf85a/image_51.jpg,static/tour_images/pioneeradventures/d473b6b06dedf85a/image_52.jpeg,static/tour_images/pioneeradventures/d473b6b06dedf85a/image_53.jpeg,static/tour_images/pioneeradventures/d473b6b06dedf85a/image_54.jpg,static/tour_images/pioneeradventures/d473b6b06dedf85a/image_55.jpg,static/tour_images/pioneeradventures/d473b6b06dedf85a/image_56.jpg,static/tour_images/pioneeradventures/d473b6b06dedf85a/image_58.jpg,static/tour_images/pioneeradventures/d473b6b06dedf85a/image_59.jpeg,static/tour_images/pioneeradventures/d473b6b06dedf85a/image_60.jpg,static/tour_images/pioneeradventures/d473b6b06dedf85a/image_61.jpg,static/tour_images/pioneeradventures/d473b6b06dedf85a/image_62.jpg,static/tour_images/pioneeradventures/d473b6b06dedf85a/image_63.jpg,static/tour_images/pioneeradventures/d473b6b06dedf85a/image_64.jpg,static/tour_images/pioneeradventures/d473b6b06dedf85a/image_65.jpg,static/tour_images/pioneeradventures/d473b6b06dedf85a/image_66.jpg,static/tour_images/pioneeradventures/d473b6b06dedf85a/image_67.jpg,static/tour_images/pioneeradventures/d473b6b06dedf85a/image_68.jpg,static/tour_images/pioneeradventures/d473b6b06dedf85a/image_69.jpg,static/tour_images/pioneeradventures/d473b6b06dedf85a/image_70.jpg",,True,https://www.pioneeradventures.com.au/tours/day-tour/,大人：89オーストラリアドル | 子供（3～13歳）：79オーストラリアドル,,,unknown,water,"Airlie Beach,Great Barrier Reef,Whitsunday Island","adventure,family-friendly,relaxation,sunset",family,adventurous,,,全年齢対象,家族連れ、一人旅の方、そして友人同士で、ユニークで快適な方法でサンゴ礁を探検したい方々に。,,"['0歳から2歳までの乳幼児は無料でご利用いただけます。', '残念ながら、当船は車椅子でのご利用ができません。', '船やバスへの乗降には階段をご利用いただきます。', 'バス、電車、タクシー、リムジン、配車サービスなどの個人輸送サービスでは、チャイルドシートの着用は義務付けられていません。']",特定の要件はありません。船舶は完全に日陰になっています。,['アルコール飲料およびノンアルコール飲料は、機内にある完全な酒類販売免許を取得したバーで購入できます。'],,0.0
66270ef3e8be90eb,ボトムズ・アップ・ナイト・ボートツアー,pioneeradventures,,ボトムズアップ・ナイトボートツアーで魅惑的な夜の冒険へ。家族連れ、カップル、そして活気あふれるサンゴ礁の夜の世界を探検したい方に最適なこの60分ツアーは、忘れられない体験を提供します。UVライトの輝きのもと、サンゴ礁の浅瀬を滑るように進む船上から、息をのむような水中世界が息吹を宿す瞬間を目撃してください。ガイドの解説付きで、グレートバリアリーフに息づく多様な生態系について学びましょう。 自然の生息地でザリガニ、ウミガメ、タコ、さらにはサメまで観察できる貴重な機会をお楽しみください。船内のライセンスバーでくつろぎながら、シュートハーバー周辺の静かな美しさを満喫しましょう。,60分,コーラル・シー・マリーナ＆リゾート,,A$99,A$89,送迎バスによる送迎船内バー（酒類提供可）サンゴ礁に関するガイド付き解説水中観察用UVライト（視認性向上）,60分間の夕暮れツアーでサンゴ礁を探検ザリガニ、ウミガメ、タコ、サメなどの水中生物を観察ガイド付き解説ツアー水中UVライトによるユニークな観察体験シュートハーバー周辺でのリラックスクルーズ,,,,https://www.pioneeradventures.com.au/bottoms-up-night-tour/,,static/tour_images/pioneeradventures/66270ef3e8be90eb/image_1.jpg,"static/tour_images/pioneeradventures/66270ef3e8be90eb/image_1.jpg,static/tour_images/pioneeradventures/66270ef3e8be90eb/image_2.jpeg,static/tour_images/pioneeradventures/66270ef3e8be90eb/image_3.jpg,static/tour_images/pioneeradventures/66270ef3e8be90eb/image_4.jpg,static/tour_images/pioneeradventures/66270ef3e8be90eb/image_6.jpeg,static/tour_images/pioneeradventures/66270ef3e8be90eb/image_7.jpeg,static/tour_images/pioneeradventures/66270ef3e8be90eb/image_8.jpg,static/tour_images/pioneeradventures/66270ef3e8be90eb/image_9.jpg,static/tour_images/pioneeradventures/66270ef3e8be90eb/image_10.jpg,static/tour_images/pioneeradventures/66270ef3e8be90eb/image_11.jpg,static/tour_images/pioneeradventures/66270ef3e8be90eb/image_12.jpg,static/tour_images/pioneeradventures/66270ef3e8be90eb/image_13.jpg,static/tour_images/pioneeradventures/66270ef3e8be90eb/image_15.jpg,static/tour_images/pioneeradventures/66270ef3e8be90eb/image_16.jpg",,True,https://www.pioneeradventures.com.au/bottoms-up-night-tour/,大人：99オーストラリアドル | 子供：89オーストラリアドル,,,unknown,combo,"Airlie Beach,Great Barrier Reef","adventure,family-friendly,luxury,private,relaxation,sunset",family,adventurous,,,全年齢対象,グレートバリアリーフの夜行性海洋生物を探検することに興味を持つ家族、カップル、自然愛好家。,,[年齢：全年齢対象（車椅子での入場不可）、幼児は無料][大人：14歳以上][子供：2～13歳][幼児：0～2歳 無料],,[船内ライセンスバー],,0.0
31c07d19eb2cbaed,エアリービーチ グラスボトムボート 日帰りツアー,pioneeradventures,,70分間のグラスボトムボートツアーで、これまでにない方法でウィットサンデー諸島を体験してください。ご家族、お友達、お一人様にも最適なこのツアーでは、濡れることなく鮮やかな水中世界を覗き見ることができます。ウィットサンデー諸島の牧歌的な島々を巡り、カラフルな熱帯魚、珊瑚、ウミガメ、エイが織りなす万華鏡のような光景を目の当たりにしましょう。 特注の日除け付き船「ボトムズアップ」が快適で没入感のある体験を保証します。海洋生物愛好家から、ただリラックスした冒険を求める方まで、あらゆる年齢層に最適なツアーです。,70分,シュート・ハーバー海洋ターミナル,,A$89,A$79,70分ガイド付きグラスボトムボート探検ツアーサンゴ礁についての面白くて知識豊富な解説送迎バス付き完全日除け船安全装備完備未成年者用ライフジャケットライオンズ展望台でのボーナス写真撮影スポット,地元のサンゴ礁と海洋生物を観察水に濡れずにウィットサンデー諸島を体験全年齢対象の家族向けツアーユニークなグラスボトムボートでの観察ライオンズ展望台での写真撮影スポット,,,,https://www.pioneeradventures.com.au/tours/daydream-extreme/,,,,,True,https://www.pioneeradventures.com.au/tours/daydream-extreme/,大人（14歳以上）：89豪ドル | 子供（3～13歳）：79豪ドル | ファミリー（大人2名＋子供2名）：269豪ドル | プライベートチャーター（1～37名様）：2999豪ドル | シニア（有効なシニアカード提示）：79豪ドル | 幼児（0～2歳）：無料,,,unknown,combo,"Airlie Beach,Great Barrier Reef,Whitsunday Island","adventure,family-friendly,private,relaxation",family,relaxed,,,全年齢対象,家族、友人、一人旅の方、そしてユニークでリラックスできる冒険を求める海洋生物愛好家。,,,,,,
1bb18e6ebdfb112f,エアリービーチ グラスボトムボート 日帰りツアー,pioneeradventures,,70分間のグラスボトムボートツアーで、これまでにない方法でウィットサンデーを体験しましょう。グレートバリアリーフの驚異を濡れずに探検したい方に最適です。このツアーでは、鮮やかな珊瑚、熱帯魚、海洋生物が織りなす万華鏡のような色彩を、活気あふれる海洋生態系のユニークな窓からご覧いただけます。 ご家族、ご友人、お一人様にも最適なこの冒険は、息をのむような景色と教育的見識を、日陰の快適な船「ボトムズ・アップ」からお楽しみいただけます。ライオンズ・ルックアウトでのボーナス写真スポットが、旅にさらなる彩りを添えます。,70分,シュート・ハーバー海洋ターミナル,,FROM A$89,A$79,70分ガイド付きグラスボトムボート探検ツアーサンゴ礁についての面白くて知識豊富な解説送迎バス付き完全日除け船体安全装備完備未成年者用ライフジャケットライオンズ展望台でのボーナス写真撮影スポット,地元のサンゴ礁と海洋生物を観察水に濡れずにウィットサンデー諸島を探索全年齢層に最適サンゴ礁観察用に特注された船ライオンズ展望台での写真撮影スポット送迎サービスあり,,,,https://www.pioneeradventures.com.au/bottoms-up-sunset-tour/,,,,,True,https://www.pioneeradventures.com.au/bottoms-up-sunset-tour/,大人（14歳以上）：89豪ドル | 子供（3～13歳）：79豪ドル | ファミリー（大人2名、子供2名）：269豪ドル | プライベートチャーター（1～37名様）：2999豪ドル | シニア（有効なシニアカードが必要）：79豪ドル | 幼児（0～2歳）：無料,,,unknown,combo,"Airlie Beach,Great Barrier Reef,Whitsunday Island","adventure,family-friendly,private",family,relaxed,,,全年齢対象,家族、友人、一人旅の方、そして海洋生物愛好家,,,,,,
